Dates,URL,News
15/2/2000,http://www.marketwatch.com/story/thom-calandras-stockwatch-gold-is-poised-for-greatness-2000-02-15,gold is poised for greatness
16/2/2000,,
17/2/2000,http://www.marketwatch.com/story/gold-falls-on-technical-pull-back-2000-02-17,gold falls on technical pull back
18/2/2000,,
19/2/2000,,
20/2/2000,,
21/2/2000,,
22/2/2000,,
23/2/2000,,
24/2/2000,,
25/2/2000,,
26/2/2000,,
27/2/2000,,
28/2/2000,,
29/2/2000,,
1/3/2000,,
2/3/2000,,
3/3/2000,,
4/3/2000,,
5/3/2000,,
6/3/2000,,
7/3/2000,,
8/3/2000,,
9/3/2000,,
10/3/2000,,
11/3/2000,,
12/3/2000,,
13/3/2000,,
14/3/2000,,
15/3/2000,,
16/3/2000,,
17/3/2000,,
18/3/2000,,
19/3/2000,,
20/3/2000,,
21/3/2000,,
22/3/2000,,
23/3/2000,,
24/3/2000,http://www.marketwatch.com/story/gold-quiet-on-lack-of-market-news,gold quiet on lack of market news
25/3/2000,,
26/3/2000,,
27/3/2000,,
28/3/2000,,
29/3/2000,,
30/3/2000,,
31/3/2000,,
1/4/2000,,
2/4/2000,,
3/4/2000,,
4/4/2000,,
5/4/2000,,
6/4/2000,,
7/4/2000,,
8/4/2000,,
9/4/2000,,
10/4/2000,,
11/4/2000,,
12/4/2000,,
13/4/2000,,
14/4/2000,,
15/4/2000,,
16/4/2000,,
17/4/2000,,
18/4/2000,,
19/4/2000,,
20/4/2000,,
21/4/2000,,
22/4/2000,,
23/4/2000,,
24/4/2000,,
25/4/2000,,
26/4/2000,,
27/4/2000,http://www.marketwatch.com/story/gold-futures-steady-as-index-climbs,gold futures steady as index climbs
28/4/2000,,
29/4/2000,,
30/4/2000,,
1/5/2000,,
2/5/2000,,
3/5/2000,,
4/5/2000,http://www.marketwatch.com/story/gold-and-silver-stocks-in-relief-rally,gold and silver stocks in relief rally
5/5/2000,,
6/5/2000,,
7/5/2000,,
8/5/2000,,
9/5/2000,,
10/5/2000,,
11/5/2000,,
12/5/2000,,
13/5/2000,,
14/5/2000,,
15/5/2000,,
16/5/2000,,
17/5/2000,http://www.marketwatch.com/story/gold-prices-and-stocks-weaken,"gold prices, stocks weaken"
18/5/2000,,
19/5/2000,http://www.marketwatch.com/story/gold-sector-steady-ahead-of-uk-auction,gold steady ahead of u.k. auction
20/5/2000,,
21/5/2000,,
22/5/2000,,
23/5/2000,,
24/5/2000,,
25/5/2000,,
26/5/2000,,
27/5/2000,,
28/5/2000,,
29/5/2000,,
30/5/2000,http://www.marketwatch.com/story/gold-little-changed-copper-sinks,gold little changed; copper sinks
31/5/2000,,
1/6/2000,,
2/6/2000,,
3/6/2000,,
4/6/2000,,
5/6/2000,,
6/6/2000,,
7/6/2000,http://www.marketwatch.com/story/gold-slips-after-four-days-of-gains,gold slips after four days of gains
8/6/2000,,
9/6/2000,,
10/6/2000,,
11/6/2000,,
12/6/2000,,
13/6/2000,,
14/6/2000,,
15/6/2000,,
16/6/2000,,
17/6/2000,,
18/6/2000,,
19/6/2000,,
20/6/2000,,
21/6/2000,http://www.marketwatch.com/story/metals-mixed-gold-stocks-climb,"metals mixed, gold stocks climb"
22/6/2000,http://www.marketwatch.com/story/gold-futures-stocks-move-slightly-lower,gold slightly lower
23/6/2000,,
24/6/2000,,
25/6/2000,,
26/6/2000,,
27/6/2000,http://www.marketwatch.com/story/gold-futures-equities-mixed-in-light-trading,gold mixed in light trading
28/6/2000,http://www.marketwatch.com/story/gold-gains-after-fed-decision-on-interest-rates,gold up after fed's rate decision
29/6/2000,,
30/6/2000,,
1/7/2000,,
2/7/2000,,
3/7/2000,,
4/7/2000,,
5/7/2000,,
6/7/2000,,
7/7/2000,,
8/7/2000,http://www.marketwatch.com/story/sidelines-quokka-goes-for-olympic-gold-2000-07-08,quokka goes for olympic gold
9/7/2000,,
10/7/2000,,
11/7/2000,http://www.marketwatch.com/story/gold-prices-lower-ahead-of-gold-auction,gold prices lower ahead of auction
12/7/2000,,
13/7/2000,,
14/7/2000,,
15/7/2000,,
16/7/2000,,
17/7/2000,,
18/7/2000,,
19/7/2000,,
20/7/2000,,
21/7/2000,,
22/7/2000,,
23/7/2000,,
24/7/2000,,
25/7/2000,,
26/7/2000,,
27/7/2000,,
28/7/2000,,
29/7/2000,,
30/7/2000,,
31/7/2000,,
1/8/2000,,
2/8/2000,,
3/8/2000,,
4/8/2000,,
5/8/2000,,
6/8/2000,,
7/8/2000,,
8/8/2000,,
9/8/2000,,
10/8/2000,,
11/8/2000,,
12/8/2000,,
13/8/2000,,
14/8/2000,,
15/8/2000,,
16/8/2000,,
17/8/2000,,
18/8/2000,,
19/8/2000,,
20/8/2000,,
21/8/2000,,
22/8/2000,,
23/8/2000,,
24/8/2000,http://www.marketwatch.com/story/gold-prices-company-shares-gain,"gold prices, company shares gain"
25/8/2000,,
26/8/2000,,
27/8/2000,,
28/8/2000,,
29/8/2000,,
30/8/2000,,
31/8/2000,,
1/9/2000,,
2/9/2000,,
3/9/2000,,
4/9/2000,,
5/9/2000,,
6/9/2000,,
7/9/2000,http://www.marketwatch.com/story/palladium-rallies-as-gold-falls,palladium rallies as gold falls
8/9/2000,http://www.marketwatch.com/story/gold-lower-in-quiet-trading,gold lower in quiet trading
9/9/2000,,
10/9/2000,,
11/9/2000,,
12/9/2000,,
13/9/2000,,
14/9/2000,http://www.marketwatch.com/story/gold-holds-steady-on-greenbacks-strength,gold steady on dollar's strength
15/9/2000,,
16/9/2000,,
17/9/2000,,
18/9/2000,,
19/9/2000,,
20/9/2000,,
21/9/2000,,
22/9/2000,,
23/9/2000,,
24/9/2000,,
25/9/2000,,
26/9/2000,,
27/9/2000,,
28/9/2000,,
29/9/2000,,
30/9/2000,,
1/10/2000,,
2/10/2000,,
3/10/2000,,
4/10/2000,,
5/10/2000,,
6/10/2000,,
7/10/2000,,
8/10/2000,,
9/10/2000,,
10/10/2000,http://www.marketwatch.com/story/gold-gains-on-dollar-weakness-200010101628220,gold gains on dollar weakness
11/10/2000,,
12/10/2000,,
13/10/2000,,
14/10/2000,,
15/10/2000,,
16/10/2000,http://www.marketwatch.com/story/gold-slips-for-a-second-straight-day,gold slips for a second-straight day
17/10/2000,http://www.marketwatch.com/story/gold-slips-amid-selling-overseas,gold slips amid selling overseas
18/10/2000,,
19/10/2000,,
20/10/2000,,
21/10/2000,,
22/10/2000,,
23/10/2000,http://www.marketwatch.com/story/gold-quiet-in-low-volume-trading,gold quiet in low-volume trading
24/10/2000,,
25/10/2000,,
26/10/2000,http://www.marketwatch.com/story/gold-shares-higher-futures-prices-fall,gold shares higher; futures prices fall
27/10/2000,,
28/10/2000,,
29/10/2000,,
30/10/2000,,
31/10/2000,,
1/11/2000,http://www.marketwatch.com/story/gold-slightly-lower-on-dollar-moves,gold slightly lower on dollar moves
2/11/2000,,
3/11/2000,,
4/11/2000,,
5/11/2000,,
6/11/2000,,
7/11/2000,,
8/11/2000,http://www.marketwatch.com/story/gold-futures-prices-little-changed-shares-fall,gold futures prices little changed
9/11/2000,,
10/11/2000,,
11/11/2000,,
12/11/2000,,
13/11/2000,,
14/11/2000,,
15/11/2000,,
16/11/2000,,
17/11/2000,,
18/11/2000,,
19/11/2000,,
20/11/2000,,
21/11/2000,,
22/11/2000,,
23/11/2000,,
24/11/2000,,
25/11/2000,,
26/11/2000,,
27/11/2000,,
28/11/2000,,
29/11/2000,,
30/11/2000,,
1/12/2000,,
2/12/2000,,
3/12/2000,,
4/12/2000,,
5/12/2000,,
6/12/2000,,
7/12/2000,http://www.marketwatch.com/story/gold-prices-fall-palladium-rises,gold prices fall; palladium rises
8/12/2000,,
9/12/2000,,
10/12/2000,,
11/12/2000,,
12/12/2000,,
13/12/2000,http://www.marketwatch.com/story/gold-shares-prices-decline,"gold shares, prices decline"
14/12/2000,,
15/12/2000,http://www.marketwatch.com/story/gold-mining-stocks-as-a-safe-haven-2000-12-15,gold mining stocks as a safe haven
16/12/2000,,
17/12/2000,,
18/12/2000,,
19/12/2000,,
20/12/2000,,
21/12/2000,http://www.marketwatch.com/story/gold-shares-fall-prices-little-changed-20001221169160,gold prices little changed; shares fall
22/12/2000,,
23/12/2000,,
24/12/2000,,
25/12/2000,,
26/12/2000,,
27/12/2000,,
28/12/2000,,
29/12/2000,,
30/12/2000,,
31/12/2000,,
1/1/2001,,
2/1/2001,http://www.marketwatch.com/story/gold-shares-climb-as-prices-inch-lower,gold shares climb as prices fall
3/1/2001,,
4/1/2001,,
5/1/2001,,
6/1/2001,,
7/1/2001,,
8/1/2001,,
9/1/2001,,
10/1/2001,http://www.marketwatch.com/story/gold-closes-lower-palladium-rises,"gold closes lower, palladium rises"
11/1/2001,,
12/1/2001,,
13/1/2001,,
14/1/2001,,
15/1/2001,,
16/1/2001,,
17/1/2001,,
18/1/2001,,
19/1/2001,,
20/1/2001,,
21/1/2001,,
22/1/2001,,
23/1/2001,,
24/1/2001,,
25/1/2001,,
26/1/2001,,
27/1/2001,,
28/1/2001,,
29/1/2001,,
30/1/2001,,
31/1/2001,,
1/2/2001,,
2/2/2001,http://www.marketwatch.com/story/gold-shares-futures-prices-decline,"gold shares, futures prices decline"
3/2/2001,,
4/2/2001,,
5/2/2001,,
6/2/2001,,
7/2/2001,,
8/2/2001,,
9/2/2001,http://www.marketwatch.com/story/gold-shares-climb-futures-prices-fall,"gold shares climb, futures prices fall"
10/2/2001,,
11/2/2001,,
12/2/2001,,
13/2/2001,,
14/2/2001,,
15/2/2001,,
16/2/2001,,
17/2/2001,,
18/2/2001,,
19/2/2001,,
20/2/2001,http://www.marketwatch.com/story/gold-stocks-futures-prices-decline,"gold stocks, futures prices decline"
21/2/2001,,
22/2/2001,http://www.marketwatch.com/story/gold-stocks-prices-slightly-higher,"gold stocks, prices slightly higher"
23/2/2001,,
24/2/2001,,
25/2/2001,,
26/2/2001,,
27/2/2001,,
28/2/2001,,
1/3/2001,,
2/3/2001,,
3/3/2001,,
4/3/2001,,
5/3/2001,http://www.marketwatch.com/story/metals-shares-rise-gold-prices-steady,"metals shares rise, gold prices steady"
6/3/2001,,
7/3/2001,http://www.marketwatch.com/story/metals-issues-gold-prices-climb,"metals issues, gold prices climb"
8/3/2001,,
9/3/2001,,
10/3/2001,,
11/3/2001,,
12/3/2001,,
13/3/2001,http://www.marketwatch.com/story/gold-prices-shares-drop,"gold prices, shares drop"
14/3/2001,http://www.marketwatch.com/story/devalue-against-gold-to-fix-japan,devalue against gold to fix japan
15/3/2001,,
16/3/2001,,
17/3/2001,,
18/3/2001,,
19/3/2001,,
20/3/2001,http://www.marketwatch.com/story/gold-futures-market-closes-higher,gold futures market closes higher
21/3/2001,,
22/3/2001,,
23/3/2001,,
24/3/2001,,
25/3/2001,,
26/3/2001,,
27/3/2001,,
28/3/2001,,
29/3/2001,http://www.marketwatch.com/story/palladium-and-gold-prices-decline,palladium and gold prices decline
30/3/2001,,
31/3/2001,,
1/4/2001,,
2/4/2001,,
3/4/2001,,
4/4/2001,,
5/4/2001,,
6/4/2001,,
7/4/2001,,
8/4/2001,,
9/4/2001,,
10/4/2001,http://www.marketwatch.com/story/gold-prices-fall-further,gold prices fall further
11/4/2001,,
12/4/2001,,
13/4/2001,,
14/4/2001,,
15/4/2001,,
16/4/2001,,
17/4/2001,,
18/4/2001,,
19/4/2001,,
20/4/2001,,
21/4/2001,,
22/4/2001,,
23/4/2001,,
24/4/2001,http://www.marketwatch.com/story/metals-issues-climb-gold-steadies,metals issues climb; gold steadies
25/4/2001,,
26/4/2001,,
27/4/2001,,
28/4/2001,,
29/4/2001,,
30/4/2001,,
1/5/2001,,
2/5/2001,,
3/5/2001,http://www.marketwatch.com/story/gold-prices-rise-as-palladium-falls,gold prices rise as palladium falls
4/5/2001,,
5/5/2001,,
6/5/2001,,
7/5/2001,,
8/5/2001,,
9/5/2001,,
10/5/2001,,
11/5/2001,,
12/5/2001,,
13/5/2001,,
14/5/2001,,
15/5/2001,,
16/5/2001,,
17/5/2001,http://www.marketwatch.com/story/metal-stocks-rise-in-tandem-with-gold-price,gold price lifts metal stocks
18/5/2001,http://www.marketwatch.com/story/gold-leaps-14-an-ounce-to-nine-month-high,gold spikes to 9-month high
19/5/2001,,
20/5/2001,,
21/5/2001,,
22/5/2001,,
23/5/2001,,
24/5/2001,,
25/5/2001,,
26/5/2001,,
27/5/2001,,
28/5/2001,,
29/5/2001,,
30/5/2001,http://www.marketwatch.com/story/gold-falls-for-seventh-trading-day,gold falls for seventh trading day
31/5/2001,,
1/6/2001,,
2/6/2001,,
3/6/2001,,
4/6/2001,,
5/6/2001,,
6/6/2001,,
7/6/2001,http://www.marketwatch.com/story/gold-prices-head-higher-in-new-york,gold issues dull; prices advance
8/6/2001,,
9/6/2001,,
10/6/2001,,
11/6/2001,,
12/6/2001,,
13/6/2001,,
14/6/2001,,
15/6/2001,,
16/6/2001,,
17/6/2001,,
18/6/2001,,
19/6/2001,http://www.marketwatch.com/story/gold-futures-prices-close-higher,gold futures prices close higher
20/6/2001,,
21/6/2001,,
22/6/2001,,
23/6/2001,,
24/6/2001,,
25/6/2001,http://www.marketwatch.com/story/1150am-updatebarrick-gold-gets-bigger,1150am update:barrick gold gets bigger
26/6/2001,,
27/6/2001,,
28/6/2001,,
29/6/2001,,
30/6/2001,,
1/7/2001,,
2/7/2001,,
3/7/2001,http://www.marketwatch.com/story/metals-issues-shine-as-gold-prices-ease,"metals issues shine, gold prices ease"
4/7/2001,,
5/7/2001,,
6/7/2001,,
7/7/2001,,
8/7/2001,,
9/7/2001,,
10/7/2001,,
11/7/2001,,
12/7/2001,,
13/7/2001,,
14/7/2001,,
15/7/2001,,
16/7/2001,,
17/7/2001,http://www.marketwatch.com/story/gold-issues-futures-prices-inch-up,"gold issues, futures prices inch up"
18/7/2001,,
19/7/2001,,
20/7/2001,,
21/7/2001,,
22/7/2001,,
23/7/2001,,
24/7/2001,,
25/7/2001,,
26/7/2001,,
27/7/2001,,
28/7/2001,,
29/7/2001,,
30/7/2001,,
31/7/2001,,
1/8/2001,,
2/8/2001,,
3/8/2001,,
4/8/2001,,
5/8/2001,,
6/8/2001,,
7/8/2001,,
8/8/2001,,
9/8/2001,,
10/8/2001,,
11/8/2001,,
12/8/2001,,
13/8/2001,,
14/8/2001,,
15/8/2001,,
16/8/2001,,
17/8/2001,,
18/8/2001,,
19/8/2001,,
20/8/2001,,
21/8/2001,,
22/8/2001,,
23/8/2001,,
24/8/2001,,
25/8/2001,,
26/8/2001,,
27/8/2001,,
28/8/2001,,
29/8/2001,,
30/8/2001,,
31/8/2001,,
1/9/2001,,
2/9/2001,,
3/9/2001,,
4/9/2001,,
5/9/2001,,
6/9/2001,,
7/9/2001,,
8/9/2001,,
9/9/2001,,
10/9/2001,,
11/9/2001,http://www.marketwatch.com/story/220pm-update-gold-and-oil-climb-after-attacks-2001-09-11,220pm update: gold and oil climb after attacks
12/9/2001,,
13/9/2001,,
14/9/2001,,
15/9/2001,,
16/9/2001,,
17/9/2001,,
18/9/2001,,
19/9/2001,,
20/9/2001,http://www.marketwatch.com/story/gold-shares-turn-higher-prices-drop,gold shares turn higher; prices drop
21/9/2001,,
22/9/2001,,
23/9/2001,,
24/9/2001,,
25/9/2001,,
26/9/2001,http://www.marketwatch.com/story/gold-futures-shares-post-sharp-gains,gold futures post sharp gains
27/9/2001,,
28/9/2001,,
29/9/2001,,
30/9/2001,,
1/10/2001,,
2/10/2001,,
3/10/2001,http://www.marketwatch.com/story/metals-issues-lower-gold-prices-climb,metals issues lower; gold prices climb
4/10/2001,,
5/10/2001,,
6/10/2001,,
7/10/2001,,
8/10/2001,,
9/10/2001,,
10/10/2001,,
11/10/2001,,
12/10/2001,,
13/10/2001,,
14/10/2001,,
15/10/2001,,
16/10/2001,,
17/10/2001,"http://www.marketwatch.com/story/invest-in-gold-mutual-funds,http://www.marketwatch.com/story/gold-prices-shares-post-gains","invest in gold mutual funds,gold prices, shares post gains"
18/10/2001,,
19/10/2001,,
20/10/2001,,
21/10/2001,,
22/10/2001,,
23/10/2001,http://www.marketwatch.com/story/gold-futures-steady-shares-inch-up,"gold futures steady, shares inch up"
24/10/2001,,
25/10/2001,,
26/10/2001,,
27/10/2001,,
28/10/2001,,
29/10/2001,,
30/10/2001,,
31/10/2001,,
1/11/2001,,
2/11/2001,http://www.marketwatch.com/story/gold-sees-steady-trading-session,gold sees steady trading session
3/11/2001,,
4/11/2001,,
5/11/2001,,
6/11/2001,,
7/11/2001,,
8/11/2001,http://www.marketwatch.com/story/gold-futures-drop-to-two-week-low-2001-11-08,gold futures drop to two-week low
9/11/2001,,
10/11/2001,,
11/11/2001,,
12/11/2001,,
13/11/2001,,
14/11/2001,http://www.marketwatch.com/story/newmonts-mega-deal-marks-bullish-gold-bet-2001-11-14,mega-gold merger is big bet on metal
15/11/2001,http://www.marketwatch.com/story/canadian-stocks-stumble-on-oil-slide-2001-11-15,"oil, gold losses hurt canada stocks"
16/11/2001,,
17/11/2001,,
18/11/2001,,
19/11/2001,,
20/11/2001,,
21/11/2001,,
22/11/2001,,
23/11/2001,,
24/11/2001,,
25/11/2001,,
26/11/2001,,
27/11/2001,,
28/11/2001,,
29/11/2001,,
30/11/2001,http://www.marketwatch.com/story/gold-prices-metals-issues-climb-2001-11-30,"gold prices, metals issues climb"
1/12/2001,,
2/12/2001,,
3/12/2001,,
4/12/2001,,
5/12/2001,,
6/12/2001,,
7/12/2001,,
8/12/2001,,
9/12/2001,,
10/12/2001,http://www.marketwatch.com/story/gold-futures-prices-pull-shares-lower-2001-12-10,"gold futures prices, shares lower"
11/12/2001,,
12/12/2001,,
13/12/2001,,
14/12/2001,,
15/12/2001,,
16/12/2001,,
17/12/2001,,
18/12/2001,http://www.marketwatch.com/story/gold-futures-prices-top-280-an-ounce-2001-12-18,gold futures prices top $280 an ounce
19/12/2001,,
20/12/2001,,
21/12/2001,,
22/12/2001,,
23/12/2001,,
24/12/2001,,
25/12/2001,,
26/12/2001,,
27/12/2001,,
28/12/2001,,
29/12/2001,,
30/12/2001,,
31/12/2001,,
1/1/2002,,
2/1/2002,,
3/1/2002,http://www.marketwatch.com/story/gold-falls-slightly-in-slow-start-to-new-year-2002-01-03,gold falls in slow start to new year
4/1/2002,,
5/1/2002,,
6/1/2002,,
7/1/2002,,
8/1/2002,,
9/1/2002,,
10/1/2002,,
11/1/2002,,
12/1/2002,,
13/1/2002,,
14/1/2002,http://www.marketwatch.com/story/golds-price-rise-points-to-commodity-inflation-2002-01-14,anatomy of a budding gold rally
15/1/2002,,
16/1/2002,,
17/1/2002,,
18/1/2002,,
19/1/2002,,
20/1/2002,,
21/1/2002,,
22/1/2002,,
23/1/2002,http://www.marketwatch.com/story/gold-futures-slip-a-bit-further-2002-01-23,gold futures slip a bit further
24/1/2002,,
25/1/2002,,
26/1/2002,,
27/1/2002,,
28/1/2002,,
29/1/2002,,
30/1/2002,,
31/1/2002,,
1/2/2002,,
2/2/2002,,
3/2/2002,,
4/2/2002,,
5/2/2002,http://www.marketwatch.com/story/gold-funds-spell-long-term-losers-2002-02-05,gold funds spell long-term losers
6/2/2002,,
7/2/2002,,
8/2/2002,,
9/2/2002,,
10/2/2002,,
11/2/2002,http://www.marketwatch.com/story/gold-fields-chief-sees-extended-gold-rally-2002-02-11,gold fields head sees better days
12/2/2002,,
13/2/2002,,
14/2/2002,http://www.marketwatch.com/story/van-eck-gold-bug-still-bullish-2002-02-14,van eck gold bug still bullish
15/2/2002,,
16/2/2002,,
17/2/2002,,
18/2/2002,,
19/2/2002,,
20/2/2002,,
21/2/2002,,
22/2/2002,,
23/2/2002,,
24/2/2002,,
25/2/2002,http://www.marketwatch.com/story/gold-prices-dull-on-newmont-news-2002-02-25,gold prices dull on newmont news
26/2/2002,,
27/2/2002,,
28/2/2002,http://www.marketwatch.com/story/gold-futures-metals-shares-gain-2002-02-28,"gold futures, metals shares gain"
1/3/2002,,
2/3/2002,,
3/3/2002,,
4/3/2002,,
5/3/2002,http://www.marketwatch.com/story/gold-pulls-back-from-earlier-rise-2002-03-05,gold pulls back from earlier rise
6/3/2002,,
7/3/2002,,
8/3/2002,,
9/3/2002,,
10/3/2002,,
11/3/2002,,
12/3/2002,http://www.marketwatch.com/story/metals-shares-up-on-golds-price-gain-2002-03-12,metals shares up on gold's price gain
13/3/2002,,
14/3/2002,http://www.marketwatch.com/story/gold-futures-and-company-shares-in-dull-dealings-2002-03-14,"gold futures, issues in dull dealings"
15/3/2002,,
16/3/2002,,
17/3/2002,,
18/3/2002,,
19/3/2002,,
20/3/2002,http://www.marketwatch.com/story/japans-gold-imports-surge-2002-03-20,japan's gold imports surge 7-fold
21/3/2002,http://www.marketwatch.com/story/amex-gold-bugs-index-closes-at-2-year-high-2002-03-21,gold bugs index at 2-year high
22/3/2002,http://www.marketwatch.com/story/stock-funds-move-higher-this-week-led-by-gold-2002-03-22,"stock funds move higher, led by gold"
23/3/2002,,
24/3/2002,,
25/3/2002,,
26/3/2002,http://www.marketwatch.com/story/golds-easy-money-lures-wall-street-2002-03-26,gold's easy money lures wall street
27/3/2002,,
28/3/2002,,
29/3/2002,,
30/3/2002,,
31/3/2002,,
1/4/2002,,
2/4/2002,,
3/4/2002,,
4/4/2002,,
5/4/2002,http://www.marketwatch.com/story/gold-futures-slip-for-a-third-session-2002-04-05,gold futures slip for a third session
6/4/2002,,
7/4/2002,,
8/4/2002,,
9/4/2002,,
10/4/2002,,
11/4/2002,,
12/4/2002,,
13/4/2002,,
14/4/2002,,
15/4/2002,http://www.marketwatch.com/story/gold-futures-metals-issues-decline-2002-04-15,"gold futures, metals issues decline"
16/4/2002,,
17/4/2002,,
18/4/2002,,
19/4/2002,,
20/4/2002,,
21/4/2002,,
22/4/2002,,
23/4/2002,,
24/4/2002,,
25/4/2002,,
26/4/2002,,
27/4/2002,,
28/4/2002,,
29/4/2002,http://www.marketwatch.com/story/gold-dips-after-charge-natural-gas-jumps-2002-04-29,gold dips after strong charge
30/4/2002,,
1/5/2002,,
2/5/2002,,
3/5/2002,http://www.marketwatch.com/story/gold-newsletters-jump-off-bandwagon-2002-05-03-910304,gold newsletters jump off bandwagon
4/5/2002,,
5/5/2002,,
6/5/2002,,
7/5/2002,,
8/5/2002,,
9/5/2002,"http://www.marketwatch.com/story/gold-fields-rises-in-nyse-debut-2002-05-09,http://www.marketwatch.com/story/gold-stocks-broadly-higher-2002-05-09","gold fields up in nyse debut,gold stocks broadly higher"
10/5/2002,"http://www.marketwatch.com/story/gold-funds-shine-in-down-week-2002-05-10,http://www.marketwatch.com/story/gold-stocks-regain-strength-at-the-close-2002-05-10","gold funds shine in down week,gold stocks regain strength at close"
11/5/2002,,
12/5/2002,,
13/5/2002,,
14/5/2002,,
15/5/2002,,
16/5/2002,,
17/5/2002,http://www.marketwatch.com/story/dollar-plunge-propels-gold-stocks-2002-05-17,dollar plunge propels gold stocks
18/5/2002,,
19/5/2002,,
20/5/2002,,
21/5/2002,,
22/5/2002,"http://www.marketwatch.com/story/gold-stock-indexes-touch-new-highs-2002-05-22,http://www.marketwatch.com/story/how-high-can-gold-prices-go-2002-05-22","gold stock indexes touch new highs,how high can gold go?"
23/5/2002,http://www.marketwatch.com/story/south-african-gold-2002-05-23,south african gold
24/5/2002,http://www.marketwatch.com/story/gold-stocks-down-ahead-of-holiday-weekend-2002-05-24,gold stocks down ahead of holiday
25/5/2002,,
26/5/2002,,
27/5/2002,,
28/5/2002,http://www.marketwatch.com/story/nymex-gold-futures-end-at-32410-energy-weakens-2002-05-28,gold futures breach $325 an ounce
29/5/2002,,
30/5/2002,http://www.marketwatch.com/story/gold-stocks-lose-ground-2002-05-30,gold stocks lose ground
31/5/2002,,
1/6/2002,,
2/6/2002,,
3/6/2002,"http://www.marketwatch.com/story/slim-gains-for-nymex-gold-futures-late-fade-for-crude-2002-06-03,http://www.marketwatch.com/story/gold-silver-shares-rally-as-broad-market-sags-2002-06-03","slim gains for nymex gold futures,gold, silver rally as broad market sags"
4/6/2002,,
5/6/2002,,
6/6/2002,,
7/6/2002,,
8/6/2002,,
9/6/2002,,
10/6/2002,http://www.marketwatch.com/story/kinross-gold-to-merge-with-echo-bay-tvx-gold-2002-06-10,"kinross gold buying echo bay, tvx"
11/6/2002,http://www.marketwatch.com/story/gold-limits-losses-in-toronto-2002-06-11,gold reversal buoys bay street
12/6/2002,http://www.marketwatch.com/story/golds-recent-slip-whets-appetite-of-investors-2002-06-12,gold rally running on hope
13/6/2002,http://www.marketwatch.com/story/gold-stocks-pressured-by-disinflation-2002-06-13,gold stocks pressured by disinflation
14/6/2002,http://www.marketwatch.com/story/gold-silver-stocks-rally-2002-06-14,"gold, silver stocks rally"
15/6/2002,,
16/6/2002,,
17/6/2002,http://www.marketwatch.com/story/gold-and-silver-stocks-fall-2002-06-17,gold and silver stocks fall
18/6/2002,,
19/6/2002,,
20/6/2002,,
21/6/2002,,
22/6/2002,,
23/6/2002,,
24/6/2002,,
25/6/2002,,
26/6/2002,,
27/6/2002,http://www.marketwatch.com/story/crude-ends-higher-gold-declines-2002-06-27,"crude ends higher, gold declines"
28/6/2002,http://www.marketwatch.com/story/gold-silver-stocks-decline-for-the-week-2002-06-28,"gold, silver stocks end week lower"
29/6/2002,,
30/6/2002,,
1/7/2002,,
2/7/2002,,
3/7/2002,,
4/7/2002,,
5/7/2002,http://www.marketwatch.com/story/gold-rally-to-resume-as-stocks-crash-analysts-say-2002-07-05,"gold rally to resume, say analysts"
6/7/2002,,
7/7/2002,,
8/7/2002,http://www.marketwatch.com/story/gold-stocks-lift-on-a-weaker-dollar-2002-07-08,gold stocks lift on a weaker dollar
9/7/2002,,
10/7/2002,,
11/7/2002,http://www.marketwatch.com/story/gold-silver-stocks-fall-2002-07-11,"gold, silver stocks under pressure"
12/7/2002,,
13/7/2002,,
14/7/2002,,
15/7/2002,http://www.marketwatch.com/story/gold-retreats-with-djias-rise-2002-07-15,gold stocks retreat from earlier gains
16/7/2002,,
17/7/2002,,
18/7/2002,,
19/7/2002,http://www.marketwatch.com/story/gold-silver-stocks-rise-as-dow-hits-four-year-low-2002-07-19,gold shares up amid blue chips dive
20/7/2002,,
21/7/2002,,
22/7/2002,http://www.marketwatch.com/story/gold-silver-stocks-sell-off-2002-07-22,"gold, silver stocks sell off"
23/7/2002,,
24/7/2002,,
25/7/2002,,
26/7/2002,,
27/7/2002,,
28/7/2002,,
29/7/2002,,
30/7/2002,,
31/7/2002,http://www.marketwatch.com/story/gold-stocks-end-in-the-red-2002-07-31,gold stocks end in the red
1/8/2002,http://www.marketwatch.com/story/gold-stocks-rebound-as-broader-market-dives-2002-08-01,gold stocks rebound as market falls
2/8/2002,http://www.marketwatch.com/story/gold-stocks-give-bay-street-an-edge-2002-08-02,bay street buoyed by gold stocks
3/8/2002,,
4/8/2002,,
5/8/2002,,
6/8/2002,http://www.marketwatch.com/story/gold-stocks-rally-at-the-close-2002-08-06,gold stocks rally at the close
7/8/2002,,
8/8/2002,http://www.marketwatch.com/story/gold-stocks-dip-after-wholesale-prices-fall-2002-08-08,fall in wholesale prices hit gold stocks
9/8/2002,,
10/8/2002,,
11/8/2002,,
12/8/2002,,
13/8/2002,,
14/8/2002,http://www.marketwatch.com/story/gold-falls-as-dollar-equity-markets-rebound-2002-08-14,"gold falls as dollar, equities rebound"
15/8/2002,,
16/8/2002,,
17/8/2002,,
18/8/2002,,
19/8/2002,,
20/8/2002,,
21/8/2002,,
22/8/2002,,
23/8/2002,,
24/8/2002,,
25/8/2002,,
26/8/2002,,
27/8/2002,http://www.marketwatch.com/story/gold-gatherings-intend-to-offer-hot-ticket-to-profits-2002-08-27,gold shows designed to woo main st.
28/8/2002,,
29/8/2002,,
30/8/2002,,
31/8/2002,,
1/9/2002,,
2/9/2002,,
3/9/2002,,
4/9/2002,,
5/9/2002,http://www.marketwatch.com/story/gold-climbs-as-broader-market-drops-2002-09-05,gold climbs as broader market drops
6/9/2002,,
7/9/2002,,
8/9/2002,,
9/9/2002,,
10/9/2002,,
11/9/2002,http://www.marketwatch.com/story/gold-prices-fall-issues-reverse-course-2002-09-11,"gold prices fall, issues reverse course"
12/9/2002,,
13/9/2002,http://www.marketwatch.com/story/gold-issues-futures-prices-fall-2002-09-13,"gold issues, futures prices fall"
14/9/2002,,
15/9/2002,,
16/9/2002,,
17/9/2002,,
18/9/2002,,
19/9/2002,,
20/9/2002,http://www.marketwatch.com/story/attendance-at-gold-shows-seen-soaring-this-year-2002-09-20,gold shows may light fire under metal
21/9/2002,,
22/9/2002,,
23/9/2002,http://www.marketwatch.com/story/gold-executives-analysts-see-gold-poised-to-break-325-2002-09-23,gold execs make bold bullion bets
24/9/2002,,
25/9/2002,,
26/9/2002,,
27/9/2002,,
28/9/2002,,
29/9/2002,http://www.marketwatch.com/story/attention-turns-to-small-gold-producers-at-denver-forum-2002-09-29-1710301,attention turns to small gold producers at denver forum
30/9/2002,http://www.marketwatch.com/story/gold-futures-5-climb-boosts-shares-2002-09-30,gold futures' $5 climb boosts shares
1/10/2002,,
2/10/2002,,
3/10/2002,,
4/10/2002,,
5/10/2002,,
6/10/2002,,
7/10/2002,,
8/10/2002,,
9/10/2002,,
10/10/2002,,
11/10/2002,http://www.marketwatch.com/story/copper-aluminum-prices-soar-gold-little-change-2002-10-11,"copper, aluminum soar; gold flat"
12/10/2002,,
13/10/2002,,
14/10/2002,,
15/10/2002,http://www.marketwatch.com/story/metals-stocks-sink-gold-futures-give-back-5-2002-10-15,"metals stocks, gold futures prices sink"
16/10/2002,,
17/10/2002,,
18/10/2002,,
19/10/2002,http://www.marketwatch.com/story/is-americas-great-real-estate-gold-rush-in-trouble-2002-10-19,is america's great real estate gold rush in trouble?
20/10/2002,,
21/10/2002,,
22/10/2002,,
23/10/2002,,
24/10/2002,,
25/10/2002,,
26/10/2002,,
27/10/2002,,
28/10/2002,,
29/10/2002,,
30/10/2002,http://www.marketwatch.com/story/metals-issues-climb-for-a-second-session-2002-10-30,metals issues climb; gold futures fall
31/10/2002,,
1/11/2002,,
2/11/2002,,
3/11/2002,,
4/11/2002,,
5/11/2002,,
6/11/2002,,
7/11/2002,,
8/11/2002,,
9/11/2002,,
10/11/2002,,
11/11/2002,,
12/11/2002,,
13/11/2002,,
14/11/2002,,
15/11/2002,,
16/11/2002,,
17/11/2002,,
18/11/2002,,
19/11/2002,,
20/11/2002,,
21/11/2002,,
22/11/2002,,
23/11/2002,,
24/11/2002,,
25/11/2002,,
26/11/2002,,
27/11/2002,http://www.marketwatch.com/story/harmony-gold-mining-adrs-debut-on-nyse-2002-11-27,harmony gold mining adrs debut on nyse
28/11/2002,,
29/11/2002,,
30/11/2002,,
1/12/2002,,
2/12/2002,http://www.marketwatch.com/story/gold-prices-gain-as-stock-market-falters-2002-12-02,gold prices up as stock market falters
3/12/2002,,
4/12/2002,,
5/12/2002,,
6/12/2002,http://www.marketwatch.com/story/gold-shines-tech-and-telecom-snap-7-week-win-streak-2002-12-06,gold shows its mettle
7/12/2002,,
8/12/2002,,
9/12/2002,,
10/12/2002,,
11/12/2002,,
12/12/2002,http://www.marketwatch.com/story/gold-at-six-month-high-on-dollar-geopolitical-concerns-2002-12-12,gold futures touch 6-month high
13/12/2002,"http://www.marketwatch.com/story/us-stocks-headed-lower-as-gold-spikes-2002-12-13,http://www.marketwatch.com/story/gold-finally-macho-heads-toward-next-hurdle-2002-12-13","u.s. stocks headed lower as gold spikes,gold backers -- finally -- in nirvana"
14/12/2002,,
15/12/2002,,
16/12/2002,"http://www.marketwatch.com/story/gold-prices-hit-338-issues-shoot-up-2002-12-16,http://www.marketwatch.com/story/canadian-stocks-gain-gold-leads-the-way-2002-12-16","gold prices hit $338, issues shoot up,gold stocks jump-start bay street"
17/12/2002,,
18/12/2002,,
19/12/2002,,
20/12/2002,http://www.marketwatch.com/story/not-everything-that-glitters-is-gold-2002-12-20,not everything that glitters is gold
21/12/2002,,
22/12/2002,,
23/12/2002,"http://www.marketwatch.com/story/bay-street-gains-on-strength-in-gold-energy-issues-2002-12-23,http://www.marketwatch.com/story/gold-soars-to-end-near-a-six-year-high-2002-12-23","bay street gains; gold, energy strong,soaring gold ends near six-year high"
24/12/2002,,
25/12/2002,,
26/12/2002,http://www.marketwatch.com/story/dollar-slips-gold-extends-recent-surge-2002-12-26,"dollar slips, gold extends recent surge"
27/12/2002,,
28/12/2002,,
29/12/2002,,
30/12/2002,,
31/12/2002,,
1/1/2003,,
2/1/2003,,
3/1/2003,,
4/1/2003,,
5/1/2003,,
6/1/2003,http://www.marketwatch.com/story/crude-eases-in-london-but-gold-holds-gains-2003-01-06,"crude eases in london, but gold holds gains"
7/1/2003,,
8/1/2003,,
9/1/2003,,
10/1/2003,,
11/1/2003,,
12/1/2003,,
13/1/2003,,
14/1/2003,http://www.marketwatch.com/story/stock-markets-resilience-weighs-on-gold-2003-01-14,gold falls as stock market climbs
15/1/2003,,
16/1/2003,http://www.marketwatch.com/story/gold-at-359-near-six-year-high-after-iraq-inspections-2003-01-16,"gold touches $359, nears 6-yr high"
17/1/2003,,
18/1/2003,,
19/1/2003,,
20/1/2003,,
21/1/2003,"http://www.marketwatch.com/story/researchers-index-forecasts-sharp-imminent-gold-gain-2003-01-21,http://www.marketwatch.com/story/gold-futures-hold-near-six-year-high-above-357-2003-01-21","gold gain is imminent, forecaster says,gold futures hold above $357"
22/1/2003,,
23/1/2003,http://www.marketwatch.com/story/feb-gold-at-36610-up-620-after-36770-high-2003-01-23,"feb gold at $366.10, up $6.20 after $367.70 high"
24/1/2003,,
25/1/2003,,
26/1/2003,,
27/1/2003,,
28/1/2003,,
29/1/2003,,
30/1/2003,,
31/1/2003,,
1/2/2003,,
2/2/2003,,
3/2/2003,,
4/2/2003,"http://www.marketwatch.com/story/gold-futures-close-near-380-a-1996-high-2003-02-04,http://www.marketwatch.com/story/gold-analyst-thus-far-on-the-mark-predicts-434-price-2003-02-04","gold futures close near $380 an ounce,researcher nails gold-price forecast"
5/2/2003,"http://www.marketwatch.com/story/april-gold-futures-up-390-at-38380-ahead-of-powell-2003-02-05,http://www.marketwatch.com/story/gold-extends-slide-after-powell-ends-un-address-2003-02-05","april gold futures up $3.90 at $383.80 ahead of powell,gold extends slide after powell ends u.n. address"
6/2/2003,,
7/2/2003,http://www.marketwatch.com/story/april-gold-up-350-at-37420oz-after-37560-high-2003-02-07,april gold up $3.50 at $374.20/oz after $375.60 high
8/2/2003,,
9/2/2003,,
10/2/2003,"http://www.marketwatch.com/story/internet-gold-q4-earns-5c-vs-25c-2003-02-10,http://www.marketwatch.com/story/gold-drops-on-news-that-iraq-will-allow-spy-flights-2003-02-10,http://www.marketwatch.com/story/gold-stocks-lose-luster-2003-02-10","internet gold q4 earns 5c vs. 2.5c,gold drops on news that iraq will allow spy flights,gold stocks lose luster"
11/2/2003,"http://www.marketwatch.com/story/gold-ends-lower-at-363-after-volatile-session-2003-02-11,http://www.marketwatch.com/story/hecla-mining-02-gold-silver-production-at-record-2003-02-11","gold ends lower after volatile session,hecla mining '02 gold, silver production at record"
12/2/2003,http://www.marketwatch.com/story/april-gold-falls-10-to-353oz-lowest-close-in-4-wks-2003-02-12,"april gold falls $10 to $353/oz, lowest close in 4 wks"
13/2/2003,,
14/2/2003,http://www.marketwatch.com/story/april-gold-hits-four-week-low-at-350oz-down-770-2003-02-14,"april gold hits four-week low at $350/oz, down $7.70"
15/2/2003,,
16/2/2003,,
17/2/2003,,
18/2/2003,"http://www.marketwatch.com/story/april-gold-at-34510oz-down-710-after-34350-low-2003-02-18,http://www.marketwatch.com/story/april-gold-closes-down-790-at-34430-a-2-month-low-2003-02-18","april gold at $345.10/oz, down $7.10 after $343.50 low,april gold closes down $7.90 at $344.30, a 2-month low"
19/2/2003,,
20/2/2003,,
21/2/2003,,
22/2/2003,,
23/2/2003,,
24/2/2003,,
25/2/2003,,
26/2/2003,http://www.marketwatch.com/story/weak-stock-market-supports-gold-futures-2003-02-26,weak stock market supports gold
27/2/2003,,
28/2/2003,,
1/3/2003,,
2/3/2003,,
3/3/2003,,
4/3/2003,,
5/3/2003,,
6/3/2003,,
7/3/2003,,
8/3/2003,,
9/3/2003,,
10/3/2003,,
11/3/2003,,
12/3/2003,,
13/3/2003,,
14/3/2003,,
15/3/2003,,
16/3/2003,,
17/3/2003,http://www.marketwatch.com/story/april-gold-up-60c-at-33720-off-34350-high-2003-03-17,"april gold up 60c at $337.20, off $343.50 high"
18/3/2003,http://www.marketwatch.com/story/barrick-gold-up-32-in-xau-2003-03-18-13902731,barrick gold up 3.2% in $xau
19/3/2003,,
20/3/2003,http://www.marketwatch.com/story/spot-gold-at-33520-an-ounce-off-40-cents-kitco-2003-03-20,"spot gold at $335.20 an ounce, off 40 cents - kitco"
21/3/2003,http://www.marketwatch.com/story/gold-futures-sink-as-us-allies-gain-ground-in-iraq-2003-03-21,"gold sinks as u.s., allies gain ground"
22/3/2003,,
23/3/2003,,
24/3/2003,http://www.marketwatch.com/story/april-gold-closes-at-32950oz-up-340-2003-03-24,"april gold closes at $329.50/oz, up $3.40"
25/3/2003,,
26/3/2003,,
27/3/2003,,
28/3/2003,,
29/3/2003,,
30/3/2003,http://www.marketwatch.com/story/gold-up-more-than-2-to-3338033430-oz-in-sydney-2003-03-30,gold up more than $2 to $333.80/334.30 /oz. in sydney
31/3/2003,,
1/4/2003,,
2/4/2003,http://www.marketwatch.com/story/correct-june-gold-closes-at-33040oz-down-480-2003-04-02,"correct: june gold closes at $330.40/oz, down $4.80"
3/4/2003,"http://www.marketwatch.com/story/gold-futures-sink-to-four-month-low-2003-04-03,http://www.marketwatch.com/story/gold-futures-at-four-month-low-2003-04-03","gold futures sink to four-month low,gold futures at four-month low"
4/4/2003,,
5/4/2003,,
6/4/2003,,
7/4/2003,"http://www.marketwatch.com/story/spot-gold-at-32140-in-asia-down-41-from-ny-close-2003-04-07,http://www.marketwatch.com/story/more-pressure-on-gold-as-coalition-squeezes-baghdad-2003-04-07","spot gold at $321.40 in asia, down $4.1 from ny close,allied advances weigh on gold"
8/4/2003,http://www.marketwatch.com/story/gold-prices-close-higher-with-eyes-on-dollar-iraq-2003-04-08,"gold higher with eyes on dollar, iraq"
9/4/2003,"http://www.marketwatch.com/story/spot-gold-prices-rise-440-to-32650-in-asia-2003-04-09,http://www.marketwatch.com/story/barrick-gold-gets-favorable-court-ruling-on-epa-report-2003-04-09,http://www.marketwatch.com/story/meridian-gold-up-25-in-xau-2003-04-09","spot gold prices rise $4.40 to $326.50 in asia,barrick gold gets favorable court ruling on epa report,meridian gold up 2.5% in $xau"
10/4/2003,,
11/4/2003,,
12/4/2003,,
13/4/2003,,
14/4/2003,,
15/4/2003,,
16/4/2003,,
17/4/2003,http://www.marketwatch.com/story/freeport-mcmoran-copper-gold-q1-eps-33c-vs-loss-3c-2003-04-17,freeport-mcmoran copper & gold q1 eps 33c vs loss 3c
18/4/2003,,
19/4/2003,,
20/4/2003,,
21/4/2003,http://www.marketwatch.com/story/gold-futures-close-near-334-an-ounce-2003-04-21,gold futures close near $334 an ounce
22/4/2003,http://www.marketwatch.com/story/gold-futures-set-to-market-fifth-session-of-gains-2003-04-22,gold futures set to market fifth session of gains
23/4/2003,,
24/4/2003,http://www.marketwatch.com/story/gold-futures-close-up-recover-prior-sessions-loss-2003-04-24,"gold futures close up, recover prior session's loss"
25/4/2003,http://www.marketwatch.com/story/gold-futures-end-the-week-with-2-gain-2003-04-25,gold futures end the week with 2% gain
26/4/2003,,
27/4/2003,,
28/4/2003,http://www.marketwatch.com/story/gold-futures-fall-hold-recent-trading-range-2003-04-28,"gold futures fall, hold recent trading range"
29/4/2003,,
30/4/2003,,
1/5/2003,http://www.marketwatch.com/story/meridian-gold-up-61-in-xau-2003-05-01,meridian gold up 6.1% in $xau
2/5/2003,,
3/5/2003,,
4/5/2003,,
5/5/2003,,
6/5/2003,"http://www.marketwatch.com/story/glamis-gold-ltd-q1-revenue-at-207-mln-vs-182-mln-2003-05-06,http://www.marketwatch.com/story/gold-futures-near-highest-level-in-eight-weeks-2003-05-06","glamis gold ltd. q1 revenue at $20.7 mln vs $18.2 mln,gold futures near highest level in eight weeks"
7/5/2003,,
8/5/2003,,
9/5/2003,http://www.marketwatch.com/story/gold-futures-close-flat-on-session-up-2-on-week-2003-05-09,"gold futures close flat on session, up 2% on week"
10/5/2003,,
11/5/2003,,
12/5/2003,http://www.marketwatch.com/story/nymex-gold-futures-above-350-close-at-two-month-high-2003-05-12,gold futures back above $350
13/5/2003,,
14/5/2003,"http://www.marketwatch.com/story/gold-futures-rise-to-fresh-two-month-high-2003-05-14,http://www.marketwatch.com/story/gold-futures-climb-to-fresh-two-month-high-2003-05-14","gold futures rise to fresh two-month high,gold climbs to fresh two-month high"
15/5/2003,,
16/5/2003,http://www.marketwatch.com/story/gold-futures-retreat-ahead-of-g-7-meeting-2003-05-16,gold futures bend to profit-taking
17/5/2003,,
18/5/2003,,
19/5/2003,"http://www.marketwatch.com/story/spot-gold-prices-rise-4-from-ny-to-36775-in-asia-2003-05-19,http://www.marketwatch.com/story/philadelphia-gold-silver-index-rises-33-2003-05-19","spot gold prices rise $4 from ny to $367.75 in asia,philadelphia gold & silver index rises 3.3%"
20/5/2003,,
21/5/2003,http://www.marketwatch.com/story/gold-prices-climbs-for-a-sixth-day-2003-05-21,gold prices climbs for a sixth day
22/5/2003,,
23/5/2003,http://www.marketwatch.com/story/gold-banc-in-restitution-deal-with-fmr-ceo-mike-gullion-2003-05-23,gold banc in restitution deal with fmr ceo mike gullion
24/5/2003,,
25/5/2003,,
26/5/2003,,
27/5/2003,http://www.marketwatch.com/story/gold-futures-metals-stocks-climb-amid-dollar-weakness-2003-05-27,"gold futures, metals stocks climb amid dollar weakness"
28/5/2003,http://www.marketwatch.com/story/philadelphia-gold-silver-index-falls-36-2003-05-28,philadelphia gold & silver index falls 3.6%
29/5/2003,,
30/5/2003,http://www.marketwatch.com/story/gold-futures-metals-indexes-fall-back-2003-05-30,"gold futures, metals indexes fall back"
31/5/2003,,
1/6/2003,,
2/6/2003,http://www.marketwatch.com/story/gold-mining-stocks-sag-as-dollar-gains-2003-06-02,gold-mining stocks sag as dollar gains
3/6/2003,,
4/6/2003,,
5/6/2003,,
6/6/2003,,
7/6/2003,,
8/6/2003,,
9/6/2003,http://www.marketwatch.com/story/gold-closes-lower-analysts-cautiously-optimistic-2003-06-09,gold closes lower monday
10/6/2003,,
11/6/2003,"http://www.marketwatch.com/story/august-gold-closes-at-35620-an-ounce-up-340-2003-06-11,http://www.marketwatch.com/story/gold-futures-close-up-by-1-metals-shares-higher-2003-06-11","august gold closes at $356.20 an ounce, up $3.40,gold futures close up by 1%; metals shares higher"
12/6/2003,http://www.marketwatch.com/story/gold-futures-ease-back-on-fresh-dollar-strength-2003-06-12,gold futures ease back on fresh dollar strength
13/6/2003,http://www.marketwatch.com/story/gold-futures-close-up-on-session-down-on-week-2003-06-13,"gold futures close up on session, down on week"
14/6/2003,,
15/6/2003,,
16/6/2003,http://www.marketwatch.com/story/gold-futures-close-near-360-metals-shares-climb-2003-06-16,gold futures close near $360; metals shares climb
17/6/2003,,
18/6/2003,http://www.marketwatch.com/story/companhia-vale-do-rio-doce-sells-gold-mine-for-209m-2003-06-18,companhia vale do rio doce sells gold mine for $20.9m
19/6/2003,http://www.marketwatch.com/story/prudential-ups-gold-price-target-newmont-rating-2003-06-19,"prudential ups gold price target, newmont rating"
20/6/2003,,
21/6/2003,,
22/6/2003,,
23/6/2003,http://www.marketwatch.com/story/gold-prices-metals-shares-close-lower-2003-06-23,"gold prices, metals shares close lower"
24/6/2003,,
25/6/2003,"http://www.marketwatch.com/story/aug-gold-ends-at-34960-up-08-ahead-of-fed-decision-2003-06-25,http://www.marketwatch.com/story/aug-gold-down-in-evening-trading-down-150-at-34810-2003-06-25","aug gold ends at $349.60, up 0.8% ahead of fed decision,aug gold down in evening trading, down $1.50 at $348.10"
26/6/2003,http://www.marketwatch.com/story/gold-futures-close-with-a-more-than-5-an-ounce-loss-2003-06-26,gold prices close more than $5 lower
27/6/2003,"http://www.marketwatch.com/story/gold-futures-climb-metals-stocks-narrowly-higher-2003-06-27,http://www.marketwatch.com/story/gold-closes-session-higher-but-sheds-11-vs-week-2003-06-27","gold futures climb; metals stocks narrowly higher,gold prices close down $11 on week"
28/6/2003,,
29/6/2003,,
30/6/2003,,
1/7/2003,,
2/7/2003,http://www.marketwatch.com/story/meridian-gold-closes-sales-onjerritt-canyon-interest-2003-07-02,meridian gold closes sales onjerritt canyon interest
3/7/2003,http://www.marketwatch.com/story/gold-futures-edge-higher-metals-shares-mixed-2003-07-03,gold futures edge higher; metals shares mixed
4/7/2003,,
5/7/2003,,
6/7/2003,,
7/7/2003,,
8/7/2003,,
9/7/2003,,
10/7/2003,http://www.marketwatch.com/story/gold-slips-silver-rises-and-stocks-trade-mixed-2003-07-10,"gold slips, silver rises, and stocks trade mixed"
11/7/2003,,
12/7/2003,,
13/7/2003,,
14/7/2003,,
15/7/2003,http://www.marketwatch.com/story/august-gold-contract-down-as-much-as-650-an-ounce-2003-07-15,august gold contract down as much as $6.50 an ounce
16/7/2003,http://www.marketwatch.com/story/toronto-closes-lower-on-tech-tumble-2003-07-16,"techs, gold take down toronto"
17/7/2003,,
18/7/2003,,
19/7/2003,,
20/7/2003,,
21/7/2003,,
22/7/2003,,
23/7/2003,http://www.marketwatch.com/story/philadelphia-gold-silver-index-rises-38-2003-07-23,philadelphia gold & silver index rises 3.8%
24/7/2003,,
25/7/2003,http://www.marketwatch.com/story/cboe-gold-index-up-09-2003-07-25,cboe gold index up 0.9%
26/7/2003,,
27/7/2003,,
28/7/2003,,
29/7/2003,http://www.marketwatch.com/story/gold-prices-close-more-than-3-lower-2003-07-29,gold prices close more than $3 lower
30/7/2003,http://www.marketwatch.com/story/gold-falls-under-357-to-close-at-a-one-week-low-2003-07-30,"gold under $357, low point for week"
31/7/2003,,
1/8/2003,"http://www.marketwatch.com/story/gold-futures-end-the-week-with-a-nearly-5-loss-2003-08-01,http://www.marketwatch.com/story/gold-futures-near-two-week-low-metals-shares-fall-2003-08-01","gold futures end the week with a nearly 5% loss,gold futures near two-week low; metals shares fall"
2/8/2003,,
3/8/2003,,
4/8/2003,http://www.marketwatch.com/story/gold-banc-names-robert-gourley-to-board-2003-08-04,gold banc names robert gourley to board
5/8/2003,http://www.marketwatch.com/story/canadian-stocks-close-in-the-red-2003-08-05,gold tempers bay street losses
6/8/2003,,
7/8/2003,,
8/8/2003,,
9/8/2003,,
10/8/2003,,
11/8/2003,http://www.marketwatch.com/story/nymex-gold-closes-above-363-an-ounce-2003-08-11,gold contract tops $363 an ounce
12/8/2003,http://www.marketwatch.com/story/philadelphia-gold-silver-index-down-151-at-8620-2003-08-12,philadelphia gold & silver index down 1.51 at 86.20
13/8/2003,"http://www.marketwatch.com/story/gold-futures-at-fresh-two-week-high-2003-08-13,http://www.marketwatch.com/story/bema-gold-updates-russia-kupol-results-2003-08-13,http://www.marketwatch.com/story/bema-gold-shares-hit-52-wk-high-ahead-of-russia-results-2003-08-13","gold futures at fresh two-week high,bema gold updates russia kupol results,bema gold shares hit 52-wk high ahead of russia results"
14/8/2003,http://www.marketwatch.com/story/gold-futures-metals-index-reach-fresh-highs-2003-08-14,"gold futures, metals index reach fresh highs"
15/8/2003,http://www.marketwatch.com/story/gold-futures-close-lower-friday-up-for-the-week-2003-08-15,"gold lower on session, up on week"
16/8/2003,,
17/8/2003,,
18/8/2003,http://www.marketwatch.com/story/maxam-gold-president-and-ceo-dale-l-runyon-dies-2003-08-18,maxam gold president and ceo dale l. runyon dies
19/8/2003,,
20/8/2003,,
21/8/2003,http://www.marketwatch.com/story/nymex-gold-futures-end-lower-on-upbeat-economic-data-2003-08-21,gold falls on upbeat economic data
22/8/2003,http://www.marketwatch.com/story/gold-futures-end-just-short-of-week-ago-close-2003-08-22,gold futures end just short of week-ago close
23/8/2003,,
24/8/2003,,
25/8/2003,http://www.marketwatch.com/story/gold-futures-close-lower-palladium-climbs-2003-08-25,gold futures close lower; palladium climbs
26/8/2003,,
27/8/2003,http://www.marketwatch.com/story/nymex-gold-rallies-2-to-end-back-above-370-level-2003-08-27,nymex gold rallies back above $370
28/8/2003,,
29/8/2003,http://www.marketwatch.com/story/gold-futures-rally-carrying-metals-stocks-higher-2003-08-29,"gold futures rally, carrying metals stocks higher"
30/8/2003,,
31/8/2003,,
1/9/2003,,
2/9/2003,http://www.marketwatch.com/story/philadelphia-gold-silver-index-down-01-at-9090-2003-09-02,philadelphia gold & silver index down 0.1% at 90.90
3/9/2003,http://www.marketwatch.com/story/gold-futures-close-higher-on-the-session-2003-09-03,gold futures close higher on the session
4/9/2003,http://www.marketwatch.com/story/gold-futures-pare-losses-at-close-metals-shares-higher-2003-09-04,gold futures pare losses at close
5/9/2003,"http://www.marketwatch.com/story/canada-stocks-end-modestly-higher-despite-job-losses-2003-09-05,http://www.marketwatch.com/story/gold-futures-close-at-highest-level-since-february-2003-09-05","nortel, gold buoy bay street,gold futures close at highest level since february"
6/9/2003,,
7/9/2003,,
8/9/2003,"http://www.marketwatch.com/story/gold-futures-metals-shares-ease-back-2003-09-08,http://www.marketwatch.com/story/dec-gold-down-260-at-37610-gold-indexes-down-1-2003-09-08","gold futures metals shares ease back,dec gold down $2.60 at $376.10; gold indexes down 1%"
9/9/2003,"http://www.marketwatch.com/story/crystallex-to-detail-costs-for-gold-deposits-2003-09-09,http://www.marketwatch.com/story/gold-prices-close-above-382-at-seven-year-high-2003-09-09,http://www.marketwatch.com/story/dec-gold-up-760-up-2-at-38380oz-2003-09-09","crystallex to detail costs for gold deposits,gold futures close at seven-year high,dec gold up $7.60, up 2%, at $383.80/oz"
10/9/2003,"http://www.marketwatch.com/story/metals-shares-ease-back-as-gold-futures-fall-2003-09-10,http://www.marketwatch.com/story/gold-futures-hold-above-380-2003-09-10","metals shares ease back as gold futures fall,gold futures hold above $380"
11/9/2003,http://www.marketwatch.com/story/dec-gold-down-410-at-377-an-ounce-2003-09-11,dec gold down $4.10 at $377 an ounce
12/9/2003,,
13/9/2003,,
14/9/2003,,
15/9/2003,"http://www.marketwatch.com/story/dec-gold-down-240-at-37450oz-after-37350-low-2003-09-15,http://www.marketwatch.com/story/gold-futures-mark-four-session-losing-streak-2003-09-15,http://www.marketwatch.com/story/gold-futures-close-lower-but-off-the-sessions-lows-2003-09-15","dec gold down $2.40 at $374.50/oz after $373.50 low,gold marks four-session losing streak,gold futures close lower, but off the session's lows"
16/9/2003,,
17/9/2003,,
18/9/2003,,
19/9/2003,"http://www.marketwatch.com/story/gold-prices-climb-pull-metals-shares-higher-2003-09-19,http://www.marketwatch.com/story/gold-rises-130-2003-09-19","gold prices climb, pull metals shares higher,gold rises $1.30"
20/9/2003,,
21/9/2003,,
22/9/2003,"http://www.marketwatch.com/story/gold-rises-460-per-ounce-2003-09-22,http://www.marketwatch.com/story/gold-futures-touch-seven-year-high-2003-09-22,http://www.marketwatch.com/story/metals-shares-end-higher-on-gold-price-rally-2003-09-22,http://www.marketwatch.com/story/gold-futures-metals-indices-touch-record-highs-2003-09-22","gold rises $4.60 per ounce,gold futures touch seven-year high,metals shares end higher on gold price rally,gold futures, metals indices touch record highs"
23/9/2003,,
24/9/2003,,
25/9/2003,http://www.marketwatch.com/story/gold-futures-top-393-an-ounce-2003-09-25,gold futures top $393 an ounce
26/9/2003,http://www.marketwatch.com/story/gold-futures-fall-4-an-ounce-metals-indexes-down-3-2003-09-26,gold futures fall $4 an ounce; metals indexes down 3%
27/9/2003,,
28/9/2003,http://www.marketwatch.com/story/spot-gold-trading-at-38110-an-ounce-kitco-2003-09-28,spot gold trading at $381.10 an ounce - kitco
29/9/2003,"http://www.marketwatch.com/story/vista-gold-aims-for-612-mln-private-placement-2003-09-29,http://www.marketwatch.com/story/dollar-decline-lifts-gold-futures-shares-2003-09-29","vista gold aims for $6.12 mln private placement,dollar decline lifts gold futures, shares"
30/9/2003,http://www.marketwatch.com/story/golds-gains-prompt-higher-q3-close-for-metals-stocks-2003-09-30,gold's gains prompt higher q3 close for metals stocks
1/10/2003,http://www.marketwatch.com/story/gold-futures-close-with-a-loss-of-more-than-1-2003-10-01,gold futures close with a loss of more than $1
2/10/2003,http://www.marketwatch.com/story/metals-shares-turn-higher-gold-futures-still-lower-2003-10-02,metals shares turn higher; gold futures still lower
3/10/2003,http://www.marketwatch.com/story/metals-shares-slip-gold-futures-climb-2003-10-03,metals shares slip; gold futures climb
4/10/2003,,
5/10/2003,,
6/10/2003,,
7/10/2003,,
8/10/2003,http://www.marketwatch.com/story/canadian-stocks-close-with-modest-gains-2003-10-08,gold gains give edge to bay street
9/10/2003,,
10/10/2003,,
11/10/2003,,
12/10/2003,,
13/10/2003,http://www.marketwatch.com/story/gold-reverses-course-closes-higher-copper-rallies-2003-10-13,"gold reverses course, closes higher; copper rallies"
14/10/2003,http://www.marketwatch.com/story/barrick-gold-acquires-stake-in-highland-gold-2003-10-14,barrick gold acquires stake in highland gold
15/10/2003,,
16/10/2003,http://www.marketwatch.com/story/gold-market-climbs-after-economic-financial-data-2003-10-16,"gold market climbs after economic, financial data"
17/10/2003,,
18/10/2003,,
19/10/2003,,
20/10/2003,,
21/10/2003,,
22/10/2003,,
23/10/2003,"http://www.marketwatch.com/story/nymex-gold-closes-lower-for-the-first-time-in-four-days-2003-10-23,http://www.marketwatch.com/story/gold-futures-close-down-nearly-2-an-ounce-2003-10-23","gold falls for first time in four days,gold futures close down nearly $2 an ounce"
24/10/2003,,
25/10/2003,,
26/10/2003,,
27/10/2003,"http://www.marketwatch.com/story/gold-futures-retreat-but-close-above-388-an-ounce-2003-10-27,http://www.marketwatch.com/story/metals-mining-shares-defy-gold-price-weakness-2003-10-27","after a surge, gold futures retreat,metals mining shares defy gold price weakness"
28/10/2003,http://www.marketwatch.com/story/fed-decision-has-little-effect-on-oil-gold-sectors-2003-10-28,"fed decision has little effect on oil, gold sectors"
29/10/2003,,
30/10/2003,,
31/10/2003,"http://www.marketwatch.com/story/gold-futures-end-higher-metals-shares-climb-2003-10-31,http://www.marketwatch.com/story/cboe-gold-index-down-25-for-week-2003-10-31","gold futures end higher, shares climb,cboe gold index down 2.5% for week"
1/11/2003,,
2/11/2003,,
3/11/2003,,
4/11/2003,http://www.marketwatch.com/story/gold-futures-metals-shares-inch-up-2003-11-04,"gold futures, metals shares inch up"
5/11/2003,http://www.marketwatch.com/story/gold-futures-close-near-383-an-ounce-2003-11-05,gold futures close near $383 an ounce
6/11/2003,"http://www.marketwatch.com/story/gold-futures-fall-as-economic-data-lifts-dollar-2003-11-06,http://www.marketwatch.com/story/gold-prices-fall-after-two-session-climb-2003-11-06","gold futures fall as economic data lifts dollar,gold prices fall after two-session climb"
7/11/2003,,
8/11/2003,,
9/11/2003,,
10/11/2003,"http://www.marketwatch.com/story/gold-futures-close-near-387-an-ounce-2003-11-10,http://www.marketwatch.com/story/metals-shares-end-lower-despite-gold-futures-strength-2003-11-10","gold futures close near $387 an ounce,metals shares end lower despite gold futures strength"
11/11/2003,,
12/11/2003,"http://www.marketwatch.com/story/dec-gold-touches-397-highest-since-may-1996-2003-11-12,http://www.marketwatch.com/story/philadelphia-gold-silver-index-gains-41-2003-11-12","dec gold touches $397, highest since may 1996,philadelphia gold & silver index gains 4.1%"
13/11/2003,,
14/11/2003,,
15/11/2003,,
16/11/2003,,
17/11/2003,http://www.marketwatch.com/story/gold-futures-tumble-closing-near-one-week-low-2003-11-17,gold futures close near one-week low
18/11/2003,,
19/11/2003,http://www.marketwatch.com/story/gold-slips-after-overnight-breach-of-400-2003-11-19,gold slips after overnight breach of $400
20/11/2003,,
21/11/2003,,
22/11/2003,,
23/11/2003,,
24/11/2003,http://www.marketwatch.com/story/gold-closes-lower-as-investor-interest-stalls-2003-11-24,"gold closes lower, other metals slide"
25/11/2003,,
26/11/2003,,
27/11/2003,,
28/11/2003,http://www.marketwatch.com/story/philadelphia-gold-silver-index-climbs-16-2003-11-28,philadelphia gold & silver index climbs 1.6%
29/11/2003,,
30/11/2003,,
1/12/2003,http://www.marketwatch.com/story/gold-futures-top-400-2003-12-01,gold futures top $400
2/12/2003,,
3/12/2003,http://www.marketwatch.com/story/gold-futures-close-with-only-a-20-cent-gain-2003-12-03,gold futures close with only a 20-cent gain
4/12/2003,,
5/12/2003,,
6/12/2003,,
7/12/2003,,
8/12/2003,,
9/12/2003,http://www.marketwatch.com/story/gold-futures-continue-rise-metals-shares-fall-2003-12-09,gold futures continue rise; metals shares fall
10/12/2003,,
11/12/2003,,
12/12/2003,,
13/12/2003,,
14/12/2003,,
15/12/2003,http://www.marketwatch.com/story/gold-futures-off-180-to-40760-2003-12-15,gold futures off $1.80 to $407.60
16/12/2003,http://www.marketwatch.com/story/gold-futures-close-lower-copper-ends-above-1-2003-12-16,gold futures close lower; copper ends above $1
17/12/2003,,
18/12/2003,,
19/12/2003,"http://www.marketwatch.com/story/philadelphia-gold-silver-index-falls-26-2003-12-19,http://www.marketwatch.com/story/metals-shares-gold-futures-weaken-2003-12-19,http://www.marketwatch.com/story/gold-futures-end-down-copper-gains-mining-shares-dip-2003-12-19","philadelphia gold & silver index falls 2.6%,metals shares, gold futures weaken,gold futures end week with minor loss"
20/12/2003,,
21/12/2003,,
22/12/2003,,
23/12/2003,"http://www.marketwatch.com/story/gold-futures-close-narrowly-higher-copper-climbs-11-2003-12-23,http://www.marketwatch.com/story/gold-futures-falls-but-copper-rises-2003-12-23","gold futures end higher; copper up 1.1%,gold futures falls, but copper rises"
24/12/2003,,
25/12/2003,,
26/12/2003,"http://www.marketwatch.com/story/philadelphia-gold-silver-index-climbs-18-2003-12-26,http://www.marketwatch.com/story/philadelphia-gold-silver-index-rises-16-2003-12-26","philadelphia gold & silver index climbs 1.8%,philadelphia gold & silver index rises 1.6%"
27/12/2003,,
28/12/2003,,
29/12/2003,http://www.marketwatch.com/story/the-gold-rush-is-on-in-shanghai-2003-12-29,the gold rush is on in shanghai
30/12/2003,"http://www.marketwatch.com/story/gold-futures-at-fresh-15-year-high-2003-12-30,http://www.marketwatch.com/story/spot-gold-quoted-at-41575-in-early-asia-trade-2003-12-30","gold futures at fresh, 15-year high,spot gold quoted at $415.75 in early asia trade"
31/12/2003,http://www.marketwatch.com/story/gold-futures-close-2003-nearly-20-higher-on-the-year-2003-12-31,gold futures end 2003 up nearly 20%
1/1/2004,,
2/1/2004,,
3/1/2004,,
4/1/2004,,
5/1/2004,,
6/1/2004,,
7/1/2004,,
8/1/2004,http://www.marketwatch.com/story/gold-copper-prices-head-higher-2004-01-08,"gold, copper prices head higher"
9/1/2004,http://www.marketwatch.com/story/gold-futures-close-near-427-an-ounce-2004-01-09,gold futures close near $427 an ounce
10/1/2004,,
11/1/2004,,
12/1/2004,,
13/1/2004,http://www.marketwatch.com/story/spot-gold-bid-at-42350-an-ounce-down-260-kitco-2004-01-13,"spot gold bid at $423.50 an ounce, down $2.60 - kitco"
14/1/2004,"http://www.marketwatch.com/story/nymex-gold-ends-with-a-2-loss,http://www.marketwatch.com/story/gold-prices-fall-as-much-as-6-2004-01-14","nymex gold ends with a $2 loss,gold prices fall as much as $6"
15/1/2004,"http://www.marketwatch.com/story/mining-indexes-end-at-mid-november-level-gold-sinks-3-2004-01-15,http://www.marketwatch.com/story/spot-gold-bid-at-41330-an-ounce-down-810-kitco-2004-01-15","mining indexes slump on gold slide,spot gold bid at $413.30 an ounce, down $8.10 - kitco"
16/1/2004,,
17/1/2004,,
18/1/2004,,
19/1/2004,,
20/1/2004,http://www.marketwatch.com/story/gold-futures-close-higher-for-first-time-in-six-session,gold futures close higher for first time in six session
21/1/2004,http://www.marketwatch.com/story/gold-pulls-back-palladium-gains,gold pulls back; palladium gains
22/1/2004,,
23/1/2004,http://www.marketwatch.com/story/kinross-gold-upped-to-gold-at-ubs-2004-01-23,kinross gold upped to 'gold' at ubs
24/1/2004,,
25/1/2004,,
26/1/2004,"http://www.marketwatch.com/story/gold-futures-close-at-six-week-low-under-407-2004-01-26,http://www.marketwatch.com/story/gold-veterans-brace-for-rough-ride-2004-01-26","gold futures close at six-week low,gold veterans brace for rough ride"
27/1/2004,http://www.marketwatch.com/story/gold-futures-close-back-above-410,gold futures close back above $410
28/1/2004,http://www.marketwatch.com/story/gold-futures-end-at-two-week-high-as-japan-mulls-buy-2004-01-28,gold futures rise as japan mulls buy
29/1/2004,http://www.marketwatch.com/story/gold-futures-fall-under-400-first-time-since-dec-2-2004-01-29,"gold futures fall under $400, first time since dec. 2"
30/1/2004,,
31/1/2004,,
1/2/2004,,
2/2/2004,,
3/2/2004,http://www.marketwatch.com/story/gold-climbs-back-above-400-eyes-currency-moves,"gold climbs back above $400, eyes currency moves"
4/2/2004,,
5/2/2004,http://www.marketwatch.com/story/gold-futures-dull-mining-shares-edge-up,gold futures dull; mining shares edge up
6/2/2004,http://www.marketwatch.com/story/dollar-weakness-lifts-gold-to-one-week-high-of-410,dollar weakness lifts gold to one-week high of $410
7/2/2004,,
8/2/2004,,
9/2/2004,,
10/2/2004,,
11/2/2004,"http://www.marketwatch.com/story/gold-prices-end-near-411-an-ounce,http://www.marketwatch.com/story/philadelphia-gold-silver-index-gains-24-2004-02-11","gold prices end near $411 an ounce,philadelphia gold & silver index gains 2.4%"
12/2/2004,"http://www.marketwatch.com/story/gold-ends-atop-414-on-low-interest-rate-signals-2004-02-12,http://www.marketwatch.com/story/gold-futures-end-the-session-above-414","gold tops $414 on low rate signals,gold futures end the session above $414"
13/2/2004,"http://www.marketwatch.com/story/gold-futures-drop-back-under-410,http://www.marketwatch.com/story/gold-drops-from-one-month-high-but-ends-higher-on-week-2004-02-13,http://www.marketwatch.com/story/gold-prices-trade-at-one-month-high","gold futures drop back under $410,gold down on session, but up on week,gold prices trade at one-month high"
14/2/2004,,
15/2/2004,,
16/2/2004,,
17/2/2004,"http://www.marketwatch.com/story/philadelphia-gold-silver-index-rises-24-2004-02-17,http://www.marketwatch.com/story/glamis-gold-q4-revenue-at-225-mln-vs-yr-ago-224-mln-2004-02-17","philadelphia gold & silver index rises 2.4%,glamis gold q4 revenue at $22.5 mln vs yr-ago $22.4 mln"
18/2/2004,"http://www.marketwatch.com/story/philadelphia-gold-silver-index-falls-27-2004-02-18,http://www.marketwatch.com/story/spot-gold-bid-at-41580-an-ounce-up-10c-kitco-2004-02-18","philadelphia gold & silver index falls 2.7%,spot gold bid at $415.80 an ounce, up 10c - kitco"
19/2/2004,http://www.marketwatch.com/story/gold-kist-announces-200-mln-note-offiering-2004-02-19,gold kist announces $200 mln note offiering
20/2/2004,http://www.marketwatch.com/story/gold-falls-to-six-session-low,gold falls to six-session low
21/2/2004,,
22/2/2004,,
23/2/2004,http://www.marketwatch.com/story/gold-futures-close-higher-but-still-under-400-2004-02-23,gold futures edge up after steep drop
24/2/2004,http://www.marketwatch.com/story/canadian-stocks-close-lower-gold-gains-limit-losses-2004-02-24,gold shares buoy bay street
25/2/2004,,
26/2/2004,http://www.marketwatch.com/story/gold-ends-off-lows-as-price-fall-sparks-buying,gold ends off lows as price fall sparks buying
27/2/2004,,
28/2/2004,,
29/2/2004,,
1/3/2004,"http://www.marketwatch.com/story/cboe-gold-index-rises-17-2004-03-01,http://www.marketwatch.com/story/gold-wont-predict-outcome-of-eisner-vote-cnbc-2004-03-01,http://www.marketwatch.com/story/gold-wont-name-potential-eisner-successors-cnbc-2004-03-01","cboe gold index rises 1.7%,gold: won't predict outcome of eisner vote - cnbc,gold: won't name potential eisner successors - cnbc"
2/3/2004,"http://www.marketwatch.com/story/philadelphia-gold-silver-index-falls-22-2004-03-02,http://www.marketwatch.com/story/metals-futures-close-lower-gold-falls-nearly-6","philadelphia gold & silver index falls 2.2%,metals futures close lower; gold falls nearly $6"
3/3/2004,,
4/3/2004,,
5/3/2004,,
6/3/2004,,
7/3/2004,,
8/3/2004,,
9/3/2004,"http://www.marketwatch.com/story/gold-futures-edge-up,http://www.marketwatch.com/story/spot-gold-bid-at-40050-an-ounce-up-10c-kitco-2004-03-09","gold futures edge up,spot gold bid at $400.50 an ounce, up 10c - kitco"
10/3/2004,,
11/3/2004,"http://www.marketwatch.com/story/gold-futures-climb-amid-copper-silver-gains-2004-03-11,http://www.marketwatch.com/story/gold-futures-under-400","gold up as copper, silver post gains,gold futures under $400"
12/3/2004,http://www.marketwatch.com/story/philadelphia-gold-and-silver-index-down-34-for-week-2004-03-12,philadelphia gold and silver index down 3.4% for week
13/3/2004,,
14/3/2004,,
15/3/2004,,
16/3/2004,,
17/3/2004,"http://www.marketwatch.com/story/spot-gold-bid-at-40210-an-ounce-up-20c-kitco-2004-03-17,http://www.marketwatch.com/story/gold-futures-climb-for-a-third-session","spot gold bid at $402.10 an ounce, up 20c - kitco,gold futures climb for a third session"
18/3/2004,"http://www.marketwatch.com/story/gold-futures-log-four-session-climb,http://www.marketwatch.com/story/spot-gold-bid-at-40710-an-ounce-up-60c-kitco-2004-03-18","gold futures log four-session climb,spot gold bid at $407.10 an ounce, up 60c - kitco"
19/3/2004,http://www.marketwatch.com/story/gold-futures-metals-shares-turn-lower,"gold futures, metals shares turn lower"
20/3/2004,,
21/3/2004,,
22/3/2004,http://www.marketwatch.com/story/spot-gold-bid-at-41420-an-ounce-up-210-kitco-2004-03-22,"spot gold bid at $414.20 an ounce, up $2.10 - kitco"
23/3/2004,http://www.marketwatch.com/story/gold-prices-end-higher-for-seventh-session-2004-03-23,gold prices end higher for seventh session
24/3/2004,"http://www.marketwatch.com/story/placer-dome-sees-892k-oz-of-gold-product-in-04,http://www.marketwatch.com/story/gold-futures-close-lower-end-winning-streak-2004-03-24","placer dome sees 892k oz. of gold product in '04,gold futures close lower, end winning streak"
25/3/2004,,
26/3/2004,http://www.marketwatch.com/story/gold-futures-poised-for-weekly-gain-2004-03-26,gold futures poised for weekly gain
27/3/2004,,
28/3/2004,,
29/3/2004,,
30/3/2004,"http://www.marketwatch.com/story/gold-prices-back-above-420-2004-03-30,http://www.marketwatch.com/story/gold-futures-end-higher-after-touching-an-11-week-high-2004-03-30","gold prices back above $420,gold hits 11-week high, ends higher"
31/3/2004,,
1/4/2004,http://www.marketwatch.com/story/gold-futures-tap-15-year-high-then-pull-back-2004-04-01,"gold futures tap 15-year high, then pull back"
2/4/2004,"http://www.marketwatch.com/story/gold-falls-on-session-week-as-dollar-rallies-2004-04-02,http://www.marketwatch.com/story/philadelphia-gold-and-silver-index-up-17-for-the-week-2004-04-02","gold futures ends lower on dollar rally,philadelphia gold and silver index up 1.7% for the week"
3/4/2004,,
4/4/2004,,
5/4/2004,,
6/4/2004,http://www.marketwatch.com/story/gold-prices-end-higher-for-first-time-in-three-sessions-2004-04-06,gold higher after two losing sessions
7/4/2004,"http://www.marketwatch.com/story/gold-prices-narrowly-higher-metals-shares-rise-2004-04-07,http://www.marketwatch.com/story/gold-ends-at-four-session-high-amid-broader-market-fall-2004-04-07","gold prices narrowly higher; metals shares rise,gold prices end at four-session high"
8/4/2004,http://www.marketwatch.com/story/gold-prices-down-for-session-and-holiday-shortened-week-2004-04-08,gold prices down for session and holiday-shortened week
9/4/2004,,
10/4/2004,,
11/4/2004,,
12/4/2004,,
13/4/2004,,
14/4/2004,,
15/4/2004,,
16/4/2004,,
17/4/2004,,
18/4/2004,,
19/4/2004,,
20/4/2004,http://www.marketwatch.com/story/gold-prices-fall-back-under-400-freeport-shares-down-2004-04-20,gold prices fall back under $400; freeport shares down
21/4/2004,"http://www.marketwatch.com/story/gold-futures-at-seven-week-low-2004-04-21,http://www.marketwatch.com/story/gold-futures-continue-lower-but-off-the-sessions-low-2004-04-21","gold futures at seven-week low,gold futures continue lower, but off the session's low"
22/4/2004,http://www.marketwatch.com/story/gold-futures-hold-gains-in-last-hour-of-trade-2004-04-22,gold futures hold gains in last hour of trade
23/4/2004,http://www.marketwatch.com/story/gold-prices-rise-but-end-lower-for-the-week-2004-04-23,"gold prices rise, but end lower for the week"
24/4/2004,,
25/4/2004,,
26/4/2004,http://www.marketwatch.com/story/gold-futures-up-market-eyes-economic-data-iraq-2004-04-26,"gold futures up; market eyes economic data, iraq"
27/4/2004,"http://www.marketwatch.com/story/gold-futures-trade-near-sessions-high-2004-04-27,http://www.marketwatch.com/story/correct-gold-silver-futures-close-at-one-week-highs-2004-04-27","gold futures trade near session's high,correct: gold, silver futures close at one-week highs"
28/4/2004,,
29/4/2004,,
30/4/2004,http://www.marketwatch.com/story/gold-futures-still-up-but-set-for-hefty-monthly-loss-2004-04-30,"gold futures still up, but set for hefty monthly loss"
1/5/2004,,
2/5/2004,,
3/5/2004,,
4/5/2004,,
5/5/2004,http://www.marketwatch.com/story/metals-shares-fall-but-gold-futures-edge-up-2004-05-05,"metals shares fall, but gold futures edge up"
6/5/2004,,
7/5/2004,http://www.marketwatch.com/story/gold-ends-lower-on-session-week-mining-shares-hit-2004-05-07,"gold ends down on session, week"
8/5/2004,,
9/5/2004,,
10/5/2004,http://www.marketwatch.com/story/spot-gold-bid-at-37230-an-ounce-down-610-2004-05-10,"spot gold bid at $372.30 an ounce, down $6.10"
11/5/2004,http://www.marketwatch.com/story/gold-futures-fall-for-fourth-session-2004-05-11,gold futures fall for fourth session
12/5/2004,,
13/5/2004,,
14/5/2004,http://www.marketwatch.com/story/gold-futures-stocks-rise-as-data-prompts-dollar-slide-2004-05-14,"gold futures, stocks rise as data prompts dollar slide"
15/5/2004,,
16/5/2004,,
17/5/2004,http://www.marketwatch.com/story/gold-futures-close-at-seven-session-high-2004-05-17,gold futures close at seven-session high
18/5/2004,,
19/5/2004,http://www.marketwatch.com/story/gold-futures-climb-as-much-as-8-an-ounce-2004-05-19,gold futures climb as much as $8 an ounce
20/5/2004,http://www.marketwatch.com/story/spot-gold-bid-at-38030-an-ounce-down-220-2004-05-20,"spot gold bid at $380.30 an ounce, down $2.20"
21/5/2004,http://www.marketwatch.com/story/gold-futures-close-up-nearly-8-for-the-week-2004-05-21,gold futures close up nearly $8 for the week
22/5/2004,,
23/5/2004,,
24/5/2004,,
25/5/2004,,
26/5/2004,,
27/5/2004,http://www.marketwatch.com/story/merrill-sees-gold-trade-in-370-390-range-in-near-term-2004-05-27,merrill sees gold trade in $370-390 range in near term
28/5/2004,http://www.marketwatch.com/story/gold-chips-and-networking-wrap-week-with-gains-2004-05-28,"gold, chips and networking higher"
29/5/2004,,
30/5/2004,,
31/5/2004,,
1/6/2004,http://www.marketwatch.com/story/gold-futures-metals-shares-pull-back-2004-06-01,"gold futures, metals shares pull back"
2/6/2004,,
3/6/2004,,
4/6/2004,,
5/6/2004,,
6/6/2004,,
7/6/2004,http://www.marketwatch.com/story/spot-gold-bid-at-39210-an-ounce-up-150-2004-06-07,"spot gold bid at $392.10 an ounce, up $1.50"
8/6/2004,,
9/6/2004,http://www.marketwatch.com/story/spot-gold-quoted-at-38360-down-018-from-ny-2004-06-09,"spot gold quoted at $383.60, down 0.18% from ny"
10/6/2004,,
11/6/2004,,
12/6/2004,,
13/6/2004,,
14/6/2004,,
15/6/2004,http://www.marketwatch.com/story/spot-gold-quoted-at-38270-down-01-from-ny-2004-06-15,"spot gold quoted at $382.70, down 0.1% from ny"
16/6/2004,,
17/6/2004,,
18/6/2004,http://www.marketwatch.com/story/spot-gold-bid-at-389-an-ounce-up-30c-2004-06-18,"spot gold bid at $389 an ounce, up 30c"
19/6/2004,,
20/6/2004,,
21/6/2004,,
22/6/2004,http://www.marketwatch.com/story/metals-shares-end-higher-following-strength-in-gold-2004-06-22,"metals shares end higher, following strength in gold"
23/6/2004,http://www.marketwatch.com/story/spot-gold-quoted-at-39480-up-005-from-ny-2004-06-23,"spot gold quoted at $394.80, up 0.05% from ny"
24/6/2004,"http://www.marketwatch.com/story/gold-closes-above-400-for-first-time-in-two-months-2004-06-24,http://www.marketwatch.com/story/gold-futures-top-400-first-time-in-two-months-2004-06-24,http://www.marketwatch.com/story/spot-gold-quoted-at-40140-down-03-from-ny-2004-06-24-23902148","gold atop $400 for 1st time since april,gold futures top $400, first time in two months,spot gold quoted at $401.40, down 0.3% from ny"
25/6/2004,,
26/6/2004,,
27/6/2004,,
28/6/2004,http://www.marketwatch.com/story/metals-shares-end-lower-on-the-heels-of-golds-decline-2004-06-28,metals shares end lower on the heels of gold's decline
29/6/2004,,
30/6/2004,,
1/7/2004,http://www.marketwatch.com/story/spot-gold-quoted-at-39580-unchanged-from-new-york-2004-07-01-2190561,"spot gold quoted at $395.80, unchanged from new york"
2/7/2004,http://www.marketwatch.com/story/gold-ends-at-four-day-high-as-jobs-data-hits-dollar-2004-07-02,gold rises as jobs data hits dollar
3/7/2004,,
4/7/2004,,
5/7/2004,,
6/7/2004,http://www.marketwatch.com/story/dollar-advances-vs-yen-drifts-vs-euro-on-ism-details-2004-07-06,"dollar aided by gold's fall, service data"
7/7/2004,,
8/7/2004,http://www.marketwatch.com/story/spot-gold-quoted-at-40610-down-180-from-new-york-2004-07-08,"spot gold quoted at $406.10, down $1.80 from new york"
9/7/2004,,
10/7/2004,,
11/7/2004,,
12/7/2004,http://www.marketwatch.com/story/gold-stages-late-day-reversal-ends-with-a-narrow-gain-2004-07-12,"gold stages late day reversal, ends with a narrow gain"
13/7/2004,"http://www.marketwatch.com/story/gold-futures-down-almost-7-in-afternoon-trade-2004-07-13,http://www.marketwatch.com/story/gold-falls-near-one-week-low-2004-07-13","gold futures down almost $7 in afternoon trade,gold falls near one-week low"
14/7/2004,http://www.marketwatch.com/story/gold-futures-climb-close-back-above-405-2004-07-14,"gold climbs, closes back above $405"
15/7/2004,"http://www.marketwatch.com/story/spot-gold-quoted-at-40360-unchanged-from-new-york-2004-07-15,http://www.marketwatch.com/story/gold-prices-narrowly-lower-still-trading-above-405-2004-07-15","spot gold quoted at $403.60, unchanged from new york,gold prices narrowly lower, still trading above $405"
16/7/2004,,
17/7/2004,,
18/7/2004,,
19/7/2004,http://www.marketwatch.com/story/spot-gold-quoted-at-40590-up-60-cents-from-new-york-2004-07-19,"spot gold quoted at $405.90, up 60 cents from new york"
20/7/2004,"http://www.marketwatch.com/story/gold-futures-weak-in-evening-trading-2004-07-20,http://www.marketwatch.com/story/spot-gold-quoted-at-40080-down-60c-from-new-york-2004-07-20","gold futures weak in evening trading,spot gold quoted at $400.80, down 60c from new york"
21/7/2004,,
22/7/2004,"http://www.marketwatch.com/story/spot-gold-bid-at-39550-an-ounce-down-100-2004-07-22,http://www.marketwatch.com/story/gold-edges-up-as-traders-eye-dollar-2004-07-22,http://www.marketwatch.com/story/gold-futures-close-lower-for-a-fourth-session-2004-07-22,http://www.marketwatch.com/story/spot-gold-quoted-at-39420-down-20c-from-new-york-2004-07-22","spot gold bid at $395.50 an ounce, down $1.00,gold edges up as traders eye dollar,gold ends lower for a fourth session,spot gold quoted at $394.20, down 20c from new york"
23/7/2004,,
24/7/2004,,
25/7/2004,,
26/7/2004,,
27/7/2004,"http://www.marketwatch.com/story/barrick-gold-q2-earns-decline-but-match-expectations-2004-07-27,http://www.marketwatch.com/story/berma-gold-gets-60m-bridge-loan-for-kupol-development-2004-07-27,http://www.marketwatch.com/story/gold-futures-end-at-lowest-level-in-six-weeks-2004-07-27,http://www.marketwatch.com/story/gold-futures-turn-lower-as-dollar-gains-ground-2004-07-27","barrick gold q2 earns decline, but match expectations,berma gold gets $60m bridge loan for kupol development,gold futures end at lowest level in six weeks,gold futures turn lower as dollar gains ground"
28/7/2004,"http://www.marketwatch.com/story/spot-gold-quoted-at-38910-up-60-cents-from-new-york-2004-07-28,http://www.marketwatch.com/story/gold-slips-in-early-dealings-2004-07-28,http://www.marketwatch.com/story/canadian-stocks-end-higher-on-oil-gold-strength-2004-07-28","spot gold quoted at $389.10, up 60 cents from new york,gold slips in early dealings,oil and gold lift bay street"
29/7/2004,,
30/7/2004,"http://www.marketwatch.com/story/gold-ends-up-for-the-week-but-down-for-the-month-2004-07-30,http://www.marketwatch.com/story/gold-futures-climb-on-weak-gdp-2004-07-30,http://www.marketwatch.com/story/aug-gold-up-370-at-39070oz-in-new-york-2004-07-30","gold ends up for the week, but down for the month,gold futures climb on weak gdp,aug gold up $3.70 at $390.70/oz in new york"
31/7/2004,,
1/8/2004,,
2/8/2004,http://www.marketwatch.com/story/gold-prices-end-with-a-narrow-gain-on-terror-scare-2004-08-02,gold prices edge up on terror scare
3/8/2004,http://www.marketwatch.com/story/spot-gold-bid-at-39070-an-ounce-down-90c-2004-08-03,"spot gold bid at $390.70 an ounce, down 90c"
4/8/2004,http://www.marketwatch.com/story/spot-gold-quoted-at-392-up-20-cents-from-new-york-2004-08-04,"spot gold quoted at $392, up 20 cents from new york"
5/8/2004,"http://www.marketwatch.com/story/spot-gold-quoted-at-39180-down-10c-from-new-york-2004-08-05,http://www.marketwatch.com/story/gold-futures-fall-mining-shares-mixed-2004-08-05,http://www.marketwatch.com/story/contrary-opinion-bad-for-stocks-good-for-gold-2004-08-05","spot gold quoted at $391.80, down 10c from new york,gold futures fall; mining shares mixed,bad for stocks, good for gold?"
6/8/2004,http://www.marketwatch.com/story/gold-futures-climb-above-400-to-two-week-high-2004-08-06,gold futures climb above $400 to two-week high
7/8/2004,,
8/8/2004,,
9/8/2004,"http://www.marketwatch.com/story/spot-gold-quoted-at-399-down-130-from-new-york-2004-08-09,http://www.marketwatch.com/story/gold-prices-post-narrow-gain-in-afternoon-dealings-2004-08-09","spot gold quoted at $399, down $1.30 from new york,gold prices post narrow gain in afternoon dealings"
10/8/2004,"http://www.marketwatch.com/story/gold-futures-close-lower-ahead-of-fed-decision-2004-08-10,http://www.marketwatch.com/story/gold-prices-fall-indexes-off-highs-after-feds-hike-2004-08-10","gold futures close lower ahead of fed decision,gold futures fall in evening trade"
11/8/2004,"http://www.marketwatch.com/story/gold-falls-as-much-as-6-in-morning-trade-2004-08-11,http://www.marketwatch.com/story/gold-fields-iamgold-agree-to-21-billion-combination-2004-08-11","gold falls as much as $6 in morning trade,gold fields, iamgold agree to $2.1 billion combination"
12/8/2004,http://www.marketwatch.com/story/spot-gold-quoted-at-39350-down-40c-from-new-york-2004-08-12,"spot gold quoted at $393.50, down 40c from new york"
13/8/2004,http://www.marketwatch.com/story/gold-futures-end-up-for-the-day-down-for-the-week-2004-08-13,"gold futures end up for the day, down for the week"
14/8/2004,,
15/8/2004,,
16/8/2004,,
17/8/2004,http://www.marketwatch.com/story/spot-gold-bid-at-40180-an-ounce-off-70c-2004-08-17,"spot gold bid at $401.80 an ounce, off 70c"
18/8/2004,,
19/8/2004,"http://www.marketwatch.com/story/spot-gold-quoted-at-40410-in-asia-trade-2004-08-19,http://www.marketwatch.com/story/gold-futures-touch-five-week-high-above-410-2004-08-19,http://www.marketwatch.com/story/dec-gold-up-230-at-40890-in-afternoon-ny-trade-2004-08-19,http://www.marketwatch.com/story/gold-ends-at-five-week-high-indexes-up-for-a-sixth-day-2004-08-19","spot gold quoted at $404.10 in asia trade,gold futures touch five-week high above $410,dec gold up $2.30 at $408.90 in afternoon ny trade,gold futures climb to five-week high"
20/8/2004,,
21/8/2004,,
22/8/2004,,
23/8/2004,"http://www.marketwatch.com/story/dec-gold-ends-at-41280-down-270-for-the-ny-session-2004-08-23,http://www.marketwatch.com/story/dec-gold-falls-250-to-413oz-in-afternoon-dealings-2004-08-23,http://www.marketwatch.com/story/gold-futures-closes-under-413-as-dollar-gains-2004-08-23","dec gold ends at $412.80, down $2.70 for the ny session,dec gold falls $2.50 to $413/oz in afternoon dealings,gold slips, pressured by dollar gains"
24/8/2004,"http://www.marketwatch.com/story/dec-gold-down-14-at-40710-2004-08-24,http://www.marketwatch.com/story/spot-gold-bid-at-40730-an-ounce-down-320-2004-08-24","dec gold down 1.4% at $407.10,spot gold bid at $407.30 an ounce, down $3.20"
25/8/2004,"http://www.marketwatch.com/story/dec-gold-up-470-at-40970oz-in-afternoon-dealings-2004-08-25,http://www.marketwatch.com/story/gold-futures-gain-more-ground-in-afternoon-trade-2004-08-25,http://www.marketwatch.com/story/dec-gold-closes-at-410oz-up-5-for-the-session-2004-08-25,http://www.marketwatch.com/story/gold-futures-close-higher-recoup-some-losses-2004-08-25","dec gold up $4.70 at $409.70/oz in afternoon dealings,gold futures gain more ground in afternoon trade,dec gold closes at $410/oz, up $5 for the session,gold futures recoup a bit after losses"
26/8/2004,,
27/8/2004,http://www.marketwatch.com/story/dec-gold-down-280-at-40680oz-in-ny-2004-08-27,dec gold down $2.80 at $406.80/oz in ny
28/8/2004,,
29/8/2004,,
30/8/2004,http://www.marketwatch.com/story/spot-gold-bid-at-40490-an-ounce-up-200-2004-08-30,"spot gold bid at $404.90 an ounce, up $2.00"
31/8/2004,"http://www.marketwatch.com/story/dec-gold-up-1-at-411-with-40-min-left-in-the-session-2004-08-31,http://www.marketwatch.com/story/spot-gold-bid-at-40840-an-ounce-up-80c-2004-08-31,http://www.marketwatch.com/story/spot-gold-quoted-at-40940-down-10c-from-new-york-2004-08-31","dec gold up $1 at $411 with 40 min left in the session,spot gold bid at $408.40 an ounce, up 80c,spot gold quoted at $409.40, down 10c from new york"
1/9/2004,"http://www.marketwatch.com/story/gold-prices-fall-as-traders-eye-dollar-data-2004-09-01,http://www.marketwatch.com/story/spot-gold-quoted-at-40830-down-120-from-new-york-2004-09-01","gold prices fall as traders eye dollar, data,spot gold quoted at $408.30, down $1.20 from new york"
2/9/2004,"http://www.marketwatch.com/story/spot-gold-quoted-at-40520-down-30c-from-new-york-2004-09-02,http://www.marketwatch.com/story/toronto-stocks-close-lower-as-gold-nortel-fall-2004-09-02,http://www.marketwatch.com/story/gold-futures-lower-in-last-hour-of-trade-2004-09-02","spot gold quoted at $405.20, down 30c from new york,gold, nortel weigh on bay street,gold futures lower in last hour of trade"
3/9/2004,,
4/9/2004,,
5/9/2004,,
6/9/2004,,
7/9/2004,"http://www.marketwatch.com/story/dec-gold-closes-at-39940oz-down-310-for-the-day-2004-09-07,http://www.marketwatch.com/story/canadian-stocks-end-higher-ahead-of-rate-decision-2004-09-07,http://www.marketwatch.com/story/gold-futures-still-weak-in-afternoon-dealings-2004-09-07","dec gold closes at $399.40/oz, down $3.10 for the day,gold and energy weigh on bay street,gold futures still weak in afternoon dealings"
8/9/2004,"http://www.marketwatch.com/story/gold-futures-get-late-boost-2004-09-08,http://www.marketwatch.com/story/spot-gold-bid-at-39740-an-ounce-up-50c-2004-09-08,http://www.marketwatch.com/story/gold-futures-finish-higher-sector-stocks-fall-2004-09-08","gold futures get late boost,spot gold bid at $397.40 an ounce, up 50c,gold futures finish higher; stocks fall"
9/9/2004,http://www.marketwatch.com/story/spot-gold-quoted-at-39970-up-180-from-new-york-2004-09-09-2390950,"spot gold quoted at $399.70, up $1.80 from new york"
10/9/2004,http://www.marketwatch.com/story/gold-futures-end-higher-for-the-day-and-the-week-2004-09-10,gold futures end higher for the day and the week
11/9/2004,,
12/9/2004,,
13/9/2004,,
14/9/2004,http://www.marketwatch.com/story/gold-futures-mining-shares-head-higher-2004-09-14,"gold futures, mining shares head higher"
15/9/2004,http://www.marketwatch.com/story/gold-futures-close-under-407-pressured-by-dollar-rise-2004-09-15,"gold futures close under $407, pressured by dollar rise"
16/9/2004,http://www.marketwatch.com/story/spot-gold-quoted-at-40410-in-asia-2004-09-16,spot gold quoted at $404.10 in asia
17/9/2004,http://www.marketwatch.com/story/gold-futures-indexes-head-higher-in-early-trade-2004-09-17,"gold futures, indexes head higher in early trade"
18/9/2004,,
19/9/2004,,
20/9/2004,"http://www.marketwatch.com/story/spot-gold-quoted-at-40450-down-40c-from-new-york-2004-09-20,http://www.marketwatch.com/story/spot-gold-quoted-at-40440-down-50c-from-new-york-2004-09-20","spot gold quoted at $404.50, down 40c from new york,spot gold quoted at $404.40, down 50c from new york"
21/9/2004,http://www.marketwatch.com/story/canadian-stocks-end-with-triple-digit-gains-2004-09-21,"gold, energy boost bay street"
22/9/2004,,
23/9/2004,"http://www.marketwatch.com/story/dec-gold-closes-at-1-mo-high-of-41260-up-360-2004-09-23,http://www.marketwatch.com/story/dec-gold-up-380-at-41280oz-in-afternoon-trade-2004-09-23","dec gold closes at 1-mo high of $412.60, up $3.60,dec gold up $3.80 at $412.80/oz in afternoon trade"
24/9/2004,,
25/9/2004,,
26/9/2004,,
27/9/2004,,
28/9/2004,,
29/9/2004,http://www.marketwatch.com/story/spot-gold-quoted-at-41160-an-oz-in-asia-trade-2004-09-29,spot gold quoted at $411.60 an oz in asia trade
30/9/2004,"http://www.marketwatch.com/story/iamgold-deal-for-gold-field-non-sadc-assets-2004-09-30,http://www.marketwatch.com/story/wold-bank-chief-supports-uk-proposal-on-imf-gold-2004-09-30,http://www.marketwatch.com/story/gold-futures-top-420-to-close-at-a-five-month-high-2004-09-30","iamgold deal for gold field non-sadc assets,wold bank chief supports uk proposal on imf gold,gold futures rise to five-month high"
1/10/2004,http://www.marketwatch.com/story/dec-gold-falls-40c-to-420oz-in-ny-2004-10-01,dec gold falls 40c to $420/oz in ny
2/10/2004,,
3/10/2004,http://www.marketwatch.com/story/spot-gold-quoted-at-41810-in-asia-trade-2004-10-03,spot gold quoted at $418.10 in asia trade
4/10/2004,http://www.marketwatch.com/story/spot-gold-quoted-at-41290-down-60c-from-new-york-2004-10-04,"spot gold quoted at $412.90, down 60c from new york"
5/10/2004,"http://www.marketwatch.com/story/spot-gold-quoted-at-41850-up-70c-from-new-york-2004-10-05,http://www.marketwatch.com/story/dec-gold-up-360-at-41920oz-in-ny-2004-10-05","spot gold quoted at $418.50, up 70c from new york,dec gold up $3.60 at $419.20/oz in ny"
6/10/2004,"http://www.marketwatch.com/story/spot-gold-quoted-at-41730-down-40c-from-new-york-2004-10-06,http://www.marketwatch.com/story/spot-gold-quoted-at-41750-down-20c-from-new-york-2004-10-06","spot gold quoted at $417.30, down 40c from new york,spot gold quoted at $417.50, down 20c from new york"
7/10/2004,"http://www.marketwatch.com/story/gold-futures-hold-above-420-ahead-of-jobs-data-2004-10-07,http://www.marketwatch.com/story/gold-futures-close-with-a-50-cent-loss-2004-10-07","gold futures hold above $420 ahead of jobs data,gold futures close with a 50-cent loss"
8/10/2004,http://www.marketwatch.com/story/gold-closes-at-six-month-high-gains-3-for-the-week-2004-10-08,gold closes at 6-month high
9/10/2004,,
10/10/2004,,
11/10/2004,http://www.marketwatch.com/story/dec-gold-down-1-at-42350oz-in-afternoon-ny-trade-2004-10-11,dec gold down $1 at $423.50/oz in afternoon ny trade
12/10/2004,"http://www.marketwatch.com/story/gold-falls-as-much-as-10-an-ounce-2004-10-12,http://www.marketwatch.com/story/spot-gold-quoted-at-41440-down-10c-from-new-york-2004-10-12,http://www.marketwatch.com/story/gold-banc-down-55-at-1321-2004-10-12","gold falls as much as $10 an ounce,spot gold quoted at $414.40, down 10c from new york,gold banc down 5.5% at $13.21"
13/10/2004,,
14/10/2004,,
15/10/2004,http://www.marketwatch.com/story/gold-prices-up-as-economic-data-fail-to-lift-dollar-2004-10-15,gold prices up as economic data fail to lift dollar
16/10/2004,,
17/10/2004,,
18/10/2004,"http://www.marketwatch.com/story/iamgold-leads-mining-shares-lower-gold-dulls-2004-10-18,http://www.marketwatch.com/story/kinross-gold-upped-to-neutral-at-jp-morgan-2004-10-18-5914922,http://www.marketwatch.com/story/harmony-to-shortly-post-gold-fields-offer-terms-2004-10-18","iamgold leads mining shares lower; gold dulls,kinross gold upped to neutral at jp morgan,harmony to 'shortly post' gold fields offer terms"
19/10/2004,,
20/10/2004,"http://www.marketwatch.com/story/canadian-stocks-end-higher-paced-by-gold-energy-gains-2004-10-20,http://www.marketwatch.com/story/gold-futures-close-at-six-month-high-near-425-2004-10-20,http://www.marketwatch.com/story/dec-gold-up-350-at-42510-after-6-mo-high-of-42690-2004-10-20,http://www.marketwatch.com/story/99-cents-onlys-jeff-gold-is-named-president-2004-10-20,http://www.marketwatch.com/story/dec-gold-up-320-closes-at-a-6-mo-high-of-42480-2004-10-20,http://www.marketwatch.com/story/harmony-gold-retains-merrill-as-co-advisor-for-gfi-bid-2004-10-20-291536","gold, energy lead bay street rally,gold ends at six-month high near $425,dec gold up $3.50 at $425.10 after 6-mo high of $426.90,99 cents only's jeff gold is named president,dec gold up $3.20, closes at a 6-mo high of $424.80,harmony gold retains merrill as co-advisor for gfi bid"
21/10/2004,http://www.marketwatch.com/story/gold-futures-pull-back-in-morning-trade-2004-10-21,gold futures pull back in morning trade
22/10/2004,,
23/10/2004,,
24/10/2004,,
25/10/2004,"http://www.marketwatch.com/story/spot-gold-quoted-at-42850-up-30-cents-from-new-york-2004-10-25,http://www.marketwatch.com/story/cboe-gold-index-taps-high-of-9614-highest-since-1997-2004-10-25,http://www.marketwatch.com/story/gold-futures-near-430-as-dollar-falls-2004-10-25,http://www.marketwatch.com/story/dec-gold-continues-higher-up-410-at-42970oz-in-ny-2004-10-25","spot gold quoted at $428.50, up 30 cents from new york,cboe gold index taps high of 96.14, highest since 1997,gold nears $430 as dollar falls,dec gold continues higher, up $4.10 at $429.70/oz in ny"
26/10/2004,"http://www.marketwatch.com/story/barrick-gold-down-07-at-2239-2004-10-26,http://www.marketwatch.com/story/barrick-gold-q3-net-falls-2004-10-26,http://www.marketwatch.com/story/spot-gold-quoted-at-42590-down-10c-from-new-york-2004-10-26","barrick gold down 0.7% at $22.39,barrick gold q3 net falls,spot gold quoted at $425.90, down 10c from new york"
27/10/2004,http://www.marketwatch.com/story/gold-futures-close-lower-for-a-second-day-as-oil-falls-2004-10-27,gold closes lower for a second day
28/10/2004,"http://www.marketwatch.com/story/spot-gold-quoted-at-425-up-30-cents-from-new-york-2004-10-28,http://www.marketwatch.com/story/gold-prices-edge-up-mining-shares-mixed-2004-10-28","spot gold quoted at $425, up 30 cents from new york,gold prices edge up; mining shares mixed"
29/10/2004,"http://www.marketwatch.com/story/dec-gold-up-70c-at-42680oz-in-morning-ny-trade-2004-10-29,http://www.marketwatch.com/story/philadelphia-gold-and-silver-index-up-14-on-the-month-2004-10-29","dec gold up 70c at $426.80/oz in morning ny trade,philadelphia gold and silver index up 1.4% on the month"
30/10/2004,,
31/10/2004,,
1/11/2004,http://www.marketwatch.com/story/gold-futures-drop-take-cue-from-reversal-in-crude-2004-11-01,"gold futures drop, take cue from reversal in crude"
2/11/2004,"http://www.marketwatch.com/story/dec-gold-closes-at-42080oz-down-740-2004-11-02,http://www.marketwatch.com/story/spot-gold-trading-at-42050-in-asia-2004-11-02","dec gold closes at $420.80/oz, down $7.40,spot gold trading at $420.50 in asia"
3/11/2004,http://www.marketwatch.com/story/dec-gold-futures-up-450-at-42530-2004-11-03,dec. gold futures up $4.50 at $425.30
4/11/2004,,
5/11/2004,"http://www.marketwatch.com/story/dec-gold-taps-fresh-7-mo-high-of-435oz-2004-11-05,http://www.marketwatch.com/story/philly-gold-and-silver-index-up-2-on-day-up-3-on-wk-2004-11-05","dec gold taps fresh 7-mo high of $435/oz,philly gold and silver index up 2% on day, up 3% on wk"
6/11/2004,,
7/11/2004,,
8/11/2004,http://www.marketwatch.com/story/spot-gold-quoted-at-43150-down-1-from-new-york-2004-11-08,"spot gold quoted at $431.50, down $1 from new york"
9/11/2004,http://www.marketwatch.com/story/dec-gold-closes-at-43620oz-up-280-for-the-day-2004-11-09,"dec gold closes at $436.20/oz, up $2.80 for the day"
10/11/2004,http://www.marketwatch.com/story/gold-futures-continue-lower-in-afternoon-trade-2004-11-10,gold futures continue lower in afternoon trade
11/11/2004,"http://www.marketwatch.com/story/dec-gold-closes-at-43540oz-in-ny-up-90c-for-the-day-2004-11-11,http://www.marketwatch.com/story/gold-prices-end-modestly-higher-for-the-session-2004-11-11","dec gold closes at $435.40/oz in ny, up 90c for the day,gold prices end modestly higher for the session"
12/11/2004,"http://www.marketwatch.com/story/gold-futures-end-at-16-year-high-rise-4-on-week-2004-11-12,http://www.marketwatch.com/story/gold-taps-fresh-16-year-high-in-late-morning-trade-2004-11-12","gold at 16-year high, up $4 on week,gold taps fresh 16-year high in late morning trade"
13/11/2004,,
14/11/2004,,
15/11/2004,http://www.marketwatch.com/story/gold-futures-lose-ground-in-late-morning-trade-2004-11-15,gold futures lose ground in late morning trade
16/11/2004,,
17/11/2004,http://www.marketwatch.com/story/gold-futures-top-445-an-ounce-in-ny-2004-11-17,gold futures top $445 an ounce in ny
18/11/2004,"http://www.marketwatch.com/story/spot-gold-quoted-at-44210-unchanged-from-new-york-2004-11-18,http://www.marketwatch.com/story/spot-gold-quoted-at-442-down-10-cents-from-new-york-2004-11-18","spot gold quoted at $442.10, unchanged from new york,spot gold quoted at $442, down 10 cents from new york"
19/11/2004,http://www.marketwatch.com/story/gold-futures-climb-above-446-2004-11-19,gold futures climb above $446
20/11/2004,,
21/11/2004,,
22/11/2004,"http://www.marketwatch.com/story/gold-prices-edge-closer-to-450-2004-11-22,http://www.marketwatch.com/story/internet-gold-to-buy-remaining-shrs-of-goldtrade-2004-11-22","gold prices edge closer to $450,internet gold to buy remaining shrs of goldtrade"
23/11/2004,"http://www.marketwatch.com/story/gold-futures-continue-lower-in-late-morning-trade-2004-11-23,http://www.marketwatch.com/story/dec-gold-closes-at-44790oz-down-110-for-the-day-2004-11-23,http://www.marketwatch.com/story/gold-futures-end-modestly-lower-mining-shares-retreat-2004-11-23","gold futures continue lower in late morning trade,dec gold closes at $447.90/oz, down $1.10 for the day,gold futures close modestly lower"
24/11/2004,"http://www.marketwatch.com/story/dec-gold-climbs-1-to-44890oz-in-morning-ny-trade-2004-11-24,http://www.marketwatch.com/story/dec-gold-closes-at-44930oz-up-140-for-the-day-2004-11-24","dec gold climbs $1 to $448.90/oz in morning ny trade,dec gold closes at $449.30/oz, up $1.40 for the day"
25/11/2004,,
26/11/2004,,
27/11/2004,,
28/11/2004,,
29/11/2004,"http://www.marketwatch.com/story/gold-futures-close-above-453-2004-11-29,http://www.marketwatch.com/story/metals-indexes-stand-pat-even-as-gold-futures-climb-2004-11-29,http://www.marketwatch.com/story/south-africa-upholds-harmony-gold-as-concert-party-2004-11-29,http://www.marketwatch.com/story/gold-futures-close-above-453-on-dollar-concern-2004-11-29,http://www.marketwatch.com/story/south-africa-dismisses-gold-fields-appeal-2004-11-29","gold futures close above $453,metals indexes stand pat even as gold futures climb,south africa upholds harmony gold as concert party,gold tops $453 to start busy week,south africa dismisses gold fields appeal"
30/11/2004,"http://www.marketwatch.com/story/feb-gold-falls-260-to-end-the-day-at-45320-in-ny-2004-11-30,http://www.marketwatch.com/story/feb-gold-down-2-at-45380oz-2004-11-30,http://www.marketwatch.com/story/barrick-gold-cut-to-neutral-at-ubs-on-share-price-2004-11-30-691491","feb gold falls $2.60 to end the day at $453.20 in ny,feb gold down $2 at $453.80/oz,barrick gold cut to neutral at ubs on share price"
1/12/2004,http://www.marketwatch.com/story/dollar-decline-lifts-gold-futures-to-a-close-near-456-2004-12-01,"gold near $456, highest since june `88"
2/12/2004,"http://www.marketwatch.com/story/barrick-gold-to-invest-28m-in-celtic-resources-2004-12-02,http://www.marketwatch.com/story/feb-gold-up-110-at-457oz-in-morning-ny-trade-2004-12-02","barrick gold to invest $28m in celtic resources,feb gold up $1.10 at $457/oz in morning ny trade"
3/12/2004,"http://www.marketwatch.com/story/feb-gold-falls-10c-to-45220oz-in-morning-ny-trade-2004-12-03,http://www.marketwatch.com/story/amex-gold-bugs-index-down-66-for-the-week-2004-12-03,http://www.marketwatch.com/story/feb-gold-up-150-at-45380oz-reversing-fr-450-low-2004-12-03,http://www.marketwatch.com/story/gold-futures-rally-to-a-fresh-mid-1988-high-near-458-2004-12-03,http://www.marketwatch.com/story/gold-futures-close-at-a-fresh-mid-1988-high-2004-12-03,http://www.marketwatch.com/story/gold-prices-close-at-fresh-16-year-high-near-458-2004-12-03","feb gold falls 10c to $452.20/oz in morning ny trade,amex gold bugs index down 6.6% for the week,feb gold up $1.50 at $453.80/oz, reversing fr $450 low,gold futures rally to a fresh mid-1988 high near $458,gold futures close at a fresh mid-1988 high,gold ends at 16-year high near $458"
4/12/2004,,
5/12/2004,,
6/12/2004,"http://www.marketwatch.com/story/gold-prices-close-lower-on-dollar-strength-2004-12-06,http://www.marketwatch.com/story/feb-gold-down-330-to-45450oz-after-45650-high-2004-12-06,http://www.marketwatch.com/story/feb-gold-closes-at-45590oz-down-190-for-the-day-2004-12-06","gold prices dull on dollar strength,feb gold down $3.30 to $454.50/oz after $456.50 high,feb gold closes at $455.90/oz, down $1.90 for the day"
7/12/2004,"http://www.marketwatch.com/story/gold-fields-ceo-says-disappointed-by-vote-2004-12-07,http://www.marketwatch.com/story/amex-gold-bugs-index-ends-at-2-mo-low-of-2186-down-3-2004-12-07","gold fields ceo says disappointed by vote,amex gold bugs index ends at 2-mo low of 218.6, down 3%"
8/12/2004,"http://www.marketwatch.com/story/feb-gold-closes-at-lowest-level-since-nov-11-2004-12-08,http://www.marketwatch.com/story/feb-gold-down-1750-or-39-at-43620oz-2004-12-08,http://www.marketwatch.com/story/feb-gold-drops-1550-to-43820oz-in-morning-trade-2004-12-08,http://www.marketwatch.com/story/harmony-calls-for-gold-fields-chairman-resignation-rpt-2004-12-08","feb gold closes at lowest level since nov 11,feb gold down $17.50, or 3.9%, at $436.20/oz,feb gold drops $15.50 to $438.20/oz in morning trade,harmony calls for gold fields chairman resignation -rpt"
9/12/2004,,
10/12/2004,"http://www.marketwatch.com/story/amex-gold-bugs-index-falls-06-on-day-down-6-on-wk-2004-12-10,http://www.marketwatch.com/story/feb-gold-down-2250-or-5-for-the-week-2004-12-10","amex gold bugs index falls 0.6% on day, down 6% on wk,feb gold down $22.50, or 5%, for the week"
11/12/2004,,
12/12/2004,,
13/12/2004,http://www.marketwatch.com/story/gold-futures-climb-to-three-session-high-above-441oz-2004-12-13,gold futures climb to three-session high above $441/oz
14/12/2004,"http://www.marketwatch.com/story/feb-gold-falls-110-to-43920oz-in-morning-ny-trade-2004-12-14,http://www.marketwatch.com/story/gold-falls-ahead-of-expected-rate-hike-2004-12-14","feb gold falls $1.10 to $439.20/oz in morning ny trade,gold falls ahead of expected rate hike"
15/12/2004,"http://www.marketwatch.com/story/gold-climbs-to-one-week-high-2004-12-15,http://www.marketwatch.com/story/feb-gold-up-510-at-44240oz-in-midday-trade-2004-12-15,http://www.marketwatch.com/story/gold-futures-close-above-442-at-one-week-high-2004-12-15","gold climbs to one-week high,feb gold up $5.10 at $442.40/oz in midday trade,gold futures close above $442 at one-week high"
16/12/2004,http://www.marketwatch.com/story/gold-futures-dull-hold-above-440-2004-12-16,"gold futures dull, hold above $440"
17/12/2004,http://www.marketwatch.com/story/feb-gold-closes-at-44290oz-up-470-for-the-day-2004-12-17,"feb gold closes at $442.90/oz, up $4.70 for the day"
18/12/2004,,
19/12/2004,,
20/12/2004,,
21/12/2004,,
22/12/2004,"http://www.marketwatch.com/story/gold-futures-close-narrowly-lower-2004-12-22,http://www.marketwatch.com/story/gold-futures-end-lower-on-broad-market-climb-us-data-2004-12-22,http://www.marketwatch.com/story/philly-gold-and-silver-index-ends-at-9912-down-09-2004-12-22","gold futures close narrowly lower,gold dulls on market climb, u.s. data,philly gold and silver index ends at 99.12, down 0.9%"
23/12/2004,"http://www.marketwatch.com/story/feb-gold-up-120-at-44260oz-in-ny-2004-12-23,http://www.marketwatch.com/story/gold-futures-climb-as-dollar-falls-2004-12-23,http://www.marketwatch.com/story/gold-futures-continue-higher-in-last-half-hour-of-trade-2004-12-23","feb gold up $1.20 at $442.60/oz in ny,gold futures climb as dollar falls,gold futures continue higher in last half hour of trade"
24/12/2004,,
25/12/2004,,
26/12/2004,,
27/12/2004,"http://www.marketwatch.com/story/gold-prices-near-three-week-high-2004-12-27,http://www.marketwatch.com/story/feb-gold-up-330-to-close-at-44620oz-2004-12-27,http://www.marketwatch.com/story/gold-futures-close-at-a-three-week-high-2004-12-27,http://www.marketwatch.com/story/amex-gold-bugs-index-ends-at-highest-level-since-dec-15-2004-12-27","gold prices near three-week high,feb gold up $3.30 to close at $446.20/oz,gold futures end at a three-week high,amex gold bugs index ends at highest level since dec 15"
28/12/2004,,
29/12/2004,,
30/12/2004,,
31/12/2004,,
1/1/2005,,
2/1/2005,,
3/1/2005,"http://www.marketwatch.com/story/feb-gold-down-770-at-43070oz-in-ny-2005-01-03,http://www.marketwatch.com/story/gold-futures-close-at-lowest-levels-since-november-2005-01-03,http://www.marketwatch.com/story/gold-off-055-at-4355ounce-2005-01-03","feb gold down $7.70 at $430.70/oz in ny,gold futures close at lowest levels since november,gold off 0.55% at $435.5/ounce"
4/1/2005,,
5/1/2005,,
6/1/2005,"http://www.marketwatch.com/story/spot-gold-quoted-at-42230-up-180-from-new-york-2005-01-06,http://www.marketwatch.com/story/gold-falls-for-a-fourth-day-ends-near-three-month-low-2005-01-06","spot gold quoted at $422.30, up $1.80 from new york,gold logs 4-session loss of almost $17"
7/1/2005,"http://www.marketwatch.com/story/feb-gold-up-230-at-42390oz-in-morning-ny-trade-2005-01-07,http://www.marketwatch.com/story/gold-prices-turns-lower-after-high-near-426-2005-01-07","feb gold up $2.30 at $423.90/oz in morning ny trade,gold prices turns lower after high near $426"
8/1/2005,,
9/1/2005,,
10/1/2005,"http://www.marketwatch.com/story/feb-gold-climbs-170-to-42120oz-in-morning-ny-trade-2005-01-10,http://www.marketwatch.com/story/gold-futures-hold-ground-around-420-2005-01-10,http://www.marketwatch.com/story/spot-gold-quoted-at-42080-up-220-from-new-york-2005-01-10","feb gold climbs $1.70 to $421.20/oz in morning ny trade,gold futures hold ground around $420,spot gold quoted at $420.80, up $2.20 from new york"
11/1/2005,,
12/1/2005,http://www.marketwatch.com/story/gold-futures-touch-one-week-high-2005-01-12,gold futures touch one-week high
13/1/2005,"http://www.marketwatch.com/story/feb-gold-falls-190-to-42470oz-in-morning-ny-trade-2005-01-13,http://www.marketwatch.com/story/gold-prices-fall-for-first-time-in-three-days-2005-01-13,http://www.marketwatch.com/story/feb-gold-falls-160-to-425oz-in-afternoon-dealings-2005-01-13","feb gold falls $1.90 to $424.70/oz in morning ny trade,gold prices fall for first time in three days,feb gold falls $1.60 to $425/oz in afternoon dealings"
14/1/2005,"http://www.marketwatch.com/story/feb-gold-falls-290-to-42220oz-after-42120-low-2005-01-14,http://www.marketwatch.com/story/gold-etf-continues-to-shine-as-assets-near-2b-2005-01-14","feb gold falls $2.90 to $422.20/oz after $421.20 low,gold etf continues to shine"
15/1/2005,,
16/1/2005,,
17/1/2005,,
18/1/2005,"http://www.marketwatch.com/story/feb-gold-up-60c-at-42360oz-in-ny-2005-01-18,http://www.marketwatch.com/story/feb-gold-tops-423oz-in-late-morning-trade-2005-01-18,http://www.marketwatch.com/story/compania-de-minas-commits-27m-ounces-of-gold-2005-01-18,http://www.marketwatch.com/story/feb-gold-falls-80c-to-42220oz-in-morning-ny-trade-2005-01-18","feb gold up 60c at $423.60/oz in ny,feb gold tops $423/oz in late morning trade,compania de minas commits 2.7m ounces of gold,feb gold falls 80c to $422.20/oz in morning ny trade"
19/1/2005,"http://www.marketwatch.com/story/philly-gold-and-silver-index-falls-05-to-end-at-9353-2005-01-19,http://www.marketwatch.com/story/spot-gold-quoted-at-42210-down-30c-from-new-york-2005-01-19-21905853,http://www.marketwatch.com/story/feb-gold-up-3-at-42650oz-after-1-wk-high-of-42720-2005-01-19,http://www.marketwatch.com/story/gold-continues-higher-but-trades-off-the-days-high-2005-01-19,http://www.marketwatch.com/story/gold-futures-tap-one-week-high-2005-01-19","philly gold and silver index falls 0.5% to end at 93.53,spot gold quoted at $422.10, down 30c from new york,feb gold up $3 at $426.50/oz after 1-wk high of $427.20,gold continues higher, but trades off the day's high,gold futures tap one-week high"
20/1/2005,"http://www.marketwatch.com/story/spot-gold-quoted-at-42130-down-40c-from-new-york-2005-01-20,http://www.marketwatch.com/story/feb-gold-down-60c-at-42270oz-in-afternoon-dealings-2005-01-20","spot gold quoted at $421.30, down 40c from new york,feb gold down 60c at $422.70/oz in afternoon dealings"
21/1/2005,"http://www.marketwatch.com/story/feb-gold-trades-at-two-week-high-of-42850oz-2005-01-21,http://www.marketwatch.com/story/goldcorp-board-says-to-reject-glamis-gold-hostile-bid-2005-01-21","feb gold trades at two-week high of $428.50/oz,goldcorp board says to reject glamis gold hostile bid"
22/1/2005,,
23/1/2005,,
24/1/2005,http://www.marketwatch.com/story/wheaton-river-board-says-to-reject-glamis-gold-bid-2005-01-24,wheaton river board says to reject glamis gold bid
25/1/2005,"http://www.marketwatch.com/story/philly-gold-and-silver-index-falls-27-to-end-at-9176-2005-01-25,http://www.marketwatch.com/story/spot-gold-quoted-at-42130-down-60c-from-new-york-2005-01-25,http://www.marketwatch.com/story/barrick-gold-sees-2005-gold-production-54m-55m-2005-01-25,http://www.marketwatch.com/story/barrick-gold-sees-2005-gold-production-54m-55m-ounces-2005-01-25,http://www.marketwatch.com/story/feb-gold-down-490-at-42220oz-in-ny-2005-01-25","philly gold and silver index falls 2.7% to end at 91.76,spot gold quoted at $421.30, down 60c from new york,barrick gold sees 2005 gold production 5.4m-5.5m,barrick gold sees 2005 gold production 5.4m-5.5m ounces,feb gold down $4.90 at $422.20/oz in ny"
26/1/2005,http://www.marketwatch.com/story/feb-gold-closes-at-42690oz-up-480-or-11-2005-01-26,"feb gold closes at $426.90/oz, up $4.80, or 1.1%"
27/1/2005,"http://www.marketwatch.com/story/feb-gold-down-110-at-42580oz-in-afternoon-dealings-2005-01-27,http://www.marketwatch.com/story/feb-gold-falls-220-to-42470oz-in-morning-ny-trade-2005-01-27","feb gold down $1.10 at $425.80/oz in afternoon dealings,feb gold falls $2.20 to $424.70/oz in morning ny trade"
28/1/2005,,
29/1/2005,,
30/1/2005,,
31/1/2005,,
1/2/2005,"http://www.marketwatch.com/story/gold-futures-tallies-four-session-loss-of-610oz-2005-02-01,http://www.marketwatch.com/story/gold-futures-mark-four-session-decline-of-610oz-2005-02-01","gold futures tallies four-session loss of $6.10/oz,gold futures mark four-session decline of $6.10/oz"
2/2/2005,"http://www.marketwatch.com/story/april-gold-moves-lower-after-earlier-rise-to-42410-2005-02-02,http://www.marketwatch.com/story/april-gold-falls-80c-to-42210oz-in-ny-2005-02-02","april gold moves lower after earlier rise to $424.10,april gold falls 80c to $422.10/oz in ny"
3/2/2005,http://www.marketwatch.com/story/gold-futures-drop-to-lowest-level-since-mid-october-2005-02-03,gold futures drop to lowest level since mid-october
4/2/2005,"http://www.marketwatch.com/story/april-gold-closes-at-lowest-level-since-sept-27-2005-02-04,http://www.marketwatch.com/story/gold-futures-edge-lower-in-morning-trade-2005-02-04","april gold closes at lowest level since sept. 27,gold futures edge lower in morning trade"
5/2/2005,,
6/2/2005,,
7/2/2005,,
8/2/2005,"http://www.marketwatch.com/story/goldcorp-board-rejects-glamis-gold-takeover-bid-2005-02-08,http://www.marketwatch.com/story/roy-disney-stanley-gold-to-withhold-board-votes-2005-02-08","goldcorp board rejects glamis gold takeover bid,roy disney, stanley gold to withhold votes"
9/2/2005,,
10/2/2005,"http://www.marketwatch.com/story/canadian-stocks-rally-as-gold-energy-sectors-surge-2005-02-10,http://www.marketwatch.com/story/spot-gold-quoted-at-418-up-110-from-new-york-2005-02-10","gold, energy prices help lift canadian stocks,spot gold quoted at $418, up $1.10 from new york"
11/2/2005,,
12/2/2005,,
13/2/2005,,
14/2/2005,"http://www.marketwatch.com/story/spot-gold-quoted-at-42370-down-210-from-new-york-2005-02-14,http://www.marketwatch.com/story/spot-gold-quoted-at-42390-down-190-from-new-york-2005-02-14","spot gold quoted at $423.70, down $2.10 from new york,spot gold quoted at $423.90, down $1.90 from new york"
15/2/2005,http://www.marketwatch.com/story/spot-gold-quoted-at-42460-down-1-from-new-york-2005-02-15,"spot gold quoted at $424.60, down $1 from new york"
16/2/2005,,
17/2/2005,http://www.marketwatch.com/story/gold-futures-end-top-428-silver-copper-also-rally-2005-02-17,gold futures end atop $428 an ounce
18/2/2005,,
19/2/2005,,
20/2/2005,,
21/2/2005,,
22/2/2005,,
23/2/2005,,
24/2/2005,http://www.marketwatch.com/story/meridian-gold-upped-to-overweight-at-jp-morgan-2005-02-24,meridian gold upped to 'overweight' at j.p. morgan
25/2/2005,,
26/2/2005,,
27/2/2005,,
28/2/2005,,
1/3/2005,,
2/3/2005,,
3/3/2005,http://www.marketwatch.com/story/spot-gold-quoted-at-43020-up-10c-from-new-york-2005-03-03,"spot gold quoted at $430.20, up 10c from new york"
4/3/2005,,
5/3/2005,,
6/3/2005,,
7/3/2005,http://www.marketwatch.com/story/barrick-gold-upped-to-sector-outperformer-at-cibc-2005-03-07,barrick gold upped to 'sector outperformer' at cibc
8/3/2005,http://www.marketwatch.com/story/spot-gold-quoted-at-44040-down-30c-from-new-york-2005-03-08,spot gold quoted at $440.40 down 30c from new york
9/3/2005,,
10/3/2005,http://www.marketwatch.com/story/gold-stages-late-rally-ends-above-443-an-ounce-level-2005-03-10,gold futures end atop $443 level
11/3/2005,http://www.marketwatch.com/story/kinross-gold-cut-to-neutral-at-ubs-2005-03-11,kinross gold cut to 'neutral' at ubs
12/3/2005,,
13/3/2005,,
14/3/2005,,
15/3/2005,"http://www.marketwatch.com/story/spot-gold-quoted-at-43990-down-10c-from-new-york-2005-03-15,http://www.marketwatch.com/story/copper-shines-gold-eases-after-capital-flows-data-2005-03-15","spot gold quoted at $439.90, down 10c from new york,gold slips in wake of capital flows data"
16/3/2005,,
17/3/2005,,
18/3/2005,,
19/3/2005,,
20/3/2005,,
21/3/2005,"http://www.marketwatch.com/story/gold-etfs-fall-monday-ahead-of-fed-meeting-2005-03-21,http://www.marketwatch.com/story/canadian-end-lower-as-gold-losses-nortel-weigh-2005-03-21","gold etfs fall monday ahead of fed meeting,gold losses weigh on toronto"
22/3/2005,http://www.marketwatch.com/story/wheaton-river-goldcorp-buys-bermejal-gold-deposit-2005-03-22-16915713,"wheaton river, goldcorp buys bermejal gold deposit"
23/3/2005,http://www.marketwatch.com/story/kinross-gold-names-tye-burt-as-president-ceo-2005-03-23,"kinross gold names tye burt as president, ceo"
24/3/2005,http://www.marketwatch.com/story/highlights-of-rising-and-falling-us-stocks-2005-03-24,"guilford pharma, harmony gold, more"
25/3/2005,,
26/3/2005,,
27/3/2005,,
28/3/2005,,
29/3/2005,,
30/3/2005,"http://www.marketwatch.com/story/meridian-to-buy-gold-fields-jv-for-75m-2005-03-30,http://www.marketwatch.com/story/gold-outpaced-in-metals-rally-mining-stocks-also-gain-2005-03-30","meridian to buy gold fields j.v. for $7.5m,gold outpaced in metals rally"
31/3/2005,,
1/4/2005,,
2/4/2005,,
3/4/2005,http://www.marketwatch.com/story/spot-gold-quoted-at-42620-in-asia-trade-2005-04-03,spot gold quoted at $426.20 in asia trade
4/4/2005,"http://www.marketwatch.com/story/spot-gold-quoted-at-42340-up-60c-from-new-york-2005-04-04,http://www.marketwatch.com/story/us-not-convinced-imf-should-sell-gold-for-debt-relief-2005-04-04-15913344","spot gold quoted at $423.40, up 60c from new york,u.s. not convinced imf should sell gold for debt relief"
5/4/2005,,
6/4/2005,,
7/4/2005,,
8/4/2005,,
9/4/2005,,
10/4/2005,,
11/4/2005,,
12/4/2005,"http://www.marketwatch.com/story/glamis-gold-q1-gold-output-up-84-2005-04-12,http://www.marketwatch.com/story/spot-gold-quoted-at-42900-in-asia-trade-2005-04-12","glamis gold q1 gold output up 84%,spot gold quoted at $429.00 in asia trade"
13/4/2005,,
14/4/2005,,
15/4/2005,http://www.marketwatch.com/story/spot-gold-quoted-at-42240-in-asia-trade-2005-04-15,spot gold quoted at $422.40 in asia trade
16/4/2005,,
17/4/2005,,
18/4/2005,http://www.marketwatch.com/story/gold-banc-corp-1q-earns-21c-vs-34c-2005-04-18,gold banc corp 1q earns 21c vs 34c
19/4/2005,,
20/4/2005,,
21/4/2005,,
22/4/2005,,
23/4/2005,,
24/4/2005,,
25/4/2005,,
26/4/2005,,
27/4/2005,,
28/4/2005,,
29/4/2005,,
30/4/2005,,
1/5/2005,,
2/5/2005,,
3/5/2005,,
4/5/2005,,
5/5/2005,,
6/5/2005,,
7/5/2005,,
8/5/2005,,
9/5/2005,"http://www.marketwatch.com/story/spot-gold-quoted-at-427-up-120-from-new-york-2005-05-09,http://www.marketwatch.com/story/roy-disney-stanley-gold-file-suit-against-disney-2005-05-09,http://www.marketwatch.com/story/roy-disney-gold-allege-statements-made-re-ceo-search-2005-05-09","spot gold quoted at $427, up $1.20 from new york,roy disney, stanley gold file suit against disney,roy disney, gold allege statements made re: ceo search"
10/5/2005,http://www.marketwatch.com/story/gold-kist-quaterly-earnings-rise-sales-slip-2005-05-10,"gold kist quaterly earnings rise, sales slip"
11/5/2005,,
12/5/2005,,
13/5/2005,http://www.marketwatch.com/story/apollo-gold-cut-to-underperform-by-bmo-nesbitt-2005-05-13,apollo gold cut to underperform by bmo nesbitt
14/5/2005,,
15/5/2005,,
16/5/2005,,
17/5/2005,,
18/5/2005,,
19/5/2005,,
20/5/2005,,
21/5/2005,,
22/5/2005,,
23/5/2005,,
24/5/2005,,
25/5/2005,,
26/5/2005,,
27/5/2005,,
28/5/2005,,
29/5/2005,,
30/5/2005,,
31/5/2005,http://www.marketwatch.com/story/eldorado-gold-to-buy-afcan-mining-via-stock-swap-2005-05-31,eldorado gold to buy afcan mining via stock swap
1/6/2005,,
2/6/2005,http://www.marketwatch.com/story/bullish-trend-for-gold-as-history-repeats-itself-2005-06-02,gold's slide reversing
3/6/2005,,
4/6/2005,,
5/6/2005,,
6/6/2005,,
7/6/2005,,
8/6/2005,,
9/6/2005,,
10/6/2005,,
11/6/2005,http://www.marketwatch.com/story/us-imf-debt-relief-wont-require-gold-sales-2005-06-11,u.s.: imf debt relief won't require gold sales
12/6/2005,,
13/6/2005,,
14/6/2005,,
15/6/2005,,
16/6/2005,"http://www.marketwatch.com/story/gold-surges-to-seven-week-high-2005-06-16,http://www.marketwatch.com/story/spot-gold-quoted-at-43580-in-asia-trade-2005-06-16","gold surges to seven-week high,spot gold quoted at $435.80 in asia trade"
17/6/2005,http://www.marketwatch.com/story/gold-sets-new-seven-week-high-2005-06-17,"gold, copper extend rallies, set new highs"
18/6/2005,,
19/6/2005,,
20/6/2005,,
21/6/2005,,
22/6/2005,,
23/6/2005,http://www.marketwatch.com/story/gold-kist-slumps-after-merrill-lynch-downgrade-2005-06-23,gold kist slumps after merrill lynch downgrade
24/6/2005,http://www.marketwatch.com/story/gold-prices-fall-but-hold-440-level-2005-06-24,"gold prices fall, but hold $440 level"
25/6/2005,,
26/6/2005,,
27/6/2005,http://www.marketwatch.com/story/is-gld-as-good-as-gold-2005-06-27,is gld as good as gold?
28/6/2005,http://www.marketwatch.com/story/gold-futures-trade-at-a-four-session-low-2005-06-28,gold futures trade at a four-session low
29/6/2005,"http://www.marketwatch.com/story/cboe-gold-index-closes-at-842-up-4-2005-06-29,http://www.marketwatch.com/story/eldorado-gold-names-new-chief-operating-officer-2005-06-29","cboe gold index closes at 84.2, up 4%,eldorado gold names new chief operating officer"
30/6/2005,,
1/7/2005,"http://www.marketwatch.com/story/cboe-gold-index-ends-at-8354-up-03-2005-07-01,http://www.marketwatch.com/story/gold-edges-lower-in-morning-trade-2005-07-01,http://www.marketwatch.com/story/aug-gold-drops-490-or-11-to-43220oz-2005-07-01,http://www.marketwatch.com/story/aug-gold-closes-3-lower-for-the-week-2005-07-01","cboe gold index ends at 83.54, up 0.3%,gold edges lower in morning trade,aug gold drops $4.90, or 1.1%, to $432.20/oz,aug gold closes 3% lower for the week"
2/7/2005,,
3/7/2005,,
4/7/2005,,
5/7/2005,"http://www.marketwatch.com/story/aug-gold-drops-550-or-13-to-42330oz-in-ny-2005-07-05,http://www.marketwatch.com/story/aug-gold-down-370-at-42510oz-after-low-of-42450-2005-07-05","aug gold drops $5.50, or 1.3%, to $423.30/oz in ny,aug gold down $3.70 at $425.10/oz after low of $424.50"
6/7/2005,"http://www.marketwatch.com/story/aug-gold-climbs-90c-to-42480oz-in-late-morning-trade-2005-07-06,http://www.marketwatch.com/story/metals-indexes-close-higher-mirror-golds-gains-2005-07-06,http://www.marketwatch.com/story/gold-futures-end-three-session-losing-streak-2005-07-06","aug gold climbs 90c to $424.80/oz in late morning trade,metals indexes close higher, mirror gold's gains,gold futures end three-session losing streak"
7/7/2005,,
8/7/2005,,
9/7/2005,,
10/7/2005,,
11/7/2005,"http://www.marketwatch.com/story/cboe-gold-index-ends-at-highest-level-since-late-march-2005-07-11,http://www.marketwatch.com/story/gold-ends-atop-426-key-indexes-near-four-month-high-2005-07-11","cboe gold index ends at highest level since late march,gold futures top $426 on dollar, terror"
12/7/2005,http://www.marketwatch.com/story/gold-futures-rises-above-427-to-close-at-one-week-high-2005-07-12,gold atop $427 at one-week high
13/7/2005,"http://www.marketwatch.com/story/gold-prices-metals-indexes-lower-in-afternoon-trade-2005-07-13,http://www.marketwatch.com/story/aug-gold-falls-240-to-42470oz-in-morning-trade-2005-07-13","gold prices, metals indexes lower in afternoon trade,aug gold falls $2.40 to $424.70/oz in morning trade"
14/7/2005,"http://www.marketwatch.com/story/aug-gold-falls-30c-to-42430oz-in-morning-trade-2005-07-14,http://www.marketwatch.com/story/aug-gold-falls-to-6-week-low-of-422oz-2005-07-14","aug gold falls 30c to $424.30/oz in morning trade,aug gold falls to 6-week low of $422/oz"
15/7/2005,,
16/7/2005,,
17/7/2005,,
18/7/2005,http://www.marketwatch.com/story/amex-gold-bugs-index-ends-at-19313-down-05-2005-07-18,"amex gold bugs index ends at 193.13, down 0.5%"
19/7/2005,"http://www.marketwatch.com/story/gold-prices-close-at-three-session-low-2005-07-19,http://www.marketwatch.com/story/aug-gold-falls-60c-to-42040oz-in-ny-2005-07-19","gold prices close at three-session low,aug gold falls 60c to $420.40/oz in ny"
20/7/2005,"http://www.marketwatch.com/story/gold-futures-end-at-one-week-high-2005-07-20,http://www.marketwatch.com/story/amex-gold-bugs-index-climbs-11-to-close-at-19607-2005-07-20","gold futures end at one-week high,amex gold bugs index climbs 1.1% to close at 196.07"
21/7/2005,http://www.marketwatch.com/story/metals-indexes-end-at-1-wk-highs-mirror-gold-strength-2005-07-21,"metals indexes end at 1-wk highs, mirror gold strength"
22/7/2005,http://www.marketwatch.com/story/aug-gold-ends-the-week-380oz-or-09-higher-2005-07-22,"aug gold ends the week $3.80/oz, or 0.9%, higher"
23/7/2005,,
24/7/2005,,
25/7/2005,"http://www.marketwatch.com/story/aug-gold-up-1-at-426oz-after-42640-high-2005-07-25,http://www.marketwatch.com/story/cboe-gold-index-closes-at-828-down-13-2005-07-25","aug gold up $1 at $426/oz after $426.40 high,cboe gold index closes at 82.8, down 1.3%"
26/7/2005,http://www.marketwatch.com/story/dec-gold-down-250-to-close-at-42930oz-2005-07-26,dec gold down $2.50 to close at $429.30/oz
27/7/2005,"http://www.marketwatch.com/story/aug-gold-rises-120-to-42470oz-in-ny-2005-07-27,http://www.marketwatch.com/story/gold-futures-climb-but-metals-indexes-fall-2005-07-27,http://www.marketwatch.com/story/philadelphia-goldsilver-index-closes-at-9113-up-04-2005-07-27","aug gold rises $1.20 to $424.70/oz in ny,gold futures climb, but metals indexes fall,philadelphia gold/silver index closes at 91.13, up 0.4%"
28/7/2005,"http://www.marketwatch.com/story/dec-gold-climbs-280-to-43330oz-in-ny-2005-07-28,http://www.marketwatch.com/story/aug-gold-closes-at-42740oz-up-260-2005-07-28,http://www.marketwatch.com/story/spot-gold-quoted-at-42740-in-asia-trade-2005-07-28","dec gold climbs $2.80 to $433.30/oz in ny,aug gold closes at $427.40/oz, up $2.60,spot gold quoted at $427.40 in asia trade"
29/7/2005,"http://www.marketwatch.com/story/gold-set-to-log-loss-on-month-gain-for-week-2005-07-29,http://www.marketwatch.com/story/gold-futures-end-higher-on-week-lower-on-month-2005-07-29","gold set to log loss on month, gain for week,gold up on week, down on month"
30/7/2005,,
31/7/2005,,
1/8/2005,,
2/8/2005,http://www.marketwatch.com/story/dec-gold-closes-unchanged-at-43770oz-in-ny-2005-08-02,dec gold closes unchanged at $437.70/oz in ny
3/8/2005,http://www.marketwatch.com/story/gold-futures-top-440-for-first-time-in-almost-5-weeks-2005-08-03,gold futures top $440 for first time in almost 5 weeks
4/8/2005,,
5/8/2005,http://www.marketwatch.com/story/dec-gold-closes-at-44280oz-down-90c-for-the-session-2005-08-05,"dec gold closes at $442.80/oz, down 90c for the session"
6/8/2005,,
7/8/2005,,
8/8/2005,,
9/8/2005,"http://www.marketwatch.com/story/dec-gold-down-60c-at-43970-after-43840-low-2005-08-09,http://www.marketwatch.com/story/spot-gold-quoted-at-43460-in-asia-trade-2005-08-09,http://www.marketwatch.com/story/gold-kist-tops-wall-st-earnings-view-2005-08-09,http://www.marketwatch.com/story/amex-gold-bugs-index-up-01-at-20314-2005-08-09","dec gold down 60c at $439.70 after $438.40 low,spot gold quoted at $434.60 in asia trade,gold kist tops wall st. earnings view,amex gold bugs index up 0.1% at 203.14"
10/8/2005,"http://www.marketwatch.com/story/gold-prices-end-higher-as-the-us-dollar-loses-more-ground-2005-08-10,http://www.marketwatch.com/story/dec-gold-closes-at-442oz-up-220-or-05-2005-08-10","gold prices end higher as the u.s. dollar loses more ground,dec gold closes at $442/oz, up $2.20, or 0.5%"
11/8/2005,"http://www.marketwatch.com/story/gold-futures-end-above-450-at-5-month-high-2005-08-11,http://www.marketwatch.com/story/dec-gold-climbs-to-a-7-week-high-above-448oz-2005-08-11,http://www.marketwatch.com/story/gold-futures-climb-to-a-four-session-high-2005-08-11","gold ends atop $450 at 5-month high,dec gold climbs to a 7-week high above $448/oz,gold futures climb to a four-session high"
12/8/2005,"http://www.marketwatch.com/story/philadelphia-goldsilver-index-ends-at-9996-up-05-on-day-2005-08-12,http://www.marketwatch.com/story/dec-gold-up-1-or-02-at-45190-in-last-half-hr-of-trade-2005-08-12","philadelphia gold/silver index ends at 99.96, up 0.5% on day,dec gold up $1, or 0.2%, at $451.90 in last half hr of trade"
13/8/2005,,
14/8/2005,,
15/8/2005,http://www.marketwatch.com/story/gold-closes-almost-4-lower-copper-taps-another-record-2005-08-15,gold closes almost $4 lower; copper taps another record
16/8/2005,http://www.marketwatch.com/story/dec-gold-falls-30c-to-44730oz-in-morning-trade-2005-08-16,dec gold falls 30c to $447.30/oz in morning trade
17/8/2005,"http://www.marketwatch.com/story/metals-indexes-close-broadly-lower-on-gold-copper-weakness-2005-08-17,http://www.marketwatch.com/story/gold-futures-close-at-one-week-low-copper-sinks-2005-08-17,http://www.marketwatch.com/story/dec-gold-falls-3-to-44850oz-in-morning-trade-2005-08-17","metals indexes close broadly lower on gold, copper weakness,gold ends under $450; copper sinks,dec gold falls $3 to $448.50/oz in morning trade"
18/8/2005,http://www.marketwatch.com/story/dec-gold-climbs-140-to-44660oz-in-ny-2005-08-18,dec gold climbs $1.40 to $446.60/oz in ny
19/8/2005,http://www.marketwatch.com/story/gold-falls-06-for-the-day-down-2-for-the-week-2005-08-19,"gold falls 0.6% for the day, down 2% for the week"
20/8/2005,,
21/8/2005,,
22/8/2005,http://www.marketwatch.com/story/spot-gold-quoted-at-43780-in-asia-trade-2005-08-22,spot gold quoted at $437.80 in asia trade
23/8/2005,,
24/8/2005,"http://www.marketwatch.com/story/gold-futures-close-with-a-more-than-2-loss-2005-08-24,http://www.marketwatch.com/story/spot-gold-quoted-at-43720-in-asia-trade-2005-08-24,http://www.marketwatch.com/story/cboe-gold-index-falls-23-to-close-at-8404-2005-08-24","gold futures close back toward $442,spot gold quoted at $437.20 in asia trade,cboe gold index falls 2.3% to close at 84.04"
25/8/2005,"http://www.marketwatch.com/story/gold-ends-higher-on-weak-dollar-silver-at-7-month-low-2005-08-25,http://www.marketwatch.com/story/dec-gold-closes-at-44310oz-in-ny-up-90c-for-the-session-2005-08-25","gold rises; silver drops to 7-month low,dec gold closes at $443.10/oz in ny, up 90c for the session"
26/8/2005,"http://www.marketwatch.com/story/dec-gold-falls-110-to-442oz-near-the-sessions-close-2005-08-26,http://www.marketwatch.com/story/dec-gold-rises-30c-to-44340oz-in-morning-ny-trade-2005-08-26","dec gold falls $1.10 to $442/oz near the session's close,dec gold rises 30c to $443.40/oz in morning ny trade"
27/8/2005,,
28/8/2005,,
29/8/2005,,
30/8/2005,"http://www.marketwatch.com/story/amex-gold-bugs-index-ends-at-4-wk-low-of-19879-down-19-2005-08-30,http://www.marketwatch.com/story/dec-gold-drops-740-or-17-to-434oz-in-ny-2005-08-30","amex gold bugs index ends at 4-wk low of 198.79, down 1.9%,dec gold drops $7.40, or 1.7%, to $434/oz in ny"
31/8/2005,"http://www.marketwatch.com/story/december-gold-futures-close-up-260-at-43810-2005-08-31,http://www.marketwatch.com/story/spot-gold-quoted-at-43470-in-asia-trade-2005-08-31,http://www.marketwatch.com/story/gold-futures-stage-a-recovery-dollar-gdp-in-focus-2005-08-31","december gold futures close up $2.60 at $438.10,spot gold quoted at $434.70 in asia trade,gold futures rally on weaker dollar"
1/9/2005,http://www.marketwatch.com/story/gold-etfs-higher-on-weaker-dollar-2005-09-01,gold etfs higher on weaker dollar
2/9/2005,http://www.marketwatch.com/story/gold-futures-head-for-three-session-win-2005-09-02,gold futures head for three-session win
3/9/2005,,
4/9/2005,,
5/9/2005,,
6/9/2005,"http://www.marketwatch.com/story/gold-prices-edge-up-for-a-fourth-session-2005-09-06,http://www.marketwatch.com/story/philadelphia-goldsilver-index-falls-05-to-close-at-985-2005-09-06","gold prices edge up for a fourth session,philadelphia gold/silver index falls 0.5% to close at 98.5"
7/9/2005,http://www.marketwatch.com/story/silver-futures-end-at-a-two-week-high-gold-posts-small-gain-2005-09-07,silver futures end at a two-week high; gold posts small gain
8/9/2005,"http://www.marketwatch.com/story/cboe-gold-index-closes-at-highest-level-since-march-2005-09-08,http://www.marketwatch.com/story/dec-gold-up-360-at-45260oz-after-45390-high-2005-09-08,http://www.marketwatch.com/story/gold-futures-continue-higher-but-off-sessions-high-2005-09-08","cboe gold index closes at highest level since march,dec gold up $3.60 at $452.60/oz after $453.90 high,gold futures continue higher, but off session's high"
9/9/2005,"http://www.marketwatch.com/story/cboe-gold-index-up-29-to-end-at-9291-up-42-on-wk-2005-09-09,http://www.marketwatch.com/story/gold-futures-heads-higher-for-a-seventh-session-2005-09-09,http://www.marketwatch.com/story/dec-gold-up-450-or-1-for-the-week-2005-09-09","cboe gold index up 2.9% to end at 92.91, up 4.2% on wk,gold futures heads higher for a seventh session,dec gold up $4.50, or 1%, for the week"
10/9/2005,,
11/9/2005,,
12/9/2005,http://www.marketwatch.com/story/gold-futures-close-higher-for-an-eighth-session-2005-09-12,gold futures close higher for an eighth session
13/9/2005,http://www.marketwatch.com/story/dec-gold-falls-410-to-44960oz-in-morning-ny-trade-2005-09-13,dec gold falls $4.10 to $449.60/oz in morning ny trade
14/9/2005,http://www.marketwatch.com/story/dec-gold-climbs-310-to-45310oz-in-afternoon-dealings-2005-09-14,dec gold climbs $3.10 to $453.10/oz in afternoon dealings
15/9/2005,,
16/9/2005,http://www.marketwatch.com/story/metals-miners-stand-out-as-spot-gold-rises-ftse-gains-2005-09-16,"metals, miners stand out as spot gold rises, ftse gains"
17/9/2005,,
18/9/2005,,
19/9/2005,"http://www.marketwatch.com/story/dec-gold-climbs-460-to-46790oz-a-9-mo-high-2005-09-19,http://www.marketwatch.com/story/gold-futures-rally-close-near-18-year-high-2005-09-19,http://www.marketwatch.com/story/gold-fields-up-46-at-1408-premarket-2005-09-19","dec gold climbs $4.60 to $467.90/oz, a 9-mo high,gold futures rally, near 18-year high,gold fields up 4.6% at $14.08 premarket"
20/9/2005,"http://www.marketwatch.com/story/disasters-aside-insiders-are-best-barometer-for-gold-2005-09-20,http://www.marketwatch.com/story/dec-gold-futures-close-down-40c-at-470-2005-09-20","gold's future draws nigh,dec gold futures close down 40c at $470"
21/9/2005,"http://www.marketwatch.com/story/dec-gold-closes-at-47320-highest-since-late-1987-2005-09-21,http://www.marketwatch.com/story/spot-gold-quoted-at-47250-in-asia-trade-2005-09-21,http://www.marketwatch.com/story/gold-futures-close-above-473-2005-09-21","dec gold closes at $473.20, highest since late 1987,spot gold quoted at $472.50 in asia trade,gold futures close above $473"
22/9/2005,http://www.marketwatch.com/story/dec-gold-futures-up-410-at-47670-an-ounce-2005-09-22,dec gold futures up $4.10 at $476.70 an ounce
23/9/2005,,
24/9/2005,,
25/9/2005,,
26/9/2005,"http://www.marketwatch.com/story/dec-gold-closes-at-46950oz-up-230-after-46230-low-2005-09-26,http://www.marketwatch.com/story/spot-gold-quoted-at-46520-in-asia-trade-2005-09-26","dec gold closes at $469.50/oz, up $2.30 after $462.30 low,spot gold quoted at $465.20 in asia trade"
27/9/2005,http://www.marketwatch.com/story/amex-gold-bugs-index-falls-22-to-close-at-23749-2005-09-27,amex gold bugs index falls 2.2% to close at 237.49
28/9/2005,,
29/9/2005,"http://www.marketwatch.com/story/philadelphia-goldsilver-index-up-2-to-end-at-11447-2005-09-29,http://www.marketwatch.com/story/lowell-better-to-buy-an-m-16-than-gold-2005-09-29,http://www.marketwatch.com/story/dec-gold-rises-above-475oz-for-the-first-time-in-a-week-2005-09-29","philadelphia gold/silver index up 2% to end at 114.47,lowell: better to buy an m-16 than gold,dec gold rises above $475/oz for the first time in a week"
30/9/2005,"http://www.marketwatch.com/story/gold-futures-decline-steepens-in-late-morning-trade-2005-09-30,http://www.marketwatch.com/story/cboe-gold-index-at-10237-down-1-on-day-up-23-on-qtr-2005-09-30","gold futures' decline steepens in late morning trade,cboe gold index at 102.37, down 1% on day, up 23% on qtr"
1/10/2005,,
2/10/2005,,
3/10/2005,"http://www.marketwatch.com/story/metals-indexes-mirror-golds-decline-to-close-broadly-lower-2005-10-03,http://www.marketwatch.com/story/dec-gold-futures-down-310-at-46920-an-ounce-2005-10-03,http://www.marketwatch.com/story/gold-fields-says-quarterly-production-fell-8-2005-10-03,http://www.marketwatch.com/story/gold-futures-close-at-a-4-session-low-copper-at-record-high-2005-10-03,http://www.marketwatch.com/story/gold-futures-lose-more-ground-in-late-morning-dealings-2005-10-03","metals indexes mirror gold's decline to close broadly lower,dec gold futures down $3.10 at $469.20 an ounce,gold fields says quarterly production fell 8%,gold futures close at a 4-session low; copper at record high,gold futures lose more ground in late morning dealings"
4/10/2005,,
5/10/2005,http://www.marketwatch.com/story/gold-unchanged-as-traders-gauge-inflation-copper-gains-2005-10-05,gold ends flat; traders gauge inflation
6/10/2005,"http://www.marketwatch.com/story/dec-gold-climbs-390-to-two-week-high-at-47320oz-2005-10-06,http://www.marketwatch.com/story/gold-prices-up-5-an-ounce-in-late-morning-trade-2005-10-06,http://www.marketwatch.com/story/gold-futures-climb-to-a-two-week-high-above-475-2005-10-06","dec gold climbs $3.90 to two-week high at $473.20/oz,gold prices up $5 an ounce in late morning trade,gold futures climb to a two-week high above $475"
7/10/2005,"http://www.marketwatch.com/story/dec-gold-up-3-at-478oz-after-47880-high-2005-10-07,http://www.marketwatch.com/story/amex-gold-bugs-index-closes-at-24308-up-24-2005-10-07","dec gold up $3 at $478/oz after $478.80 high,amex gold bugs index closes at 243.08, up 2.4%"
8/10/2005,,
9/10/2005,,
10/10/2005,"http://www.marketwatch.com/story/spot-gold-quoted-at-47450-in-asia-trade-2005-10-10,http://www.marketwatch.com/story/gold-hits-fresh-18-year-high-on-inflation-demand-concerns-2005-10-10,http://www.marketwatch.com/story/dec-gold-closes-at-478oz-up-30c-after-47960-high-2005-10-10,http://www.marketwatch.com/story/spot-gold-quoted-at-47490-in-asia-trade-2005-10-10","spot gold quoted at $474.50 in asia trade,gold hits fresh 18-year high on inflation, demand concerns,dec gold closes at $478/oz, up 30c after $479.60 high,spot gold quoted at $474.90 in asia trade"
11/10/2005,"http://www.marketwatch.com/story/amex-gold-bugs-index-closes-down-08-at-24073-2005-10-11,http://www.marketwatch.com/story/dec-gold-up-120-to-47920-after-47990-high-2005-10-11","amex gold bugs index closes down 0.8% at 240.73,dec gold up $1.20 to $479.20 after $479.90 high"
12/10/2005,"http://www.marketwatch.com/story/dec-gold-futures-up-240-at-48220-an-ounce-2005-10-12,http://www.marketwatch.com/story/gold-at-fresh-18-year-high-on-inflation-worries-2005-10-12","dec gold futures up $2.40 at $482.20 an ounce,gold at fresh 18-year high on inflation worries"
13/10/2005,"http://www.marketwatch.com/story/spot-gold-quoted-at-47140-in-asia-trade-2005-10-13,http://www.marketwatch.com/story/gold-prices-close-under-474-down-nearly-3-2005-10-13","spot gold quoted at $471.40 in asia trade,gold prices close under $474, down nearly $3"
14/10/2005,"http://www.marketwatch.com/story/dec-gold-futures-down-60c-at-47320-an-ounce-2005-10-14,http://www.marketwatch.com/story/five-top-gold-funds-2005-10-14,http://www.marketwatch.com/story/dec-gold-falls-440-to-46940oz-an-over-1-week-low-2005-10-14","dec gold futures down 60c at $473.20 an ounce,five top gold funds,dec gold falls $4.40 to $469.40/oz, an over 1-week low"
15/10/2005,,
16/10/2005,,
17/10/2005,http://www.marketwatch.com/story/spot-gold-quoted-at-474-in-asia-trade-2005-10-17,spot gold quoted at $474 in asia trade
18/10/2005,"http://www.marketwatch.com/story/dec-gold-futures-down-180-at-47480-an-ounce-2005-10-18,http://www.marketwatch.com/story/gold-prices-dull-trade-under-474-in-morning-dealings-2005-10-18","dec gold futures down $1.80 at $474.80 an ounce,gold prices dull, trade under $474 in morning dealings"
19/10/2005,http://www.marketwatch.com/story/cboe-gold-index-falls-22-to-close-at-9486-2005-10-19,cboe gold index falls 2.2% to close at 94.86
20/10/2005,http://www.marketwatch.com/story/dec-gold-falls-260-to-end-at-5-wk-low-of-46320oz-2005-10-20,dec gold falls $2.60 to end at 5-wk low of $463.20/oz
21/10/2005,http://www.marketwatch.com/story/dec-gold-loses-270-or-06-for-the-week-2005-10-21,"dec gold loses $2.70, or 0.6%, for the week"
22/10/2005,,
23/10/2005,,
24/10/2005,http://www.marketwatch.com/story/philadelphia-goldsilver-index-ends-near-one-week-high-2005-10-24,philadelphia gold/silver index ends near one-week high
25/10/2005,"http://www.marketwatch.com/story/gold-etfs-higher-in-early-trade-2005-10-25,http://www.marketwatch.com/story/apollo-gold-many-montana-tunnels-staff-on-layoff-2005-10-25,http://www.marketwatch.com/story/spot-gold-quoted-at-47210-in-asia-trade-2005-10-25","gold etfs higher in early trade,apollo gold: many montana tunnels staff on layoff,spot gold quoted at $472.10 in asia trade"
26/10/2005,http://www.marketwatch.com/story/dec-gold-falls-20c-to-47450oz-in-morning-ny-trade-2005-10-26,dec gold falls 20c to $474.50/oz in morning ny trade
27/10/2005,http://www.marketwatch.com/story/gold-closes-above-475-for-first-time-since-oct-17-2005-10-27,gold closes above $475 for first time since oct. 17
28/10/2005,"http://www.marketwatch.com/story/gold-futures-close-with-a-nearly-6-gain-for-the-week-2005-10-28,http://www.marketwatch.com/story/philadelphia-goldsilver-index-ends-at-1068-up-12-2005-10-28","gold ends with a nearly $6 weekly gain,philadelphia gold/silver index ends at 106.8, up 1.2%"
29/10/2005,,
30/10/2005,,
31/10/2005,http://www.marketwatch.com/story/barrick-gold-down-42-at-2607-2005-10-31,barrick gold down 4.2% at $26.07
1/11/2005,"http://www.marketwatch.com/story/dec-gold-falls-410-to-46280oz-in-morning-ny-trade-2005-11-01,http://www.marketwatch.com/story/gold-futures-close-at-seven-week-low-down-over-6-an-ounce-2005-11-01,http://www.marketwatch.com/story/gold-holds-atop-460-after-hours-in-wake-of-fed-hike-2005-11-01","dec gold falls $4.10 to $462.80/oz in morning ny trade,gold futures close at seven-week low, down over $6 an ounce,gold holds atop $460 after-hours"
2/11/2005,"http://www.marketwatch.com/story/gold-futures-bounce-off-a-7-week-low-to-close-4-higher-2005-11-02,http://www.marketwatch.com/story/gold-futures-climb-for-first-time-in-four-sessions-2005-11-02","gold bounces off seven-week low,gold futures climb for first time in four sessions"
3/11/2005,"http://www.marketwatch.com/story/spot-gold-quoted-at-46110-in-asia-trade-2005-11-03,http://www.marketwatch.com/story/gold-futures-pull-back-in-morning-trading-on-dollar-strength-2005-11-03,http://www.marketwatch.com/story/cboe-gold-index-closes-at-9703-down-18-2005-11-03","spot gold quoted at $461.10 in asia trade,gold futures pull back in morning trading on dollar strength,cboe gold index closes at 97.03, down 1.8%"
4/11/2005,"http://www.marketwatch.com/story/gold-futures-close-with-an-almost-17-loss-for-the-week-2005-11-04,http://www.marketwatch.com/story/philadelphia-goldsilver-index-falls-05-to-close-at-10583-2005-11-04","gold loses almost $17 for the week,philadelphia gold/silver index falls 0.5% to close at 105.83"
5/11/2005,,
6/11/2005,,
7/11/2005,"http://www.marketwatch.com/story/dec-gold-last-up-220-at-46010oz-2005-11-07,http://www.marketwatch.com/story/spot-gold-quoted-at-457-in-asia-trade-2005-11-07,http://www.marketwatch.com/story/philadelphia-goldsilver-index-up-04-to-end-at-10624-2005-11-07,http://www.marketwatch.com/story/gold-prices-post-modest-climb-remain-under-460-2005-11-07,http://www.marketwatch.com/story/gold-futures-close-above-460-an-ounce-2005-11-07","dec gold last up $2.20 at $460.10/oz,spot gold quoted at $457 in asia trade,philadelphia gold/silver index up 0.4% to end at 106.24,gold prices post modest climb, remain under $460,gold futures close above $460 an ounce"
8/11/2005,,
9/11/2005,"http://www.marketwatch.com/story/dec-gold-closes-near-a-two-week-high-up-520-at-46750oz-2005-11-09,http://www.marketwatch.com/story/gold-futures-look-to-extend-their-winning-streak-to-three-2005-11-09","dec gold closes near a two-week high, up $5.20 at $467.50/oz,gold futures look to extend their winning streak to three"
10/11/2005,"http://www.marketwatch.com/story/marshall-ilsley-pays-278-cash-1572-stk-for-gold-banc-2005-11-10,http://www.marketwatch.com/story/gold-futures-steady-in-late-morning-dealings-2005-11-10,http://www.marketwatch.com/story/gold-futures-head-higher-for-a-fourth-session-2005-11-10,http://www.marketwatch.com/story/dec-gold-closes-at-46770brl-up-20c-to-mark-4-day-win-2005-11-10,http://www.marketwatch.com/story/spot-gold-quoted-at-46510-in-asia-trade-2005-11-10,http://www.marketwatch.com/story/dec-gold-up-110-at-46860-an-ounce-2005-11-10,http://www.marketwatch.com/story/marshall-ilsley-to-pay-700m-for-gold-banc-2005-11-10-8911827","marshall & ilsley pays $2.78-cash, $15.72 stk for gold banc,gold futures steady in late morning dealings,gold futures head higher for a fourth session,dec gold closes at $467.70/brl, up 20c to mark 4-day win,spot gold quoted at $465.10 in asia trade,dec gold up $1.10 at $468.60 an ounce,marshall & ilsley to pay $700m for gold banc"
11/11/2005,http://www.marketwatch.com/story/gold-futures-turn-higher-in-late-morning-trading-2005-11-11,gold futures turn higher in late morning trading
12/11/2005,,
13/11/2005,,
14/11/2005,"http://www.marketwatch.com/story/dec-gold-falls-30c-to-end-at-46910oz-2005-11-14,http://www.marketwatch.com/story/philadelphia-goldsilver-index-falls-12-to-close-at-10995-2005-11-14","dec gold falls 30c to end at $469.10/oz,philadelphia gold/silver index falls 1.2% to close at 109.95"
15/11/2005,http://www.marketwatch.com/story/dec-gold-down-30c-at-46880-an-ounce-2005-11-15,dec gold down 30c at $468.80 an ounce
16/11/2005,http://www.marketwatch.com/story/dec-gold-up-6-at-475-an-ounce-2005-11-16,dec gold up $6 at $475 an ounce
17/11/2005,,
18/11/2005,http://www.marketwatch.com/story/amex-gold-bugs-index-ends-the-week-with-a-46-gain-2005-11-18,amex gold bugs index ends the week with a 4.6% gain
19/11/2005,,
20/11/2005,,
21/11/2005,"http://www.marketwatch.com/story/spot-gold-quoted-at-49210-in-asia-trade-2005-11-21,http://www.marketwatch.com/story/dec-gold-up-340-at-48950-an-ounce-2005-11-21,http://www.marketwatch.com/story/dec-gold-futures-end-up-330-at-48950-an-ounce-2005-11-21","spot gold quoted at $492.10 in asia trade,dec gold up $3.40 at $489.50 an ounce,dec gold futures end up $3.30 at $489.50 an ounce"
22/11/2005,"http://www.marketwatch.com/story/gobble-up-gains-on-gold-2005-11-22,http://www.marketwatch.com/story/dec-gold-futures-up-370-at-49320-an-ounce-2005-11-22","gobble up gains on gold,dec gold futures up $3.70 at $493.20 an ounce"
23/11/2005,,
24/11/2005,,
25/11/2005,,
26/11/2005,,
27/11/2005,,
28/11/2005,,
29/11/2005,"http://www.marketwatch.com/story/spot-gold-quoted-at-49490-in-asia-trade-2005-11-29,http://www.marketwatch.com/story/dec-gold-falls-260-to-49570oz-after-50230-overnight-2005-11-29,http://www.marketwatch.com/story/gold-falls-in-morning-trade-after-topping-500-overnight-2005-11-29","spot gold quoted at $494.90 in asia trade,dec gold falls $2.60 to $495.70/oz after $502.30 overnight,gold falls in morning trade after topping $500 overnight"
30/11/2005,"http://www.marketwatch.com/story/spot-gold-quoted-at-493-in-asia-trade-2005-11-30,http://www.marketwatch.com/story/spot-gold-quoted-at-49230-in-asia-trade-2005-11-30,http://www.marketwatch.com/story/dec-gold-ends-up-05-on-wk-up-59-on-month-2005-11-30,http://www.marketwatch.com/story/dec-gold-falls-310-to-496oz-after-500-high-overnight-2005-11-30","spot gold quoted at $493 in asia trade,spot gold quoted at $492.30 in asia trade,dec gold ends up 0.5% on wk, up 5.9% on month,dec gold falls $3.10 to $496/oz after $500 high overnight"
1/12/2005,"http://www.marketwatch.com/story/dec-gold-climbs-740-or-15-to-trade-at-502oz-2005-12-01,http://www.marketwatch.com/story/dec-gold-trades-at-49980oz-up-520-2005-12-01,http://www.marketwatch.com/story/gold-enters-new-phase-2005-12-01,http://www.marketwatch.com/story/golds-front-month-contract-tap-500-for-1st-time-since-1987-2005-12-01,http://www.marketwatch.com/story/gold-fields-bolivar-agree-to-330m-acquisition-plan-2005-12-01-1291449","dec gold climbs $7.40, or 1.5%, to trade at $502/oz,dec gold trades at $499.80/oz, up $5.20,gold enters new 'phase',gold's front-month contract tap $500 for 1st time since 1987,gold fields, bolivar agree to $330m acquisition plan"
2/12/2005,"http://www.marketwatch.com/story/gold-silver-close-at-new-18-year-highs-copper-falls-2005-12-02,http://www.marketwatch.com/story/philadelphia-goldsilver-index-closes-at-11623-down-16-2005-12-02,http://www.marketwatch.com/story/dec-gold-poised-for-12oz-gain-for-the-week-2005-12-02","gold, silver close at new 18-year highs; copper falls,philadelphia gold/silver index closes at 116.23, down 1.6%,dec gold poised for $12/oz gain for the week"
3/12/2005,,
4/12/2005,,
5/12/2005,,
6/12/2005,"http://www.marketwatch.com/story/feb-gold-falls-240-or-05-to-51020oz-in-ny-2005-12-06,http://www.marketwatch.com/story/philadelphia-goldsilver-index-at-highest-level-since1997-2005-12-06","feb gold falls $2.40, or 0.5%, to $510.20/oz in ny,philadelphia gold/silver index at highest level since1997"
7/12/2005,"http://www.marketwatch.com/story/gold-etfs-up-in-early-action-2005-12-07,http://www.marketwatch.com/story/spot-gold-quoted-at-51740-in-asia-trade-2005-12-07","gold etfs up in early action,spot gold quoted at $517.40 in asia trade"
8/12/2005,,
9/12/2005,"http://www.marketwatch.com/story/feb-gold-climbs-890-to-53160oz-after-53430-high-2005-12-09,http://www.marketwatch.com/story/feb-gold-closes-at-53020oz-up-750-at-over-24-yr-high-2005-12-09,http://www.marketwatch.com/story/gold-tops-534-to-mark-an-over-24-year-high-2005-12-09","feb gold climbs $8.90 to $531.60/oz after $534.30 high,feb gold closes at $530.20/oz, up $7.50 at over 24-yr high,gold tops $534 to mark an over 24-year high"
10/12/2005,,
11/12/2005,,
12/12/2005,http://www.marketwatch.com/story/february-gold-surges-to-54450-an-ounce-high-2005-12-12,february gold surges to $544.50 an ounce high
13/12/2005,http://www.marketwatch.com/story/feb-gold-extends-declines-after-hours-on-fed-rate-hike-2005-12-13,feb gold extends declines after hours on fed rate hike
14/12/2005,http://www.marketwatch.com/story/spot-gold-quoted-at-504-in-asia-trade-2005-12-14,spot gold quoted at $504 in asia trade
15/12/2005,"http://www.marketwatch.com/story/gold-prices-extend-weakness-2005-12-15,http://www.marketwatch.com/story/cboe-gold-index-up-09-at-11132-2005-12-15","gold prices extend weakness,cboe gold index up 0.9% at 111.32"
16/12/2005,http://www.marketwatch.com/story/gold-closes-down-for-the-week-2005-12-16,gold closes down for the week
17/12/2005,,
18/12/2005,,
19/12/2005,,
20/12/2005,,
21/12/2005,,
22/12/2005,"http://www.marketwatch.com/story/gold-pushes-higher-on-news-of-barrick-bid-for-placer-dome-2005-12-22,http://www.marketwatch.com/story/gold-closes-higher-for-first-time-in-three-sessions-2005-12-22","gold pushes higher on news of barrick bid for placer dome,gold closes higher for first time in three sessions"
23/12/2005,http://www.marketwatch.com/story/kinross-gold-sees-2003-losses-increasing-by-25m-2005-12-23,kinross gold sees 2003 losses increasing by $25m
24/12/2005,,
25/12/2005,,
26/12/2005,,
27/12/2005,,
28/12/2005,,
29/12/2005,http://www.marketwatch.com/story/gold-closes-higher-for-fifth-consecutive-session-2005-12-29,gold contract's winning streak hits five
30/12/2005,http://www.marketwatch.com/story/feb-gold-ends-the-year-6580-or-145-higher-2005-12-30,"feb gold ends the year $65.80, or 14.5%, higher"
31/12/2005,,
1/1/2006,,
2/1/2006,,
3/1/2006,"https://economictimes.indiatimes.com/articleshow/1356906.cms,http://www.marketwatch.com/story/gold-futures-strengthen-in-late-morning-dealings-2006-01-03,http://www.marketwatch.com/story/feb-gold-futures-up-540-at-52430-an-ounce-2006-01-03","gold prices up in asian trade,gold futures strengthen in late morning dealings,feb gold futures up $5.40 at $524.30 an ounce"
4/1/2006,"http://www.marketwatch.com/story/feb-gold-trades-modestly-higher-in-late-morning-dealings-2006-01-04,http://www.marketwatch.com/story/amex-gold-bugs-index-up-16-to-close-at-30362-2006-01-04","feb gold trades modestly higher in late morning dealings,amex gold bugs index up 1.6% to close at 303.62"
5/1/2006,http://www.marketwatch.com/story/metals-indexes-follow-gold-lower-2006-01-05,metals indexes follow gold lower
6/1/2006,"http://www.marketwatch.com/story/philadelphia-goldsilver-index-up-92-on-week-2006-01-06,http://www.marketwatch.com/story/feb-gold-taps-54010oz-nears-25-yr-high-of-543-from-dec-2006-01-06,http://www.marketwatch.com/story/gold-prices-top-540-in-afternoon-dealings-2006-01-06,http://www.marketwatch.com/story/feb-gold-closes-at-54120oz-up-1340-or-25-2006-01-06","philadelphia gold/silver index up 9.2% on week,feb gold taps $540.10/oz, nears 25-yr high of $543 from dec,gold prices top $540 in afternoon dealings,feb gold closes at $541.20/oz, up $13.40, or 2.5%"
7/1/2006,https://economictimes.indiatimes.com/articleshow/1362358.cms,"gold, silver lose shine on selling pressure"
8/1/2006,,
9/1/2006,"http://www.marketwatch.com/story/cboe-gold-index-closes-at-13117-down-06-2006-01-09,http://www.marketwatch.com/story/feb-gold-up-260-at-54380-after-53650-low-2006-01-09,http://www.marketwatch.com/story/feb-gold-taps-54850-highest-level-since-march-81-2006-01-09,http://www.marketwatch.com/story/gold-futures-resume-climb-trade-above-544-2006-01-09,http://www.marketwatch.com/story/gold-futures-close-above-550-an-ounce-2006-01-09","cboe gold index closes at 131.17, down 0.6%,feb gold up $2.60 at $543.80 after $536.50 low,feb gold taps $548.50, highest level since march '81,gold futures resume climb, trade above $544,gold futures close above $550 an ounce"
10/1/2006,"https://economictimes.indiatimes.com/articleshow/1365712.cms,http://www.marketwatch.com/story/metals-indexes-close-little-changed-despite-gold-weakness-2006-01-10,http://www.marketwatch.com/story/spot-gold-quoted-at-54310-in-asia-trade-2006-01-10,http://www.marketwatch.com/story/feb-gold-closes-down-480-or-09-at-54570oz-2006-01-10,http://www.marketwatch.com/story/gold-futures-finish-with-a-nearly-5-an-ounce-loss-2006-01-10","gold zooms by rs 80 at opening,metals indexes close little changed despite gold weakness,spot gold quoted at $543.10 in asia trade,feb gold closes down $4.80, or 0.9%, at $545.70/oz,gold futures fall from quarter-century high"
11/1/2006,,
12/1/2006,http://www.marketwatch.com/story/feb-gold-closes-at-54930oz-down-80c-or-02-2006-01-12,"feb gold closes at $549.30/oz, down 80c, or 0.2%"
13/1/2006,,
14/1/2006,,
15/1/2006,,
16/1/2006,,
17/1/2006,"http://www.marketwatch.com/story/gold-futures-pull-back-from-overnight-highs-2006-01-17,http://www.marketwatch.com/story/feb-gold-falls-1-to-556oz-in-last-half-hr-of-trading-2006-01-17,http://www.marketwatch.com/story/amex-gold-bugs-index-ends-lower-at-30837-after-3154-high-2006-01-17,http://www.marketwatch.com/story/feb-gold-falls-220-to-55480oz-after-55620-high-2006-01-17,http://www.marketwatch.com/story/gold-futures-end-lower-after-touching-a-25-year-high-2006-01-17","gold futures pull back from overnight highs,feb gold falls $1 to $556/oz in last half hr of trading,amex gold bugs index ends lower at 308.37 after 315.4 high,feb gold falls $2.20 to $554.80/oz after $556.20 high,gold ends lower after rising past $561"
18/1/2006,,
19/1/2006,"http://www.marketwatch.com/story/feb-gold-climbs-940-to-55390oz-after-55550-high-2006-01-19,https://economictimes.indiatimes.com/articleshow/1378554.cms,http://www.marketwatch.com/story/feb-gold-last-at-55770oz-up-1320-or-24-2006-01-19","feb gold climbs $9.40 to $553.90/oz after $555.50 high,funds lift gold, but small buyers await price fall,feb gold last at $557.70/oz, up $13.20, or 2.4%"
20/1/2006,"http://www.marketwatch.com/story/feb-gold-trades-down-2-from-week-ago-close-2006-01-20,http://www.marketwatch.com/story/amex-gold-bugs-index-closes-down-22-for-the-week-2006-01-20","feb gold trades down $2 from week-ago close,amex gold bugs index closes down 2.2% for the week"
21/1/2006,,
22/1/2006,,
23/1/2006,"http://www.marketwatch.com/story/gold-futures-climb-end-near-559-as-the-dollar-tumbles-2006-01-23,http://www.marketwatch.com/story/gold-futures-rise-in-morning-trading-on-dollar-weakness-2006-01-23,http://www.marketwatch.com/story/gold-prices-strengthen-but-trade-mainly-under-560-2006-01-23","gold futures close up on weaker dollar,gold futures rise in morning trading on dollar weakness,gold prices strengthen, but trade mainly under $560"
24/1/2006,"http://www.marketwatch.com/story/feb-gold-falls-1-to-57770oz-in-afternoon-dealings-2006-01-24,http://www.marketwatch.com/story/cboe-gold-index-closes-at-13333-down-02-2006-01-24","feb gold falls $1 to $577.70/oz in afternoon dealings,cboe gold index closes at 133.33, down 0.2%"
25/1/2006,"https://economictimes.indiatimes.com/articleshow/1387250.cms,http://www.marketwatch.com/story/amex-gold-bugs-index-scores-another-record-2006-01-25","need liberalisation of gold mkt: kenny,amex gold bugs index scores another record"
26/1/2006,"http://www.marketwatch.com/story/feb-gold-falls-770-to-55480oz-in-morning-trading-2006-01-26,http://www.marketwatch.com/story/spot-gold-quoted-at-55620-in-asia-trade-2006-01-26","feb gold falls $7.70 to $554.80/oz in morning trading,spot gold quoted at $556.20 in asia trade"
27/1/2006,,
28/1/2006,,
29/1/2006,,
30/1/2006,"http://www.marketwatch.com/story/gold-futures-climb-near-570-an-ounce-2006-01-30,http://www.marketwatch.com/story/run-in-oil-stocks-not-over-yet-2006-01-30","gold futures climb near $570 an ounce,black gold"
31/1/2006,"http://www.marketwatch.com/story/spot-gold-quoted-at-56770-in-asia-trade-2006-01-31,http://www.marketwatch.com/story/cboe-gold-index-up-43-at-14802-after-1494-high-2006-01-31","spot gold quoted at $567.70 in asia trade,cboe gold index up 4.3% at 148.02 after 149.4 high"
1/2/2006,"http://www.marketwatch.com/story/gold-and-silver-prices-fall-over-1-in-late-morning-dealings-2006-02-01,http://www.marketwatch.com/story/gold-silver-pull-back-from-their-more-than-two-decade-highs-2006-02-01","gold and silver prices fall over 1% in late morning dealings,gold, silver pull back from their more than two-decade highs"
2/2/2006,http://www.marketwatch.com/story/spot-gold-quoted-at-57280-in-asia-trade-2006-02-02,spot gold quoted at $572.80 in asia trade
3/2/2006,"http://www.marketwatch.com/story/gold-futures-retreat-but-still-ends-higher-on-week-2006-02-03,http://www.marketwatch.com/story/correct-kinross-gold-shares-down-32c-to-1096-2006-02-03","gold retreats, still 1% higher on week,correct: kinross gold shares down 32c to $10.96"
4/2/2006,,
5/2/2006,,
6/2/2006,"http://www.marketwatch.com/story/spot-gold-quoted-at-56910-in-asia-trade-2006-02-06,http://www.marketwatch.com/story/barrick-gold-buys-another-61m-shares-of-placer-dome-2006-02-06,http://www.marketwatch.com/story/april-gold-trades-near-sessions-high-up-540-at-577oz-2006-02-06","spot gold quoted at $569.10 in asia trade,barrick gold buys another 61m shares of placer dome,april gold trades near session's high, up $5.40 at $577/oz"
7/2/2006,http://www.marketwatch.com/story/april-gold-touches-two-week-low-of-558oz-2006-02-07,april gold touches two-week low of $558/oz
8/2/2006,,
9/2/2006,"http://www.marketwatch.com/story/gold-futures-climb-as-much-as-9-in-morning-trading-2006-02-09,http://www.marketwatch.com/story/gold-futures-climb-over-2-in-afternoon-dealings-2006-02-09","gold futures climb as much as $9 in morning trading,gold futures climb over 2% in afternoon dealings"
10/2/2006,"https://economictimes.indiatimes.com/articleshow/1408921.cms,http://www.marketwatch.com/story/gold-closes-sharply-lower-in-broad-metals-selloff-2006-02-10,https://economictimes.indiatimes.com/articleshow/1409970.cms","gold glitters again, in tune with global trend,gold closes sharply lower,gold prices rise further"
11/2/2006,,
12/2/2006,,
13/2/2006,"http://www.marketwatch.com/story/cboe-gold-index-falls-3-ends-at-5-wk-low-of-1276-2006-02-13,http://www.marketwatch.com/story/spot-gold-quoted-at-53490-in-asia-trade-2006-02-13,http://www.marketwatch.com/story/april-gold-closes-at-54210oz-down-1140-for-the-day-2006-02-13,http://www.marketwatch.com/story/april-gold-drops-to-a-5-wk-low-of-547oz-in-ny-2006-02-13,http://www.marketwatch.com/story/spot-gold-quoted-at-53710-in-asia-trade-2006-02-13","cboe gold index falls 3%, ends at 5-wk low of 127.6,spot gold quoted at $534.90 in asia trade,april gold closes at $542.10/oz, down $11.40 for the day,april gold drops to a 5-wk low of $547/oz in ny,spot gold quoted at $537.10 in asia trade"
14/2/2006,,
15/2/2006,"http://www.marketwatch.com/story/april-gold-falls-230-to-54660oz-after-54350-low-2006-02-15,http://www.marketwatch.com/story/amex-gold-bugs-index-closes-at-29878-down-3-2006-02-15,http://www.marketwatch.com/story/gold-futures-close-over-6-an-ounce-lower-2006-02-15,http://www.marketwatch.com/story/april-gold-falls-370-to-54520oz-in-morning-trading-2006-02-15","april gold falls $2.30 to $546.60/oz after $543.50 low,amex gold bugs index closes at 298.78, down 3%,gold futures close over $6-an-ounce lower,april gold falls $3.70 to $545.20/oz in morning trading"
16/2/2006,http://www.marketwatch.com/story/gold-futures-climb-set-to-recoup-part-of-wednesdays-loss-2006-02-16,"gold futures climb, set to recoup part of wednesday's loss"
17/2/2006,http://www.marketwatch.com/story/rbc-cuts-kinross-gold-corp-price-target-to-13-2006-02-17,rbc cuts kinross gold corp price target to $13
18/2/2006,https://economictimes.indiatimes.com/articleshow/1419419.cms,forex reserves rise $452m; gold value unchanged
19/2/2006,,
20/2/2006,,
21/2/2006,"http://www.marketwatch.com/story/gold-futures-up-130-at-55590-an-ounce-2006-02-21,http://www.marketwatch.com/story/gold-futures-close-higher-on-safe-haven-buying-2006-02-21,http://www.marketwatch.com/story/gold-futures-close-up-2-at-55660-an-ounce-2006-02-21","gold futures up $1.30 at $555.90 an ounce,gold gets safe-haven boost,gold futures close up $2 at $556.60 an ounce"
22/2/2006,"http://www.marketwatch.com/story/cboe-gold-index-climbs-1-to-close-at-13549-2006-02-22,http://www.marketwatch.com/story/gold-dips-as-traders-digest-jan-cpi-2006-02-22,http://www.marketwatch.com/story/gold-futures-close-flat-after-three-session-climb-2006-02-22,http://www.marketwatch.com/story/gold-falls-but-nears-the-days-high-on-record-05-demand-2006-02-22","cboe gold index climbs 1% to close at 135.49,gold dips as traders digest jan cpi,gold ends flat after three-session rise,gold falls, but nears the day's high on record '05 demand"
23/2/2006,"https://economictimes.indiatimes.com/articleshow/1425027.cms,http://www.marketwatch.com/story/april-gold-falls-140-to-55520oz-after-55310-low-2006-02-23","india's still top importer of gold,april gold falls $1.40 to $555.20/oz after $553.10 low"
24/2/2006,"http://www.marketwatch.com/story/gold-prices-up-as-much-as-10-on-saudi-refinery-attack-2006-02-24,http://www.marketwatch.com/story/gold-futures-rise-over-10-an-ounce-in-late-morning-dealings-2006-02-24,http://www.marketwatch.com/story/april-gold-taps-a-two-week-high-of-55920oz-2006-02-24","gold prices up as much as $10 on saudi refinery attack,gold futures rise over $10 an ounce in late morning dealings,april gold taps a two-week high of $559.20/oz"
25/2/2006,,
26/2/2006,,
27/2/2006,http://www.marketwatch.com/story/amex-gold-bugs-index-falls-36-to-close-at-30927-2006-02-27,amex gold bugs index falls 3.6% to close at 309.27
28/2/2006,http://www.marketwatch.com/story/gold-rises-7-but-closes-with-a-2-loss-for-the-month-2006-02-28,"gold rises, but ends with a monthly loss"
1/3/2006,"http://www.marketwatch.com/story/gold-kist-cut-to-neutral-at-jp-morgan-2006-03-01,http://www.marketwatch.com/story/april-gold-futures-close-at-highest-level-since-feb-9-2006-03-01,http://www.marketwatch.com/story/april-gold-last-up-110-at-565oz-after-3-wk-high-of-569-2006-03-01","gold kist cut to neutral at j.p. morgan,april gold futures close at highest level since feb. 9,april gold last up $1.10 at $565/oz after 3-wk high of $569"
2/3/2006,,
3/3/2006,http://www.marketwatch.com/story/april-gold-falls-190-to-56850oz-in-morning-trading-2006-03-03,april gold falls $1.90 to $568.50/oz in morning trading
4/3/2006,https://economictimes.indiatimes.com/articleshow/1437680.cms,"metal mania: silver scales new peak of rs 14,375, gold follows"
5/3/2006,,
6/3/2006,,
7/3/2006,,
8/3/2006,"http://www.marketwatch.com/story/front-month-gold-futures-down-920-at-54530ounce-2006-03-08,http://www.marketwatch.com/story/gold-futures-close-lower-tally-46-loss-in-four-sessions-2006-03-08","front-month gold futures down $9.20 at $545.30/ounce,gold futures close lower, tally 4.6% loss in four sessions"
9/3/2006,"https://economictimes.indiatimes.com/articleshow/1443639.cms,http://www.marketwatch.com/story/april-gold-closes-higher-for-first-time-in-five-sessions-2006-03-09","gold melts afresh as stockists book profits,april gold closes higher for first time in five sessions"
10/3/2006,http://www.marketwatch.com/story/amex-gold-bugs-index-ends-the-week-with-an-83-loss-2006-03-10,amex gold bugs index ends the week with an 8.3% loss
11/3/2006,,
12/3/2006,,
13/3/2006,http://www.marketwatch.com/story/gold-futures-close-over-6-higher-2006-03-13,gold futures close over $6 higher
14/3/2006,"http://www.marketwatch.com/story/spot-gold-quoted-at-55060-in-asia-trade-2006-03-14,http://www.marketwatch.com/story/april-gold-closes-at-a-one-week-high-2006-03-14,http://www.marketwatch.com/story/gold-futures-move-up-after-earlier-weakness-2006-03-14","spot gold quoted at $550.60 in asia trade,april gold closes at a one-week high,gold futures move up after earlier weakness"
15/3/2006,"http://www.marketwatch.com/story/april-gold-up-140-to-end-the-day-at-55440oz-in-ny-2006-03-15,http://www.marketwatch.com/story/gold-futures-up-over-3-an-ounce-in-afternoon-dealings-2006-03-15,http://www.marketwatch.com/story/gold-closes-higher-tallies-13-gain-in-three-sessions-2006-03-15","april gold up $1.40 to end the day at $554.40/oz in ny,gold futures up over $3 an ounce in afternoon dealings,gold tallies $13 gain in three sessions"
16/3/2006,,
17/3/2006,https://economictimes.indiatimes.com/articleshow/1453694.cms,gold strengthens as demand picks up
18/3/2006,,
19/3/2006,,
20/3/2006,"http://www.marketwatch.com/story/copper-futures-close-lower-but-gold-climbs-2006-03-20,http://www.marketwatch.com/story/glamis-gold-to-buy-western-silver-2006-03-20","copper futures close lower, but gold climbs,glamis gold to buy western silver"
21/3/2006,"http://www.marketwatch.com/story/spot-gold-quoted-at-55250-in-asia-trade-2006-03-21,http://www.marketwatch.com/story/philadelphia-goldsilver-index-falls-19-to-close-at-12815-2006-03-21,http://www.marketwatch.com/story/silver-rises-2-to-end-at-1983-level-gold-copper-dull-2006-03-21,http://www.marketwatch.com/story/gold-futures-fall-over-1-in-morning-trading-2006-03-21","spot gold quoted at $552.50 in asia trade,philadelphia gold/silver index falls 1.9% to close at 128.15,silver climbs to 1983 levels; gold dulls,gold futures fall over 1% in morning trading"
22/3/2006,"http://www.marketwatch.com/story/april-gold-falls-150-to-end-at-over-1-wk-low-of-55170oz-2006-03-22,http://www.marketwatch.com/story/spot-gold-quoted-at-550-in-asia-trade-2006-03-22,http://www.marketwatch.com/story/april-gold-falls-350-to-54980oz-in-morning-trading-2006-03-22","april gold falls $1.50 to end at over 1-wk low of $551.70/oz,spot gold quoted at $550 in asia trade,april gold falls $3.50 to $549.80/oz in morning trading"
23/3/2006,"http://www.marketwatch.com/story/spot-gold-quoted-at-54940-in-asia-trade-2006-03-23,https://economictimes.indiatimes.com/articleshow/1460326.cms","spot gold quoted at $549.40 in asia trade,paying 9.5% is tough, gifting gold coins easy"
24/3/2006,,
25/3/2006,,
26/3/2006,,
27/3/2006,,
28/3/2006,"http://www.marketwatch.com/story/gold-futures-steepen-losses-after-fed-rate-hike-2006-03-28,http://www.marketwatch.com/story/june-gold-taps-a-more-than-3-week-high-of-575oz-2006-03-28,http://www.marketwatch.com/story/gold-loses-more-ground-in-electronic-trading-after-fed-move-2006-03-28,http://www.marketwatch.com/story/june-gold-last-down-1-at-57120oz-in-electronic-trading-2006-03-28,http://www.marketwatch.com/story/cboe-gold-index-declines-by-14-to-13501-2006-03-28,http://www.marketwatch.com/story/sp-independent-bank-to-replace-gold-banc-on-smallcap-600-2006-03-28","gold losses steepen after fed hike,june gold taps a more than 3-week high of $575/oz,gold loses more ground in electronic trading after fed move,june gold last down $1 at $571.20/oz in electronic trading,cboe gold index declines by 1.4% to 135.01,s&p: independent bank to replace gold banc on smallcap 600"
29/3/2006,https://economictimes.indiatimes.com/articleshow/1468264.cms,"metal mania buying keeps silver, gold too hot"
30/3/2006,"http://www.marketwatch.com/story/june-gold-jumps-1179-to-25-yr-high-of-59030oz-2006-03-30,http://www.marketwatch.com/story/kinross-gold-sees-06-prod-of-144m-ounces-gold-equivalent-2006-03-30,http://www.marketwatch.com/story/metals-futures-rally-gold-silver-at-over-two-decade-highs-2006-03-30","june gold jumps $11.79 to 25-yr high of $590.30/oz,kinross gold sees '06 prod. of 1.44m ounces gold equivalent,metals futures rally; gold, silver at over two-decade highs"
31/3/2006,http://www.marketwatch.com/story/june-gold-falls-510-to-close-at-58670oz-2006-03-31,june gold falls $5.10 to close at $586.70/oz
1/4/2006,,
2/4/2006,,
3/4/2006,"http://www.marketwatch.com/story/gold-prices-climb-over-8-an-ounce-in-afternoon-trading-2006-04-03,http://www.marketwatch.com/story/spot-gold-quoted-at-587-in-asia-trade-2006-04-03","gold prices climb over $8 an ounce in afternoon trading,spot gold quoted at $587 in asia trade"
4/4/2006,,
5/4/2006,"http://www.marketwatch.com/story/philadelphia-goldsilver-index-closes-at-a-two-month-high-2006-04-05,http://www.marketwatch.com/story/gold-silver-prices-climb-copper-futures-at-all-time-high-2006-04-05,http://www.marketwatch.com/story/gold-futures-inch-higher-in-afternoon-trading-2006-04-05","philadelphia gold/silver index closes at a two-month high,gold, silver prices climb; copper futures at all-time high,gold futures inch higher in afternoon trading"
6/4/2006,"http://www.marketwatch.com/story/june-gold-climbs-550-to-598oz-after-25-yr-high-of-600-2006-04-06,http://www.marketwatch.com/story/are-gold-prices-signaling-inflation-experts-disagree-2006-04-06,http://www.marketwatch.com/story/correct-gold-futures-tap-600-in-morning-trading-2006-04-06,http://www.marketwatch.com/story/june-gold-up-710-to-59960oz-in-last-half-hr-of-trade-2006-04-06,http://www.marketwatch.com/story/gold-up-530-at-59790-an-ounce-2006-04-06","june gold climbs $5.50 to $598/oz after 25-yr high of $600,are gold prices signaling inflation?,correct: gold futures tap $600 in morning trading,june gold up $7.10 to $599.60/oz in last half hr of trade,gold up $5.30 at $597.90 an ounce"
7/4/2006,"http://www.marketwatch.com/story/june-gold-falls-440-to-59530oz-after-592-low-2006-04-07,http://www.marketwatch.com/story/gold-contract-up-70c-to-60040-an-ounce-2006-04-07,http://www.marketwatch.com/story/june-gold-ends-the-week-with-a-6oz-or-1-gain-2006-04-07,http://www.marketwatch.com/story/gold-futures-retreat-but-poised-for-a-weekly-gain-2006-04-07,http://www.marketwatch.com/story/gold-drops-7-for-session-but-gains-1-for-the-week-2006-04-07","june gold falls $4.40 to $595.30/oz after $592 low,gold contract up 70c to $600.40 an ounce,june gold ends the week with a $6/oz, or 1%, gain,gold futures retreat, but poised for a weekly gain,gold dips, but posts 1% weekly gain"
8/4/2006,,
9/4/2006,,
10/4/2006,"http://www.marketwatch.com/story/gold-futures-back-above-600-an-ounce-2006-04-10,http://www.marketwatch.com/story/gold-marks-highest-close-since-late-1980-on-iran-unease-2006-04-10","gold futures back above $600 an ounce,gold marks highest close since 1980"
11/4/2006,http://www.marketwatch.com/story/crude-gold-futures-pull-back-in-late-morning-dealings-2006-04-11,"crude, gold futures pull back in late morning dealings"
12/4/2006,http://www.marketwatch.com/story/june-gold-rises-320-to-60260oz-after-604-high-2006-04-12,june gold rises $3.20 to $602.60/oz after $604 high
13/4/2006,"http://www.marketwatch.com/story/spot-gold-quoted-at-59790-in-asia-trade-2006-04-13,http://www.marketwatch.com/story/gold-futures-close-lower-but-add-7-for-the-week-2006-04-13","spot gold quoted at $597.90 in asia trade,gold dulls but gains on the week"
14/4/2006,,
15/4/2006,,
16/4/2006,https://economictimes.indiatimes.com/articleshow/1491922.cms,"gold continues to shoot up, likely to hit rs 10k mark"
17/4/2006,,
18/4/2006,http://www.marketwatch.com/story/gold-down-50c-at-61830-an-ounce-2006-04-18,gold down 50c at $618.30 an ounce
19/4/2006,"http://www.marketwatch.com/story/june-gold-up-790-at-63120oz-after-63270-high-2006-04-19,http://www.marketwatch.com/story/gold-futures-gain-more-ground-silver-at-early-1983-levels-2006-04-19","june gold up $7.90 at $631.20/oz after $632.70 high,gold futures gain more ground; silver at early 1983 levels"
20/4/2006,"http://www.marketwatch.com/story/amex-gold-bugs-index-falls-67-to-close-at-3594-2006-04-20,http://www.marketwatch.com/story/gold-futures-close-almost-13-lower-silver-loses-nearly-14-2006-04-20,http://www.marketwatch.com/story/newmont-mining-sees-06-gold-sales-77m-to-79m-ounces-2006-04-20","amex gold bugs index falls 6.7% to close at 359.4,gold futures close almost $13 lower; silver loses nearly 14%,newmont mining sees '06 gold sales 7.7m to 7.9m ounces"
21/4/2006,"http://www.marketwatch.com/story/spot-gold-up-6-at-62090-an-ounce-2006-04-21,http://www.marketwatch.com/story/gold-prices-rise-copper-tops-3-2006-04-21,http://www.marketwatch.com/story/amex-gold-bugs-index-closes-at-37368-up-4-on-day-2006-04-21,http://www.marketwatch.com/story/gold-futures-close-up-2-copper-scores-a-record-2006-04-21,http://www.marketwatch.com/story/gold-futures-climb-as-much-as-9-copper-jumps-2006-04-21","spot gold up $6 at $620.90 an ounce,gold prices rise; copper tops $3,amex gold bugs index closes at 373.68, up 4% on day,gold futures close up 2%; copper scores a record,gold futures climb as much as $9; copper jumps"
22/4/2006,,
23/4/2006,,
24/4/2006,https://economictimes.indiatimes.com/articleshow/1501938.cms,gold prices rise during trade
25/4/2006,"http://www.marketwatch.com/story/june-gold-climbs-1130-or-18-to-63520oz-2006-04-25,http://www.marketwatch.com/story/spot-gold-quoted-at-63030-in-asia-trade-2006-04-25,http://www.marketwatch.com/story/gold-futures-rise-as-much-as-12-in-morning-trading-2006-04-25","june gold climbs $11.30, or 1.8%, to $635.20/oz,spot gold quoted at $630.30 in asia trade,gold futures rise as much as $12 in morning trading"
26/4/2006,http://www.marketwatch.com/story/june-gold-closes-at-642oz-up-780-for-the-day-2006-04-26,"june gold closes at $642/oz, up $7.80 for the day"
27/4/2006,http://www.marketwatch.com/story/gold-futures-close-almost-6-lower-silver-dulls-on-etf-clearance-2006-04-27,gold falls from a 25-year high; silver dulls
28/4/2006,"http://www.marketwatch.com/story/sweeter-than-gold-or-oil-2006-04-28,http://www.marketwatch.com/story/kinross-gold-upped-to-buy-at-ubs-2006-04-28,http://www.marketwatch.com/story/glamis-gold-upped-to-buy-at-ubs-2006-04-28,http://www.marketwatch.com/story/gold-futures-climb-more-than-20-an-ounce-2006-04-28,http://www.marketwatch.com/story/ubs-ups-06-gold-price-forecast-12-to-630ounce-2006-04-28,https://economictimes.indiatimes.com/articleshow/1508378.cms","sweeter than gold or oil,kinross gold upped to buy at ubs,glamis gold upped to buy at ubs,gold futures climb more than $20 an ounce,ubs ups '06 gold price forecast 12% to $630/ounce,gold exchange-traded fund just a click away"
29/4/2006,,
30/4/2006,,
1/5/2006,https://economictimes.indiatimes.com/articleshow/1511109.cms,record gold prices fail to dampen buying spirit
2/5/2006,"http://www.marketwatch.com/story/spot-gold-quoted-at-66750-in-asia-trade-2006-05-02,http://www.marketwatch.com/story/june-gold-taps-66930oz-highest-futures-price-since-80-2006-05-02","spot gold quoted at $667.50 in asia trade,june gold taps $669.30/oz, highest futures price since '80"
3/5/2006,"http://www.marketwatch.com/story/june-gold-up-360-at-671oz-after-trading-as-low-as-660-2006-05-03,http://www.marketwatch.com/story/gold-sheds-early-gains-as-dollar-rises-2006-05-03","june gold up $3.60 at $671/oz after trading as low as $660,gold sheds early gains as dollar rises"
4/5/2006,"http://www.marketwatch.com/story/june-gold-up-8-or-12-to-close-at-67650oz-2006-05-04,http://www.marketwatch.com/story/june-gold-climbs-350-to-672oz-after-67530-high-2006-05-04,http://www.marketwatch.com/story/spot-gold-quoted-at-677-in-asia-trade-2006-05-04","june gold up $8, or 1.2%, to close at $676.50/oz,june gold climbs $3.50 to $672/oz after $675.30 high,spot gold quoted at $677 in asia trade"
5/5/2006,"http://www.marketwatch.com/story/june-gold-closes-up-2980-or-46-for-the-week-2006-05-05,http://www.marketwatch.com/story/driven-by-uncertainty-gold-makes-its-move-2006-05-05,http://www.marketwatch.com/story/june-gold-up-5-at-68150oz-in-ny-2006-05-05,http://www.marketwatch.com/story/gold-gains-almost-30-for-the-week-to-end-at-a-26-year-high-2006-05-05","june gold closes up $29.80, or 4.6%, for the week,gold's new luster is burnished by uncertainty,june gold up $5 at $681.50/oz in ny,gold futures gain almost $30 for the week"
6/5/2006,,
7/5/2006,,
8/5/2006,"http://www.marketwatch.com/story/june-gold-falls-6-to-67830oz-after-673-low-2006-05-08,http://www.marketwatch.com/story/gold-futures-close-lower-for-first-time-in-seven-sessions-2006-05-08","june gold falls $6 to $678.30/oz after $673 low,gold futures close lower for first time in seven sessions"
9/5/2006,"http://www.marketwatch.com/story/amex-gold-bugs-index-ends-at-a-record-39328-up-46-2006-05-09,http://www.marketwatch.com/story/june-gold-climbs-as-high-as-701oz-a-nearly-26-yr-high-2006-05-09,http://www.marketwatch.com/story/gold-futures-close-above-700-for-first-time-since-oct-1980-2006-05-09,http://www.marketwatch.com/story/june-gold-climbs-to-69850oz-up-1860-or-27-2006-05-09,http://www.marketwatch.com/story/gold-kist-q2-loss-32c-vs-earnings-76c-2006-05-09","amex gold bugs index ends at a record 393.28, up 4.6%,june gold climbs as high as $701/oz, a nearly 26-yr high,gold futures close above $700 for first time since oct. 1980,june gold climbs to $698.50/oz, up $18.60, or 2.7%,gold kist q2 loss 32c vs earnings 76c"
10/5/2006,"http://www.marketwatch.com/story/cboe-gold-index-up-07-to-end-at-17211-after-16906-low-2006-05-10,http://www.marketwatch.com/story/spot-gold-quoted-at-70710-in-asia-trade-2006-05-10,http://www.marketwatch.com/story/gold-futures-fall-under-700-copper-sets-new-records-2006-05-10,https://economictimes.indiatimes.com/articleshow/1523104.cms","cboe gold index up 0.7% to end at 172.11 after 169.06 low,spot gold quoted at $707.10 in asia trade,gold futures fall under $700; copper sets new records,speculative buying takes gold to near $700/ounce"
11/5/2006,https://economictimes.indiatimes.com/articleshow/1524950.cms,"gold shines on, settles above rs 10k"
12/5/2006,"http://www.marketwatch.com/story/gold-futures-climb-but-back-off-levels-above-730-2006-05-12,http://www.marketwatch.com/story/june-gold-drops-10-or-14-to-71150oz-2006-05-12,http://www.marketwatch.com/story/amex-gold-bugs-index-ends-at-3686-down-48-on-day-2006-05-12","gold futures climb, but back off levels above $730,june gold drops $10, or 1.4%, to $711.50/oz,amex gold bugs index ends at 368.6, down 4.8% on day"
13/5/2006,,
14/5/2006,,
15/5/2006,,
16/5/2006,,
17/5/2006,"http://www.marketwatch.com/story/gold-futures-climb-above-700-an-ounce-in-morning-dealings-2006-05-17,http://www.marketwatch.com/story/spot-gold-quoted-at-68860-in-asia-trade-2006-05-17,http://www.marketwatch.com/story/amex-gold-bugs-index-falls-3-to-close-at-3306-2006-05-17","gold futures climb above $700 an ounce in morning dealings,spot gold quoted at $688.60 in asia trade,amex gold bugs index falls 3% to close at 330.6"
18/5/2006,http://www.marketwatch.com/story/gold-futures-tally-a-two-day-loss-of-12-2006-05-18,gold futures tally a two-day loss of $12
19/5/2006,http://www.marketwatch.com/story/cboe-gold-index-closes-at-14118-points-down-04-2006-05-19,"cboe gold index closes at 141.18 points, down 0.4%"
20/5/2006,,
21/5/2006,,
22/5/2006,"http://www.marketwatch.com/story/gold-recovers-from-a-three-week-low-to-end-slightly-higher-2006-05-22,http://www.marketwatch.com/story/june-gold-contract-down-1970-to-63780-an-ounce-2006-05-22","gold recovers from a three-week low to end slightly higher,june gold contract down $19.70 to $637.80 an ounce"
23/5/2006,http://www.marketwatch.com/story/gold-futures-close-with-16-gain-copper-rallies-over-12-2006-05-23,gold gains $16; copper ends 12% higher
24/5/2006,http://www.marketwatch.com/story/june-gold-last-down-3020-or-46-at-643oz-in-ny-2006-05-24,"june gold last down $30.20, or 4.6%, at $643/oz in ny"
25/5/2006,"http://www.marketwatch.com/story/gold-closes-11-higher-to-recoup-part-of-its-recent-decline-2006-05-25,http://www.marketwatch.com/story/june-gold-climbs-11-or-17-to-close-at-64850oz-2006-05-25","gold closes $11 higher to recoup part of its recent decline,june gold climbs $11, or 1.7%, to close at $648.50/oz"
26/5/2006,"http://www.marketwatch.com/story/gold-futures-rise-for-the-day-but-suffer-a-1-weekly-loss-2006-05-26,https://economictimes.indiatimes.com/articleshow/1572611.cms","gold futures gain for the day, lose for the week,gold recovers on fresh buying"
27/5/2006,,
28/5/2006,,
29/5/2006,,
30/5/2006,"http://www.marketwatch.com/story/philadelphia-goldsilver-index-closes-at-14044-down-15-2006-05-30,http://www.marketwatch.com/story/june-gold-climbs-750-to-65850oz-2006-05-30","philadelphia gold/silver index closes at 140.44, down 1.5%,june gold climbs $7.50 to $658.50/oz"
31/5/2006,"http://www.marketwatch.com/story/amex-gold-bugs-index-ends-the-month-down-119-2006-05-31,http://www.marketwatch.com/story/gold-futures-end-the-month-nearly-12-lower-2006-05-31,http://www.marketwatch.com/story/august-gold-drops-1250-or-19-to-648oz-in-ny-2006-05-31,http://www.marketwatch.com/story/goldman-raises-coverage-view-on-gold-to-attractive-2006-05-31","amex gold bugs index ends the month down 11.9%,gold futures end the month nearly $12 lower,august gold drops $12.50, or 1.9%, to $648/oz in ny,goldman raises coverage view on gold to attractive"
1/6/2006,"https://economictimes.indiatimes.com/articleshow/1600590.cms,http://www.marketwatch.com/story/spot-gold-quoted-at-62210-in-asia-trade-2006-06-01,http://www.marketwatch.com/story/august-gold-taps-a-low-of-62570oz-its-lowest-in-6-weeks-2006-06-01","gold ignores global cue, extends gains,spot gold quoted at $622.10 in asia trade,august gold taps a low of $625.70/oz, its lowest in 6 weeks"
2/6/2006,https://economictimes.indiatimes.com/articleshow/1605145.cms,"global meltdown steals thunder from gold, silver"
3/6/2006,,
4/6/2006,,
5/6/2006,"http://www.marketwatch.com/story/agnico-eagle-to-develop-finland-gold-project-for-135-mln-2006-06-05,http://www.marketwatch.com/story/gold-closes-higher-as-iran-spooks-oil-market-2006-06-05","agnico-eagle to develop finland gold project for $135 mln,gold closes higher as iran spooks oil market"
6/6/2006,http://www.marketwatch.com/story/gold-futures-fall-as-much-as-17-in-morning-trading-2006-06-06,gold futures fall as much as $17 in morning trading
7/6/2006,"http://www.marketwatch.com/story/gold-closes-at-7-week-low-as-dollar-continues-higher-2006-06-07,http://www.marketwatch.com/story/spot-gold-quoted-at-62520-in-asia-trade-2006-06-07","gold closes at 7-week low as dollar continues higher,spot gold quoted at $625.20 in asia trade"
8/6/2006,,
9/6/2006,"http://www.marketwatch.com/story/august-gold-turns-lower-trades-down-30-cents-at-61350oz-2006-06-09,http://www.marketwatch.com/story/newmont-mining-upped-at-merrill-gold-price-seen-higher-2006-06-09","august gold turns lower, trades down 30 cents at $613.50/oz,newmont mining upped at merrill, gold price seen higher"
10/6/2006,,
11/6/2006,,
12/6/2006,http://www.marketwatch.com/story/august-gold-down-10-cents-at-61270oz-after-a-61640-high-2006-06-12,august gold down 10 cents at $612.70/oz after a $616.40 high
13/6/2006,"http://www.marketwatch.com/story/vedanta-to-offer-to-buy-sterlite-gold-for-c6545m-2006-06-13,http://www.marketwatch.com/story/vedanta-resources-agrees-to-buy-sterlite-gold-2006-06-13,http://www.marketwatch.com/story/spot-gold-quoted-at-55980-in-asia-trade-2006-06-13,http://www.marketwatch.com/story/august-gold-drops-3080-or-5-to-58050oz-in-ny-2006-06-13","vedanta to offer to buy sterlite gold for c$65.45m,vedanta resources agrees to buy sterlite gold,spot gold quoted at $559.80 in asia trade,august gold drops $30.80, or 5%, to $580.50/oz in ny"
14/6/2006,"http://www.marketwatch.com/story/gold-kist-started-at-hold-at-stifel-nicolaus-2006-06-14,https://economictimes.indiatimes.com/articleshow/1645068.cms,http://www.marketwatch.com/story/august-gold-up-220-at-569oz-in-afternoon-dealings-2006-06-14,https://economictimes.indiatimes.com/articleshow/1645117.cms,http://www.marketwatch.com/story/gold-futures-head-higher-as-the-dollar-loses-ground-2006-06-14","gold kist started at hold at stifel nicolaus,gold's no longer the apple of investor's eye,august gold up $2.20 at $569/oz in afternoon dealings,vedanta acquires sterlite gold of canada for rs 285 cr,gold futures head higher as the dollar loses ground"
15/6/2006,http://www.marketwatch.com/story/spot-gold-quoted-at-57870-in-asia-trade-2006-06-15,spot gold quoted at $578.70 in asia trade
16/6/2006,,
17/6/2006,https://economictimes.indiatimes.com/articleshow/1655722.cms,gold rallies as demand picks up at lower levels
18/6/2006,,
19/6/2006,http://www.marketwatch.com/story/gold-falls-as-dollar-gains-iran-tensions-ease-2006-06-19,"gold falls as dollar gains, iran tensions ease"
20/6/2006,,
21/6/2006,"http://www.marketwatch.com/story/cboe-gold-index-up-54-to-close-at-13374-2006-06-21,https://economictimes.indiatimes.com/articleshow/1665020.cms,http://www.marketwatch.com/story/cboe-gold-index-closes-at-its-highest-level-since-june-7-2006-06-21,http://www.marketwatch.com/story/glamis-project-gold-reserves-more-than-double-to-998m-ozs-2006-06-21","cboe gold index up 5.4% to close at 133.74,speculative buying puts gold & silver back on track,cboe gold index closes at its highest level since june 7,glamis: project gold reserves more than double to 9.98m ozs"
22/6/2006,http://www.marketwatch.com/story/gold-dips-as-dollar-rallies-2006-06-22,gold dips as dollar rallies
23/6/2006,,
24/6/2006,,
25/6/2006,,
26/6/2006,http://www.marketwatch.com/story/gold-down-1-at-587-in-the-early-going-2006-06-26,gold down $1 at $587 in the early going
27/6/2006,"http://www.marketwatch.com/story/gold-futures-up-230-at-590-an-ounce-2006-06-27,http://www.marketwatch.com/story/gold-turns-lower-as-investors-await-fed-2006-06-27,http://www.marketwatch.com/story/gold-futures-up-5-at-59270-an-ounce-2006-06-27,http://www.marketwatch.com/story/ibm-to-manage-gold-fields-south-africa-it-systems-2006-06-27","gold futures up $2.30 at $590 an ounce,gold closes lower as investors await fed,gold futures up $5 at $592.70 an ounce,ibm to manage gold fields' south africa it systems"
28/6/2006,"http://www.marketwatch.com/story/gold-futures-up-310-at-58750-an-ounce-2006-06-28,http://www.marketwatch.com/story/gold-futures-close-down-340-at-581-an-ounce-2006-06-28,http://www.marketwatch.com/story/gold-closes-lower-as-traders-await-fed-decision-2006-06-28","gold futures up $3.10 at $587.50 an ounce,gold futures close down $3.40 at $581 an ounce,gold drops as traders await fed, dollar rises"
29/6/2006,http://www.marketwatch.com/story/gold-retakes-the-600oz-level-as-dollar-tumbles-2006-06-29,gold surges as dollar falls on fed statement
30/6/2006,,
1/7/2006,,
2/7/2006,,
3/7/2006,,
4/7/2006,,
5/7/2006,"https://economictimes.indiatimes.com/articleshow/1708622.cms,http://www.marketwatch.com/story/web-music-companies-seeks-gold-in-oldies-2006-07-05,http://www.marketwatch.com/story/cboe-gold-index-defies-metals-price-rise-falls-29-2006-07-05","gold production up two-fold,web music companies seeks gold in oldies,cboe gold index defies metals price rise, falls 2.9%"
6/7/2006,http://www.marketwatch.com/story/gold-futures-down-220-at-62750-an-ounce-2006-07-06,gold futures down $2.20 at $627.50 an ounce
7/7/2006,http://www.marketwatch.com/story/gold-dips-as-traders-consolidate-gains-2006-07-07,gold falls as traders consolidate gains
8/7/2006,https://economictimes.indiatimes.com/articleshow/1715683.cms,"gold mirrors global trend, gains over rs 100 in city"
9/7/2006,,
10/7/2006,https://economictimes.indiatimes.com/markets/commodities/dubai-gold-exchange-volume-rise-20-in-may-june-06/articleshow/1720617.cms,dubai gold exchange volume rise 20% in may- june '06
11/7/2006,http://www.marketwatch.com/story/gold-futures-up-720-at-63330-an-ounce-2006-07-11,gold futures up $7.20 at $633.30 an ounce
12/7/2006,,
13/7/2006,"http://www.marketwatch.com/story/august-gold-up-560-at-660oz-in-electronic-trading-2006-07-13,http://www.marketwatch.com/story/gold-opens-higher-as-crude-oil-prices-soar-2006-07-13,http://www.marketwatch.com/story/aug-gold-settles-up-320-at-65440ounce-on-nymex-2006-07-13","august gold up $5.60 at $660/oz in electronic trading,gold opens higher as crude oil prices soar,aug. gold settles up $3.20 at $654.40/ounce on nymex"
14/7/2006,,
15/7/2006,,
16/7/2006,,
17/7/2006,"http://www.marketwatch.com/story/gold-closes-lower-as-dollar-rises-2006-07-17,http://www.marketwatch.com/story/gold-futures-close-down-1610-at-65190-an-ounce-2006-07-17","gold closes lower as dollar rises,gold futures close down $16.10 at $651.90 an ounce"
18/7/2006,http://www.marketwatch.com/story/gold-stocks-fall-nortel-energized-by-deal-with-microsoft-2006-07-18,gold stocks fall; nortel energized by microsoft deal
19/7/2006,http://www.marketwatch.com/story/gold-futures-up-550-at-635-an-ounce-2006-07-19,gold futures up $5.50 at $635 an ounce
20/7/2006,"https://economictimes.indiatimes.com/articleshow/1779188.cms,http://www.marketwatch.com/story/gold-closes-down-more-than-10-2006-07-20","buoyant dollar takes sheen out of gold, silver,gold closes down more than $10"
21/7/2006,http://www.marketwatch.com/story/gold-futures-close-down-1230-at-62020-an-ounce-2006-07-21,gold futures close down $12.30 at $620.20 an ounce
22/7/2006,,
23/7/2006,,
24/7/2006,"http://www.marketwatch.com/story/gold-futures-down-520-at-615-an-ounce-2006-07-24,http://www.marketwatch.com/story/gold-futures-down-7-at-61320-an-ounce-2006-07-24","gold futures down $5.20 at $615 an ounce,gold futures down $7 at $613.20 an ounce"
25/7/2006,http://www.marketwatch.com/story/gold-opens-higher-as-mideast-violence-continues-unabated-2006-07-25,gold opens higher as mideast violence continues unabated
26/7/2006,,
27/7/2006,"http://www.marketwatch.com/story/correct-newmont-sells-black-gold-oil-sands-land-for-280m-2006-07-27,http://www.marketwatch.com/story/gold-closes-higher-on-weaker-dollar-al-qaida-threat-2006-07-27","correct: newmont sells black gold oil-sands land for $280m,gold closes higher on weaker dollar, al-qaida threat"
28/7/2006,"http://www.marketwatch.com/story/gold-gains-24-on-the-week-2006-07-28,http://www.marketwatch.com/story/gold-trades-flat-as-dollar-falls-on-slowdown-in-gdp-in-q2-2006-07-28","gold gains 2.4% on the week,gold trades flat as dollar falls on slowdown in gdp in q2"
29/7/2006,https://economictimes.indiatimes.com/articleshow/1822781.cms,"silver tops rs 18,000/kg, but gold takes a break"
30/7/2006,,
31/7/2006,,
1/8/2006,https://economictimes.indiatimes.com/articleshow/1837875.cms,gold decline but still near two-week high
2/8/2006,,
3/8/2006,,
4/8/2006,,
5/8/2006,,
6/8/2006,,
7/8/2006,"http://www.marketwatch.com/story/gold-futures-up-340-at-653-an-ounce-2006-08-07,http://www.marketwatch.com/story/gold-closes-higher-as-oil-price-rises-copper-hit-by-strike-2006-08-07","gold futures up $3.40 at $653 an ounce,gold closes higher as oil price rises; copper hit by strike"
8/8/2006,"http://www.marketwatch.com/story/gold-futures-close-down-220-at-65730-an-ounce-2006-08-08,https://economictimes.indiatimes.com/articleshow/1869100.cms,http://www.marketwatch.com/story/gold-kist-q3-loss-14c-vs-profit-87c-2006-08-08,http://www.marketwatch.com/story/gold-kist-reports-loss-vs-year-ago-profit-2006-08-08","gold futures close down $2.20 at $657.30 an ounce,gold gains on weak dollar, west asia crisis,gold kist q3 loss 14c vs. profit 87c,gold kist reports loss vs. year-ago profit"
9/8/2006,,
10/8/2006,"http://www.marketwatch.com/story/gold-futures-down-620-at-65580-an-ounce-2006-08-10,http://www.marketwatch.com/story/gold-falls-as-traders-scramble-to-assess-news-of-terror-plot-2006-08-10,http://www.marketwatch.com/story/gold-futures-close-16-at-646-an-ounce-2006-08-10,http://www.marketwatch.com/story/gold-falls-as-traders-weigh-lower-oil-prices-terror-plot-2006-08-10,https://economictimes.indiatimes.com/articleshow/1879139.cms","gold futures down 6.20 at $655.80 an ounce,gold falls as traders scramble to assess news of terror plot,gold futures close $16 at $646 an ounce,gold falls as terror plot hits oil, lifts dollar,gold fest to kick off in sept; aims to woo shoppers back"
11/8/2006,http://www.marketwatch.com/story/gold-futures-down-18-for-the-week-2006-08-11,gold futures down 1.8% for the week
12/8/2006,,
13/8/2006,http://www.marketwatch.com/story/december-gold-contract-down-300-to-64140-2006-08-13,december gold contract down $3.00 to $641.40
14/8/2006,http://www.marketwatch.com/story/dec-gold-closes-at-its-lowest-level-since-july-26-2006-08-14,dec. gold closes at its lowest level since july 26
15/8/2006,http://www.marketwatch.com/story/gold-futures-head-lower-on-track-for-four-session-loss-2006-08-15,"gold futures head lower, on track for four-session loss"
16/8/2006,"http://www.marketwatch.com/story/gold-rises-as-dollar-falls-on-tame-cpi-reading-2006-08-16,http://www.marketwatch.com/story/gold-prices-edge-up-after-four-session-decline-2006-08-16","gold rises as dollar falls on tame cpi reading,gold prices edge up after four-session decline"
17/8/2006,"http://www.marketwatch.com/story/dec-gold-drops-7-or-11-to-632oz-in-afternoon-trade-2006-08-17,http://www.marketwatch.com/story/gold-closes-at-7-week-low-tracking-oil-decline-2006-08-17,http://www.marketwatch.com/story/gold-futures-close-down-1370-at-62530-an-ounce-2006-08-17","dec. gold drops $7, or 1.1%, to $632/oz in afternoon trade,gold closes at 7-week low, tracking oil decline,gold futures close down $13.70 at $625.30 an ounce"
18/8/2006,"http://www.marketwatch.com/story/dec-gold-drops-730-to-a-near-4-wk-low-of-618oz-2006-08-18,http://www.marketwatch.com/story/gold-futures-close-lower-for-the-session-and-week-2006-08-18,http://www.marketwatch.com/story/dec-gold-falls-10-cents-to-62520oz-in-morning-trading-2006-08-18,http://www.marketwatch.com/story/dec-gold-closes-down-35-for-the-week-2006-08-18","dec. gold drops $7.30 to a near 4-wk low of $618/oz,gold futures close lower for the session and week,dec. gold falls 10 cents to $625.20/oz in morning trading,dec. gold closes down 3.5% for the week"
19/8/2006,,
20/8/2006,,
21/8/2006,"http://www.marketwatch.com/story/gold-kist-to-consider-pilgrims-pride-takeover-offer-2006-08-21,http://www.marketwatch.com/story/gold-kist-disappointed-with-pilgrims-pride-takeover-bid-2006-08-21,http://www.marketwatch.com/story/gold-futures-end-at-a-three-session-high-2006-08-21","gold kist to consider pilgrim's pride takeover offer,gold kist disappointed with pilgrim's pride takeover bid,gold futures end at a three-session high"
22/8/2006,,
23/8/2006,"http://www.marketwatch.com/story/moodys-revises-pilgrims-pride-outlook-on-gold-kist-bid-2006-08-23,http://www.marketwatch.com/story/gold-futures-fall-close-at-a-three-session-low-2006-08-23","moody's revises pilgrim's pride outlook on gold kist bid,gold futures fall, close at a three-session low"
24/8/2006,,
25/8/2006,http://www.marketwatch.com/story/dec-gold-climbs-110-to-62960oz-in-morning-dealings-2006-08-25,dec. gold climbs $1.10 to $629.60/oz in morning dealings
26/8/2006,,
27/8/2006,,
28/8/2006,,
29/8/2006,,
30/8/2006,,
31/8/2006,http://www.marketwatch.com/story/goldcorp-offers-86-billion-in-stock-for-glamis-gold-2006-08-31,goldcorp offers $8.6 billion in stock for glamis gold
1/9/2006,"http://www.marketwatch.com/story/gold-silver-futures-end-the-week-higher-2006-09-01,http://www.marketwatch.com/story/dec-gold-falls-390-to-63030-in-morning-trading-2006-09-01,http://www.marketwatch.com/story/dec-gold-closes-at-63260oz-down-160-or-03-2006-09-01","gold, silver futures end the week higher,dec. gold falls $3.90 to $630.30 in morning trading,dec. gold closes at $632.60/oz, down $1.60, or 0.3%"
2/9/2006,,
3/9/2006,,
4/9/2006,https://economictimes.indiatimes.com/articleshow/1952929.cms,"gold poised to follow global cues, move within range"
5/9/2006,http://www.marketwatch.com/story/gold-futures-close-near-a-one-month-high-2006-09-05,gold futures close near a one-month high
6/9/2006,,
7/9/2006,"http://www.marketwatch.com/story/gold-futures-tally-a-two-session-loss-of-22-2006-09-07,http://www.marketwatch.com/story/gold-futures-drop-as-much-as-13-an-ounce-in-morning-trade-2006-09-07","gold futures tally a two-session loss of $22,gold futures drop as much as $13 an ounce in morning trade"
8/9/2006,"http://www.marketwatch.com/story/gold-prices-continue-lower-in-afternoon-trading-2006-09-08,http://www.marketwatch.com/story/dec-gold-falls-790-or-13-to-617oz-2006-09-08,http://www.marketwatch.com/story/gold-closes-at-a-two-month-low-down-over-2-for-the-week-2006-09-08","gold prices continue lower in afternoon trading,dec. gold falls $7.90, or 1.3%, to $617/oz,gold closes at a two-month low, down 2% on week"
9/9/2006,https://economictimes.indiatimes.com/articleshow/1971480.cms,gold crashes on global meltdown
10/9/2006,,
11/9/2006,"http://www.marketwatch.com/story/gold-fields-ltd-down-67-at-1828-2006-09-11,http://www.marketwatch.com/story/dec-gold-futures-down-1730-at-600ounce-2006-09-11,http://www.marketwatch.com/story/nyses-biggest-loser-list-littered-with-gold-energy-stocks-2006-09-11","gold fields ltd. down 6.7% at $18.28,dec. gold futures down $17.30 at $600/ounce,nyse decliners littered with gold, energy"
12/9/2006,"http://www.marketwatch.com/story/gold-kist-hires-adviser-to-help-review-strategic-options-2006-09-12,http://www.marketwatch.com/story/gold-kist-hires-another-adviser-to-assist-its-review-2006-09-12","gold kist hires adviser to help review strategic options,gold kist hires another adviser to assist its review"
13/9/2006,"https://economictimes.indiatimes.com/articleshow/1984875.cms,http://www.marketwatch.com/story/gold-futures-close-up-2-at-59630-an-ounce-2006-09-13","gold buying gains pace as prices move south,gold futures close up $2 at $596.30 an ounce"
14/9/2006,http://www.marketwatch.com/story/iamgold-merged-co-to-be-worlds-10th-biggest-gold-producer-2006-09-14,iamgold: merged co. to be world's 10th biggest gold producer
15/9/2006,"http://www.marketwatch.com/story/crude-gold-futures-reverse-course-to-trade-higher-2006-09-15,https://economictimes.indiatimes.com/mf/mf-news/gold-etfs-on-hold-but-world-fund-gets-going/articleshow/1992815.cms","crude, gold futures reverse course to trade higher,gold etf's on hold, but world fund gets going"
16/9/2006,,
17/9/2006,,
18/9/2006,https://economictimes.indiatimes.com/articleshow/2003309.cms,gold rises for second day
19/9/2006,"http://www.marketwatch.com/story/gold-futures-poised-to-give-back-bulk-of-recent-gains-2006-09-19,http://www.marketwatch.com/story/dec-gold-falls-310-to-58970oz-in-morning-trading-2006-09-19","gold futures poised to give back bulk of recent gains,dec. gold falls $3.10 to $589.70/oz in morning trading"
20/9/2006,"http://www.marketwatch.com/story/kinross-gold-agrees-500-million-credit-facility-2006-09-20,http://www.marketwatch.com/story/dec-gold-closes-at-58620oz-up-3-for-the-day-2006-09-20","kinross gold agrees $500 million credit facility,dec. gold closes at $586.20/oz, up $3 for the day"
21/9/2006,http://www.marketwatch.com/story/dec-gold-moves-up-by-160-to-58780oz-after-58250-low-2006-09-21,dec. gold moves up by $1.60 to $587.80/oz after $582.50 low
22/9/2006,"https://economictimes.indiatimes.com/articleshow/2015697.cms,http://www.marketwatch.com/story/gold-futures-up-850-at-59680-an-ounce-2006-09-22,http://www.marketwatch.com/story/dec-gold-up-710-ends-at-over-1-week-high-of-59540oz-2006-09-22","gold, silver bounce back on support from traders,gold futures up $8.50 at $596.80 an ounce,dec. gold up $7.10, ends at over 1-week high of $595.40/oz"
23/9/2006,,
24/9/2006,,
25/9/2006,http://www.marketwatch.com/story/dec-gold-falls-710-to-58830oz-in-ny-2006-09-25,dec. gold falls $7.10 to $588.30/oz in ny
26/9/2006,"http://www.marketwatch.com/story/dec-gold-falls-190-to-594oz-in-morning-trading-2006-09-26,http://www.marketwatch.com/story/dec-gold-futures-down-170-at-59420ounce-2006-09-26","dec. gold falls $1.90 to $594/oz in morning trading,dec. gold futures down $1.70 at $594.20/ounce"
27/9/2006,"http://www.marketwatch.com/story/gold-up-380-at-60090-an-ounce-in-electronic-trade-2006-09-27,http://www.marketwatch.com/story/newmont-mining-sees-temporary-decline-in-equity-gold-sales-2006-09-27,http://www.marketwatch.com/story/gold-breaks-through-600-an-ounce-as-oil-price-firms-2006-09-27","gold up $3.80 at $600.90 an ounce in electronic trade,newmont mining sees temporary decline in equity gold sales,gold breaks through $600 an ounce as oil price firms"
28/9/2006,http://www.marketwatch.com/story/pilgrims-pride-to-launch-gold-kist-tender-at-20-a-share-2006-09-28,pilgrim's pride to launch gold kist tender at $20 a share
29/9/2006,"http://www.marketwatch.com/story/gold-futures-head-lower-but-hold-above-600-2006-09-29,http://www.marketwatch.com/story/gold-futures-fall-under-600-in-afternoon-trading-2006-09-29,http://www.marketwatch.com/story/moodys-may-upgrade-ratings-on-gold-kist-2006-09-29","gold futures head lower, but hold above $600,gold futures fall under $600 in afternoon trading,moody's may upgrade ratings on gold kist"
30/9/2006,,
1/10/2006,,
2/10/2006,,
3/10/2006,"http://www.marketwatch.com/story/gold-futures-tally-a-three-session-drop-of-over-29-2006-10-03,https://economictimes.indiatimes.com/articleshow/2075883.cms","gold futures tally a three-session drop of over $29,falling oil price erodes gold's appeal in asia"
4/10/2006,http://www.marketwatch.com/story/dec-gold-tallies-four-session-drop-of-over-44-or-7-2006-10-04,"dec. gold tallies four-session drop of over $44, or 7%"
5/10/2006,http://www.marketwatch.com/story/dec-gold-up-880-or-16-at-57550oz-in-ny-2006-10-05,"dec. gold up $8.80, or 1.6%, at $575.50/oz in ny"
6/10/2006,http://www.marketwatch.com/story/dec-gold-falls-680-to-56860oz-in-morning-trading-2006-10-06,dec. gold falls $6.80 to $568.60/oz in morning trading
7/10/2006,,
8/10/2006,,
9/10/2006,"http://www.marketwatch.com/story/gold-futures-up-90c-at-57770-an-ounce-2006-10-09,http://www.marketwatch.com/story/gold-futures-up-470-at-58150-an-ounce-2006-10-09,http://www.marketwatch.com/story/gold-well-off-highs-korea-tensions-fail-to-dispel-negative-tone-2006-10-09","gold futures up 90c at $577.70 an ounce,gold futures up $4.70 at $581.50 an ounce,gold boosted by safe-haven demand"
10/10/2006,http://www.marketwatch.com/story/stocks-rise-depite-weakness-in-oil-gold-prices-2006-10-10,"stocks rise depite weakness in oil, gold prices"
11/10/2006,http://www.marketwatch.com/story/dec-gold-climbs-but-ends-near-the-days-low-2006-10-11,"dec. gold climbs, but ends near the day's low"
12/10/2006,"http://www.marketwatch.com/story/gold-kist-rejects-pilgrims-pride-offer-as-inadequate-2006-10-12-1291249,http://www.marketwatch.com/story/meridian-gold-volume-245k-shares-2006-10-12,http://www.marketwatch.com/story/gold-kist-shares-up-7c-at-2082-2006-10-12,http://www.marketwatch.com/story/meridian-gold-avg-daily-volume-101m-shares-2006-10-12,http://www.marketwatch.com/story/bema-gold-upped-to-outperform-at-bmo-capital-2006-10-12,http://www.marketwatch.com/story/gold-futures-close-above-580-an-ounce-2006-10-12","gold kist rejects pilgrim's pride offer as inadequate,meridian gold volume 245k shares,gold kist shares up 7c at $20.82,meridian gold avg daily volume 1.01m shares,bema gold upped to outperform at bmo capital,gold futures close above $580 an ounce"
13/10/2006,http://www.marketwatch.com/story/dec-gold-finishes-the-week-28-higher-2006-10-13,dec. gold finishes the week 2.8% higher
14/10/2006,,
15/10/2006,,
16/10/2006,,
17/10/2006,"http://www.marketwatch.com/story/gold-futures-holding-below-600-an-ounce-oil-above-60-2006-10-17,http://www.marketwatch.com/story/gold-futures-lose-5-an-ounce-for-the-session-2006-10-17","gold futures holding below $600 an ounce; oil above $60,gold futures lose $5 an ounce for the session"
18/10/2006,"http://www.marketwatch.com/story/gold-reverses-course-late-in-the-session-to-close-lower-2006-10-18,http://www.marketwatch.com/story/dec-gold-up-180-at-59530oz-after-598-high-2006-10-18,https://economictimes.indiatimes.com/articleshow/2191631.cms,http://www.marketwatch.com/story/gold-futures-rise-but-hold-under-600-an-ounce-2006-10-18,https://economictimes.indiatimes.com/articleshow/2191678.cms","gold reverses course late in the session to close lower,dec. gold up $1.80 at $595.30/oz after $598 high,gold's just to flaunt, no longer an investment,gold futures rise, but hold under $600 an ounce,decline in gold demand trims growth in import bill"
19/10/2006,,
20/10/2006,http://www.marketwatch.com/story/gold-futures-modestly-lower-but-trades-above-600-2006-10-20,"gold futures modestly lower, but trades above $600"
21/10/2006,,
22/10/2006,,
23/10/2006,http://www.marketwatch.com/story/dec-gold-drops-1350-or-23-to-end-at-58290oz-2006-10-23,"dec. gold drops $13.50, or 2.3%, to end at $582.90/oz"
24/10/2006,,
25/10/2006,"http://www.marketwatch.com/story/gold-futures-down-210-at-58550-an-ounce-2006-10-25,http://www.marketwatch.com/story/gold-futures-close-up-320-at-59080-an-ounce-2006-10-25","gold futures down $2.10 at $585.50 an ounce,gold futures close up $3.20 at $590.80 an ounce"
26/10/2006,,
27/10/2006,"https://economictimes.indiatimes.com/articleshow/175294.cms,http://www.marketwatch.com/story/dec-gold-ends-the-week-with-a-gain-of-08-2006-10-27","gold fails to breach $600 as investors play safe,dec. gold ends the week with a gain of 0.8%"
28/10/2006,,
29/10/2006,,
30/10/2006,"http://www.marketwatch.com/story/dec-gold-last-up-870-or-15-at-60970oz-2006-10-30,http://www.marketwatch.com/story/pilgrims-pride-extends-gold-kist-tender-offer-2006-10-30","dec. gold last up $8.70, or 1.5%, at $609.70/oz,pilgrim's pride extends gold kist tender offer"
31/10/2006,http://www.marketwatch.com/story/dec-gold-falls-390-to-60350oz-in-morning-trading-2006-10-31,dec. gold falls $3.90 to $603.50/oz in morning trading
1/11/2006,"http://www.marketwatch.com/story/dec-gold-up-1250-or-21-to-close-at-61930oz-2006-11-01,https://economictimes.indiatimes.com/articleshow/262515.cms","dec. gold up $12.50, or 2.1%, to close at $619.30/oz,gold pales as dollar edges up"
2/11/2006,"http://www.marketwatch.com/story/gold-futures-end-higher-tally-two-session-gain-of-21-2006-11-02,http://www.marketwatch.com/story/barrick-gold-profit-jumps-sees-rising-production-costs-2006-11-02,http://www.marketwatch.com/story/gold-futures-end-higher-to-tally-two-session-gain-of-21-2006-11-02","gold futures end higher, tally two-session gain of $21,barrick gold profit jumps; sees rising production costs,gold in two-session gain of $21"
3/11/2006,http://www.marketwatch.com/story/kinross-gold-q3-realized-price-up-41-at-621-an-ounce-2006-11-03,kinross gold q3 realized price up 41% at $621 an ounce
4/11/2006,,
5/11/2006,,
6/11/2006,http://www.marketwatch.com/story/bema-gold-four-seasons-rise-after-ma-deals-2006-11-06,"bema gold, four seasons soar after m&a deals"
7/11/2006,http://www.marketwatch.com/story/dec-gold-climbs-260-to-63050oz-in-morning-trading-2006-11-07,dec. gold climbs $2.60 to $630.50/oz in morning trading
8/11/2006,,
9/11/2006,"http://www.marketwatch.com/story/gold-closes-at-2-month-high-on-firm-oil-economic-concerns-2006-11-09,http://www.marketwatch.com/story/gold-futures-rise-after-wednesdays-drop-2006-11-09","gold up on firm oil prices firm, economic concerns,gold futures rise after wednesday's drop"
10/11/2006,"http://www.marketwatch.com/story/dec-gold-falls-730-to-62950oz-in-ny-2006-11-10,http://www.marketwatch.com/story/gold-drops-almost-7-still-ends-with-a-slight-weekly-gain-2006-11-10","dec. gold falls $7.30 to $629.50/oz in ny,gold drops almost $7, still posts slight weekly gain"
11/11/2006,,
12/11/2006,,
13/11/2006,,
14/11/2006,,
15/11/2006,,
16/11/2006,"http://www.marketwatch.com/story/dec-gold-closes-lower-for-a-fifth-session-in-a-row-2006-11-16,http://www.marketwatch.com/story/gold-futures-fall-after-failing-to-reach-630-level-2006-11-16,http://www.marketwatch.com/story/dec-gold-falls-230-to-62150oz-after-629-high-2006-11-16,http://www.marketwatch.com/story/gold-futures-heads-higher-after-four-session-loss-2006-11-16,http://www.marketwatch.com/story/dec-gold-climbs-250-to-62630oz-in-morning-trading-2006-11-16","dec. gold closes lower for a fifth session in a row,gold futures fall after failing to reach $630 level,dec. gold falls $2.30 to $621.50/oz after $629 high,gold futures heads higher after four-session loss,dec. gold climbs $2.50 to $626.30/oz in morning trading"
17/11/2006,"http://www.marketwatch.com/story/financial-gold-losses-offset-by-oil-tech-gains-2006-11-17,http://www.marketwatch.com/story/dec-gold-falls-220-to-61950-in-morning-trading-2006-11-17","financial, gold losses offset by oil, tech gains,dec. gold falls $2.20 to $619.50 in morning trading"
18/11/2006,,
19/11/2006,,
20/11/2006,http://www.marketwatch.com/story/dec-gold-climbs-220-to-62470oz-in-ny-2006-11-20,dec. gold climbs $2.20 to $624.70/oz in ny
21/11/2006,,
22/11/2006,"http://www.marketwatch.com/story/dec-gold-climbs-310-to-63180oz-after-63330-high-2006-11-22,http://www.marketwatch.com/story/dec-gold-up-10-cents-at-62880oz-down-from-635-high-2006-11-22,http://www.marketwatch.com/story/friday-will-be-historic-day-for-gold-2006-11-22","dec. gold climbs $3.10 to $631.80/oz after $633.30 high,dec. gold up 10 cents at $628.80/oz, down from $635 high,friday will be historic day for gold"
23/11/2006,,
24/11/2006,http://www.marketwatch.com/story/gold-futures-climbs-as-dollar-tumbles-2006-11-24,gold futures climbs as dollar tumbles
25/11/2006,,
26/11/2006,,
27/11/2006,,
28/11/2006,http://www.marketwatch.com/story/dec-gold-down-390-at-63670-retreats-from-64130-high-2006-11-28,"dec. gold down $3.90 at $636.70, retreats from $641.30 high"
29/11/2006,http://www.marketwatch.com/story/dec-gold-falls-50-cents-to-63680oz-in-afternoon-trading-2006-11-29,dec. gold falls 50 cents to $636.80/oz in afternoon trading
30/11/2006,"http://www.marketwatch.com/story/dec-gold-closes-at-its-highest-level-since-sept-5-2006-11-30,http://www.marketwatch.com/story/dec-gold-up-870-to-64420oz-in-morning-trading-2006-11-30,http://www.marketwatch.com/story/gold-futures-rise-on-further-dollar-weakness-2006-11-30,http://www.marketwatch.com/story/dec-gold-up-1140-or-18-to-close-at-64690oz-2006-11-30","dec. gold closes at its highest level since sept. 5,dec. gold up $8.70 to $644.20/oz in morning trading,gold futures rise on further dollar weakness,dec. gold up $11.40, or 1.8%, to close at $646.90/oz"
1/12/2006,"http://www.marketwatch.com/story/feb-gold-gains-25-for-the-week-2006-12-01,https://economictimes.indiatimes.com/articleshow/659526.cms,http://www.marketwatch.com/story/dec-gold-falls-40-cents-to-64650oz-in-morning-trading-2006-12-01","feb. gold gains 2.5% for the week,gold futures contracts get smaller,dec. gold falls 40 cents to $646.50/oz in morning trading"
2/12/2006,,
3/12/2006,,
4/12/2006,"http://www.marketwatch.com/story/pilgrims-pride-to-acquire-gold-kist-for-21-a-share-2006-12-04,http://www.marketwatch.com/story/gold-futures-end-the-session-with-a-modest-gain-2006-12-04,http://www.marketwatch.com/story/feb-gold-up-10-cents-at-65070oz-in-morning-trading-2006-12-04","pilgrim's pride to acquire gold kist for $21 a share,gold futures end the session with a modest gain,feb gold up 10 cents at $650.70/oz in morning trading"
5/12/2006,http://www.marketwatch.com/story/gold-futures-close-lower-as-dollar-regains-lost-ground-2006-12-05,gold futures end lower with traders on dollar watch
6/12/2006,,
7/12/2006,"https://economictimes.indiatimes.com/articleshow/733949.cms,http://www.marketwatch.com/story/feb-gold-falls-4-to-63190oz-in-ny-2006-12-07,http://www.marketwatch.com/story/gold-futures-close-higher-recover-from-a-two-week-low-2006-12-07","gold loses sheen as dollar shines,feb. gold falls $4 to $631.90/oz in ny,gold futures close higher, recover from a two-week low"
8/12/2006,"http://www.marketwatch.com/story/gold-futures-reverse-course-to-trade-lower-as-dollar-gains-2006-12-08,http://www.marketwatch.com/story/gold-futures-ends-the-week-3-lower-2006-12-08","gold futures reverse course to trade lower as dollar gains,gold futures ends the week 3% lower"
9/12/2006,,
10/12/2006,,
11/12/2006,,
12/12/2006,"http://www.marketwatch.com/story/gold-ends-lower-ahead-of-fed-decision-on-interest-rates-2006-12-12,https://economictimes.indiatimes.com/articleshow/790029.cms,http://www.marketwatch.com/story/feb-gold-falls-120-to-63360oz-in-ny-2006-12-12","gold ends lower ahead of fed decision on interest rates,gold improves on demand from middle east,feb. gold falls $1.20 to $633.60/oz in ny"
13/12/2006,http://www.marketwatch.com/story/gold-futures-end-above-630-as-traders-eye-dollar-oil-gains-2006-12-13,"gold futures end above $630 as traders eye dollar, oil gains"
14/12/2006,"http://www.marketwatch.com/story/feb-gold-falls-150-to-close-at-63090oz-in-ny-2006-12-14,http://www.marketwatch.com/story/gold-prices-post-modest-gains-as-traders-eye-dollar-oil-2006-12-14,http://www.marketwatch.com/story/feb-gold-down-170-at-63070oz-in-last-half-hr-of-trade-2006-12-14,http://www.marketwatch.com/story/gold-futures-edge-lower-but-hold-above-630-2006-12-14","feb. gold falls $1.50 to close at $630.90/oz in ny,gold prices post modest gains as traders eye dollar, oil,feb. gold down $1.70 at $630.70/oz in last half hr of trade,gold futures edge lower, but hold above $630"
15/12/2006,https://economictimes.indiatimes.com/articleshow/818827.cms,gold eases in asia
16/12/2006,https://economictimes.indiatimes.com/markets/commodities/delhi-bullion-trade-takes-a-hit-as-gold-costs-less-in-up/articleshow/823439.cms,delhi bullion trade takes a hit as gold costs less in up
17/12/2006,,
18/12/2006,"http://www.marketwatch.com/story/gold-silver-futures-continue-lower-in-afternoon-trading-2006-12-18,http://www.marketwatch.com/story/gold-silver-futures-close-at-lowest-levels-since-october-2006-12-18","gold, silver futures continue lower in afternoon trading,gold, silver futures close at lowest levels since october"
19/12/2006,,
20/12/2006,http://www.marketwatch.com/story/gold-futures-fall-copper-trades-at-lowest-level-since-june-2006-12-20,gold futures fall; copper trades at lowest level since june
21/12/2006,http://www.marketwatch.com/story/gold-futures-head-lower-for-a-second-day-2006-12-21,gold futures head lower for a second day
22/12/2006,,
23/12/2006,,
24/12/2006,,
25/12/2006,,
26/12/2006,http://www.marketwatch.com/story/gold-gains-as-political-tensions-create-safe-haven-bid-2006-12-26,gold rallies as political worry creates safe-haven bid
27/12/2006,,
28/12/2006,"http://www.marketwatch.com/story/gold-ends-higher-marking-fourth-consecutive-rise-2006-12-28,http://www.marketwatch.com/story/pilgrims-pride-says-89-of-gold-kist-shares-tendered-2006-12-28-8914346","gold gains for fourth straight session as dollar falls,pilgrim's pride says 89% of gold kist shares tendered"
29/12/2006,,
30/12/2006,,
31/12/2006,,
1/1/2007,https://economictimes.indiatimes.com/markets/commodities/ncdex-to-launch-10-gm-gold-contract/articleshow/1011695.cms,ncdex to launch 10 gm gold contract
2/1/2007,http://www.marketwatch.com/story/gold-futures-extend-recent-gains-as-dollar-slips-2007-01-02,gold futures extend winning streak
3/1/2007,http://www.marketwatch.com/story/feb-gold-retreats-from-a-one-month-high-as-dollar-gains-2007-01-03,feb. gold retreats from a one-month high as dollar gains
4/1/2007,"http://www.marketwatch.com/story/feb-gold-down-180-at-628oz-in-afternoon-trading-2007-01-04,http://www.marketwatch.com/story/correct-feb-gold-down-360-ends-at-2-wk-low-of-62620-2007-01-04","feb. gold down $1.80 at $628/oz in afternoon trading,correct: feb. gold down $3.60, ends at 2-wk low of $626.20"
5/1/2007,"http://www.marketwatch.com/story/feb-gold-drops-2140-or-34-to-605oz-in-ny-2007-01-05,http://www.marketwatch.com/story/feb-gold-closes-at-its-lowest-level-since-late-october-2007-01-05","feb. gold drops $21.40, or 3.4%, to $605/oz in ny,feb. gold closes at its lowest level since late october"
6/1/2007,,
7/1/2007,,
8/1/2007,http://www.marketwatch.com/story/feb-gold-falls-150-to-60540oz-after-61110-high-2007-01-08,feb. gold falls $1.50 to $605.40/oz after $611.10 high
9/1/2007,"http://www.marketwatch.com/story/pilgrims-pride-completes-gold-kist-acquisition-2007-01-09,https://economictimes.indiatimes.com/markets/commodities/stockists-buying-drives-up-gold-silver-range-bound/articleshow/1102113.cms","pilgrim's pride completes gold kist acquisition,stockists' buying drives up gold; silver range-bound"
10/1/2007,http://www.marketwatch.com/story/gold-futures-fall-but-hold-above-610-in-morning-trade-2007-01-10,"gold futures fall, but hold above $610 in morning trade"
11/1/2007,http://www.marketwatch.com/story/feb-gold-falls-90-cents-to-61250oz-after-617-high-2007-01-11,feb. gold falls 90 cents to $612.50/oz after $617 high
12/1/2007,"http://www.marketwatch.com/story/gold-futures-close-13-higher-to-score-a-weekly-gain-of-over-3-2007-01-12,https://economictimes.indiatimes.com/articleshow/1157165.cms,https://economictimes.indiatimes.com/articleshow/1144410.cms,http://www.marketwatch.com/story/feb-gold-settles-at-62690-up-13-on-day-up-20-for-week-2007-01-12","gold closes up $13, scores weekly gain of over 3%,gold rises on signs of inflation,gold prices rise on global cues; silver loses lustre,feb. gold settles at $626.90, up $13 on day, up $20 for week"
13/1/2007,,
14/1/2007,,
15/1/2007,,
16/1/2007,http://www.marketwatch.com/story/gold-gains-as-weak-dollar-weighs-vs-lower-oil-2007-01-16,gold gains as weak dollar weighs vs. lower oil
17/1/2007,http://www.marketwatch.com/story/gold-futures-edge-higher-in-early-dealings-2007-01-17,gold futures edge higher in early dealings
18/1/2007,http://www.marketwatch.com/story/feb-gold-down-520-to-close-at-62810oz-in-ny-2007-01-18,feb. gold down $5.20 to close at $628.10/oz in ny
19/1/2007,http://www.marketwatch.com/story/gold-prices-rally-close-with-weekly-gain-as-oil-retakes-51-mark-2007-01-19,gold gains over $9 for the week as oil retakes $51
20/1/2007,,
21/1/2007,,
22/1/2007,http://www.marketwatch.com/story/feb-gold-climbs-110-to-63750oz-in-morning-trading-2007-01-22,feb. gold climbs $1.10 to $637.50/oz in morning trading
23/1/2007,http://www.marketwatch.com/story/feb-gold-marks-highest-closing-level-since-dec-5-2007-01-23,feb. gold marks highest closing level since dec. 5
24/1/2007,http://www.marketwatch.com/story/feb-gold-falls-290-to-643oz-in-morning-trading-2007-01-24,feb. gold falls $2.90 to $643/oz in morning trading
25/1/2007,"http://www.marketwatch.com/story/feb-gold-taps-an-8-week-high-of-65460oz-in-ny-2007-01-25,http://www.marketwatch.com/story/gold-futures-trade-at-8-week-high-above-650-an-ounce-2007-01-25,http://www.marketwatch.com/story/feb-gold-climbs-410-to-65230oz-in-ny-2007-01-25","feb. gold taps an 8-week high of $654.60/oz in ny,gold futures trade at 8-week high above $650 an ounce,feb. gold climbs $4.10 to $652.30/oz in ny"
26/1/2007,"http://www.marketwatch.com/story/feb-gold-falls-430-or-07-to-64380oz-in-ny-2007-01-26,http://www.marketwatch.com/story/feb-gold-falls-340-to-close-at-64470oz-for-the-session-2007-01-26,http://www.marketwatch.com/story/gold-futures-end-lower-for-the-day-up-for-the-week-2007-01-26","feb. gold falls $4.30, or 0.7%, to $643.80/oz in ny,feb. gold falls $3.40 to close at $644.70/oz for the session,gold futures end lower for the day, up for the week"
27/1/2007,,
28/1/2007,,
29/1/2007,"http://www.marketwatch.com/story/feb-gold-up-280-at-64750oz-recovers-from-64080-low-2007-01-29,http://www.marketwatch.com/story/feb-gold-falls-150-to-close-at-64320oz-2007-01-29","feb. gold up $2.80 at $647.50/oz, recovers from $640.80 low,feb. gold falls $1.50 to close at $643.20/oz"
30/1/2007,,
31/1/2007,"http://www.marketwatch.com/story/april-gold-last-up-1-or-660-at-657oz-2007-01-31,http://www.marketwatch.com/story/gold-futures-gain-ahead-of-fed-interest-rate-decision-2007-01-31,http://www.marketwatch.com/story/feb-gold-tops-650-for-first-time-since-jan-25-2007-01-31,http://www.marketwatch.com/story/feb-gold-gains-22-for-the-month-2007-01-31","april gold last up 1%, or $6.60, at $657/oz,gold futures gain ahead of fed interest rate decision,feb. gold tops $650 for first time since jan. 25,feb. gold gains 2.2% for the month"
1/2/2007,"http://www.marketwatch.com/story/april-gold-last-up-440-at-66230oz-after-667-high-2007-02-01,http://www.marketwatch.com/story/gold-futures-climb-more-than-5-to-close-near-a-six-month-high-2007-02-01,http://www.marketwatch.com/story/feb-gold-up-540-to-end-near-6-month-high-of-65740oz-2007-02-01","april gold last up $4.40 at $662.30/oz after $667 high,gold futures climb over $5 to a six-month high,feb. gold up $5.40 to end near 6-month high of $657.40/oz"
2/2/2007,https://economictimes.indiatimes.com/articleshow/1553093.cms,gold soars to 2-month high on speculative buying
3/2/2007,,
4/2/2007,,
5/2/2007,http://www.marketwatch.com/story/april-gold-climbs-4-to-65550oz-in-morning-trading-2007-02-05,april gold climbs $4 to $655.50/oz in morning trading
6/2/2007,http://www.marketwatch.com/story/april-gold-up-280-at-65890oz-in-ny-2007-02-06,april gold up $2.80 at $658.90/oz in ny
7/2/2007,http://www.marketwatch.com/story/april-gold-last-up-10-cents-at-65880oz-2007-02-07,april gold last up 10 cents at $658.80/oz
8/2/2007,"http://www.marketwatch.com/story/gold-closes-up-550-at-66280-an-ounce-2007-02-08,http://www.marketwatch.com/story/april-gold-climbs-240-to-65970oz-in-morning-trading-2007-02-08","gold closes up $5.50 at $662.80 an ounce,april gold climbs $2.40 to $659.70/oz in morning trading"
9/2/2007,http://www.marketwatch.com/story/gold-ends-at-a-six-month-high-above-670-up-over-3-for-the-week-2007-02-09,gold futures close at a six-month high above $670
10/2/2007,,
11/2/2007,,
12/2/2007,http://www.marketwatch.com/story/april-gold-falls-5-to-close-at-66730oz-in-ny-2007-02-12,april gold falls $5 to close at $667.30/oz in ny
13/2/2007,,
14/2/2007,"http://www.marketwatch.com/story/gold-futures-close-above-670-an-ounce-2007-02-14,https://economictimes.indiatimes.com/articleshow/1613134.cms","gold futures close above $670 an ounce,benchmark mf hopes for gold etf"
15/2/2007,,
16/2/2007,,
17/2/2007,,
18/2/2007,,
19/2/2007,,
20/2/2007,http://www.marketwatch.com/story/gold-falls-over-11-pressured-by-dollar-gains-2007-02-20,"gold falls over $11, pressured by dollar gains"
21/2/2007,,
22/2/2007,http://www.marketwatch.com/story/gold-down-1-after-powerful-rally-2007-02-22,"gold falls after powerful rally, as dollar gains"
23/2/2007,http://www.marketwatch.com/story/gold-futures-up-8-at-691-an-ounce-2007-02-23,gold futures up $8 at $691 an ounce
24/2/2007,,
25/2/2007,,
26/2/2007,"http://www.marketwatch.com/story/april-gold-climbs-190-to-68860oz-after-69180-high-2007-02-26,http://www.marketwatch.com/story/gold-futures-end-at-seven-month-high-near-690-2007-02-26","april gold climbs $1.90 to $688.60/oz after $691.80 high,gold futures end at seven-month high near $690"
27/2/2007,http://www.marketwatch.com/story/april-gold-at-664-in-electronic-trade-after-68720-close-2007-02-27,april gold at $664 in electronic trade after $687.20 close
28/2/2007,"http://www.marketwatch.com/story/gold-futures-down-16-an-ounce-2007-02-28,http://www.marketwatch.com/story/april-gold-ends-the-month-with-a-22-or-1460oz-gain-2007-02-28","gold futures down $16 an ounce,april gold ends the month with a 2.2%, or $14.60/oz, gain"
1/3/2007,,
2/3/2007,https://economictimes.indiatimes.com/articleshow/1714394.cms,gold falls as drop in equity markets spurs selling
3/3/2007,,
4/3/2007,,
5/3/2007,http://www.marketwatch.com/story/april-gold-falls-11-or-710-to-637oz-in-ny-2007-03-05,"april gold falls 1.1%, or $7.10, to $637/oz in ny"
6/3/2007,,
7/3/2007,,
8/3/2007,,
9/3/2007,"http://www.marketwatch.com/story/april-gold-ends-the-week-with-a-790-or-12-gain-2007-03-09,https://economictimes.indiatimes.com/markets/commodities/gold-prices-hinges-on-fears-of-global-recession/articleshow/1738750.cms","april gold ends the week with a $7.90, or 1.2%, gain,gold prices hinges on fears of global recession"
10/3/2007,,
11/3/2007,,
12/3/2007,"http://www.marketwatch.com/story/april-gold-last-down-330-at-64870oz-after-647-low-2007-03-12,http://www.marketwatch.com/story/gold-futures-close-lower-but-remain-above-650-an-ounce-2007-03-12,http://www.marketwatch.com/story/gold-futures-fall-under-650-an-ounce-2007-03-12","april gold last down $3.30 at $648.70/oz after $647 low,gold futures close lower, but remain above $650,gold futures fall under $650 an ounce"
13/3/2007,http://www.marketwatch.com/story/gold-futures-hold-ground-above-the-650-level-2007-03-13,gold futures hold ground above the $650 level
14/3/2007,http://www.marketwatch.com/story/gold-futures-drop-for-fourth-session-in-a-row-down-over-5-2007-03-14,"gold futures drop for fourth session in a row, down over $5"
15/3/2007,http://www.marketwatch.com/story/april-gold-climbs-580-to-64830oz-in-ny-2007-03-15,april gold climbs $5.80 to $648.30/oz in ny
16/3/2007,http://www.marketwatch.com/story/gold-futures-close-at-a-more-than-1-week-high-2007-03-16,gold futures close at a more than 1-week high
17/3/2007,,
18/3/2007,,
19/3/2007,http://www.marketwatch.com/story/april-gold-climbs-60-cents-to-65450oz-in-afternoon-trade-2007-03-19,april gold climbs 60 cents to $654.50/oz in afternoon trade
20/3/2007,,
21/3/2007,,
22/3/2007,"http://www.marketwatch.com/story/gold-silver-end-at-3-week-highs-on-crude-rally-feds-statement-2007-03-22,http://www.marketwatch.com/story/april-gold-futures-up-520-at-66520ounce-2007-03-22","gold, silver futures climb to three-week highs,april gold futures up $5.20 at $665.20/ounce"
23/3/2007,http://www.marketwatch.com/story/gold-rises-tracking-spike-in-crude-oil-2007-03-23,"gold rises, tracking spike in crude oil"
24/3/2007,,
25/3/2007,"https://economictimes.indiatimes.com/articleshow/1804290.cms,https://economictimes.indiatimes.com/articleshow/1804308.cms","gold prices down after traders book  profits on gains,india inc joins summer gold rush"
26/3/2007,http://www.marketwatch.com/story/gold-rises-supported-by-crude-oil-gains-2007-03-26,"gold rises, supported by crude oil gains"
27/3/2007,,
28/3/2007,,
29/3/2007,,
30/3/2007,http://www.marketwatch.com/story/april-gold-up-150-to-close-at-663oz-for-the-session-2007-03-30,april gold up $1.50 to close at $663/oz for the session
31/3/2007,,
1/4/2007,,
2/4/2007,"http://www.marketwatch.com/story/june-gold-down-480-at-66420oz-after-66330-low-2007-04-02,http://www.marketwatch.com/story/april-gold-closes-at-66570oz-up-270-2007-04-02","june gold down $4.80 at $664.20/oz after $663.30 low,april gold closes at $665.70/oz, up $2.70"
3/4/2007,http://www.marketwatch.com/story/june-gold-closes-at-66970oz-down-180-2007-04-03,"june gold closes at $669.70/oz, down $1.80"
4/4/2007,"http://www.marketwatch.com/story/june-gold-closes-at-highest-level-since-feb-28-2007-04-04,http://www.marketwatch.com/story/june-gold-last-up-14-or-910-at-67880oz-in-ny-2007-04-04","june gold closes at highest level since feb. 28,june gold last up 1.4%, or $9.10, at $678.80/oz in ny"
5/4/2007,http://www.marketwatch.com/story/gold-edges-lower-but-holds-above-670-2007-04-05,"gold edges lower, but holds above $670"
6/4/2007,,
7/4/2007,,
8/4/2007,,
9/4/2007,https://economictimes.indiatimes.com/articleshow/1876768.cms,gold-buying gets a day as bonus
10/4/2007,"http://www.marketwatch.com/story/gold-closes-higher-on-dollar-weakness-trade-tensions-2007-04-10,http://www.marketwatch.com/story/gold-rises-on-dollar-weakness-trade-tensions-2007-04-10-8913128,http://www.marketwatch.com/story/correct-june-gold-settles-up-460-at-68150ounce-2007-04-10","gold closes higher on dollar weakness, trade tensions,gold rises on dollar weakness, trade tensions,correct: june gold settles up $4.60 at $681.50/ounce"
11/4/2007,http://www.marketwatch.com/story/gold-edges-up-as-dollar-recovers-some-losses-2007-04-11,"gold edges up, as dollar recovers some losses"
12/4/2007,"http://www.marketwatch.com/story/gold-rises-on-weaker-dollar-inflation-concerns-2007-04-12,https://economictimes.indiatimes.com/articleshow/1894997.cms","gold rises on weaker dollar, inflation concerns,gold, silver stay on northward course"
13/4/2007,http://www.marketwatch.com/story/june-gold-settles-up-1020-at-68990ounce-on-nymex-2007-04-13,june gold settles up $10.20 at $689.90/ounce on nymex
14/4/2007,,
15/4/2007,,
16/4/2007,"http://www.marketwatch.com/story/june-gold-down-02-or-140-at-68850oz-in-ny-2007-04-16,http://www.marketwatch.com/story/gold-futures-close-at-a-seven-week-high-2007-04-16","june gold down 0.2%, or $1.40, at $688.50/oz in ny,gold futures close at a seven-week high"
17/4/2007,https://economictimes.indiatimes.com/articleshow/2048675.cms,gold sales shine on rising rupee
18/4/2007,http://www.marketwatch.com/story/copper-traders-take-profits-after-mine-strike-concern-lifts-price-2007-04-18,copper dips as traders lock in gains; gold edges up
19/4/2007,"http://www.marketwatch.com/story/gold-ends-at-a-one-week-low-as-china-gdp-sparks-rate-hike-fears-2007-04-19,https://economictimes.indiatimes.com/articleshow/1922653.cms","gold dips as china growth sparks rate fears,gold etfs get lukewarm response"
20/4/2007,http://www.marketwatch.com/story/gold-futures-up-850-at-69680-an-ounce-in-early-trade-2007-04-20,gold futures up $8.50 at $696.80 an ounce in early trade
21/4/2007,,
22/4/2007,,
23/4/2007,"http://www.marketwatch.com/story/gold-futures-end-lower-but-hold-ground-well-above-690-2007-04-23,https://economictimes.indiatimes.com/articleshow/1943828.cms,http://www.marketwatch.com/story/june-gold-falls-110-to-69470oz-in-ny-2007-04-23","gold ends lower, but holds ground well above $690,gold weakens on lack of support; silver up,june gold falls $1.10 to $694.70/oz in ny"
24/4/2007,http://www.marketwatch.com/story/gold-edges-higher-as-traders-eye-dollar-2007-04-24,gold edges higher as traders eye dollar
25/4/2007,,
26/4/2007,,
27/4/2007,"http://www.marketwatch.com/story/june-gold-up-170-at-67970oz-in-last-half-hr-of-ny-trade-2007-04-27,https://economictimes.indiatimes.com/articleshow/1968874.cms","june gold up $1.70 at $679.70/oz in last half hr of ny trade,gold's southward journey continues"
28/4/2007,,
29/4/2007,,
30/4/2007,,
1/5/2007,"http://www.marketwatch.com/story/june-gold-down-09-or-6-at-67750oz-in-ny-2007-05-01,http://www.marketwatch.com/story/gold-futures-down-7-in-morning-trading-2007-05-01","june gold down 0.9%, or $6, at $677.50/oz in ny,gold futures down $7 in morning trading"
2/5/2007,,
3/5/2007,https://economictimes.indiatimes.com/articleshow/1998649.cms,gold decline amid speculation of indian demand falling
4/5/2007,"http://www.marketwatch.com/story/gold-rises-as-dollar-declines-after-job-data-2007-05-04,http://www.marketwatch.com/story/copper-and-silver-every-bit-as-bright-as-gold-2007-05-04","gold rises, as dollar declines after job data,copper and silver: every bit as bright as gold"
5/5/2007,,
6/5/2007,,
7/5/2007,http://www.marketwatch.com/story/gold-scores-3-session-win-boosted-by-falling-dollar-2007-05-07,"gold scores 3-session win, boosted by falling dollar"
8/5/2007,,
9/5/2007,,
10/5/2007,,
11/5/2007,"http://www.marketwatch.com/story/gold-futures-recover-some-of-their-losses-2007-05-11,https://economictimes.indiatimes.com/articleshow/2045876.cms,https://economictimes.indiatimes.com/articleshow/2029706.cms","gold futures recover some of their losses,even small investors want to bite gold biscuits,gold price falls as dollar strengthens"
12/5/2007,,
13/5/2007,,
14/5/2007,"http://www.marketwatch.com/story/june-gold-down-220-at-67010oz-in-last-half-hr-of-trade-2007-05-14,https://economictimes.indiatimes.com/articleshow/2045314.cms,http://www.marketwatch.com/story/kazakhmys-to-buy-eurasia-gold-for-c288-mln-in-cash-2007-05-14","june gold down $2.20 at $670.10/oz in last half hr of trade,gold prices decline in line with weak overseas trend,kazakhmys to buy eurasia gold for c$288 mln in cash"
15/5/2007,,
16/5/2007,"http://www.marketwatch.com/story/gold-futures-drop-13-to-close-at-a-two-month-low-2007-05-16,http://www.marketwatch.com/story/gold-falls-as-dollar-edges-higher-against-rivals-2007-05-16","gold ends at a 2-month low, down $13 an ounce,gold falls, as dollar edges higher against rivals"
17/5/2007,"http://www.marketwatch.com/story/june-gold-last-down-450-to-657oz-in-morning-trading-2007-05-17,http://www.marketwatch.com/story/june-gold-taps-65550oz-its-weakest-level-since-march-15-2007-05-17,http://www.marketwatch.com/story/copper-futures-head-for-a-four-session-loss-gold-declines-2007-05-17","june gold last down $4.50 to $657/oz in morning trading,june gold taps $655.50/oz, its weakest level since march 15,copper futures head for a four-session loss; gold declines"
18/5/2007,,
19/5/2007,,
20/5/2007,,
21/5/2007,http://www.marketwatch.com/story/gold-futures-close-almost-2-higher-after-last-weeks-loss-2007-05-21,gold futures advance after last week's loss
22/5/2007,http://www.marketwatch.com/story/june-gold-falls-390-to-close-at-65990oz-2007-05-22,june gold falls $3.90 to close at $659.90/oz
23/5/2007,"http://www.marketwatch.com/story/gold-futures-climb-aims-to-recoup-recent-loss-2007-05-23,http://www.marketwatch.com/story/gold-futures-close-higher-as-the-dollar-slips-oil-gains-2007-05-23","gold futures climb, aims to recoup recent loss,gold futures close higher as dollar slips, oil gains"
24/5/2007,,
25/5/2007,http://www.marketwatch.com/story/gold-recoups-losses-on-worries-over-north-korea-2007-05-25,gold recoups losses on worries over north korea
26/5/2007,,
27/5/2007,,
28/5/2007,https://economictimes.indiatimes.com/articleshow/2078411.cms,global travel ind strikes gold in old
29/5/2007,,
30/5/2007,https://economictimes.indiatimes.com/markets/commodities/gold-shines-on-global-cues/articleshow/2085192.cms,gold shines on global cues
31/5/2007,,
1/6/2007,,
2/6/2007,,
3/6/2007,,
4/6/2007,http://www.marketwatch.com/story/june-gold-up-210-at-67330-an-ounce-on-nymex-2007-06-04,june gold up $2.10 at $673.30 an ounce on nymex
5/6/2007,http://www.marketwatch.com/story/august-gold-falls-120-to-close-at-67510oz-in-ny-2007-06-05,august gold falls $1.20 to close at $675.10/oz in ny
6/6/2007,http://www.marketwatch.com/story/august-gold-falls-230-to-67280oz-in-early-ny-trading-2007-06-06,august gold falls $2.30 to $672.80/oz in early ny trading
7/6/2007,http://www.marketwatch.com/story/drdgold-mintails-in-gold-processing-joint-venture-2007-06-07,"drdgold, mintails in gold processing joint venture"
8/6/2007,"http://www.marketwatch.com/story/gold-falls-on-stronger-dollar-higher-bond-yields-2007-06-08,http://www.marketwatch.com/story/gold-ends-sharply-lower-loses-over-26-on-the-week-2007-06-08","gold falls on stronger dollar, higher bond yields,gold ends sharply lower, loses over $26 on the week"
9/6/2007,,
10/6/2007,,
11/6/2007,http://www.marketwatch.com/story/august-gold-ends-up-870-at-6590-an-ounce-on-nymex-2007-06-11,august gold ends up $8.70 at $659.0 an ounce on nymex
12/6/2007,http://www.marketwatch.com/story/gold-futures-close-with-a-nearly-6-loss-2007-06-12,gold futures close with a nearly $6 loss
13/6/2007,http://www.marketwatch.com/story/august-gold-turns-lower-again-down-110-to-652oz-2007-06-13,"august gold turns lower again, down $1.10 to $652/oz"
14/6/2007,http://www.marketwatch.com/story/gold-futures-gain-more-than-5-in-morning-trading-2007-06-14,gold futures gain more than $5 in morning trading
15/6/2007,http://www.marketwatch.com/story/august-gold-up-40-cents-at-65630oz-in-morning-trading-2007-06-15,august gold up 40 cents at $656.30/oz in morning trading
16/6/2007,,
17/6/2007,,
18/6/2007,"http://www.marketwatch.com/story/august-gold-last-up-10-cents-at-65880oz-2007-06-18,http://www.marketwatch.com/story/gold-futures-climb-over-1-to-close-near-the-660-mark-2007-06-18,http://www.marketwatch.com/story/august-gold-taps-66250oz-its-highest-level-since-june-7-2007-06-18","august gold last up 10 cents at $658.80/oz,gold climbs over $1 to close near the $660 mark,august gold taps $662.50/oz, its highest level since june 7"
19/6/2007,"http://www.marketwatch.com/story/gold-ends-higher-to-tally-a-gain-of-12-in-four-winning-sessions-2007-06-19,http://www.marketwatch.com/story/august-gold-climbs-390-or-06-to-66380oz-in-ny-2007-06-19","gold futures gain $12 in four winning sessions,august gold climbs $3.90, or 0.6%, to $663.80/oz in ny"
20/6/2007,http://www.marketwatch.com/story/august-gold-down-90-cents-at-66380-an-ounce-on-nymex-2007-06-20,august gold down 90 cents at $663.80 an ounce on nymex
21/6/2007,http://www.marketwatch.com/story/gold-futures-lose-almost-6-to-close-at-an-over-1-week-low-2007-06-21,gold futures lose almost $6 to close at an over 1-week low
22/6/2007,http://www.marketwatch.com/story/august-gold-climbs-310-to-65730oz-in-morning-trading-2007-06-22,august gold climbs $3.10 to $657.30/oz in morning trading
23/6/2007,,
24/6/2007,,
25/6/2007,http://www.marketwatch.com/story/gold-futures-fall-to-near-a-two-week-low-2007-06-25,gold futures fall to near a two-week low
26/6/2007,"http://www.marketwatch.com/story/august-gold-drops-to-64550-its-lowest-level-since-jan-17-2007-06-26,http://www.marketwatch.com/story/gold-futures-drop-more-than-9-to-close-at-five-month-low-2007-06-26,http://www.marketwatch.com/story/fields-of-gold-2007-06-26,http://www.marketwatch.com/story/august-gold-down-320-at-65150-an-ounce-on-nymex-2007-06-26","august gold drops to $645.50, its lowest level since jan. 17,gold futures drop over $9 to end at five-month low,fields of gold,august gold down $3.20 at $651.50 an ounce on nymex"
27/6/2007,http://www.marketwatch.com/story/august-gold-falls-50-cents-to-64480oz-in-morning-trade-2007-06-27,august gold falls 50 cents to $644.80/oz in morning trade
28/6/2007,http://www.marketwatch.com/story/gold-closes-almost-6-higher-extends-rise-to-after-hours-2007-06-28,"gold ends up almost $6, extends rise to after hours"
29/6/2007,,
30/6/2007,,
1/7/2007,,
2/7/2007,http://www.marketwatch.com/story/gold-futures-close-more-than-8-higher-2007-07-02,gold futures close more than $8 higher
3/7/2007,"http://www.marketwatch.com/story/august-gold-closes-at-65540oz-down-380-in-ny-2007-07-03,http://www.marketwatch.com/story/gold-futures-close-lower-give-back-part-of-recent-gains-2007-07-03","august gold closes at $655.40/oz, down $3.80 in ny,gold futures close lower, give back part of recent gains"
4/7/2007,,
5/7/2007,http://www.marketwatch.com/story/gold-futures-edge-lower-in-morning-trading-2007-07-05,gold futures edge lower in morning trading
6/7/2007,,
7/7/2007,https://economictimes.indiatimes.com/articleshow/2183770.cms,"gold tumbles to 9-month low at rs 8,520 
"
8/7/2007,,
9/7/2007,,
10/7/2007,"http://www.marketwatch.com/story/gold-futures-climb-to-a-three-week-high-2007-07-10,http://www.marketwatch.com/story/gold-closes-at-three-week-high-as-us-dollar-declines-2007-07-10","gold futures climb to a three-week high,gold ends at a three-week high as the dollar ebbs"
11/7/2007,"http://www.marketwatch.com/story/august-gold-falls-2-to-66240oz-in-ny-2007-07-11,http://www.marketwatch.com/story/august-gold-falls-230-to-close-at-66210oz-2007-07-11,http://www.marketwatch.com/story/gold-futures-head-lower-after-a-three-session-gain-2007-07-11","august gold falls $2 to $662.40/oz in ny,august gold falls $2.30 to close at $662.10/oz,gold futures head lower after a three-session gain"
12/7/2007,http://www.marketwatch.com/story/gold-futures-rise-above-668-to-close-at-five-week-high-2007-07-12,gold futures close at the highest in five weeks
13/7/2007,"http://www.marketwatch.com/story/august-gold-gains-19-or-1250-for-the-week-2007-07-13,http://www.marketwatch.com/story/gold-futures-head-lower-but-trades-higher-for-the-week-2007-07-13,http://www.marketwatch.com/story/august-gold-last-down-240-at-66590oz-2007-07-13,http://www.marketwatch.com/story/august-gold-falls-1-to-close-at-66730oz-2007-07-13","august gold gains 1.9%, or $12.50, for the week,gold futures head lower, but trades higher for the week,august gold last down $2.40 at $665.90/oz,august gold falls $1 to close at $667.30/oz"
14/7/2007,,
15/7/2007,,
16/7/2007,,
17/7/2007,,
18/7/2007,http://www.marketwatch.com/story/august-gold-up-260-at-66850-an-ounce-on-nymex-2007-07-18,august gold up $2.60 at $668.50 an ounce on nymex
19/7/2007,"http://www.marketwatch.com/story/august-gold-marks-highest-closing-level-since-may-15-2007-07-19,http://www.marketwatch.com/story/gold-copper-end-at-highest-levels-in-more-than-two-months-2007-07-19","august gold marks highest closing level since may 15,gold, copper end at highest levels in more than two months"
20/7/2007,"http://www.marketwatch.com/story/gold-silver-and-copper-futures-climb-to-multi-week-highs-2007-07-20,http://www.marketwatch.com/story/august-gold-last-up-390-to-682oz-in-morning-trading-2007-07-20,http://www.marketwatch.com/story/august-gold-taps-683oz-its-highest-level-since-may-10-2007-07-20","gold, silver and copper futures climb to multi-week highs,august gold last up $3.90 to $682/oz in morning trading,august gold taps $683/oz, its highest level since may 10"
21/7/2007,,
22/7/2007,,
23/7/2007,,
24/7/2007,http://www.marketwatch.com/story/august-gold-up-320-at-68470-an-ounce-on-nymex-2007-07-24,august gold up $3.20 at $684.70 an ounce on nymex
25/7/2007,"http://www.marketwatch.com/story/august-gold-loses-more-ground-drops-to-a-1-week-low-2007-07-25,http://www.marketwatch.com/story/august-gold-drops-11-to-close-at-a-1-wk-low-of-67380oz-2007-07-25","august gold loses more ground, drops to a 1-week low,august gold drops $11 to close at a 1-wk low of $673.80/oz"
26/7/2007,"http://www.marketwatch.com/story/gold-futures-drop-22-in-two-sessions-2007-07-26,http://www.marketwatch.com/story/gold-futures-close-lower-tally-a-two-session-loss-of-22-2007-07-26","gold futures drop $22 in two sessions,gold futures suffer a two-session drop of $22"
27/7/2007,,
28/7/2007,,
29/7/2007,,
30/7/2007,,
31/7/2007,"http://www.marketwatch.com/story/gold-futures-climb-score-monthly-gain-of-more-than-2-2007-07-31,http://www.marketwatch.com/story/august-gold-gains-280-to-close-at-66690oz-2007-07-31","gold futures climb, score monthly gain of over 2%,august gold gains $2.80 to close at $666.90/oz"
1/8/2007,http://www.marketwatch.com/story/gold-heads-lower-after-a-two-session-win-2007-08-01,gold heads lower after a two-session win
2/8/2007,http://www.marketwatch.com/story/gold-futures-post-a-modest-gain-close-below-680-an-ounce-2007-08-02,"gold futures post a modest gain, close below $680"
3/8/2007,http://www.marketwatch.com/story/gold-ends-the-week-over-12-higher-after-us-payrolls-report-2007-08-03,gold futures end the week with a gain of over $12
4/8/2007,,
5/8/2007,,
6/8/2007,,
7/8/2007,,
8/8/2007,,
9/8/2007,,
10/8/2007,,
11/8/2007,,
12/8/2007,,
13/8/2007,http://www.marketwatch.com/story/gold-dehedging-reaches-5-year-high-newmont-mining-leads-2007-08-13,gold dehedging reaches 5-year high; newmont mining leads
14/8/2007,http://www.marketwatch.com/story/december-gold-down-60-cents-at-68030-an-ounce-on-nymex-2007-08-14,december gold down 60 cents at $680.30 an ounce on nymex
15/8/2007,https://economictimes.indiatimes.com/articleshow/2282338.cms,"gold, silver move in narrow range"
16/8/2007,http://www.marketwatch.com/story/gold-and-other-metals-tumble-amid-stock-sell-off-2007-08-16,gold and other metals end with sharp losses
17/8/2007,"https://economictimes.indiatimes.com/articleshow/2286645.cms,http://www.marketwatch.com/story/gold-futures-rise-sharply-as-fed-cuts-rate-2007-08-17","gold shines, silver fades,gold futures rise sharply as fed cuts rate"
18/8/2007,,
19/8/2007,,
20/8/2007,http://www.marketwatch.com/story/gold-futures-close-modestly-lower-as-traders-assess-market-risks-2007-08-20,gold futures retreat from $670 high
21/8/2007,,
22/8/2007,,
23/8/2007,,
24/8/2007,"http://www.marketwatch.com/story/dec-gold-up-14-or-910-to-close-at-67750oz-2007-08-24,http://www.marketwatch.com/story/dec-gold-closes-at-its-highest-level-since-aug-15-2007-08-24","dec. gold up 1.4%, or $9.10, to close at $677.50/oz,dec. gold closes at its highest level since aug. 15"
25/8/2007,,
26/8/2007,,
27/8/2007,,
28/8/2007,,
29/8/2007,"http://www.marketwatch.com/story/december-gold-up-70-cents-at-67420-an-ounce-on-nymex-2007-08-29,http://www.marketwatch.com/story/dec-gold-climbs-170-to-67520oz-in-afternoon-trading-2007-08-29","december gold up 70 cents at $674.20 an ounce on nymex,dec. gold climbs $1.70 to $675.20/oz in afternoon trading"
30/8/2007,https://economictimes.indiatimes.com/articleshow/2321509.cms,gold gains in delhi
31/8/2007,,
1/9/2007,,
2/9/2007,,
3/9/2007,,
4/9/2007,"http://www.marketwatch.com/story/gold-futures-end-above-690-at-highest-level-since-late-july-2007-09-04,http://www.marketwatch.com/story/gold-futures-close-at-a-six-week-high-above-690-2007-09-04","gold futures end above $690 at highest level since late july,gold futures close above $690 at six-week high"
5/9/2007,,
6/9/2007,http://www.marketwatch.com/story/gold-futures-climb-past-700-an-ounce-2007-09-06,gold futures climb past $700 an ounce
7/9/2007,"http://www.marketwatch.com/story/gold-shoots-higher-after-weak-payroll-reading-2007-09-07,http://www.marketwatch.com/story/gold-futures-rally-close-higher-on-week-after-dismal-jobs-data-2007-09-07,http://www.marketwatch.com/story/gold-futures-rally-friday-to-end-up-41-for-the-week-2007-09-07","gold shoots higher after weak payroll reading,gold futures close over 4% higher for the week,gold futures rally friday to end up 4.1% for the week"
8/9/2007,,
9/9/2007,,
10/9/2007,"http://www.marketwatch.com/story/dec-gold-last-up-330-at-713oz-after-a-71550-high-2007-09-10,http://www.marketwatch.com/story/gold-futures-close-higher-up-more-than-2-2007-09-10","dec. gold last up $3.30 at $713/oz after a $715.50 high,gold futures close higher, up more than $2"
11/9/2007,,
12/9/2007,http://www.marketwatch.com/story/correct-gold-futures-close-lower-ending-winning-streak-2007-09-12,gold falls after four-session rise
13/9/2007,"http://www.marketwatch.com/story/dec-gold-falls-280-to-close-at-71790oz-2007-09-13,http://www.marketwatch.com/story/gold-futures-close-lower-for-a-second-session-2007-09-13,http://www.marketwatch.com/story/dec-gold-falls-670-to-714oz-in-morning-trading-2007-09-13","dec. gold falls $2.80 to close at $717.90/oz,gold prices close lower for a second session,dec. gold falls $6.70 to $714/oz in morning trading"
14/9/2007,"http://www.marketwatch.com/story/december-gold-down-240-at-71550-an-ounce-on-nymex-2007-09-14,http://www.marketwatch.com/story/december-gold-down-320-at-71470-an-ounce-on-nymex-2007-09-14","december gold down $2.40 at $715.50 an ounce on nymex,december gold down $3.20 at $714.70 an ounce on nymex"
15/9/2007,,
16/9/2007,,
17/9/2007,http://www.marketwatch.com/story/gold-peaks-above-728-ends-at-16-month-high-2007-09-17,"gold peaks above $728, ends at 16-month high"
18/9/2007,http://www.marketwatch.com/story/dec-gold-up-06-at-72840-in-electronic-trade-on-fed-cut-2007-09-18,dec. gold up 0.6% at $728.40 in electronic trade on fed cut
19/9/2007,http://www.marketwatch.com/story/gold-rises-sharply-boosted-by-dollar-weakness-2007-09-19,"gold rises sharply, boosted by dollar weakness"
20/9/2007,"http://www.marketwatch.com/story/gold-futures-climb-past-740-in-morning-dealings-2007-09-20,http://www.marketwatch.com/story/october-gold-contract-climbs-43-to-7273-an-ounce-2007-09-20,http://www.marketwatch.com/story/dec-gold-up-15-or-1070-at-74020oz-in-ny-2007-09-20,http://www.marketwatch.com/story/gold-rallies-on-dollar-weakness-record-oil-prices-2007-09-20","gold futures climb past $740 in morning dealings,october gold contract climbs $4.3 to $727.3 an ounce,dec. gold up 1.5%, or $10.70, at $740.20/oz in ny,gold rallies on dollar weakness, record oil prices"
21/9/2007,http://www.marketwatch.com/story/dec-gold-ends-the-week-up-2110oz-or-29-2007-09-21,"dec. gold ends the week up $21.10/oz, or 2.9%"
22/9/2007,,
23/9/2007,,
24/9/2007,http://www.marketwatch.com/story/gold-ends-with-modest-gain-but-below-intraday-high-2007-09-24,"gold futures edge up, but close below peak"
25/9/2007,,
26/9/2007,"http://www.marketwatch.com/story/december-gold-down-450-at-73440-an-ounce-on-nymex-2007-09-26,http://www.marketwatch.com/story/gold-futures-close-lower-as-dollar-rebounds-2007-09-26","december gold down $4.50 at $734.40 an ounce on nymex,gold futures close lower as dollar rebounds"
27/9/2007,http://www.marketwatch.com/story/gold-futures-close-higher-as-oil-prices-rally-2007-09-27-1391552,"gold futures close higher, as oil prices rally"
28/9/2007,,
29/9/2007,,
30/9/2007,,
1/10/2007,http://www.marketwatch.com/story/december-gold-down-1-at-749-an-ounce-on-nymex-2007-10-01,december gold down $1 at $749 an ounce on nymex
2/10/2007,"http://www.marketwatch.com/story/dec-gold-closes-at-73630oz-down-1780-or-24-2007-10-02,http://www.marketwatch.com/story/gold-futures-drop-nearly-18-by-the-close-2007-10-02","dec. gold closes at $736.30/oz, down $17.80, or 2.4%,gold futures drop nearly $18 by the close"
3/10/2007,"http://www.marketwatch.com/story/gold-ends-marginally-lower-2007-10-03,http://www.marketwatch.com/story/december-gold-down-110-at-73520-an-ounce-on-nymex-2007-10-03","gold ends marginally lower,december gold down $1.10 at $735.20 an ounce on nymex"
4/10/2007,http://www.marketwatch.com/story/around-1500-workers-rescued-from-gold-mine-report-2007-10-04,"around 1,500 workers rescued from gold mine: report"
5/10/2007,,
6/10/2007,,
7/10/2007,,
8/10/2007,http://www.marketwatch.com/story/gold-ends-lower-as-dollar-gains-2007-10-08,gold falls as dollar advances
9/10/2007,,
10/10/2007,,
11/10/2007,http://www.marketwatch.com/story/gold-prices-move-higher-2007-10-11,gold prices move higher
12/10/2007,"http://www.marketwatch.com/story/gold-falls-as-dollar-strengthens-on-retail-sales-2007-10-12,http://www.marketwatch.com/story/gold-fields-to-sell-venezuela-assets-to-rusoro-for-532-mln-2007-10-12","gold falls as dollar strengthens on retail sales,gold fields to sell venezuela assets to rusoro for $532 mln"
13/10/2007,,
14/10/2007,,
15/10/2007,,
16/10/2007,http://www.marketwatch.com/story/dec-gold-last-up-780-or-1-at-770-in-electronic-trade-2007-10-16,"dec. gold last up $7.80, or 1%, at $770 in electronic trade"
17/10/2007,,
18/10/2007,http://www.marketwatch.com/story/the-gold-bugs-were-right-2007-10-18,"gold bugs: ""we told you so ... """
19/10/2007,https://economictimes.indiatimes.com/articleshow/2472236.cms,rising rupee takes shine off gold etfs
20/10/2007,,
21/10/2007,,
22/10/2007,http://www.marketwatch.com/story/dec-gold-down-1530-or-2-at-75310-an-ounce-on-nymex-2007-10-22,"dec. gold down $15.30, or 2%, at $753.10 an ounce on nymex"
23/10/2007,http://www.marketwatch.com/story/gold-futures-rise-amid-dollar-weakness-2007-10-23,gold futures gain amid weakness in the dollar
24/10/2007,http://www.marketwatch.com/story/freeport-mcmoran-copper-gold-profit-doubles-2007-10-24,freeport-mcmoran copper & gold profit doubles
25/10/2007,https://economictimes.indiatimes.com/articleshow/2488240.cms,gold coin sales dip on shining bullion prices
26/10/2007,"http://www.marketwatch.com/story/gold-futures-up-880-at-77980-an-ounce-2007-10-26,http://www.marketwatch.com/story/december-gold-up-1050-at-78150-an-ounce-on-nymex-2007-10-26","gold futures up $8.80 at $779.80 an ounce,december gold up $10.50 at $781.50 an ounce on nymex"
27/10/2007,https://economictimes.indiatimes.com/articleshow/2493881.cms,gold scales new high globally on local demand
28/10/2007,,
29/10/2007,http://www.marketwatch.com/story/gold-futures-up-870-to-79620-an-ounce-2007-10-29,gold futures up $8.70 to $796.20 an ounce
30/10/2007,"http://www.marketwatch.com/story/december-gold-down-430-at-78830-an-ounce-on-nymex-2007-10-30,http://www.marketwatch.com/story/credit-suisse-sees-gold-prices-trending-up-in-long-term-2007-10-30,http://www.marketwatch.com/story/gold-may-top-800-within-a-week-analyst-says-2007-10-30","december gold down $4.30 at $788.30 an ounce on nymex,credit suisse sees gold prices trending up in long term,gold may top $800 within a week, analyst says"
31/10/2007,http://www.marketwatch.com/story/dec-gold-up-570-at-79350-an-ounce-after-fed-cuts-rates-2007-10-31,dec. gold up $5.70 at $793.50 an ounce after fed cuts rates
1/11/2007,"http://www.marketwatch.com/story/dec-gold-down-820-at-78710-an-ounce-on-nymex-2007-11-01,http://www.marketwatch.com/story/gold-futures-close-slightly-lower-as-oil-declines-2007-11-01","dec. gold down $8.20 at $787.10 an ounce on nymex,gold futures close slightly lower, as oil declines"
2/11/2007,,
3/11/2007,,
4/11/2007,,
5/11/2007,"http://www.marketwatch.com/story/dines-still-glowing-about-uranium-2007-11-05,https://economictimes.indiatimes.com/articleshow/2520107.cms,http://www.marketwatch.com/story/dec-gold-ends-up-230-at-81080-an-ounce-on-nymex-2007-11-05","gold, uranium rises vindicate 'original bug',gold, silver down on fresh offerings,dec. gold ends up $2.30 at $810.80 an ounce on nymex"
6/11/2007,"http://www.marketwatch.com/story/gold-sets-fresh-multi-decade-high-of-8152ounce-up-44-2007-11-06,https://economictimes.indiatimes.com/articleshow/2520850.cms","gold sets fresh multi-decade high of $815.2/ounce, up $4.4,gold pauses as new stock spoils party"
7/11/2007,http://www.marketwatch.com/story/gold-at-record-closing-high-of-83350-an-ounce-on-nymex-2007-11-07,gold at record closing high of $833.50 an ounce on nymex
8/11/2007,"http://www.marketwatch.com/story/gold-surges-to-a-record-closing-high-of-83750-2007-11-08,https://economictimes.indiatimes.com/articleshow/2526749.cms,http://www.marketwatch.com/story/gold-ends-at-new-record-high-of-83750-an-ounce-on-nymex-2007-11-08","gold surges to a record closing high of $837.50,scrap gold pulls down prices,gold ends at new record high of $837.50 an ounce on nymex"
9/11/2007,,
10/11/2007,,
11/11/2007,,
12/11/2007,"http://www.marketwatch.com/story/gold-futures-tumble-more-than-3-as-traders-rush-to-sell-2007-11-12,http://www.marketwatch.com/story/dec-gold-tumbles-2020-at-81450-an-ounce-on-nymex-2007-11-12,http://www.marketwatch.com/story/oil-gold-lower-on-saudi-hints-of-opec-production-hike-2007-11-12","gold futures tumble over 3% as traders rush to sell,dec. gold tumbles $20.20 at $814.50 an ounce on nymex,oil, gold lower on saudi hints of opec production hike"
13/11/2007,,
14/11/2007,,
15/11/2007,http://www.marketwatch.com/story/gold-closes-down-34-copper-falls-65-2007-11-15,gold closes down 3.4%; copper falls 6.5%
16/11/2007,"http://www.marketwatch.com/story/dec-gold-ends-down-30-cents-at-787-an-ounce-on-nymex-2007-11-16,https://economictimes.indiatimes.com/news/economy/indicators/rupee-recoups-early-losses-gold-plunges-on-global-cues/articleshow/2546271.cms","dec. gold ends down 30 cents at $787 an ounce on nymex,rupee recoups early losses, gold plunges on global cues"
17/11/2007,,
18/11/2007,,
19/11/2007,,
20/11/2007,"http://www.marketwatch.com/story/dec-gold-ends-up-1340-at-79140-an-ounce-on-nymex-2007-11-20,http://www.marketwatch.com/story/gold-for-december-climbs-4-to-782-an-ounce-2007-11-20","dec. gold ends up $13.40 at $791.40 an ounce on nymex,gold for december climbs $4 to $782 an ounce"
21/11/2007,,
22/11/2007,http://www.marketwatch.com/story/january-dated-gold-up-250-at-80460-an-ounce-2007-11-22,january dated gold up $2.50 at $804.60 an ounce
23/11/2007,,
24/11/2007,,
25/11/2007,,
26/11/2007,,
27/11/2007,"http://www.marketwatch.com/story/gold-for-december-delivery-ends-down-1250-at-814-an-ounce-2007-11-27,http://www.marketwatch.com/story/gold-sinks-2-as-dollar-rises-crude-oil-slumps-2007-11-27","gold for december delivery ends down $12.50 at $814 an ounce,gold sinks 2% as dollar rises, crude oil slumps"
28/11/2007,https://economictimes.indiatimes.com/news/economy/indicators/gold-falls-on-global-cues-rupee-closes-weak/articleshow/2579074.cms,"gold falls on global cues, rupee closes weak"
29/11/2007,,
30/11/2007,"https://economictimes.indiatimes.com/articleshow/2585532.cms,https://economictimes.indiatimes.com/news/economy/indicators/gold-prices-fall-rupee-surges/articleshow/2585726.cms,http://www.marketwatch.com/story/gold-futures-open-lower-amid-profit-taking-2007-11-30,http://www.marketwatch.com/story/feb-gold-ends-down-1320-at-78910-an-ounce-on-nymex-2007-11-30,http://www.marketwatch.com/story/gold-futures-end-lower-lose-over-42-on-the-week-2007-11-30","gold prices fall as stock markets surge,gold prices fall , rupee surges,gold futures open lower amid profit-taking,feb. gold ends down $13.20 at $789.10 an ounce on nymex,gold futures end lower; lose over $42 on the week"
1/12/2007,,
2/12/2007,,
3/12/2007,http://www.marketwatch.com/story/gold-ends-higher-after-last-weeks-steep-fall-2007-12-03,gold ends higher after last week's steep fall
4/12/2007,http://www.marketwatch.com/story/gold-futures-rally-above-800-platinum-gains-2007-12-04,gold futures rally above $800; platinum gains
5/12/2007,http://www.marketwatch.com/story/feb-gold-ends-down-390-at-80370-an-ounce-on-nymex-2007-12-05,feb. gold ends down $3.90 at $803.70 an ounce on nymex
6/12/2007,http://www.marketwatch.com/story/feb-gold-ends-up-340-at-80710-an-ounce-on-nymex-2007-12-06,feb. gold ends up $3.40 at $807.10 an ounce on nymex
7/12/2007,"http://www.marketwatch.com/story/gold-futures-fall-690-after-stronger-jobs-report-2007-12-07,http://www.marketwatch.com/story/gold-futures-decline-on-better-than-expected-jobs-growth-2007-12-07","gold futures fall $6.90 after stronger jobs report,gold futures fall $6.90 on stronger jobs growth"
8/12/2007,,
9/12/2007,,
10/12/2007,http://www.marketwatch.com/story/gold-futures-rally-nearly-2-on-dollar-weakness-2007-12-10,gold futures rally nearly 2% on dollar weakness
11/12/2007,http://www.marketwatch.com/story/feb-gold-down-170-at-81180-an-ounce-on-nymex-2007-12-11,feb. gold down $1.70 at $811.80 an ounce on nymex
12/12/2007,,
13/12/2007,http://www.marketwatch.com/story/gold-futures-decline-as-dollar-gains-2007-12-13,"gold futures decline, as dollar gains"
14/12/2007,,
15/12/2007,,
16/12/2007,,
17/12/2007,,
18/12/2007,,
19/12/2007,,
20/12/2007,,
21/12/2007,,
22/12/2007,,
23/12/2007,,
24/12/2007,https://economictimes.indiatimes.com/articleshow/2648629.cms,"rupee strengthens, gold prices decline marginally"
25/12/2007,https://economictimes.indiatimes.com/articleshow/2650575.cms,gold prices recover on buying support
26/12/2007,,
27/12/2007,"http://www.marketwatch.com/story/gold-closes-above-830-on-bhuttos-death-weaker-dollar-2007-12-27,https://economictimes.indiatimes.com/news/economy/indicators/rupee-ends-flat-sharp-rise-in-gold/articleshow/2655869.cms","gold above $830 on weaker dollar, bhutto's death,rupee ends flat; sharp rise in gold"
28/12/2007,http://www.marketwatch.com/story/gold-futures-rise-amid-safe-haven-demand-dollar-weakness-2007-12-28,"gold futures rise amid safe-haven demand, dollar weakness"
29/12/2007,https://economictimes.indiatimes.com/markets/commodities/pak-turmoil-drives-safe-haven-gold/articleshow/2659803.cms,pak turmoil drives safe haven gold
30/12/2007,,
31/12/2007,,
1/1/2008,,
2/1/2008,,
3/1/2008,,
4/1/2008,,
5/1/2008,,
6/1/2008,,
7/1/2008,http://www.marketwatch.com/story/merrill-lynch-forecasts-gold-between-700-900ounce-in-2008-2008-01-07,merrill lynch forecasts gold between $700-$900/ounce in 2008
8/1/2008,http://www.marketwatch.com/story/goldcorp-2007-gold-production-up-35-to-229-mln-ounces-2008-01-08,goldcorp: 2007 gold production up 35% to 2.29 mln ounces
9/1/2008,"http://www.marketwatch.com/story/feb-gold-ends-up-140-at-88170-an-ounce-on-nymex-2008-01-09,http://www.marketwatch.com/story/february-gold-futures-spike-1130-to-89160-2008-01-09","feb. gold ends up $1.40 at $881.70 an ounce on nymex,february gold futures spike $11.30 to $891.60"
10/1/2008,,
11/1/2008,"http://www.marketwatch.com/story/gold-timers-giddy-about-golds-new-high-a-contrarian-bad-sign-2008-01-11,http://www.marketwatch.com/story/february-gold-up-210-at-89570oz-in-electronic-trading-2008-01-11","is gold's glass half full, or half empty?,february gold up $2.10 at $895.70/oz in electronic trading"
12/1/2008,http://www.marketwatch.com/story/gold-tops-900-on-possible-rate-cut-up-32-in-week-2008-01-12-12103010,gold tops $900 on possible rate-cut; up $32 in week
13/1/2008,,
14/1/2008,http://www.marketwatch.com/story/yamana-gold-to-produce-up-to-13m-gold-equivalent-oz-in-2008-2008-01-14,yamana gold to produce up to 1.3m gold equivalent oz in 2008
15/1/2008,,
16/1/2008,,
17/1/2008,,
18/1/2008,,
19/1/2008,,
20/1/2008,,
21/1/2008,,
22/1/2008,"https://economictimes.indiatimes.com/news/economy/indicators/rupee-strengthens-gold-prices-plunge/articleshow/2721640.cms,http://www.marketwatch.com/story/crude-oil-futures-lose-over-3-a-barrel-gold-drops-2008-01-22","rupee strengthens, gold prices plunge,crude-oil futures lose over $3 a barrel, gold drops"
23/1/2008,http://www.marketwatch.com/story/kinross-gold-launches-400m-convertible-notes-offering-2008-01-23,kinross gold launches $400m convertible notes offering
24/1/2008,,
25/1/2008,"http://www.marketwatch.com/story/gold-futures-gain-after-south-african-operations-halted-2008-01-25,http://www.marketwatch.com/story/febgold-futures-climb-79-to-91410oz-2008-01-25","gold futures gain after south african operations halted,feb.gold futures climb $7.9 to $914.10/oz"
26/1/2008,,
27/1/2008,,
28/1/2008,"http://www.marketwatch.com/story/gold-futures-close-up-18-after-metal-touches-record-2008-01-28,http://www.marketwatch.com/story/is-gold-ready-for-a-rocket-shot-2008-01-28","gold futures close up 2% after hitting record,is gold ready for a 'rocket shot'?"
29/1/2008,"http://www.marketwatch.com/story/feb-gold-ends-down-2-at-92510-2008-01-29,http://www.marketwatch.com/story/gold-futures-end-lower-after-hitting-record-high-2008-01-29","feb. gold ends down $2 at $925.10,gold futures end lower after hitting record high"
30/1/2008,http://www.marketwatch.com/story/april-gold-down-80-cents-at-930-an-ounce-on-nymex-2008-01-30,april gold down 80 cents at $930 an ounce on nymex
31/1/2008,,
1/2/2008,"https://economictimes.indiatimes.com/news/economy/indicators/rupee-up-and-gold-price-hits-new-high/articleshow/2749177.cms,http://www.marketwatch.com/story/april-gold-down-920-at-91880-an-ounce-on-nymex-2008-02-01","rupee up and gold price hits new high,april gold down $9.20 at $918.80 an ounce on nymex"
2/2/2008,,
3/2/2008,,
4/2/2008,,
5/2/2008,,
6/2/2008,,
7/2/2008,,
8/2/2008,http://www.marketwatch.com/story/april-gold-up-7-at-917-an-ounce-on-nymex-2008-02-08,april gold up $7 at $917 an ounce on nymex
9/2/2008,https://economictimes.indiatimes.com/articleshow/2769522.cms,"gold regains peak of rs 11,920"
10/2/2008,,
11/2/2008,,
12/2/2008,,
13/2/2008,http://www.marketwatch.com/story/gold-ends-down-platinum-soars-to-new-record-high-2008-02-13,gold ends down; platinum soars to new record high
14/2/2008,,
15/2/2008,http://www.marketwatch.com/story/april-gold-ends-down-470-at-90610-an-ounce-on-nymex-2008-02-15,april gold ends down $4.70 at $906.10 an ounce on nymex
16/2/2008,,
17/2/2008,,
18/2/2008,,
19/2/2008,http://www.marketwatch.com/story/gold-platinum-soar-in-broad-metals-rally-2008-02-19,"gold, platinum soar in broad metals rally"
20/2/2008,,
21/2/2008,"https://economictimes.indiatimes.com/articleshow/2802295.cms,http://www.marketwatch.com/story/europe-scores-gains-as-miners-nestle-and-deals-lend-support-2008-02-21","gold glitters at rs 12,215; silver reaches 27-year high,miners help pace europe on m&a, higher gold"
22/2/2008,,
23/2/2008,https://economictimes.indiatimes.com/articleshow/2807366.cms,"gold, commodity prices up on better demand"
24/2/2008,,
25/2/2008,"http://www.marketwatch.com/story/gold-drops-after-treasury-official-backs-imf-gold-sales-2008-02-25,http://www.marketwatch.com/story/gold-drops-on-report-that-us-backs-imf-gold-sales-2008-02-25","gold drops after treasury official backs imf gold sales,gold drops on report u.s. backs imf gold sales"
26/2/2008,http://www.marketwatch.com/story/gold-futures-rebound-as-dollar-drops-2008-02-26,gold futures rebound as dollar drops
27/2/2008,http://www.marketwatch.com/story/april-gold-up-1230-at-96120-an-ounce-on-nymex-2008-02-27,april gold up $12.30 at $961.20 an ounce on nymex
28/2/2008,,
29/2/2008,"http://www.marketwatch.com/story/gold-futures-up-500-at-97250-an-ounce-2008-02-29,http://www.marketwatch.com/story/gold-ends-up-posts-a-weekly-gain-of-over-27-2008-02-29,http://www.marketwatch.com/story/gold-futures-gain-after-hitting-record-high-over-978-2008-02-29","gold futures up $5.00 at $972.50 an ounce,gold ends up, posts a weekly gain of over $27,gold ends up, posts a weekly gain of more than $27"
1/3/2008,,
2/3/2008,,
3/3/2008,,
4/3/2008,http://www.marketwatch.com/story/april-gold-up-160-at-98580-an-ounce-on-nymex-2008-03-04,april gold up $1.60 at $985.80 an ounce on nymex
5/3/2008,"http://www.marketwatch.com/story/gold-futures-rise-as-dollar-edges-lower-2008-03-05,http://www.marketwatch.com/story/april-gold-hits-record-high-of-99330-an-ounce-on-nymex-2008-03-05,http://www.marketwatch.com/story/april-gold-up-1790-at-98420-an-ounce-on-nymex-2008-03-05","gold futures rise, as dollar edges lower,april gold hits record high of $993.30 an ounce on nymex,april gold up $17.90 at $984.20 an ounce on nymex"
6/3/2008,"http://www.marketwatch.com/story/april-gold-down-390-to-98460-an-ounce-on-nymex-2008-03-06,http://www.marketwatch.com/story/april-gold-ends-down-1140-at-97710-an-ounce-on-nymex-2008-03-06,http://www.marketwatch.com/story/april-gold-down-1450-to-974-an-ounce-on-nymex-2008-03-06","april gold down $3.90 to $984.60 an ounce on nymex,april gold ends down $11.40 at $977.10 an ounce on nymex,april gold down $14.50 to $974 an ounce on nymex"
7/3/2008,,
8/3/2008,,
9/3/2008,,
10/3/2008,http://www.marketwatch.com/story/april-gold-ends-down-240-at-97180-an-ounce-on-nymex-2008-03-10,april gold ends down $2.40 at $971.80 an ounce on nymex
11/3/2008,"http://www.marketwatch.com/story/gold-gains-after-fed-move-2008-03-11,http://www.marketwatch.com/story/april-gold-ends-up-420-at-976-an-ounce-on-nymex-2008-03-11","gold gains after fed move,april gold ends up $4.20 at $976 an ounce on nymex"
12/3/2008,"http://www.marketwatch.com/story/gold-futures-close-with-gains-2008-03-12,http://www.marketwatch.com/story/april-gold-ends-up-450-at-98050-an-ounce-on-nymex-2008-03-12","gold futures close with gains,april gold ends up $4.50 at $980.50 an ounce on nymex"
13/3/2008,http://www.marketwatch.com/story/gold-futures-touched-1000-an-ounce-back-at-99660-2008-03-13,"gold futures touched $1,000 an ounce, back at $996.60"
14/3/2008,http://www.marketwatch.com/story/the-message-of-the-bond-market-about-inflationary-expectations-2008-03-14,gold and bonds agree
15/3/2008,,
16/3/2008,,
17/3/2008,https://economictimes.indiatimes.com/articleshow/2875085.cms,gold outshines stocks in returns to investment
18/3/2008,,
19/3/2008,http://www.marketwatch.com/story/gold-prices-continue-to-slip-after-overnight-tumble-2008-03-19,gold prices continue to slip after overnight tumble
20/3/2008,http://www.marketwatch.com/story/gold-falls-nearly-3-continuing-slide-as-dollar-rallies-2008-03-20,"gold falls nearly 3%, continuing slide as dollar rallies"
21/3/2008,,
22/3/2008,,
23/3/2008,,
24/3/2008,http://www.marketwatch.com/story/april-gold-down-490-to-91510-an-ounce-on-nymex-2008-03-24,april gold down $4.90 to $915.10 an ounce on nymex
25/3/2008,http://www.marketwatch.com/story/gold-futures-rally-16-as-dollar-falls-sharply-2008-03-25,gold futures rally 1.6% as dollar falls sharply
26/3/2008,http://www.marketwatch.com/story/gold-notches-15-gain-to-close-at-94920-an-ounce-2008-03-26,gold notches 1.5% gain to close at $949.20 an ounce
27/3/2008,https://economictimes.indiatimes.com/articleshow/2903215.cms,"gold hits 1-week high on falling dollar, high oil"
28/3/2008,http://www.marketwatch.com/story/gold-futures-accelerate-losses-down-2-2008-03-28,"gold futures accelerate losses, down 2%"
29/3/2008,,
30/3/2008,,
31/3/2008,"https://economictimes.indiatimes.com/articleshow/2914447.cms,http://www.marketwatch.com/story/gold-ends-quarter-up-103-march-down-52-2008-03-31,http://www.marketwatch.com/story/gold-for-june-delivery-ends-down-15-at-92150-an-ounce-2008-03-31","gold moves up on firm global cues,gold ends quarter up 10.3%; march down 5.2%,gold for june delivery ends down $15 at $921.50 an ounce"
1/4/2008,"http://www.marketwatch.com/story/gold-futures-drop-sharply-as-dollar-gains-2008-04-01,http://www.marketwatch.com/story/gold-futures-stumble-36-to-end-at-88780-an-ounce-2008-04-01","gold futures drop sharply, as dollar gains,gold futures stumble 3.6% to end at $887.80 an ounce"
2/4/2008,,
3/4/2008,http://www.marketwatch.com/story/gold-up-310-at-89830-an-ounce-2008-04-03,gold up $3.10 at $898.30 an ounce
4/4/2008,"http://www.marketwatch.com/story/june-gold-rises-after-nonfarm-payrolls-data-2008-04-04,http://www.marketwatch.com/story/anglogold-ashanti-revises-higher-gold-production-view-2008-04-04,http://www.marketwatch.com/story/gold-futures-end-higher-but-post-a-weekly-decline-2008-04-04","june gold rises after nonfarm payrolls data,anglogold ashanti revises higher gold production view,gold futures end higher, but post a weekly decline"
5/4/2008,,
6/4/2008,,
7/4/2008,"http://www.marketwatch.com/story/gold-futures-rally-as-other-commodities-also-rise-2008-04-07,http://www.marketwatch.com/story/june-gold-ends-up-1360-at-92680-an-ounce-on-nymex-2008-04-07","gold futures rally, as other commodities also rise,june gold ends up $13.60 at $926.80 an ounce on nymex"
8/4/2008,,
9/4/2008,"http://www.marketwatch.com/story/june-gold-ends-up-1950-at-93750-an-ounce-on-nymex-2008-04-09,http://www.marketwatch.com/story/gold-down-940-at-90460-an-ounce-in-electronic-trading-2008-04-09,http://www.marketwatch.com/story/mongolia-to-decide-on-rio-tintos-oyu-tolgoi-gold-copper-project-before-june-2008-04-09","june gold ends up $19.50 at $937.50 an ounce on nymex,gold down $9.40 at $904.60 an ounce in electronic trading,mongolia to decide on rio tinto's oyu tolgoi gold, copper project before june"
10/4/2008,http://www.marketwatch.com/story/june-gold-down-120-at-93630-an-ounce-on-nymex-2008-04-10,june gold down $1.20 at $936.30 an ounce on nymex
11/4/2008,,
12/4/2008,,
13/4/2008,,
14/4/2008,http://www.marketwatch.com/story/june-gold-up-710-at-93410-an-ounce-on-nymex-2008-04-14,june gold up $7.10 at $934.10 an ounce on nymex
15/4/2008,,
16/4/2008,http://www.marketwatch.com/story/gold-futures-rise-1-as-dollar-falls-sharply-2008-04-16,gold futures rise 1% as dollar falls sharply
17/4/2008,"http://www.marketwatch.com/story/gold-futures-edge-down-as-dollar-strengthens-2008-04-17,https://economictimes.indiatimes.com/articleshow/2959813.cms,http://www.marketwatch.com/story/gold-futures-close-lower-as-dollar-strengthens-2008-04-17","gold futures edge down as dollar strengthens,gold rises by rs 175 on increased demand, firm global cues,gold futures finish lower as dollar strengthens"
18/4/2008,http://www.marketwatch.com/story/benchmark-up-on-broad-based-gains-despite-gold-sell-off-2008-04-18,benchmark gains despite gold sell-off
19/4/2008,,
20/4/2008,,
21/4/2008,http://www.marketwatch.com/story/gold-ends-slightly-higher-as-dollar-falls-2008-04-21,"gold ends slightly higher, as dollar falls"
22/4/2008,"http://www.marketwatch.com/story/gold-futures-open-higher-as-dollar-drops-2008-04-22,http://www.marketwatch.com/story/june-gold-ends-up-760-at-92520-an-ounce-on-nymex-2008-04-22,https://economictimes.indiatimes.com/articleshow/2972730.cms,http://www.marketwatch.com/story/june-gold-opens-up-590-at-92350-an-ounce-on-nymex-2008-04-22","gold futures open higher, as dollar drops,june gold ends up $7.60 at $925.20 an ounce on nymex,gold eases, silver slumps,june gold opens up $5.90 at $923.50 an ounce on nymex"
23/4/2008,,
24/4/2008,"http://www.marketwatch.com/story/gold-down-670-at-89950-an-ounce-2008-04-24,http://www.marketwatch.com/story/gold-futures-end-sharply-lower-as-dollar-rallies-2008-04-24","gold down $6.70 at $899.50 an ounce,gold futures end sharply lower, as dollar rallies"
25/4/2008,http://www.marketwatch.com/story/gold-down-370-at-88310-an-ounce-2008-04-25,gold down $3.70 at $883.10 an ounce
26/4/2008,,
27/4/2008,,
28/4/2008,"https://economictimes.indiatimes.com/articleshow/2992105.cms,http://www.marketwatch.com/story/gold-futures-end-up-07-at-8955-an-ounce-2008-04-28","gold up on firm global cues,gold futures end up 0.7% at $895.5 an ounce"
29/4/2008,http://www.marketwatch.com/story/june-gold-down-2070-to-87480-an-ounce-on-nymex-2008-04-29,june gold down $20.70 to $874.80 an ounce on nymex
30/4/2008,"http://www.marketwatch.com/story/june-gold-up-1040-at-87550-an-ounce-on-nymex-2008-04-30,http://www.marketwatch.com/story/gold-futures-extend-decline-ahead-of-fed-decision-2008-04-30,http://www.marketwatch.com/story/june-gold-up-180-at-86690-an-ounce-after-fed-cuts-rates-2008-04-30","june gold up $10.40 at $875.50 an ounce on nymex,gold futures extend decline ahead of fed decision,june gold up $1.80 at $866.90 an ounce after fed cuts rates"
1/5/2008,,
2/5/2008,http://www.marketwatch.com/story/june-gold-up-880-at-85970-an-ounce-on-nymex-2008-05-02,june gold up $8.80 at $859.70 an ounce on nymex
3/5/2008,,
4/5/2008,,
5/5/2008,http://www.marketwatch.com/story/june-gold-last-up-1150-or-13-at-86950oz-2008-05-05,"june gold last up $11.50, or 1.3%, at $869.50/oz"
6/5/2008,"http://www.marketwatch.com/story/barrick-gold-board-hikes-quarterly-dividend-by-33-2008-05-06,http://www.marketwatch.com/story/june-gold-last-up-990-or-11-at-884oz-2008-05-06,http://www.marketwatch.com/story/randgold-q1-gold-production-down-13-versus-q4-2008-05-06,http://www.marketwatch.com/story/gold-logs-three-session-win-with-oil-at-record-high-2008-05-06","barrick gold board hikes quarterly dividend by 33%,june gold last up $9.90, or 1.1%, at $884/oz,randgold q1 gold production down 13% versus q4,gold logs three-session win with oil at record high"
7/5/2008,https://economictimes.indiatimes.com/markets/stocks/policy/mcx-to-launch-mini-gold-contract-targets-small-traders/articleshow/3019082.cms,"mcx to launch mini gold contract, targets small traders"
8/5/2008,"http://www.marketwatch.com/story/june-gold-ends-up-1090-at-88210-an-ounce-on-nymex-2008-05-08,http://www.marketwatch.com/story/gold-futures-close-with-strong-gains-2008-05-08","june gold ends up $10.90 at $882.10 an ounce on nymex,gold futures close with strong gains"
9/5/2008,http://www.marketwatch.com/story/june-gold-up-340-at-88550-an-ounce-on-nymex-2008-05-09,june gold up $3.40 at $885.50 an ounce on nymex
10/5/2008,,
11/5/2008,,
12/5/2008,"http://www.marketwatch.com/story/june-gold-down-6-to-87980-an-ounce-on-nymex-2008-05-12,http://www.marketwatch.com/story/june-gold-falls-230-or-03-to-88350oz-in-ny-2008-05-12,http://www.marketwatch.com/story/gold-futures-fall-pressured-by-dollar-gains-2008-05-12","june gold down $6 to $879.80 an ounce on nymex,june gold falls $2.30, or 0.3%, to $883.50/oz in ny,gold futures fall, pressured by dollar gains"
13/5/2008,"https://economictimes.indiatimes.com/articleshow/3036959.cms,http://www.marketwatch.com/story/gold-down-790-at-87700-an-ounce-2008-05-13","gold declines, silver rises sharply,gold down $7.90 at $877.00 an ounce"
14/5/2008,http://www.marketwatch.com/story/gold-futures-close-lower-lose-over-19-in-three-days-2008-05-14,"gold futures close lower, lose over $19 in three days"
15/5/2008,,
16/5/2008,"http://www.marketwatch.com/story/gold-futures-close-near-900-as-oil-prices-surge-2008-05-16,http://www.marketwatch.com/story/june-gold-up-1680-at-89680-an-ounce-on-nymex-2008-05-16","gold futures close near $900 as oil prices surge,june gold up $16.80 at $896.80 an ounce on nymex"
17/5/2008,,
18/5/2008,,
19/5/2008,http://www.marketwatch.com/story/gold-futures-close-at-their-highest-level-in-a-month-2008-05-19,gold futures close at their highest level in a month
20/5/2008,http://www.marketwatch.com/story/gold-etf-demand-doubles-but-tonnage-demand-drops-report-2008-05-20,gold etf demand doubles in the first quarter
21/5/2008,http://www.marketwatch.com/story/gold-futures-edge-up-as-dollar-falls-oil-surges-2008-05-21,"gold futures edge up, as dollar falls, oil surges"
22/5/2008,,
23/5/2008,,
24/5/2008,,
25/5/2008,,
26/5/2008,,
27/5/2008,http://www.marketwatch.com/story/june-gold-finishes-at-90790oz-down-1790-or-19-2008-05-27,"june gold finishes at $907.90/oz, down $17.90, or 1.9%"
28/5/2008,http://www.marketwatch.com/story/june-gold-falls-990-or-11-to-898oz-in-ny-2008-05-28,"june gold falls $9.90, or 1.1%, to $898/oz in ny"
29/5/2008,"http://www.marketwatch.com/story/gold-newsletters-remain-too-bullish-2008-05-29,http://www.marketwatch.com/story/gold-futures-drop-as-much-as-21-an-ounce-2008-05-29","sanguine about gold,gold futures drop as much as $21 an ounce"
30/5/2008,http://www.marketwatch.com/story/gold-futures-down-40c-at-87680-an-ounce-2008-05-30,gold futures down 40c at $876.80 an ounce
31/5/2008,,
1/6/2008,,
2/6/2008,"http://www.marketwatch.com/story/august-gold-trades-at-90070oz-up-920-or-1-in-ny-2008-06-02,https://economictimes.indiatimes.com/news/economy/indicators/rupee-ends-stronger-gold-loses-rs-135-per-ten-gram/articleshow/3093943.cms","august gold trades at $900.70/oz, up $9.20, or 1%, in ny,rupee ends stronger, gold loses rs 135 per ten gram"
3/6/2008,http://www.marketwatch.com/story/august-gold-falls-11-or-12-to-886oz-in-ny-2008-06-03,"august gold falls $11, or 1.2%, to $886/oz in ny"
4/6/2008,http://www.marketwatch.com/story/august-gold-down-50-cents-at-885oz-in-electronic-trade-2008-06-04,august gold down 50 cents at $885/oz in electronic trade
5/6/2008,"http://www.marketwatch.com/story/gold-futures-lose-more-than-21-over-past-three-sessions-2008-06-05,http://www.marketwatch.com/story/gold-futures-lose-more-than-21-in-three-days-2008-06-05","gold futures lose more than $21 in three sessions,gold futures lose more than $21 in three days"
6/6/2008,"http://www.marketwatch.com/story/gold-futures-log-largest-1-day-dollar-price-gain-since-feb-2008-06-06,http://www.marketwatch.com/story/gold-futures-climb-as-much-as-23-an-ounce-2008-06-06","gold futures log largest 1-day dollar price gain since feb.,gold futures climb as much as $23 an ounce"
7/6/2008,,
8/6/2008,,
9/6/2008,"http://www.marketwatch.com/story/august-gold-up-610-at-90510-an-ounce-on-nymex-2008-06-09,http://www.marketwatch.com/story/gold-futures-up-860-at-90400-an-ounce-2008-06-09","august gold up $6.10 at $905.10 an ounce on nymex,gold futures up $8.60 at $904.00 an ounce"
10/6/2008,,
11/6/2008,"http://www.marketwatch.com/story/gold-futures-rise-as-us-dollar-falls-vs-rivals-2008-06-11,http://www.marketwatch.com/story/august-gold-up-760-at-87880-an-ounce-on-nymex-2008-06-11","gold futures rise, as u.s. dollar falls vs. rivals,august gold up $7.60 at $878.80 an ounce on nymex"
12/6/2008,,
13/6/2008,,
14/6/2008,,
15/6/2008,,
16/6/2008,,
17/6/2008,,
18/6/2008,http://www.marketwatch.com/story/gold-futures-rise-to-trade-above-893-an-ounce-2008-06-18,gold futures rise to trade above $893 an ounce
19/6/2008,http://www.marketwatch.com/story/august-gold-closes-at-90420oz-up-1070-or-12-in-ny-2008-06-19,"august gold closes at $904.20/oz, up $10.70, or 1.2%, in ny"
20/6/2008,"http://www.marketwatch.com/story/august-gold-ends-the-week-with-a-gain-of-35-2008-06-20,http://www.marketwatch.com/story/gold-futures-end-lower-on-day-but-gain-almost-4-on-week-2008-06-20","august gold ends the week with a gain of 3.5%,gold futures end lower on day, but gain almost 4% on week"
21/6/2008,,
22/6/2008,,
23/6/2008,http://www.marketwatch.com/story/august-gold-ends-at-88720oz-down-1650-or-18-in-ny-2008-06-23,"august gold ends at $887.20/oz, down $16.50, or 1.8%, in ny"
24/6/2008,http://www.marketwatch.com/story/gold-futures-close-higher-as-the-dollar-weakens-2008-06-24,gold futures close higher as the dollar weakens
25/6/2008,"http://www.marketwatch.com/story/gold-futures-down-70c-at-88850-an-ounce-2008-06-25,http://www.marketwatch.com/story/august-gold-closes-at-88230oz-down-930-in-ny-2008-06-25,http://www.marketwatch.com/story/gold-up-in-electronic-trade-as-fed-keeps-rates-steady-2008-06-25","gold futures down 70c at $888.50 an ounce,august gold closes at $882.30/oz, down $9.30, in ny,gold up in electronic trade as fed keeps rates steady"
26/6/2008,,
27/6/2008,"http://www.marketwatch.com/story/august-gold-ends-up-1620-at-93130-an-ounce-on-nymex-2008-06-27,http://www.marketwatch.com/story/contrarian-investor-prefers-gold-over-oil-2008-06-27","august gold ends up $16.20 at $931.30 an ounce on nymex,contrarian investor prefers gold over oil"
28/6/2008,,
29/6/2008,,
30/6/2008,"http://www.marketwatch.com/story/gold-futures-fall-for-the-day-but-gain-almost-11-year-to-date-2008-06-30,http://www.marketwatch.com/story/gold-futures-close-lower-but-gain-almost-11-year-to-date-2008-06-30","gold futures fall, but gain almost 11% year to date,gold futures close lower, but gain almost 11% year to date"
1/7/2008,"https://economictimes.indiatimes.com/articleshow/3182362.cms,http://www.marketwatch.com/story/august-gold-gains-1370-or-15-to-942oz-on-nymex-2008-07-01","gold glitters on stockists' buying,august gold gains $13.70, or 1.5%, to $942/oz on nymex"
2/7/2008,,
3/7/2008,"http://www.marketwatch.com/story/gold-futures-close-almost-13-lower-2008-07-03,http://www.marketwatch.com/story/august-gold-closes-at-93360oz-down-1290-on-nymex-2008-07-03","gold futures close almost $13 lower,august gold closes at $933.60/oz, down $12.90, on nymex"
4/7/2008,,
5/7/2008,,
6/7/2008,,
7/7/2008,"http://www.marketwatch.com/story/august-gold-down-1210-to-92150-an-ounce-on-nymex-2008-07-07,http://www.marketwatch.com/story/gold-futures-fall-over-1-as-dollar-surges-vs-rivals-2008-07-07","august gold down $12.10 to $921.50 an ounce on nymex,gold futures fall over 1% as dollar surges vs. rivals"
8/7/2008,"http://www.marketwatch.com/story/gold-holds-steady-as-dollar-firms-2008-07-08,http://www.marketwatch.com/story/gold-futures-up-150-at-92880-an-ounce-2008-07-08,http://www.marketwatch.com/story/gold-futures-end-lower-as-oil-tumbles-dollar-gains-2008-07-08,http://www.marketwatch.com/story/august-gold-ends-down-550-to-92330-an-ounce-on-nymex-2008-07-08","gold holds steady as dollar firms,gold futures up $1.50 at $928.80 an ounce,gold futures end lower as oil tumbles, dollar gains,august gold ends down $5.50 to $923.30 an ounce on nymex"
9/7/2008,"http://www.marketwatch.com/story/gold-prices-end-higher-after-iran-test-fires-missile-2008-07-09,http://www.marketwatch.com/story/august-gold-up-20-cents-to-92350-an-ounce-on-nymex-2008-07-09,http://www.marketwatch.com/story/august-gold-up-520-to-92850-an-ounce-on-nymex-2008-07-09","gold prices end higher after iran test fires missile,august gold up 20 cents to $923.50 an ounce on nymex,august gold up $5.20 to $928.50 an ounce on nymex"
10/7/2008,http://www.marketwatch.com/story/august-gold-up-870-to-93730-an-ounce-on-nymex-2008-07-10,august gold up $8.70 to $937.30 an ounce on nymex
11/7/2008,,
12/7/2008,,
13/7/2008,,
14/7/2008,,
15/7/2008,"http://www.marketwatch.com/story/august-gold-up-980-to-98350-an-ounce-on-nymex-2008-07-15,http://www.marketwatch.com/story/gold-ends-with-modest-gain-but-well-below-intraday-high-2008-07-15,https://economictimes.indiatimes.com/articleshow/3238082.cms","august gold up $9.80 to $983.50 an ounce on nymex,gold ends with modest gain, but well below intraday high,gold scales new height at rs 13,650 on firm global cues"
16/7/2008,"http://www.marketwatch.com/story/gold-futures-fall-as-oil-slides-dollar-rebounds-2008-07-16,http://www.marketwatch.com/story/gold-futures-fall-over-1-tracking-drop-in-crude-2008-07-16","gold futures fall as oil slides, dollar rebounds,gold futures fall over 1%, tracking drop in crude"
17/7/2008,"http://www.marketwatch.com/story/gold-futures-fall-tracking-tumble-in-oil-prices-2008-07-17,https://economictimes.indiatimes.com/news/economy/indicators/re-edges-higher-as-oil-retreats-gold-dips-on-poor-demand/articleshow/3246887.cms","gold futures fall, tracking tumble in oil prices,re edges higher as oil retreats, gold dips on poor demand"
18/7/2008,,
19/7/2008,,
20/7/2008,,
21/7/2008,https://economictimes.indiatimes.com/news/economy/indicators/rupee-up-against-dollar-gold-recovers-by-rs-60/articleshow/3260649.cms,"rupee up against dollar, gold recovers by rs 60"
22/7/2008,,
23/7/2008,"https://economictimes.indiatimes.com/articleshow/3266722.cms,http://www.marketwatch.com/story/august-gold-down-1020-to-93830-an-ounce-on-nymex-2008-07-23,http://www.marketwatch.com/story/gold-futures-accelerate-losses-2008-07-23","gold glitters, but there're few takers,august gold down $10.20 to $938.30 an ounce on nymex,gold futures accelerate losses"
24/7/2008,,
25/7/2008,,
26/7/2008,,
27/7/2008,,
28/7/2008,,
29/7/2008,http://www.marketwatch.com/story/gold-futures-end-at-one-month-low-pressured-by-dollars-gains-2008-07-29,gold ends at one-month low as dollar strengthens
30/7/2008,,
31/7/2008,"https://economictimes.indiatimes.com/articleshow/3308212.cms,http://www.marketwatch.com/story/barrick-gold-q2-net-55c-vs-45c-2008-07-31,http://www.marketwatch.com/story/gold-futures-rise-after-us-dollar-falls-vs-rivals-2008-07-31,http://www.marketwatch.com/story/barrick-gold-q2-gold-sales-187m-ounces-vs-201m-2008-07-31","gold futures fall below $900 on stronger dollar,barrick gold q2 net 55c vs 45c,gold futures rise after u.s. dollar falls vs. rivals,barrick gold q2 gold sales 1.87m ounces vs 2.01m"
1/8/2008,"http://www.marketwatch.com/story/gold-futures-turn-higher-tracking-oil-futures-rally-2008-08-01,http://www.marketwatch.com/story/december-gold-down-270-to-920-an-ounce-ahead-of-jobs-data-2008-08-01","gold futures turn higher, tracking oil futures' rally,december gold down $2.70 to $920 an ounce ahead of jobs data"
2/8/2008,,
3/8/2008,,
4/8/2008,"http://www.marketwatch.com/story/december-gold-down-860-to-90890-an-ounce-on-nymex-2008-08-04,http://www.marketwatch.com/story/gold-tracks-oil-prices-to-close-near-a-six-week-low-2008-08-04,http://www.marketwatch.com/story/december-gold-down-13-to-90450-an-ounce-on-nymex-2008-08-04","december gold down $8.60 to $908.90 an ounce on nymex,gold tracks tumbling oil price to end at six-week low,december gold down $13 to $904.50 an ounce on nymex"
5/8/2008,"https://economictimes.indiatimes.com/news/economy/indicators/rupee-rises-on-lower-oil-prices-gold-slips/articleshow/3329895.cms,http://www.marketwatch.com/story/dec-gold-up-220-at-88820oz-on-globex-2008-08-05,http://www.marketwatch.com/story/gold-futures-continue-to-drop-as-oil-slides-dollar-firms-2008-08-05","rupee rises on lower oil prices, gold slips,dec. gold up $2.20 at $888.20/oz on globex,gold futures continue to drop as oil slides, dollar firms"
6/8/2008,https://economictimes.indiatimes.com/news/economy/indicators/rupee-rises-gold-slips-to-over-7-week-low/articleshow/3334297.cms,"rupee rises, gold slips to over 7-week low"
7/8/2008,http://www.marketwatch.com/story/dec-gold-falls-450-or-05-to-87850oz-on-nymex-2008-08-07,"dec. gold falls $4.50, or 0.5%, to $878.50/oz on nymex"
8/8/2008,http://www.marketwatch.com/story/december-gold-down-990-to-868-an-ounce-on-globex-2008-08-08,december gold down $9.90 to $868 an ounce on globex
9/8/2008,,
10/8/2008,,
11/8/2008,"https://economictimes.indiatimes.com/articleshow/3353160.cms,http://www.marketwatch.com/story/dec-gold-down-35-or-41-at-829oz-on-globex-2008-08-11","gold snaps five-day losing streak, rupee falls,dec. gold down $35, or 4.1%, at $829/oz on globex"
12/8/2008,"http://www.marketwatch.com/story/china-increases-gold-medal-lead-phelps-wins-third-2008-08-12,https://economictimes.indiatimes.com/articleshow/3356218.cms,http://www.marketwatch.com/story/gold-futures-sink-more-than-100-since-july-31-2008-08-12","china increases gold medal lead,precious metals led by gold plunge to over 7-month lows,gold futures sink more than $100 since july 31"
13/8/2008,,
14/8/2008,"http://www.marketwatch.com/story/dec-gold-falls-790-or-1-to-82360oz-on-nymex-2008-08-14,http://www.marketwatch.com/story/michael-phelps-takes-sixth-beijing-gold-in-200m-medley-2008-08-14","dec. gold falls $7.90, or 1%, to $823.60/oz on nymex,michael phelps takes sixth beijing gold in 200m medley"
15/8/2008,"http://www.marketwatch.com/story/dec-gold-down-2150-or-26-at-793oz-on-nymex-2008-08-15,http://www.marketwatch.com/story/us-stock-futures-advance-as-dollar-rises-and-gold-oil-drop-2008-08-15-910308","dec. gold down $21.50, or 2.6%, at $793/oz on nymex,u.s. stock futures advance as dollar rises and gold, oil drop"
16/8/2008,https://economictimes.indiatimes.com/articleshow/3371163.cms,"gold plunges by rs 550 to rs 11,300, may test further lows"
17/8/2008,http://www.marketwatch.com/story/chinas-gold-medal-secret-chinese-women-2008-08-17,china's gold-medal secret? chinese women
18/8/2008,,
19/8/2008,"http://www.marketwatch.com/story/december-gold-down-480-to-80090-an-ounce-on-globex-2008-08-19,http://www.marketwatch.com/story/gold-turns-higher-as-oil-prices-rally-dollar-weakens-2008-08-19","december gold down $4.80 to $800.90 an ounce on globex,gold turns higher as oil prices rally, dollar weakens"
20/8/2008,"http://www.marketwatch.com/story/december-gold-up-590-to-82270-an-ounce-on-globex-2008-08-20,http://www.marketwatch.com/story/dec-gold-falls-50-cents-to-close-at-81630oz-on-nymex-2008-08-20","december gold up $5.90 to $822.70 an ounce on globex,dec. gold falls 50 cents to close at $816.30/oz on nymex"
21/8/2008,"http://www.marketwatch.com/story/december-gold-up-1720-or-21-to-83350-an-ounce-globex-2008-08-21,http://www.marketwatch.com/story/gold-futures-close-with-a-gain-of-nearly-3-2008-08-21","december gold up $17.20, or 2.1%, to $833.50 an ounce globex,gold futures close with a gain of nearly 3%"
22/8/2008,"http://www.marketwatch.com/story/gold-futures-end-lower-for-the-day-but-higher-for-the-week-2008-08-22,http://www.marketwatch.com/story/gold-futures-end-the-week-with-a-52-gain-2008-08-22","gold prices end lower, but finish higher on the week,gold futures end the week with a 5.2% gain"
23/8/2008,,
24/8/2008,,
25/8/2008,,
26/8/2008,,
27/8/2008,,
28/8/2008,http://www.marketwatch.com/story/gold-erases-gains-turning-lower-as-the-dollar-gains-2008-08-28,"gold erases gains, turning lower as the dollar gains"
29/8/2008,http://www.marketwatch.com/story/gold-closes-down-02-at-83520-an-ounce-up-02-in-week-2008-08-29,gold closes down 0.2% at $835.20 an ounce; up 0.2% in week
30/8/2008,https://economictimes.indiatimes.com/articleshow/3425546.cms,"silver plunges on lack of support, gold remains firm"
31/8/2008,,
1/9/2008,,
2/9/2008,http://www.marketwatch.com/story/gold-tumbles-25-in-commodities-sell-off-2008-09-02,gold tumbles $25 in commodities sell-off
3/9/2008,,
4/9/2008,,
5/9/2008,http://www.marketwatch.com/story/dec-gold-down-220-at-801oz-on-nymex-2008-09-05,dec. gold down $2.20 at $801/oz on nymex
6/9/2008,,
7/9/2008,,
8/9/2008,,
9/9/2008,,
10/9/2008,http://www.marketwatch.com/story/gold-falls-to-11-month-low-as-dollar-strengthens-2008-09-10,gold falls to 11-month low as dollar strengthens
11/9/2008,"http://www.marketwatch.com/story/gold-falls-for-ninth-day-as-dollar-rises-vs-euro-2008-09-11-1491339,http://www.marketwatch.com/story/gold-drops-for-ninth-day-closing-below-750-an-ounce-2008-09-11,https://economictimes.indiatimes.com/news/economy/indicators/rupee-dips-by-34-paise-gold-slides-by-rs-145/articleshow/3472812.cms","gold falls for ninth day as dollar rises vs. euro,gold falls for ninth day, closing below $750 level,rupee dips by 34 paise, gold slides by rs 145"
12/9/2008,https://economictimes.indiatimes.com/news/economy/indicators/gold-rebounds-on-firm-global-trend-rupee-drops/articleshow/3477073.cms,"gold rebounds on firm global trend, rupee drops"
13/9/2008,,
14/9/2008,,
15/9/2008,https://economictimes.indiatimes.com/articleshow/3485760.cms,gold shows resilience to troubles in financial markets
16/9/2008,,
17/9/2008,"http://www.marketwatch.com/story/gold-surges-as-investors-rush-to-safety-2008-09-17-1710308,http://www.marketwatch.com/story/gold-rises-as-deepening-financial-turmoil-triggers-purchase-2008-09-17,http://www.marketwatch.com/story/gold-etf-gains-8-on-record-trading-volume-2008-09-17","gold surges as investors rush to safety,gold rises as deepening financial turmoil triggers purchase,gold etf gains 8% on record trading volume"
18/9/2008,"http://www.marketwatch.com/story/dec-gold-up-43-or-51-at-89350oz-on-globex-2008-09-18,http://www.marketwatch.com/story/gold-futures-climb-past-900-for-first-time-in-six-weeks-2008-09-18","dec. gold up $43, or 5.1%, at $893.50/oz on globex,gold futures climb past $900 for first time in six weeks"
19/9/2008,http://www.marketwatch.com/story/gold-futures-drop-sharply-on-government-plan-2008-09-19,gold futures drop sharply on government plan
20/9/2008,,
21/9/2008,,
22/9/2008,"http://www.marketwatch.com/story/gold-ends-above-900-an-ounce-as-rescue-plan-pressures-dollar-2008-09-22,http://www.marketwatch.com/story/gold-leaps-4430-or-51-to-close-at-909-an-ounce-2008-09-22","gold rallies as massive rescue plan pressures dollar,gold leaps $44.30, or 5.1%, to close at $909 an ounce"
23/9/2008,http://www.marketwatch.com/story/gold-futures-end-lower-as-us-dollar-rises-vs-rivals-2008-09-23,"gold futures end lower, as u.s. dollar rises vs. rivals"
24/9/2008,http://www.marketwatch.com/story/gold-futures-up-450-at-89570-an-ounce-2008-09-24,gold futures up $4.50 at $895.70 an ounce
25/9/2008,"http://www.marketwatch.com/story/gold-contract-pulls-back-as-rescue-plan-moves-toward-fruition-2008-09-25,http://www.marketwatch.com/story/gold-falls-after-bush-urges-quick-action-on-rescue-plan-2008-09-25,https://economictimes.indiatimes.com/articleshow/3527817.cms","gold pulls back as investors mull rescue plan,gold falls after bush urges quick action on rescue plan,gold shines again on positive global cues"
26/9/2008,,
27/9/2008,,
28/9/2008,,
29/9/2008,"http://www.marketwatch.com/story/gold-rises-on-safe-haven-buying-after-plan-fails-2008-09-29,http://www.marketwatch.com/story/gold-futures-down-720-at-88130-an-ounce-2008-09-29,http://www.marketwatch.com/story/dec-gold-up-660-at-89510oz-on-globex-after-913-high-2008-09-29","gold rises on safe-haven buying after plan fails,gold futures down $7.20 at $881.30 an ounce,dec. gold up $6.60 at $895.10/oz on globex after $913 high"
30/9/2008,"http://www.marketwatch.com/story/gold-for-october-delivery-climbs-1660-to-90480-an-ounce-2008-09-30,https://economictimes.indiatimes.com/articleshow/3544430.cms","gold for october delivery climbs $16.60 to $904.80 an ounce,gold climbs by rs 330 per ten grams in early trade"
1/10/2008,http://www.marketwatch.com/story/dec-gold-ends-up-650-or-07-at-88730-an-ounce-2008-10-01,"dec. gold ends up $6.50, or 0.7%, at $887.30 an ounce"
2/10/2008,http://www.marketwatch.com/story/gold-falls-as-dollar-rises-after-senate-approves-plan-2008-10-02,gold falls as dollar rises after senate approves plan
3/10/2008,"https://economictimes.indiatimes.com/markets/commodities/gold-crude-oil-decline-due-to-strengthening-dollar/articleshow/3555414.cms,http://www.marketwatch.com/story/dec-gold-falls-1080-or-13-at-83350oz-on-globex-2008-10-03","gold, crude oil decline due to strengthening dollar,dec. gold falls $10.80, or 1.3%, at $833.50/oz on globex"
4/10/2008,,
5/10/2008,,
6/10/2008,http://www.marketwatch.com/story/gold-surges-on-safe-haven-buying-spree-2008-10-06,gold surges on safe-haven buying spree
7/10/2008,,
8/10/2008,"http://www.marketwatch.com/story/gold-futures-tally-three-session-climb-of-more-than-73-2008-10-08,https://economictimes.indiatimes.com/articleshow/3573392.cms,https://economictimes.indiatimes.com/articleshow/3571510.cms","gold futures tally three-session climb of more than $73,gold could extend gains on coordinated central banks rate cuts,gold sales yet to gain last year's sparkle"
9/10/2008,,
10/10/2008,http://www.marketwatch.com/story/gold-futures-surge-on-flight-to-safety-2008-10-10,gold futures surge on flight to safety
11/10/2008,,
12/10/2008,,
13/10/2008,http://www.marketwatch.com/story/gold-futures-extend-fall-on-government-rescue-plans-2008-10-13,gold futures extend fall on government rescue plans
14/10/2008,"http://www.marketwatch.com/story/why-should-gold-stop-at-1500-2008-10-14,http://www.marketwatch.com/story/gold-could-hit-1500-say-merrill-analysts-2008-10-14","why should gold stop at $1,500?,gold could hit $1,500, say merrill analysts"
15/10/2008,"https://economictimes.indiatimes.com/articleshow/3596693.cms,http://www.marketwatch.com/story/gold-rises-over-10-to-above-850-on-inflation-concerns-2008-10-15","gold ends lower at rs 13,130,gold rises over $10 to above $850 on inflation concerns"
16/10/2008,,
17/10/2008,http://www.marketwatch.com/story/gold-falls-for-seventh-day-as-investors-liquidate-positions-2008-10-17,gold falls for seventh day as investors liquidate positions
18/10/2008,https://economictimes.indiatimes.com/articleshow/3612478.cms,gold plunges further by rs 210
19/10/2008,,
20/10/2008,,
21/10/2008,,
22/10/2008,http://www.marketwatch.com/story/gold-ends-down-43-at-73520-a-one-year-low-2008-10-22,"gold ends down 4.3% at $735.20, a one-year low"
23/10/2008,"http://www.marketwatch.com/story/golds-recent-slump-bewilders-investors-2008-10-23,http://www.marketwatch.com/story/gold-ends-down-29-at-71470-a-13-month-low-2008-10-23","gold's recent slump bewilders investors,gold ends down 2.9% at $714.70, a 13-month low"
24/10/2008,,
25/10/2008,https://economictimes.indiatimes.com/articleshow/3638803.cms,"gold takes crude route, sheds over rs 100"
26/10/2008,https://economictimes.indiatimes.com/articleshow/3643356.cms,gold sales shoots up phenomenally in this festive season
27/10/2008,http://www.marketwatch.com/story/dec-gold-reverses-losses-gaining-06-to-73470-an-ounce-2008-10-27,"dec. gold reverses losses, gaining 0.6% to $734.70 an ounce"
28/10/2008,,
29/10/2008,http://www.marketwatch.com/story/gold-falls-slightly-after-fed-rate-cut-2008-10-29,gold falls slightly after fed rate cut
30/10/2008,http://www.marketwatch.com/story/dec-gold-ends-down-1550-or-21-at-73850-an-ounce-2008-10-30,"dec. gold ends down $15.50, or 2.1%, at $738.50 an ounce"
31/10/2008,,
1/11/2008,,
2/11/2008,,
3/11/2008,,
4/11/2008,https://economictimes.indiatimes.com/articleshow/3671086.cms,gold rises 1 pc as us dollar steadies
5/11/2008,"http://www.marketwatch.com/story/dec-gold-ends-at-74240oz-on-nymex-down-1490-or-2-2008-11-05,http://www.marketwatch.com/story/gold-futures-fall-1-copper-down-5-2008-11-05,http://www.marketwatch.com/story/gold-futures-close-with-a-loss-of-almost-15-2008-11-05","dec. gold ends at $742.40/oz on nymex, down $14.90, or 2%,gold futures fall 1%; copper down 5%,gold futures close with a loss of almost $15"
6/11/2008,https://economictimes.indiatimes.com/articleshow/3678913.cms,gold sparkles again
7/11/2008,http://www.marketwatch.com/story/gold-ends-slightly-higher-as-dollar-falls-vs-euro-2008-11-07,gold ends slightly higher as dollar falls vs. euro
8/11/2008,,
9/11/2008,,
10/11/2008,http://www.marketwatch.com/story/dec-gold-climbs-19-or-26-to-75320oz-on-globex-2008-11-10,"dec. gold climbs $19, or 2.6%, to $753.20/oz on globex"
11/11/2008,,
12/11/2008,http://www.marketwatch.com/story/december-gold-down-230-to-73050-an-ounce-on-globex-2008-11-12,december gold down $2.30 to $730.50 an ounce on globex
13/11/2008,,
14/11/2008,"http://www.marketwatch.com/story/gold-gains-more-than-37-for-the-day-to-end-the-week-up-11-2008-11-14,http://www.marketwatch.com/story/gold-futures-close-53-higher-on-day-up-11-on-week-2008-11-14,http://www.marketwatch.com/story/dec-gold-up-59-at-74670oz-on-globex-after-752-high-2008-11-14","gold gains more than $37 for the day to end the week up 1.1%,gold futures close 5.3% higher on day, up 1.1% on week,dec. gold up 5.9% at $746.70/oz on globex after $752 high"
15/11/2008,,
16/11/2008,,
17/11/2008,http://www.marketwatch.com/story/gold-little-changed-after-rallies-in-previous-session-2008-11-17,gold little changed after rallies in previous session
18/11/2008,,
19/11/2008,,
20/11/2008,http://www.marketwatch.com/story/gold-rises-on-safe-haven-buying-as-global-stocks-slump,gold rises on safe-haven buying as global stocks slump
21/11/2008,https://economictimes.indiatimes.com/articleshow/3738690.cms,"weakening rupee, falling stocks add glitter to gold"
22/11/2008,https://economictimes.indiatimes.com/articleshow/3745158.cms,"gold jumps by rs 700, sees second surge in a month"
23/11/2008,,
24/11/2008,http://www.marketwatch.com/story/december-gold-up-2420-to-816-an-ounce-on-globex-2008-11-24,december gold up $24.20 to $816 an ounce on globex
25/11/2008,,
26/11/2008,https://economictimes.indiatimes.com/articleshow/3757439.cms,gold sales fail to pick up even in wedding season
27/11/2008,http://www.marketwatch.com/story/gold-futures-up-460-at-81590-an-ounce-2008-11-27,gold futures up $4.60 at $815.90 an ounce
28/11/2008,,
29/11/2008,,
30/11/2008,,
1/12/2008,,
2/12/2008,https://economictimes.indiatimes.com/articleshow/3784112.cms,gold futures tumble on weak global trend
3/12/2008,,
4/12/2008,http://www.marketwatch.com/story/feb-gold-ends-down-5-or-06-at-76550-an-ounce,"feb. gold ends down $5, or 0.6%, at $765.50 an ounce"
5/12/2008,"http://www.marketwatch.com/story/gold-finishes-week-down-sharply-lower-2008-12-05,http://www.marketwatch.com/story/feb-gold-ends-down-1330-or-17-at-75220-an-ounce-2008-12-05","gold ends down first week in five as dollar gains,feb. gold ends down $13.30, or 1.7%, at $752.20 an ounce"
6/12/2008,,
7/12/2008,,
8/12/2008,http://www.marketwatch.com/story/gold-futures-rally-3-in-early-trade,gold futures rally 3% in early trade
9/12/2008,,
10/12/2008,"http://www.marketwatch.com/story/february-gold-ends-up-3460-at-80880-an-ounce-on-nymex,http://www.marketwatch.com/story/gold-futures-rise-for-a-third-session","february gold ends up $34.60 at $808.80 an ounce on nymex,gold futures rise for a third session"
11/12/2008,"http://www.marketwatch.com/story/gold-futures-up-1460-at-82340-an-ounce,http://www.marketwatch.com/story/february-gold-ends-up-1780-at-82660-an-ounce-on-nymex,http://www.marketwatch.com/story/february-gold-up-2440-or-3-to-83320-an-ounce","gold futures up $14.60 at $823.40 an ounce,february gold ends up $17.80 at $826.60 an ounce on nymex,february gold up $24.40, or 3%, to $833.20 an ounce"
12/12/2008,"http://www.marketwatch.com/story/february-gold-ends-down-610-at-82050-an-ounce-on-nymex-2008-12-12,http://www.marketwatch.com/story/gold-ends-lower-but-gains-on-the-week,http://www.marketwatch.com/story/gold-futures-down-1190-at-81470-an-ounce-2008-12-12,http://www.marketwatch.com/story/gold-and-other-metal-futures-fall-in-early-trade","february gold ends down $6.10 at $820.50 an ounce on nymex,gold ends lower, but gains on the week,gold futures down $11.90 at $814.70 an ounce,gold and other metal futures fall in early trade"
13/12/2008,,
14/12/2008,,
15/12/2008,http://www.marketwatch.com/story/feb-gold-ends-up-2-at-83650-highest-since-oct-15-2008-12-15,"feb. gold ends up 2% at $836.50, highest since oct. 15"
16/12/2008,,
17/12/2008,,
18/12/2008,http://www.marketwatch.com/story/gold-futures-up-940-at-87790-an-ounce-2008-12-18,gold futures up $9.40 at $877.90 an ounce
19/12/2008,https://economictimes.indiatimes.com/articleshow/3863786.cms,gold could move towards $820 on pullback in dollar and falling crude oil
20/12/2008,https://economictimes.indiatimes.com/articleshow/3866886.cms,"gold prices decline further, silver recovers"
21/12/2008,,
22/12/2008,"http://www.marketwatch.com/story/gold-stocks-downgraded-leading-tsx-down-over-300-points-2008-12-22,http://www.marketwatch.com/story/feb-gold-ends-up-12-at-84720-an-ounce","losing gold, energy stocks pummel toronto stocks,feb. gold ends up 1.2% at $847.20 an ounce"
23/12/2008,,
24/12/2008,http://www.marketwatch.com/story/gold-ends-slightly-higher-amid-mixed-trading-in-dollar-2008-12-24,gold slightly higher amid mixed trading in dollar
25/12/2008,,
26/12/2008,,
27/12/2008,,
28/12/2008,,
29/12/2008,https://economictimes.indiatimes.com/articleshow/3907821.cms,"gold, base metals futures rally on crude rise"
30/12/2008,http://www.marketwatch.com/story/gold-futures-edge-lower-in-thin-trading,gold futures edge lower in thin trading
31/12/2008,,
1/1/2009,https://economictimes.indiatimes.com/articleshow/3921107.cms,gold sparkles despite its year-end blip
2/1/2009,,
3/1/2009,https://economictimes.indiatimes.com/articleshow/3931190.cms,"gold declines further, silver recovers"
4/1/2009,,
5/1/2009,"https://economictimes.indiatimes.com/articleshow/3938351.cms,http://www.marketwatch.com/story/feb-gold-ends-down-2170-or-25-at-85780-an-ounce-2009-01-05","gold extends losses on weak global cues, sluggish demand ,feb. gold ends down $21.70, or 2.5%, at $857.80 an ounce"
6/1/2009,,
7/1/2009,http://www.marketwatch.com/story/feb-gold-ends-down-2430-or-28-at-84170-an-ounce-2009-01-07,"feb. gold ends down $24.30, or 2.8%, at $841.70 an ounce"
8/1/2009,http://www.marketwatch.com/story/feb-gold-ends-up-1280-or-15-at-85450-an-ounce-2009-01-08,"feb. gold ends up $12.80, or 1.5%, at $854.50 an ounce"
9/1/2009,,
10/1/2009,,
11/1/2009,,
12/1/2009,"http://www.marketwatch.com/story/plunging-oil-gold-prices-drag-down-toronto-benchmark-2009-01-12,http://www.marketwatch.com/story/gold-falls-to-near-830-as-dollar-rises,http://www.marketwatch.com/story/gold-falls-to-one-month-low-on-dollar-tumbling-oil-2009-01-12","canadian equities plunge along with oil, gold prices,gold falls to near $830 as dollar rises,gold falls to one-month low on dollar, tumbling oil"
13/1/2009,https://economictimes.indiatimes.com/articleshow/3973163.cms,gold futures may turn bearish this week on strong dollar
14/1/2009,http://www.marketwatch.com/story/feb-gold-ends-down-1190-or-14-at-80880-an-ounce-2009-01-14,"feb. gold ends down $11.90, or 1.4%, at $808.80 an ounce"
15/1/2009,,
16/1/2009,http://www.marketwatch.com/story/gold-futures-rise-first-day-in-five-as-dollar-falls-2009-01-16,gold futures rise for first day in five as dollar falls
17/1/2009,,
18/1/2009,,
19/1/2009,,
20/1/2009,,
21/1/2009,"https://economictimes.indiatimes.com/articleshow/4013208.cms,https://economictimes.indiatimes.com/articleshow/4012699.cms,http://www.marketwatch.com/story/february-gold-ends-down-510-at-85010-an-ounce-on-nymex","gold rallies by 395 per ten grams on higher global cues,india's gold import dips by 47%  to 402 tonnes in 2008,february gold ends down $5.10 at $850.10 an ounce on nymex"
22/1/2009,"http://www.marketwatch.com/story/gold-futures-fall-after-gloomy-data-on-housing-jobs,https://economictimes.indiatimes.com/articleshow/4014021.cms","gold futures fall after gloomy data on housing, jobs,gold import dips 47% to 402 tonnes in 2008"
23/1/2009,"http://www.marketwatch.com/story/february-gold-rallies-to-intraday-high-of-90050-an-ounce,http://www.marketwatch.com/story/february-gold-up-1420-to-873-an-ounce-on-globex,http://www.marketwatch.com/story/feb-gold-last-up-4040-or-47-to-89920-an-ounce","february gold rallies to intraday high of $900.50 an ounce,february gold up $14.20 to $873 an ounce on globex,feb. gold last up $40.40, or 4.7%, to $899.20 an ounce"
24/1/2009,,
25/1/2009,,
26/1/2009,,
27/1/2009,,
28/1/2009,"http://www.marketwatch.com/story/bundesbank-denies-selling-gold,http://www.marketwatch.com/story/is-gold-really-pausing-2009-01-28","bundesbank denies selling gold,whither gold?"
29/1/2009,http://www.marketwatch.com/story/gold-rises-first-day-in-three-on-safe-haven-buying-2009-01-29,gold rises first day in three on safe-haven buying
30/1/2009,,
31/1/2009,,
1/2/2009,,
2/2/2009,,
3/2/2009,,
4/2/2009,http://www.marketwatch.com/story/feb-gold-ends-up-960-11,"feb. gold ends up $9.60, or 1.1%, at $901.60 an ounce"
5/2/2009,"http://www.marketwatch.com/story/gold-rises-for-second-session-to-above-910-as-uk-cuts-rate-2009-02-05,http://www.marketwatch.com/story/feb-gold-ends-up-12-13","gold rises for second session as u.k. cuts rate,feb. gold ends up $12, or 1.3%, at $913.60 an ounce"
6/2/2009,http://www.marketwatch.com/story/gold-little-changed-after-us-unemployment,gold little changed after u.s. unemployment data
7/2/2009,,
8/2/2009,,
9/2/2009,https://economictimes.indiatimes.com/articleshow/4099699.cms,soaring prices makes gold more desirable as v-day gift
10/2/2009,"http://www.marketwatch.com/story/gold-closes-above-900-amid-bailout-doubts-2009-02-10,https://economictimes.indiatimes.com/articleshow/4102560.cms","gold rises on doubts about government plans,after gold, silver proves its mettle in local markets"
11/2/2009,http://www.marketwatch.com/story/tokyo-shares-fall-after-holiday-gold,tokyo shares fall after holiday; gold miners up in sydney
12/2/2009,"http://www.marketwatch.com/story/spdr-gold-holdings-hit-new-record,https://economictimes.indiatimes.com/articleshow/4117568.cms","spdr gold holdings hit new record above 900 tons,gold funds find favour with investors"
13/2/2009,,
14/2/2009,,
15/2/2009,,
16/2/2009,,
17/2/2009,,
18/2/2009,"http://www.marketwatch.com/story/gold-ends-up-1070-11-97770,http://www.marketwatch.com/story/spdr-gold-holdings-surpass-1000-tons","gold ends up $10.70, or 1.1%, at $977.70 an ounce,spdr gold holdings surpass 1,000 tons"
19/2/2009,"http://www.marketwatch.com/story/newmont-swings-to-profit-as-gold-gains-2009-02-19,http://www.marketwatch.com/story/gold-ends-down-160-02-97610","newmont swings to profit as gold gains,gold ends down $1.60, or 0.2%, at $976.10 an ounce"
20/2/2009,"http://www.marketwatch.com/story/us-stocks-trim-decline-options-expire,http://www.marketwatch.com/story/gold-tops-1000-an-ounce-as-stocks-hit-new-lows-2009-02-20,http://www.marketwatch.com/story/gold-futures-catch-a-bid-stock","u.s. stocks trim decline as options expire, gold eyed,gold tops $1,000 an ounce as stocks hit new lows,gold futures catch a bid as stock futures fall"
21/2/2009,,
22/2/2009,,
23/2/2009,https://economictimes.indiatimes.com/articleshow/4179283.cms,"gold falls as equities rise, may test $1,050"
24/2/2009,,
25/2/2009,http://www.marketwatch.com/story/gold-slightly-lower-rising-stocks-reduce,gold slightly lower as rising stocks reduce safety buying
26/2/2009,http://www.marketwatch.com/story/gold-ends-just-above-940-an-ounce-as-crude-rises-2009-02-26,gold falls near $940 as crude prices rise
27/2/2009,"http://www.marketwatch.com/story/weekend-vittles-the-fed-apple-oil-and-gold-2009-02-27,https://economictimes.indiatimes.com/articleshow/4200490.cms","weekend vittles: the fed, apple, oil and gold,high prices hit gold market; zero import in feb"
28/2/2009,,
1/3/2009,,
2/3/2009,"http://www.marketwatch.com/story/gold-futures-up-1220-95470-ounce,http://www.marketwatch.com/story/five-rally-killers-and-how-to-survive-them-2009-03-02","gold futures up $12.20 at $954.70 an ounce,stock doom and gold boom"
3/3/2009,"http://www.marketwatch.com/story/gold-falls-below-930-crude-stock,https://economictimes.indiatimes.com/articleshow/4215346.cms","gold falls below $930 as crude, stock futures rise,gold prices fall further as dow drops below 7,000"
4/3/2009,"http://www.marketwatch.com/story/gold-stays-lower-after-feds-beige,http://www.marketwatch.com/story/gold-little-changed-early-morning-trading","gold stays lower after fed's beige book,gold little changed in early morning trading"
5/3/2009,http://www.marketwatch.com/story/gold-futures-up-600-91270-ounce,gold futures up $6.00 at $912.70 an ounce
6/3/2009,https://economictimes.indiatimes.com/articleshow/4235339.cms,"gold spurt on revival of buying, firm overseas trend"
7/3/2009,,
8/3/2009,,
9/3/2009,http://www.marketwatch.com/story/april-gold-futures-slip-below-917,april gold futures slip below $917 an ounce
10/3/2009,http://www.marketwatch.com/story/gold-falls-below-900-us-stocks,gold falls below $900 as u.s. stocks rally
11/3/2009,"http://www.marketwatch.com/story/gold-futures-rise-above-900-dollar,https://economictimes.indiatimes.com/articleshow/4251634.cms","gold futures rise above $900 as dollar falls,investors rush in for gold exchange-traded funds"
12/3/2009,http://www.marketwatch.com/story/gold-tops-920-an-ounce-tracking-gains-in-crude-stocks-2009-03-12,"gold tops $920, tracking gains in crude, stocks"
13/3/2009,http://www.marketwatch.com/story/silvers-discount-to-gold-sticks-out-like-a-sore-thumb-2009-03-13,silver's discount to gold sticks out like sore thumb
14/3/2009,,
15/3/2009,https://economictimes.indiatimes.com/articleshow/4266117.cms,"gold prices are on rise, but for raw material"
16/3/2009,,
17/3/2009,http://www.marketwatch.com/story/gold-futures-fall-below-920-dollar,gold futures fall below $920 as dollar rises
18/3/2009,"http://www.marketwatch.com/story/gold-futures-rise-more-4-above,http://www.marketwatch.com/story/gold-falls-below-910-reduced-safe,http://www.marketwatch.com/story/april-gold-ends-at-the-lowest-level-in-two-months-2009-03-18","gold futures rise more than 4% to above $920 after fed,gold falls below $910 on reduced safe-haven buying,april gold ends at the lowest level in two months"
19/3/2009,http://www.marketwatch.com/story/gold-jumps-to-near-960-an-ounce-fed-sparks-inflation-worries-2009-03-19,gold rallies 8% as fed move fuels inflation fears
20/3/2009,http://www.marketwatch.com/story/gold-falls-slightly-after-rally-gain,"gold falls slightly after rally, but gain 2.8% in week"
21/3/2009,,
22/3/2009,,
23/3/2009,"http://www.marketwatch.com/story/gold-falls-as-treasury-details-toxic-assets-plan-2009-03-23,http://www.marketwatch.com/story/spot-gold-prices-up-3-94120","gold falls for second day as treasury details plans,spot gold prices up $3 at $941.20 a troy ounce"
24/3/2009,http://www.marketwatch.com/story/gold-falls-third-day-dollar-gains,gold falls for third day as dollar gains
25/3/2009,,
26/3/2009,,
27/3/2009,https://economictimes.indiatimes.com/articleshow/4324794.cms,gold rises marginally; silver surges by rs 300
28/3/2009,,
29/3/2009,,
30/3/2009,http://www.marketwatch.com/story/gold-falls-as-stronger-dollar-reduces-appeal-2009-03-30,gold falls as stronger dollar reduces metal's appeal
31/3/2009,http://www.marketwatch.com/story/gold-rises-slightly-dollar-falls-new,gold rises slightly as dollar falls
1/4/2009,http://www.marketwatch.com/story/four-chinese-banks-approved-shanghai-gold,four chinese banks approved for shanghai gold futures trade
2/4/2009,"https://economictimes.indiatimes.com/articleshow/4350502.cms,http://www.marketwatch.com/story/gold-falls-speculation-financial-crisis-may","gold prices flat,gold falls on speculation financial crisis may have bottomed"
3/4/2009,,
4/4/2009,,
5/4/2009,,
6/4/2009,"http://www.marketwatch.com/story/gold-falls-optimism-worst-crisis-may,http://www.marketwatch.com/story/gold-futures-down-1480-88270-ounce","gold falls on optimism worst of crisis may be over,gold futures down $14.80 at $882.70 an ounce"
7/4/2009,http://www.marketwatch.com/story/spot-gold-prices-rise-80,spot gold prices rise 80 cents to $881.90 a barrel
8/4/2009,http://www.marketwatch.com/story/april-gold-ends-up-260,"april gold ends up $2.60, or 0.3%, at $884.80 an ounce"
9/4/2009,"https://economictimes.indiatimes.com/articleshow/4380693.cms,http://www.marketwatch.com/story/gold-falls-heading-third-weekly","gold declines as funds shift to equity,gold falls, heading for third weekly loss on optimism"
10/4/2009,https://economictimes.indiatimes.com/articleshow/4382773.cms,gold melts on rupee heat
11/4/2009,https://economictimes.indiatimes.com/articleshow/4387351.cms,is it the right time to buy gold?
12/4/2009,,
13/4/2009,http://www.marketwatch.com/story/gold-rises-worries-over-gm,"gold rises on worries over gm, banks"
14/4/2009,,
15/4/2009,,
16/4/2009,http://www.marketwatch.com/story/gold-slightly-lower-deflation-worries,gold slightly lower as deflation worries continue
17/4/2009,,
18/4/2009,,
19/4/2009,,
20/4/2009,http://www.marketwatch.com/story/gold-futures-down-280-87070,gold futures down $2.80 at $870.70 an ounce
21/4/2009,"https://economictimes.indiatimes.com/articleshow/4430904.cms,http://www.marketwatch.com/story/june-gold-gains-1-88370oz","india likely to import 30 tonnes of gold in april,june gold gains $1 to $883.70/oz on globex"
22/4/2009,,
23/4/2009,,
24/4/2009,http://www.marketwatch.com/story/gold-steady-after-us-releases,gold steady after u.s. releases test criteria
25/4/2009,,
26/4/2009,,
27/4/2009,http://www.marketwatch.com/story/june-gold-ends-down-590,"june gold ends down $5.90, or 0.6%, at $908.20"
28/4/2009,http://www.marketwatch.com/story/gold-futures-down-1070-at-89750-an-ounce,gold futures down $10.70 at $897.50 an ounce
29/4/2009,,
30/4/2009,"http://www.marketwatch.com/story/spot-gold-prices-slip-010-to-88610troy-ounce,http://www.marketwatch.com/story/gold-futures-down-130-at-89920-an-ounce","spot gold prices slip $0.10 to $886.10/troy ounce,gold futures down $1.30 at $899.20 an ounce"
1/5/2009,http://www.marketwatch.com/story/june-gold-ends-down-3-or-03-at-88820-2009511343420,"june gold ends down $3, or 0.3%, at $888.20"
2/5/2009,,
3/5/2009,,
4/5/2009,"https://economictimes.indiatimes.com/articleshow/4481946.cms,http://www.marketwatch.com/story/june-gold-up-310-at-90530oz-on-globex","gold trades marginally up on pick-up in demand,june gold up $3.10 at $905.30/oz on globex"
5/5/2009,,
6/5/2009,"http://www.marketwatch.com/story/gold-closes-higher-on-thoughts-of-inflation-ahead,http://www.marketwatch.com/story/gold-ends-up-670-or-07-at-911-an-ounce,https://economictimes.indiatimes.com/opinion/vedanta/the-curious-case-of-clay-turning-to-gold/articleshow/4488640.cms","gold closes higher on thoughts of inflation ahead,gold ends up $6.70, or 0.7%, at $911 an ounce,the curious case of clay turning to gold"
7/5/2009,,
8/5/2009,"http://www.marketwatch.com/story/gold-falls-as-jobs-data-reduce-economic-worries-2009-05-08,http://www.marketwatch.com/story/june-gold-ends-down-60-cents-or-01-at-91490","gold falls as jobs data clip economic worries,june gold ends down 60 cents, or 0.1%, at $914.90"
9/5/2009,,
10/5/2009,,
11/5/2009,"http://www.marketwatch.com/story/copper-falls-as-economic-worries-return-gold-dips,http://www.marketwatch.com/story/copper-falls-on-china-demand-worries-gold-dips","copper falls as economic worries return; gold dips,copper falls on china demand worries; gold dips"
12/5/2009,,
13/5/2009,,
14/5/2009,https://economictimes.indiatimes.com/articleshow/4530737.cms,gold continues to rise on local demand; silver declines
15/5/2009,,
16/5/2009,,
17/5/2009,,
18/5/2009,https://economictimes.indiatimes.com/articleshow/4546374.cms,gold futures fall 2.3 pc due to stronger rupee
19/5/2009,http://www.marketwatch.com/story/gold-futures-end-05-higher-at-92670-an-ounce,gold futures end 0.5% higher at $926.70 an ounce
20/5/2009,,
21/5/2009,"https://economictimes.indiatimes.com/articleshow/4559973.cms,http://www.marketwatch.com/story/june-gold-rises-140-to-95260oz-on-globex","gold advances on firm overseas trend,june gold rises $1.40 to $952.60/oz on globex"
22/5/2009,,
23/5/2009,https://economictimes.indiatimes.com/articleshow/4569202.cms,sbi attracts deposits of 548 kg gold in two months
24/5/2009,http://www.marketwatch.com/story/spot-gold-prices-up-30-cents-at-95680troy-ounce,spot gold prices up 30 cents at $956.80/troy ounce
25/5/2009,,
26/5/2009,https://economictimes.indiatimes.com/opinion/et-editorial/on-black-gold/articleshow/4577916.cms,on black gold
27/5/2009,,
28/5/2009,http://www.marketwatch.com/story/spot-gold-up-50-cents-at-95950troy-ounce,spot gold up 50 cents at $959.50/troy ounce
29/5/2009,"http://www.marketwatch.com/story/june-gold-ends-up-1730-or-18-at-97880,https://economictimes.indiatimes.com/articleshow/4594142.cms","june gold ends up $17.30, or 1.8%, at $978.80,gold, silver rise on strong global cues"
30/5/2009,,
31/5/2009,http://www.marketwatch.com/story/june-gold-down-230-at-97650oz-on-globex,june gold down $2.30 at $976.50/oz on globex
1/6/2009,"https://economictimes.indiatimes.com/articleshow/4604031.cms,http://www.marketwatch.com/story/copper-rallies-on-china-manufacturing-gold-gains,http://www.marketwatch.com/story/gold-closes-at-980-an-ounce-copper-rallies","gold rules flat, silver surges by rs 300 on firm global cues,copper rallies on china manufacturing; gold gains,gold closes at $980 an ounce; copper rallies"
2/6/2009,http://www.marketwatch.com/story/gold-reclaims-980-mark-silver-approaches-16-2009-06-02,gold rises as dollar weakens anew; silver ends near $16
3/6/2009,,
4/6/2009,,
5/6/2009,"http://www.marketwatch.com/story/copper-rises-after-jobs-data-gold-silver-down,http://www.marketwatch.com/story/june-gold-extends-loss-down-nearly-1-to-97290","copper rises after jobs data; gold, silver down,june gold extends loss, down nearly 1% to $972.90"
6/6/2009,,
7/6/2009,,
8/6/2009,"http://www.marketwatch.com/story/gold-ends-at-two-week-low-as-dollar-strengthens-2009-06-08,http://www.marketwatch.com/story/june-gold-ends-down-10-or-1-at-95170,http://www.marketwatch.com/story/gold-falls-1-as-dollar-continues-to-strengthen","gold ends at two-week low as dollar continues to strengthen,june gold ends down $10, or 1%, at $951.70,gold falls 1% as dollar continues to strengthen"
9/6/2009,http://www.marketwatch.com/story/june-gold-up-2-at-95600oz-on-globex,june gold up $2 at $956.00/oz on globex
10/6/2009,,
11/6/2009,http://www.marketwatch.com/story/august-gold-falls-04-to-95130-an-ounce,august gold falls 0.4% to $951.30 an ounce
12/6/2009,https://economictimes.indiatimes.com/articleshow/4649714.cms,gold drops further on stockists offerings
13/6/2009,https://economictimes.indiatimes.com/articleshow/4652444.cms,gold continues to decline on lower global cues
14/6/2009,,
15/6/2009,,
16/6/2009,http://www.marketwatch.com/story/august-gold-ends-up-470-or-05-at-93220,"august gold ends up $4.70, or 0.5%, at $932.20"
17/6/2009,"https://economictimes.indiatimes.com/articleshow/4668393.cms,http://www.marketwatch.com/story/august-gold-ends-up-380-or-04-at-936","gold firms up on higher global cues, silver declines,august gold ends up $3.80, or 0.4%, at $936"
18/6/2009,,
19/6/2009,"http://www.marketwatch.com/story/august-gold-ends-up-160-or-02-at-93620,https://economictimes.indiatimes.com/articleshow/4676854.cms","august gold ends up $1.60, or 0.2%, at $936.20,gold falls on weak global cues, silver declines by rs 200"
20/6/2009,,
21/6/2009,,
22/6/2009,,
23/6/2009,,
24/6/2009,http://www.marketwatch.com/story/gold-ends-up-on-inflation-threat-copper-rallies,gold ends up on inflation threat; copper rallies
25/6/2009,http://www.marketwatch.com/story/gold-futures-finish-near-940-as-traders-eye-china,gold futures finish near $940 as traders eye china
26/6/2009,,
27/6/2009,,
28/6/2009,,
29/6/2009,"http://www.marketwatch.com/story/gold-rises-slightly-as-dollar-weakens,http://www.marketwatch.com/story/august-gold-rises-01-to-94190-an-ounce","gold rises slightly as dollar weakens,august gold rises 0.1% to $941.90 an ounce"
30/6/2009,,
1/7/2009,,
2/7/2009,,
3/7/2009,,
4/7/2009,,
5/7/2009,,
6/7/2009,http://www.marketwatch.com/story/august-gold-falls-09-to-92270-an-ounce,august gold falls 0.9% to $922.70 an ounce
7/7/2009,http://www.marketwatch.com/story/gold-rises-first-day-in-three-as-dollar-weakens-20097785280,gold rises first day in three as dollar weakens
8/7/2009,http://www.marketwatch.com/story/gold-falls-to-two-month-low-as-oil-tumbles,gold falls to two-month low as oil tumbles
9/7/2009,http://www.marketwatch.com/story/gold-rebounds-from-two-month-low-on-weaker-dollar,gold rebounds from two-month low on weaker dollar
10/7/2009,https://economictimes.indiatimes.com/articleshow/4763874.cms,gold remains down on weakening trend in global markets
11/7/2009,,
12/7/2009,,
13/7/2009,http://www.marketwatch.com/story/gold-rises-above-920-as-dollar-falls-against-euro-2009-07-13,gold rises above $920 as dollar falls against euro
14/7/2009,,
15/7/2009,http://www.marketwatch.com/story/august-gold-rises-13-to-93470-an-ounce,august gold rises 1.3% to $934.70 an ounce
16/7/2009,http://www.marketwatch.com/story/gold-falls-slightly-3-day-winning-streak-ends-2009-07-16,"gold falls modestly, ending 3-day winning streak"
17/7/2009,,
18/7/2009,,
19/7/2009,,
20/7/2009,"http://www.marketwatch.com/story/spot-gold-down-140-to-94770troy-ounce,http://www.marketwatch.com/story/august-gold-ends-up-12-at-94880-an-ounce,https://economictimes.indiatimes.com/articleshow/4799774.cms","spot gold down $1.40 to $947.70/troy ounce,august gold ends up 1.2% at $948.80 an ounce,gold, silver firms up sharply on higher global cues"
21/7/2009,https://economictimes.indiatimes.com/articleshow/4803912.cms,"gold, silver react downwards on subdued demand"
22/7/2009,http://www.marketwatch.com/story/spot-gold-down-20-cents-at-95090barrel-2009-07-22,spot gold down 20 cents at $950.90/barrel
23/7/2009,"http://www.marketwatch.com/story/spot-gold-rises-1-to-949troy-ounce-2009-07-23,http://www.marketwatch.com/story/gold-futures-mildly-higher-after-jobs-data-2009-07-23,http://www.marketwatch.com/story/gold-prices-soar-to-fresh-six-week-highs-2009-07-23","spot gold rises $1 to $949/troy ounce,gold futures mildly higher after jobs data,gold prices hit fresh six-week highs as dollar index weakens"
24/7/2009,,
25/7/2009,,
26/7/2009,,
27/7/2009,http://www.marketwatch.com/story/gold-futures-up-300-at-95610-an-ounce-2009-07-27,gold futures up $3.00 at $956.10 an ounce
28/7/2009,http://www.marketwatch.com/story/gold-falls-pacing-losses-in-oil-2009-07-28,"gold falls, pacing losses in oil"
29/7/2009,http://www.marketwatch.com/story/august-gold-down-910-to-930-an-ounce-on-globex-2009-07-29,august gold down $9.10 to $930 an ounce on globex
30/7/2009,"http://www.marketwatch.com/story/canadian-shares-rally-led-by-oil-and-gold-2009-07-30,http://www.marketwatch.com/story/gold-rises-first-day-in-three-as-oil-rebounds-2009-07-30,http://www.marketwatch.com/story/gold-ends-up-08-at-93490-an-ounce-2009-07-30","canadian shares bounce back with oil, gold gains,gold rebounds as oil rallies, dollar weakens,gold ends up 0.8% at $934.90 an ounce"
31/7/2009,,
1/8/2009,https://economictimes.indiatimes.com/articleshow/4845750.cms,"gold surges on strong global cues, festive demand"
2/8/2009,,
3/8/2009,,
4/8/2009,"http://www.marketwatch.com/story/august-gold-ends-up-11-at-96750-an-ounce-2009-08-04,http://www.marketwatch.com/story/august-gold-falls-05-to-95190-an-ounce-2009-08-04","august gold ends up 1.1% at $967.50 an ounce,august gold falls 0.5% to $951.90 an ounce"
5/8/2009,http://www.marketwatch.com/story/september-gold-ends-down-330-at-96420oz-2009-08-05,correct: august gold ends down $3.30 at $964.20
6/8/2009,"http://www.marketwatch.com/story/gold-remains-higher-after-jobless-data-2009-08-06,http://www.marketwatch.com/story/gold-reverses-gains-down-01-to-96310-an-ounce-2009-08-06","gold remains higher after jobless data,gold reverses gains, down 0.1% to $963.10 an ounce"
7/8/2009,http://www.marketwatch.com/story/gold-down-on-upbeat-jobs-data-stronger-dollar-2009-08-07,"gold falls on upbeat jobs data, stronger dollar"
8/8/2009,https://economictimes.indiatimes.com/articleshow/4871306.cms,"gold falls on subdued demand, weak global trend"
9/8/2009,,
10/8/2009,,
11/8/2009,http://www.marketwatch.com/story/gold-rises-for-first-day-in-five-as-dollar-falls-2009-08-11,gold rises as dollar falls ahead of fed announcement
12/8/2009,http://www.marketwatch.com/story/gold-slightly-lower-as-investors-await-fed-2009-08-12,gold slightly lower as investors await fed
13/8/2009,,
14/8/2009,http://www.marketwatch.com/story/gold-falls-on-cpi-silver-retreats-from-highs-2009-08-14,gold falls on cpi data; silver retreats from two-month high
15/8/2009,,
16/8/2009,,
17/8/2009,"http://www.marketwatch.com/story/gold-futures-fall-as-dollar-rallies-2009-08-17,http://www.marketwatch.com/story/dec-gold-down-12-to-93750-an-ounce-on-globex-2009-08-17","gold, other metals fall as dollar rallies, stocks retreat,dec. gold down 1.2% to $937.50 an ounce on globex"
18/8/2009,http://www.marketwatch.com/story/spot-gold-up-220-at-94030troy-ounce-2009-08-18,spot gold up $2.20 at $940.30/troy ounce
19/8/2009,"http://www.marketwatch.com/story/us-stocks-pare-losses-as-crude-gold-turn-up-2009-08-19,http://www.marketwatch.com/story/december-gold-ends-up-560-at-94480-an-ounce-2009-08-19,http://www.marketwatch.com/story/gold-ends-higher-as-crude-oil-prices-jump-2009-08-19","u.s. stocks pare losses as crude, gold turn up,december gold ends up $5.60 at $944.80 an ounce,gold ends higher as crude oil prices jump"
20/8/2009,"https://economictimes.indiatimes.com/articleshow/4913011.cms,http://www.marketwatch.com/story/gold-down-36-or-04-at-94110oz-after-data-2009-08-20","fall in gold prices may increase demand,gold down $3.6, or 0.4%, at $941.10/oz after data"
21/8/2009,http://www.marketwatch.com/story/canadian-shares-rise-as-gold-miners-rally-2009-08-21,canadian shares gain as gold miners rally
22/8/2009,,
23/8/2009,,
24/8/2009,http://www.marketwatch.com/story/dec-gold-turns-lower-down-03-as-dollar-rises-2009-08-24,"dec. gold turns lower, down 0.3% as dollar rises"
25/8/2009,,
26/8/2009,"http://www.marketwatch.com/story/gold-falls-as-dollar-rises-etf-holdings-decline-2009-08-26,http://www.marketwatch.com/story/sino-gold-endorses-eldorado-takeover-2009-08-26","gold falls as dollar strengthens, etf holdings decline,sino gold endorses $1.9 billion takeover by eldorado gold"
27/8/2009,http://www.marketwatch.com/story/gold-futures-down-80c-at-94500-an-ounce-2009-08-27,gold futures down 80c at $945.00 an ounce
28/8/2009,,
29/8/2009,,
30/8/2009,,
31/8/2009,"https://economictimes.indiatimes.com/articleshow/4954940.cms,http://www.marketwatch.com/story/dec-gold-falls-06-to-end-at-95350-an-ounce-2009-08-31","gold maintains an upward march on firm global cues,dec. gold falls 0.6% to end at $953.50 an ounce"
1/9/2009,https://economictimes.indiatimes.com/articleshow/4960329.cms,"gold reacts downwards, silver recovers"
2/9/2009,,
3/9/2009,http://www.marketwatch.com/story/dec-gold-rises-2-to-99770-an-ounce-2009-09-03,dec. gold rises 2% to $997.70 an ounce
4/9/2009,,
5/9/2009,,
6/9/2009,,
7/9/2009,"http://www.marketwatch.com/story/gold-taps-1000-for-first-time-since-february-2009-09-07,http://www.marketwatch.com/story/gold-bugs-brace-amid-re-test-of-1000-level-2009-09-07","gold taps $1,000 for first time since february,gold bugs brace, as metal tests $1,000 again"
8/9/2009,"http://www.marketwatch.com/story/gold-futures-up-850-at-100520-an-ounce-2009-09-08,https://economictimes.indiatimes.com/articleshow/4985730.cms,http://www.marketwatch.com/story/gold-futures-up-630-at-1003oz-on-globex-2009-09-08,https://economictimes.indiatimes.com/articleshow/4985617.cms,http://www.marketwatch.com/story/gold-reverses-gains-down-01-to-99540-an-ounce-2009-09-08,http://www.marketwatch.com/story/gold-ends-below-1000-after-hitting-18-month-high-2009-09-08","gold futures up $8.50 at $1,005.20 an ounce,gold opens to set new peak at rs 16,100 on firm global cues,gold futures up $6.30 at $1,003/oz on globex,what's behind the gold price surge,gold reverses gains, down 0.1% to $995.40 an ounce,gold ends below $1,000"
9/9/2009,,
10/9/2009,http://www.marketwatch.com/story/gold-falls-for-second-day-after-jobless-data-2009-09-10,gold falls for second day after jobless data
11/9/2009,http://www.marketwatch.com/story/gold-surges-to-new-record-as-dollar-slumps-2009-09-11,"gold ends at record high of $1,004 as dollar weakens"
12/9/2009,,
13/9/2009,https://economictimes.indiatimes.com/articleshow/5004674.cms,gold gains on investment buying
14/9/2009,http://www.marketwatch.com/story/some-gold-bugs-still-cautious-despite-rally-2009-09-14,"gold through $1000, but not in the clear?"
15/9/2009,,
16/9/2009,,
17/9/2009,"https://economictimes.indiatimes.com/articleshow/5023055.cms,http://www.marketwatch.com/story/gold-futures-up-200-at-102220-an-ounce-2009-09-17,http://www.marketwatch.com/story/gold-backs-off-from-18-month-high-2009-09-17","gold buyers flocking to market despite high prices,gold futures up $2.00 at $1,022.20 an ounce,gold dips after climbing to new 18-month high"
18/9/2009,http://www.marketwatch.com/story/gold-futures-turn-lower-as-dollar-firms-2009-09-18,gold futures turn lower as dollar firms
19/9/2009,,
20/9/2009,https://economictimes.indiatimes.com/articleshow/5033156.cms,"gold to hover around rs 16,000 this week"
21/9/2009,"http://www.marketwatch.com/story/spot-gold-gains-150-to-100450troy-ounce-2009-09-21,https://economictimes.indiatimes.com/articleshow/5039847.cms,https://economictimes.indiatimes.com/articleshow/5038182.cms","spot gold gains $1.50 to $1,004.50/troy ounce,gold, silver slip on lower global cues,precious metals tumble on concerns over imf gold sale"
22/9/2009,,
23/9/2009,,
24/9/2009,http://www.marketwatch.com/story/dec-gold-rises-02-to-101650-an-ounce-2009-09-24,"dec. gold rises 0.2% to $1,016.50 an ounce"
25/9/2009,,
26/9/2009,,
27/9/2009,,
28/9/2009,http://www.marketwatch.com/story/gold-ends-off-highs-amid-dollar-gyrations-2009-09-28,gold ends off highs amid dollar gyrations
29/9/2009,,
30/9/2009,"https://economictimes.indiatimes.com/articleshow/5070389.cms,http://www.marketwatch.com/story/dec-gold-ends-up-15-at-100930-an-ounce-2009-09-30","gold lags equities, still long-term favourite,dec. gold ends up 1.5% at $1,009.30 an ounce"
1/10/2009,,
2/10/2009,,
3/10/2009,,
4/10/2009,,
5/10/2009,"http://www.marketwatch.com/story/dec-gold-ends-up-13-at-101780-an-ounce-2009-10-05,http://www.marketwatch.com/story/gold-rises-for-second-day-on-weaker-dollar-2009-10-05","dec. gold ends up 1.3% at $1,017.80 an ounce,gold rises for second day as dollar resumes decline"
6/10/2009,"http://www.marketwatch.com/story/gold-etf-rises-to-all-time-high-2009-10-06,http://www.marketwatch.com/story/gold-hits-record-high-as-dollar-slumps-2009-10-06-16103510,http://www.marketwatch.com/story/gold-hits-new-record-high-at-103620-an-ounce-2009-10-06","gold etf rises to all-time high,gold hits record $1,045 on report of dollar's demise,gold hits new record high at $1,036.20 an ounce"
7/10/2009,"http://www.marketwatch.com/story/dec-gold-up-670-at-105110oz-on-globex-2009-10-07,http://www.marketwatch.com/story/golds-rise-in-euro-pound-muted-as-buck-drops-2009-10-07,http://www.marketwatch.com/story/gold-hits-new-high-on-rising-investment-demand-2009-10-07,http://www.marketwatch.com/story/slim-toronto-gains-as-gold-dollar-affect-trading-2009-10-07,http://www.marketwatch.com/story/gold-futures-hit-fresh-high-in-electronic-trading-2009-10-07","dec. gold up $6.70 at $1,051.10/oz on globex,gold loses luster when priced in euros, pounds, aussies,gold hits new high on rising investment demand,gold leads toronto up but gains remain muted,gold futures hit fresh high in electronic trading"
8/10/2009,http://www.marketwatch.com/story/oct-gold-up-1-at-105350-a-front-month-record-2009-10-08,"oct. gold up 1% at $1,053.50, a front-month record"
9/10/2009,http://www.marketwatch.com/story/gold-futures-end-lower-after-record-week-2009-10-09,gold futures end lower after record week
10/10/2009,https://economictimes.indiatimes.com/articleshow/5108675.cms,forex reserves rise $430 mn on back of surge in gold prices
11/10/2009,,
12/10/2009,"http://www.marketwatch.com/story/gold-futures-up-410-at-105270-an-ounce-2009-10-12,http://www.marketwatch.com/story/speculation-in-gold-futures-hits-record-high-2009-10-12","gold futures up $4.10 at $1,052.70 an ounce,high speculative positions in gold raise sell-off worries"
13/10/2009,http://www.marketwatch.com/story/gold-hits-new-high-on-rising-oil-weaker-dollar-2009-10-13,"gold hits new high on rising oil, weaker dollar"
14/10/2009,http://www.marketwatch.com/story/gold-retreats-after-hitting-new-high-2009-10-14,gold retreats after hitting new high
15/10/2009,"http://www.marketwatch.com/story/dec-gold-up-250-at-105310oz-on-globex-2009-10-15,http://www.marketwatch.com/story/gold-falls-as-dollar-rebounds-vs-most-rivals-2009-10-15","dec. gold up $2.50 at $1,053.10/oz on globex,gold falls as dollar rebounds vs. most rivals"
16/10/2009,http://www.marketwatch.com/story/gold-futures-down-190-at-104870-2009-10-16,"gold futures down $1.90 at $1,048.70"
17/10/2009,,
18/10/2009,,
19/10/2009,"http://www.marketwatch.com/story/december-gold-ends-up-06-at-105730-an-ounce-2009-10-19,https://economictimes.indiatimes.com/articleshow/5138964.cms","december gold ends up 0.6% at $1,058.10,silver falls by rs 225, gold down by rs 20"
20/10/2009,,
21/10/2009,"http://www.marketwatch.com/story/gold-futures-down-280-at-105580-an-ounce-2009-10-21,http://www.marketwatch.com/story/gold-other-metals-close-higher-as-dollar-drops-2009-10-21","gold futures down $2.80 at $1,055.80 an ounce,gold, other metals close higher as dollar drops"
22/10/2009,http://www.marketwatch.com/story/gold-futures-down-1000-at-105450-an-ounce-2009-10-22,"gold futures down $10.00 at $1,054.50 an ounce"
23/10/2009,,
24/10/2009,,
25/10/2009,,
26/10/2009,http://www.marketwatch.com/story/gold-futures-fall-640-to-1050oz-2009-10-26,"gold futures fall $6.40 to $1,050/oz"
27/10/2009,"http://www.marketwatch.com/story/december-gold-loses-660-to-1036-an-ounce-2009-10-27,http://www.marketwatch.com/story/gold-futures-close-near-1035-as-dollar-rises-2009-10-27","december gold loses $6.60 to $1,036 an ounce,gold futures close near $1,035 as dollar rises"
28/10/2009,"http://www.marketwatch.com/story/gold-futures-remain-lower-after-durable-goods-2009-10-28,http://www.marketwatch.com/story/dec-gold-down-210-at-102840oz-on-globex-2009-10-28","gold futures remain lower after durable goods,dec. gold down $2.10 at $1,028.40/oz on globex"
29/10/2009,http://www.marketwatch.com/story/gold-futures-up-04-after-jobs-claims-data-2009-10-29,"gold futures up 0.4% after jobs, claims data"
30/10/2009,"http://www.marketwatch.com/story/gold-ends-down-on-the-day-but-rises-in-october-2009-10-30,http://www.marketwatch.com/story/gold-loss-moderates-after-consumer-sentiment-rise-2009-10-30","gold ends down on the day but rises in october,gold loss moderates after consumer sentiment rise"
31/10/2009,,
1/11/2009,,
2/11/2009,"http://www.marketwatch.com/story/gold-ends-above-1050-after-global-upbeat-data-2009-11-02,http://www.marketwatch.com/story/gold-futures-add-to-gains-after-ism-housing-data-2009-11-02","gold futures end above $1,060 an ounce as dollar falls,gold futures add to gains after ism, housing data"
3/11/2009,"http://www.marketwatch.com/story/gold-futures-hit-new-record-high-near-1080-2009-11-03,http://www.marketwatch.com/story/gold-futures-add-to-gains-up-630-at-10603oz-2009-11-03,https://economictimes.indiatimes.com/markets/forex/india-still-likes-dollars-despite-buying-gold-fm/articleshow/5193280.cms,http://www.marketwatch.com/story/gold-futures-add-to-gains-after-factory-orders-2009-11-03,http://www.marketwatch.com/story/gold-futures-close-above-1084-at-new-record-2009-11-03","gold futures hit new record high near $1,080,gold futures add to gains, up $6.30 at $1,060.3/oz,india still likes dollars despite buying gold: fm,gold futures add to gains after factory orders,gold breaches new record above $1,084 an ounce"
4/11/2009,,
5/11/2009,http://www.marketwatch.com/story/dec-gold-climbs-220-to-109150oz-on-globex-2009-11-05,"dec. gold climbs $2.20 to $1,091.50/oz on globex"
6/11/2009,"http://www.marketwatch.com/story/gold-may-be-flying-but-this-gold-stocks-a-turkey-2009-11-06,http://www.marketwatch.com/story/canada-stocks-shake-off-losses-as-gold-rises-2009-11-06,https://economictimes.indiatimes.com/markets/stocks/recos/investors-must-continue-to-have-gold-in-their-portfolio-merrill-lynch-wealth-management/articleshow/5203050.cms,http://www.marketwatch.com/story/december-gold-ends-at-109570-up-06-2009-11-06,http://www.marketwatch.com/story/gold-hits-1100-an-ounce-as-unemployment-worsens-2009-11-06","gold may be flying, but this gold stock's a turkey,gains in gold stocks pull benchmark out of the red,investors must continue to have gold in their portfolio: merrill lynch wealth management,december gold ends at $1,095.70, up 0.6%,gold hits $1,100 an ounce as unemployment worsens"
7/11/2009,https://economictimes.indiatimes.com/articleshow/5205038.cms,rbi may've sold us t-bills to buy gold
8/11/2009,,
9/11/2009,http://www.marketwatch.com/story/gold-futures-close-at-new-highs-atop-1100ounce-2009-11-09,"gold futures close at new highs atop $1,100/ounce"
10/11/2009,http://www.marketwatch.com/story/gold-futures-up-90c-at-110220-an-ounce-2009-11-10,"gold futures up 90c at $1,102.20 an ounce"
11/11/2009,http://www.marketwatch.com/story/dec-gold-hits-fresh-record-of-112090-on-globex-2009-11-11,"dec. gold hits fresh record of $1,120.90 on globex"
12/11/2009,,
13/11/2009,,
14/11/2009,,
15/11/2009,http://www.marketwatch.com/story/dec-gold-taps-fresh-high-of-112790-on-globex-2009-11-15,"dec. gold taps fresh high of $1,127.90 on globex"
16/11/2009,,
17/11/2009,"https://economictimes.indiatimes.com/articleshow/5240370.cms,http://www.marketwatch.com/story/november-gold-futures-end-at-new-record-2009-11-17","gold, silver hit new historic highs,november gold futures end at new record"
18/11/2009,https://economictimes.indiatimes.com/articleshow/5241567.cms,"gold, silver hit historic highs on global demand"
19/11/2009,"https://economictimes.indiatimes.com/articleshow/5245494.cms,http://www.marketwatch.com/story/gold-futures-down-5-at-11362oz-after-data-2009-11-19","gold zooms to a new high of rs 17,205,gold futures down $5 at $1,136.2/oz after data"
20/11/2009,https://economictimes.indiatimes.com/articleshow/5251547.cms,"gold surges to rs 17,500 per 10 gm"
21/11/2009,https://economictimes.indiatimes.com/articleshow/5255691.cms,govt should implement uniform gold rates across india'
22/11/2009,http://www.marketwatch.com/story/dec-gold-up-11-at-115780oz-after-1159-high-2009-11-22,"dec. gold up $11 at $1,157.80/oz after $1,159 high"
23/11/2009,http://www.marketwatch.com/story/dec-gold-gains-30-cents-to-1165oz-on-globex-2009-11-23,"dec. gold gains 30 cents to $1,165/oz on globex"
24/11/2009,"http://www.marketwatch.com/story/gold-futures-extend-gains-into-an-eighth-session-2009-11-24,http://www.marketwatch.com/story/gold-ends-slightly-higher-on-investment-demand-2009-11-24","gold futures extend gains into an eighth session,gold ends slightly higher on investment demand"
25/11/2009,"http://www.marketwatch.com/story/dec-gold-ends-up-18-at-1187-an-ounce-2009-11-25,http://www.marketwatch.com/story/dec-gold-hits-1185-an-ounce-new-record-2009-11-25,http://www.marketwatch.com/story/gold-futures-top-1187oz-heading-into-close-2009-11-25","dec. gold ends up 1.8% at $1187 an ounce,dec. gold hits $1,185 an ounce, new record,gold futures top $1,187/oz heading into close"
26/11/2009,https://economictimes.indiatimes.com/articleshow/5272001.cms,"gold closes above rs 18,000-level on strong global cues"
27/11/2009,"http://www.marketwatch.com/story/behind-golds-flash-oils-a-true-performer-2009-11-27,http://www.marketwatch.com/story/gold-futures-down-3140-at-115560-an-ounce-2009-11-27,http://www.marketwatch.com/story/dec-gold-ends-down-11-at-117420-an-ounce-2009-11-27,http://www.marketwatch.com/story/dec-gold-falls-550-to-118150oz-on-globex-2009-11-27","hiding behind gold's flashy moves, oil's the true performer,gold futures down $31.40 at $1,155.60 an ounce,dec. gold ends down 1.1% at $1,174.20 an ounce,dec. gold falls $5.50 to $1,181.50/oz on globex"
28/11/2009,,
29/11/2009,,
30/11/2009,"http://www.marketwatch.com/story/dec-gold-falls-360-yo-117750oz-on-globex-2009-11-30,http://www.marketwatch.com/story/gold-up-06-to-118130-an-ounce-2009-11-30,http://www.marketwatch.com/story/dec-gold-slides-02-to-117210-an-ounce-2009-11-30","dec. gold falls $3.60 yo $1,177.50/oz on globex,gold up 0.6% to $1,181.30 an ounce,dec. gold slides 0.2% to $1,172.10 an ounce"
1/12/2009,,
2/12/2009,"http://www.marketwatch.com/story/gold-futures-up-1220-at-121240-an-ounce-2009-12-02,http://www.marketwatch.com/story/feds-bullard-oil-gold-spike-not-inflationary-2009-12-02,http://www.marketwatch.com/story/gold-rises-1-to-121130-after-jobs-data-2009-12-02,http://www.marketwatch.com/story/gold-taps-more-records-nears-1225-on-globex-2009-12-02-203670,http://www.marketwatch.com/story/feds-bullard-oil-and-gold-gains-not-inflationary-2009-12-02,http://www.marketwatch.com/story/dec-gold-ends-up-11-at-1212-an-ounce-2009-12-02","gold futures up $12.20 at $1,212.40 an ounce,fed's bullard - oil, gold spike not inflationary,gold rises 1% to $1,211.30 after jobs data,gold taps more records, nears $1,225 on globex,fed's bullard: oil and gold gains not inflationary,dec. gold ends up 1.1% at $1,212 an ounce"
3/12/2009,,
4/12/2009,https://economictimes.indiatimes.com/articleshow/5297902.cms,"gold touches new high overseas, dips a tad here"
5/12/2009,,
6/12/2009,,
7/12/2009,http://www.marketwatch.com/story/gold-pares-losses-down-15-as-bernanke-speaks-2009-12-07,"gold pares losses, down 1.5% as bernanke speaks"
8/12/2009,http://www.marketwatch.com/story/dec-gold-falls-09-to-115250-an-ounce-2009-12-08,"dec. gold falls 0.9% to $1,152.50 an ounce"
9/12/2009,,
10/12/2009,https://economictimes.indiatimes.com/articleshow/5323624.cms,"gold declines on stockists selling, silver tumbles"
11/12/2009,,
12/12/2009,,
13/12/2009,"http://www.marketwatch.com/story/jan-gold-last-at-112350oz-on-globex-up-360-2009-12-13,http://www.marketwatch.com/story/jan-gold-moves-up-on-globex-after-earlier-losses-2009-12-13","jan. gold last at $1,123.50/oz on globex, up $3.60,jan. gold moves up on globex after earlier losses"
14/12/2009,"https://economictimes.indiatimes.com/articleshow/5335103.cms,http://www.marketwatch.com/story/gold-futures-up-460-at-112450-an-ounce-2009-12-14","india's gold retailers jump on the 'brandwagon',gold futures up $4.60 at $1,124.50 an ounce"
15/12/2009,http://www.marketwatch.com/story/gold-ends-down-on-talk-of-tighter-fed-policy-2009-12-15,gold futures drop as fed policy comes into focus
16/12/2009,"http://www.marketwatch.com/story/feb-gold-rises-to-1137-from-11362-2009-12-16,http://www.marketwatch.com/story/february-gold-up-08-at-113190-2009-12-16","feb. gold rises to $1,137 from $1,136.2,february gold up 0.8% at $1,131.90"
17/12/2009,,
18/12/2009,,
19/12/2009,,
20/12/2009,,
21/12/2009,,
22/12/2009,"http://www.marketwatch.com/story/feb-gold-falls-08-to-108750-an-ounce-2009-12-22,http://www.marketwatch.com/story/crude-gold-reduce-gains-after-us-gdp-2009-12-22,http://www.marketwatch.com/story/gold-falls-on-higher-dollar-after-us-home-sales-2009-12-22","feb. gold falls 0.8% to $1,087.50 an ounce,crude, gold reduce gains after u.s. gdp,gold falls on higher dollar after u.s. home sales"
23/12/2009,http://www.marketwatch.com/story/gold-futures-down-180-at-108510-an-ounce-2009-12-23,"gold futures down $1.80 at $1,085.10 an ounce"
24/12/2009,"https://economictimes.indiatimes.com/articleshow/5375050.cms,http://www.marketwatch.com/story/gold-rises-on-weaker-dollar-2009-12-24","gold, silver show sharp recovery on fresh buying,gold rises on weaker dollar"
25/12/2009,,
26/12/2009,,
27/12/2009,,
28/12/2009,,
29/12/2009,https://economictimes.indiatimes.com/articleshow/5390058.cms,"dip in dollar drives gold, other metals higher"
30/12/2009,http://www.marketwatch.com/story/crude-gold-stable-after-chicago-pmi-2009-12-30,"crude, gold stable after chicago pmi"
31/12/2009,"http://www.marketwatch.com/story/gold-up-on-weaker-dollar-to-mark-9th-yearly-gain-2009-12-31,http://www.marketwatch.com/story/gold-rises-on-dollar-to-make-9th-yearly-gain-2009-12-31","gold up on weaker dollar to mark 9th yearly gain,gold rises as dollar weakens, making ninth yearly gain"
1/1/2010,,
2/1/2010,,
3/1/2010,,
4/1/2010,,
5/1/2010,,
6/1/2010,"http://www.marketwatch.com/story/gold-rises-for-fourth-day-on-inflation-worries-2010-01-06-1355290,http://www.marketwatch.com/story/gold-steady-after-ism-data-up-11-at-113060-2010-01-06","gold rises for fourth day on inflation worries,gold steady after ism data, up 1.1% at $1,130.60"
7/1/2010,"http://www.marketwatch.com/story/falling-correlations-said-bullish-for-us-stocks-2010-01-07,http://www.marketwatch.com/story/feb-gold-falls-480-to-112890oz-on-globex-2010-01-07,https://economictimes.indiatimes.com/articleshow/5418474.cms","u.s. stocks not looking for synergy with gold, other assets,feb. gold falls $4.80 to $1,128.90/oz on globex,china sends gold prices soaring"
8/1/2010,"http://www.marketwatch.com/story/gold-lost-1-to-112180-an-ounce-2010-01-08,https://economictimes.indiatimes.com/articleshow/5424950.cms","gold lost 1% to $1,121.80 an ounce,gold declines on profit-selling"
9/1/2010,,
10/1/2010,,
11/1/2010,,
12/1/2010,,
13/1/2010,"http://www.marketwatch.com/story/feb-gold-ends-up-740-at-113680-an-ounce-2010-01-13,http://www.marketwatch.com/story/gold-futures-up-250-at-113190-an-ounce-2010-01-13","feb. gold ends up $7.40 at $1,136.80 an ounce,gold futures up $2.50 at $1,131.90 an ounce"
14/1/2010,http://www.marketwatch.com/story/gold-ends-higher-after-volatile-session-2010-01-14,"gold futures gain as u.s. data, trichet move dollar"
15/1/2010,,
16/1/2010,,
17/1/2010,,
18/1/2010,http://www.marketwatch.com/story/spot-gold-rises-610-to-113880troy-ounce-2010-01-18,"spot gold rises $6.10 to $1,138.80/troy ounce"
19/1/2010,http://www.marketwatch.com/story/gold-ends-up-08-platinum-palladium-rally-2010-01-19,"gold ends up 0.8%; platinum, palladium rally"
20/1/2010,"https://economictimes.indiatimes.com/articleshow/5481762.cms,http://www.marketwatch.com/story/gold-copper-slide-on-china-worries-2010-01-20,http://www.marketwatch.com/story/feb-gold-ends-down-2740-at-111260-an-ounce-2010-01-20","gold, silver advance on mild demand,gold and copper slump on china worries,feb. gold ends down $27.40 at $1,112.60 an ounce"
21/1/2010,"http://www.marketwatch.com/story/gold-losses-moderate-after-philly-fed-lei-data-2010-01-21,http://www.marketwatch.com/story/feb-gold-at-three-week-low-down-10-on-globex-2010-01-21,http://www.marketwatch.com/story/gold-extends-loss-into-second-session-2010-01-21,http://www.marketwatch.com/story/feb-gold-loses-94-to-end-at-11032oz-2010-01-21","gold losses moderate after philly fed, lei data,feb. gold at three-week low, down $10 on globex,gold extends loss into second session,feb. gold loses $9.4 to end at $1,103.2/oz"
22/1/2010,,
23/1/2010,,
24/1/2010,,
25/1/2010,,
26/1/2010,http://www.marketwatch.com/story/feb-gold-gains-10-cents-to-109840oz-on-globex-2010-01-26,"feb. gold gains 10 cents to $1,098.40/oz on globex"
27/1/2010,http://www.marketwatch.com/story/feb-gold-rises-340-to-108790oz-on-globex-2010-01-27,"feb. gold rises $3.40 to $1,087.90/oz on globex"
28/1/2010,https://economictimes.indiatimes.com/articleshow/5510244.cms,gold prices drop further on heavy stockists offloading
29/1/2010,,
30/1/2010,,
31/1/2010,,
1/2/2010,,
2/2/2010,,
3/2/2010,"http://www.marketwatch.com/story/gold-dips-pausing-after-two-day-rally-2010-02-03,http://www.marketwatch.com/story/gold-futures-up-270-at-112070-an-ounce-2010-02-03","gold dips, dollar gains as markets pause after two-day rally,gold futures up $2.70 at $1,120.70 an ounce"
4/2/2010,,
5/2/2010,,
6/2/2010,,
7/2/2010,,
8/2/2010,https://economictimes.indiatimes.com/articleshow/5546454.cms,"gold, rupee, crude give equities company in trip down bear st"
9/2/2010,,
10/2/2010,"http://www.marketwatch.com/story/gold-ends-lower-as-dollar-firms-on-greek-delay-2010-02-10,http://www.marketwatch.com/story/gold-slips-as-greek-rescue-delay-lifts-dollar-2010-02-10","gold ends lower as dollar firms on greek delay,gold slips as delay in greece aid plan lifts dollar"
11/2/2010,"http://www.marketwatch.com/story/april-gold-climbs-30-cents-to-1095oz-on-globex-2010-02-11,http://www.marketwatch.com/story/crude-gold-stay-up-after-jobless-claims-2010-02-11","april gold climbs 30 cents to $1,095/oz on globex,crude, gold stay up after jobless claims"
12/2/2010,,
13/2/2010,,
14/2/2010,,
15/2/2010,"https://economictimes.indiatimes.com/articleshow/5576257.cms,http://www.marketwatch.com/story/april-gold-climbs-10-to-1100oz-on-globex-2010-02-15","gold gains on positive global cues, buying support,april gold climbs $10 to $1,100/oz on globex"
16/2/2010,http://www.marketwatch.com/story/fridays-drop-in-gold-futures-2010-02-16,friday's drop in gold futures
17/2/2010,,
18/2/2010,,
19/2/2010,http://www.marketwatch.com/story/investors-returning-to-popular-gold-etf-2010-02-19,inflows in spdr gold etf shows demand rising for gold
20/2/2010,,
21/2/2010,,
22/2/2010,,
23/2/2010,"http://www.marketwatch.com/story/gold-fields-says-production-to-be-5-shy-of-goal-2010-02-23,http://www.marketwatch.com/story/gold-inches-down-as-dollar-gains-2010-02-23","gold fields says production to be 5% shy of goal,gold inches down as dollar gains"
24/2/2010,,
25/2/2010,"http://www.marketwatch.com/story/australian-shares-edge-up-boosted-by-gold-miners-2010-02-25,http://www.marketwatch.com/story/gold-closed-up-1130-to-110850oz-2010-02-25,http://www.marketwatch.com/story/gold-down-a-fourth-day-as-dollar-rises-2010-02-25","australian shares edge up, boosted by gold miners,gold closed up $11.30 to $1,108.50/oz.,gold down a fourth day as dollar rises"
26/2/2010,,
27/2/2010,,
28/2/2010,,
1/3/2010,,
2/3/2010,http://www.marketwatch.com/story/gold-rises-17-to-six-week-high-as-dollar-slides-2010-03-02,gold jumps to six-week high as euro gains on dollar
3/3/2010,"http://www.marketwatch.com/story/april-gold-falls-360-to-113970oz-on-globex-2010-03-03,http://www.marketwatch.com/story/gold-closes-at-114330oz-up-590-2010-03-03","april gold falls $3.60 to $1,139.70/oz on globex,gold closes at $1,143.30/oz., up $5.90"
4/3/2010,,
5/3/2010,,
6/3/2010,,
7/3/2010,,
8/3/2010,"http://www.marketwatch.com/story/april-gold-falls-20-cents-to-112380oz-on-globe-2010-03-08,http://www.marketwatch.com/story/gold-dips-as-dollar-finds-some-support-2010-03-08","april gold falls 20 cents to $1,123.80/oz on globe,gold dips as dollar finds some support"
9/3/2010,"http://www.marketwatch.com/story/china-not-too-keen-on-gold-says-forex-chief-2010-03-09,http://www.marketwatch.com/story/gold-extends-slide-to-close-lower-a-second-day-2010-03-09,https://economictimes.indiatimes.com/articleshow/5663554.cms","china's forex chief not too keen on gold as investment,gold extends slide to close lower a second day,gold falls below rs 17k-mark on negative global cues, selling"
10/3/2010,http://www.marketwatch.com/story/gold-copper-rise-after-strong-chinese-data-2010-03-10,"gold, copper rise after strong chinese data"
11/3/2010,"http://www.marketwatch.com/story/copper-gold-end-with-slight-gains-2010-03-11,http://www.marketwatch.com/story/crude-oil-gold-lower-after-jobless-trade-data-2010-03-11","copper, gold end with slight gains,crude oil, gold lower after jobless, trade data"
12/3/2010,http://www.marketwatch.com/story/crude-gold-off-highs-after-us-sentiment-data-2010-03-12,"crude, gold off highs after u.s. sentiment data"
13/3/2010,,
14/3/2010,,
15/3/2010,http://www.marketwatch.com/story/april-gold-climbs-430-to-110970oz-on-globex-2010-03-15,"april gold climbs $4.30 to $1,109.70/oz on globex"
16/3/2010,http://www.marketwatch.com/story/april-gold-gains-530-to-112780oz-on-globex-2010-03-16,"april gold gains $5.30 to $1,127.80/oz on globex"
17/3/2010,,
18/3/2010,"http://www.marketwatch.com/story/gold-futures-end-higher-at-112750oz-2010-03-18,http://www.marketwatch.com/story/gold-futures-down-280-at-112140-an-ounce-2010-03-18","gold futures end higher at $1,127.50/oz,gold futures down $2.80 at $1,121.40 an ounce"
19/3/2010,http://www.marketwatch.com/story/gold-futures-down-360-at-112390-an-ounce-2010-03-19,"gold futures down $3.60 at $1,123.90 an ounce"
20/3/2010,,
21/3/2010,,
22/3/2010,http://www.marketwatch.com/story/gold-below-1100oz-on-continued-dollar-strength-2010-03-22,"gold below $1,100/oz on continued dollar strength"
23/3/2010,"http://www.marketwatch.com/story/gold-finishes-higher-at-110370oz-2010-03-23,http://www.marketwatch.com/story/gold-reverses-course-higher-after-housing-data-2010-03-23","gold finishes higher at $1,103.70/oz,gold reverses course, higher after housing data"
24/3/2010,,
25/3/2010,"http://www.marketwatch.com/story/gold-futures-up-450-at-109340-an-ounce-2010-03-25,http://www.marketwatch.com/story/gold-up-470-or-04-at-109410-an-ounce-2010-03-25","gold futures up $4.50 at $1,093.40 an ounce,gold up $4.70, or 0.4%, at $1,094.10 an ounce"
26/3/2010,,
27/3/2010,,
28/3/2010,,
29/3/2010,http://www.marketwatch.com/story/china-gold-demand-to-double-in-10-yrs-trade-group-2010-03-29,china gold demand to double in 10 yrs: trade group
30/3/2010,"http://www.marketwatch.com/story/gold-futures-open-70-cents-lower-on-nymex-2010-03-30,http://www.marketwatch.com/story/gold-ends-lower-on-rising-dollar-2010-03-30,http://www.marketwatch.com/story/gold-futures-open-slightly-lower-on-view-of-rates-2010-03-30","gold futures open 70 cents lower on nymex,gold ends lower on rising dollar,gold futures open slightly lower on view of rates"
31/3/2010,"http://www.marketwatch.com/story/gold-futures-add-to-gains-after-adp-data-2010-03-31,http://www.marketwatch.com/story/june-gold-adds-880-to-close-at-111450oz-2010-03-31,http://www.marketwatch.com/story/gold-futures-up-470-at-110920-an-ounce-2010-03-31","gold futures add to gains after adp data,june gold adds $8.80 to close at $1114.50/oz,gold futures up $4.70 at $1,109.20 an ounce"
1/4/2010,http://www.marketwatch.com/story/oil-gold-add-to-gains-following-ism-data-2010-04-01,"oil, gold add to gains following ism data"
2/4/2010,,
3/4/2010,,
4/4/2010,,
5/4/2010,,
6/4/2010,,
7/4/2010,http://www.marketwatch.com/story/gold-climbs-to-highest-since-jan-ignoring-dollar-2010-04-07,"gold climbs to highest since jan, ignoring dollar"
8/4/2010,http://www.marketwatch.com/story/gold-settles-lower-t-115290-an-ounce-2010-04-08,"gold settles lower t $1,152.90 an ounce"
9/4/2010,http://www.marketwatch.com/story/gold-settles-at-116190oz-highest-since-dec-2010-04-09,"gold settles at $1,161.90/oz, highest since dec"
10/4/2010,,
11/4/2010,,
12/4/2010,"http://www.marketwatch.com/story/winning-week-leaves-gold-bugs-wary-2010-04-12,http://www.marketwatch.com/story/gold-prices-reverse-trend-to-move-slightly-higher-2010-04-12","winning week for gold leaves bugs hopeful, wary,gold prices reverse trend to move slightly higher"
13/4/2010,"http://www.marketwatch.com/story/crude-oil-gold-stay-lower-after-trade-data-2010-04-13,http://www.marketwatch.com/story/gold-ends-lower-as-investors-trim-exposure-2010-04-13","crude oil, gold stay lower after trade data,gold ends lower as investors trim exposure"
14/4/2010,"http://www.marketwatch.com/story/gold-futures-at-highest-since-early-december-2010-04-14,http://www.marketwatch.com/story/gold-ends-05-higher-at-115960-an-ounce-2010-04-14,http://www.marketwatch.com/story/gold-oil-hold-on-to-gains-post-bernanke-2010-04-14,http://www.marketwatch.com/story/crude-oil-gold-add-to-gains-after-bernanke-data-2010-04-14,http://www.marketwatch.com/story/gold-futures-up-06-at-116090-an-ounce-2010-04-14","gold futures at highest since early december,gold ends 0.5% higher, at $1,159.60 an ounce,gold, oil hold on to gains post bernanke,crude oil, gold add to gains after bernanke, data,gold futures up 0.6% at $1,160.90 an ounce"
15/4/2010,"http://www.marketwatch.com/story/june-gold-gains-30-cents-to-116060oz-on-globex-2010-04-15,http://www.marketwatch.com/story/gold-futures-hold-decline-after-mixed-data-2010-04-15,http://www.marketwatch.com/story/gold-ends-higher-on-safe-haven-appeal-2010-04-15","june gold gains 30 cents to $1,160.60/oz on globex,gold futures hold decline after mixed data,gold ends modestly higher on safe-haven buying"
16/4/2010,"http://www.marketwatch.com/story/june-gold-down-117-or-1-after-sentiment-data-2010-04-16,http://www.marketwatch.com/story/gold-down-2-as-goldman-news-sets-off-selling-wave-2010-04-16","june gold down $11.7, or 1%, after sentiment data,gold down 2% as goldman news sets off selling wave"
17/4/2010,,
18/4/2010,,
19/4/2010,,
20/4/2010,http://www.marketwatch.com/story/june-gold-rises-180-to-1141oz-on-globex-2010-04-20,"june gold rises $1.80 to $1,141/oz on globex"
21/4/2010,,
22/4/2010,"http://www.marketwatch.com/story/gold-futures-retain-losses-after-economic-data-2010-04-22,https://economictimes.indiatimes.com/markets/stocks/recos/volatility-in-gold-due-to-currency-motilal-oswal-securities-ltd/articleshow/5844786.cms","gold futures retain losses after economic data,volatility in gold due to currency: motilal oswal securities ltd"
23/4/2010,"http://www.marketwatch.com/story/gold-ends-higher-on-housing-data-bounce-2010-04-23,http://www.marketwatch.com/story/crude-higher-after-home-sales-gold-pares-losses-2010-04-23,http://www.marketwatch.com/story/gold-futures-down-340-at-113950-an-ounce-2010-04-23","gold ends higher on housing data bounce,crude higher after home sales; gold pares losses,gold futures down $3.40 at $1,139.50 an ounce"
24/4/2010,,
25/4/2010,,
26/4/2010,"http://www.marketwatch.com/story/gold-survives-goldman-sachs-bugs-rejoice-2010-04-26,http://www.marketwatch.com/story/gold-turns-lower-follows-other-commodities-2010-04-26,http://www.marketwatch.com/story/gold-changes-direction-turns-lower-at-115320-2010-04-26,http://www.marketwatch.com/story/gold-ends-modestly-higher-on-greece-worries-2010-04-26,http://www.marketwatch.com/story/gold-ends-higher-platinum-hits-multimonth-high-2010-04-26","gold survives goldman sachs,gold turns lower, follows other commodities,gold changes direction, turns lower at $1,153.20,gold futures inch up after seesaw session,gold ends higher, platinum hits multimonth high"
27/4/2010,"http://www.marketwatch.com/story/gold-changes-direction-post-gains-as-dollar-eases-2010-04-27,http://www.marketwatch.com/story/gold-futures-down-270-at-115130-an-ounce-2010-04-27,http://www.marketwatch.com/story/oil-gold-trim-losses-after-consumer-confidence-2010-04-27","gold changes direction, post gains as dollar eases,gold futures down $2.70 at $1,151.30 an ounce,oil, gold trim losses after consumer confidence"
28/4/2010,http://www.marketwatch.com/story/gold-gains-oil-falls-following-spain-ratings-cut-2010-04-28,"gold gains, oil falls following spain ratings cut"
29/4/2010,,
30/4/2010,,
1/5/2010,,
2/5/2010,,
3/5/2010,"http://www.marketwatch.com/story/crude-oil-gold-stay-up-after-income-data-2010-05-03,http://www.marketwatch.com/story/oil-gold-pare-gains-after-april-ism-factory-index-2010-05-03","crude oil, gold stay up after income data,oil, gold pare gains after april ism factory index"
4/5/2010,http://www.marketwatch.com/story/gold-still-at-5-month-high-but-trims-advance-2010-05-04,gold still at 5-month high but trims advance
5/5/2010,,
6/5/2010,"http://www.marketwatch.com/story/gold-at-120170-in-post-pit-electronic-trading-2010-05-06,http://www.marketwatch.com/story/gold-futures-up-300-at-117800-an-ounce-2010-05-06,http://www.marketwatch.com/story/gold-futures-edge-higher-after-ecb-rate-decision-2010-05-06","gold at $1,201.70 in post-pit, electronic trading,gold futures up $3.00 at $1,178.00 an ounce,gold futures edge higher after ecb rate decision"
7/5/2010,http://www.marketwatch.com/story/gold-futures-up-590-at-120340-2010-05-07,"gold futures up $5.90 at $1,203.40"
8/5/2010,,
9/5/2010,,
10/5/2010,http://www.marketwatch.com/story/gold-trims-losses-on-inflationary-concerns-2010-05-10,gold trims losses on inflationary concerns
11/5/2010,"http://www.marketwatch.com/story/gold-hits-five-month-highs-as-eu-plan-questioned-2010-05-11,http://www.marketwatch.com/story/gold-gains-accelerate-up-1970-at-12205oz-2010-05-11","gold hits five-month highs as eu plan questioned,gold gains accelerate; up $19.70 at $1220.5/oz"
12/5/2010,http://www.marketwatch.com/story/record-gold-high-hits-markets-and-jewelers-2010-05-12,record gold high hits markets and jewelers
13/5/2010,"http://www.marketwatch.com/story/this-week-in-mutual-funds-golds-fat-finger-2010-05-13,https://economictimes.indiatimes.com/articleshow/5926850.cms","this week in mutual funds: gold's fat finger,gold prices rising without support of dollar"
14/5/2010,"http://www.marketwatch.com/story/gold-turns-higher-at-1231-an-ounce-2010-05-14,http://www.marketwatch.com/story/gold-open-interest-hits-record-cme-2010-05-14","gold turns higher, at $1,231 an ounce,gold open interest hits record: cme"
15/5/2010,http://www.marketwatch.com/story/gold-vs-silver-ratio-2010-05-15,gold vs silver ratio
16/5/2010,"http://www.marketwatch.com/story/crude-pushing-70-on-strong-dollar-though-gold-up-2010-05-16,http://www.marketwatch.com/story/june-gold-rises-670-to-123450oz-on-globex-2010-05-16","crude pushing $70 on strong dollar, though gold up,june gold rises $6.70 to $1,234.50/oz on globex"
17/5/2010,"http://www.marketwatch.com/story/gold-bugs-are-cheerfully-rampant-2010-05-17,http://www.marketwatch.com/story/gold-posts-modest-gains-shakes-off-early-weakness-2010-05-17,http://www.marketwatch.com/story/gold-heads-lower-in-last-moments-of-pit-trading-2010-05-17","gold bugs rampant,gold posts modest gains, shakes off early weakness,gold heads lower in last moments of pit trading"
18/5/2010,,
19/5/2010,"http://www.marketwatch.com/story/gold-etf-on-track-for-biggest-loss-since-feb-2010-05-19,http://www.marketwatch.com/story/gold-etf-sheds-2-as-euro-rises-2010-05-19","gold etf on track for biggest loss since feb.,gold etf sheds 2% as euro rises"
20/5/2010,http://www.marketwatch.com/story/gold-closes-modestly-lower-at-118860oz-2010-05-20,"gold closes modestly lower, at $1,188.60/oz"
21/5/2010,"https://economictimes.indiatimes.com/articleshow/5955669.cms,http://www.marketwatch.com/story/gold-prices-end-lower-on-margin-calls-2010-05-21,http://www.marketwatch.com/story/oil-futures-fluctuate-gold-pares-losses-2010-05-21,http://www.marketwatch.com/story/gold-closes-1-lower-at-117610-an-ounce-2010-05-21","akshay tritiya gold sales to beat last year's record,#NAME?,oil futures fluctuate, gold pares losses,gold closes 1% lower at $1,176.10 an ounce"
22/5/2010,,
23/5/2010,,
24/5/2010,,
25/5/2010,,
26/5/2010,"http://www.marketwatch.com/story/gold-prices-gain-along-with-stock-futures-2010-05-26,http://www.marketwatch.com/story/gold-futures-up-1440-at-121260-an-ounce-2010-05-26,http://www.marketwatch.com/story/gold-futures-rise-for-third-straight-session-2010-05-26,http://www.marketwatch.com/story/crude-oil-gold-higher-after-us-data-2010-05-26","gold prices gain along with stock futures,gold futures up $14.40 at $1,212.60 an ounce,gold extends gains to third day on ongoing uncertainty,crude oil, gold higher after u.s. data"
27/5/2010,http://www.marketwatch.com/story/crude-oil-gains-gold-slumps-after-gdp-jobs-data-2010-05-27,"crude oil gains, gold slumps after gdp, jobs data"
28/5/2010,"http://www.marketwatch.com/story/gold-prices-edge-up-as-dollar-declines-2010-05-28,http://www.marketwatch.com/story/gold-ekes-out-modest-gains-on-spain-debt-downgrade-2010-05-28,http://www.marketwatch.com/story/crude-oil-up-gold-down-after-spending-data-2010-05-28-842430","gold prices edge up as dollar declines,gold ekes out modest gains on spain debt downgrade,crude oil up, gold down after spending data"
29/5/2010,,
30/5/2010,,
31/5/2010,,
1/6/2010,http://www.marketwatch.com/story/gold-holds-to-gains-after-ism-data-at-1229oz-2010-06-01,"gold holds to gains after ism data, at $1,229/oz"
2/6/2010,,
3/6/2010,"http://www.marketwatch.com/story/gold-settles-lower-as-sell-off-gathers-momentum-2010-06-03,http://www.marketwatch.com/story/gold-settles-1-lower-at-1210-an-ounce-2010-06-03","gold settles lower as sell-off gathers momentum,gold settles 1% lower at $1,210 an ounce"
4/6/2010,http://www.marketwatch.com/story/gold-futures-revert-to-gains-up-05-2010-06-04,"gold futures revert to gains, up 0.5%"
5/6/2010,,
6/6/2010,,
7/6/2010,"http://www.marketwatch.com/story/gold-knows-something-gold-shares-dont-2010-06-07,http://www.marketwatch.com/story/gold-ends-2-shy-of-may-record-silver-up-5-2010-06-07","does gold know something that gold shares don't?,gold ends $2 shy of may record, silver up 5%"
8/6/2010,,
9/6/2010,http://www.marketwatch.com/story/crude-oil-higher-gold-dips-ahead-of-bernanke-2010-06-09,"crude oil higher, gold dips ahead of bernanke"
10/6/2010,,
11/6/2010,"http://www.marketwatch.com/story/gold-ends-modestly-up-as-risk-aversion-returns-2010-06-11,https://economictimes.indiatimes.com/articleshow/6036707.cms","gold ends modestly up as risk aversion returns,gold futures recover on better global trend"
12/6/2010,,
13/6/2010,http://www.marketwatch.com/story/august-gold-rises-230-to-123250oz-on-globex-2010-06-13,"august gold rises $2.30 to $1,232.50/oz on globex"
14/6/2010,"http://www.marketwatch.com/story/gold-silver-edge-higher-as-dollar-takes-step-back-2010-06-14,https://economictimes.indiatimes.com/articleshow/6046322.cms,http://www.marketwatch.com/story/gold-reverses-lower-as-safe-haven-demand-ebbs-2010-06-14","gold, silver edge higher as dollar takes step back,be wary of the gold bugs,gold reverses lower as safe-haven demand ebbs"
15/6/2010,,
16/6/2010,,
17/6/2010,"http://www.marketwatch.com/story/gold-looking-set-to-post-fresh-closing-record-2010-06-17,http://www.marketwatch.com/story/gold-ends-at-record-high-on-weaker-stocks-outlook-2010-06-17","gold looking set to post fresh closing record,gold ends at record high on weaker stocks, outlook"
18/6/2010,"http://www.marketwatch.com/story/canadian-stocks-lifted-by-gold-2010-06-18,http://www.marketwatch.com/story/gold-futures-run-towards-fresh-record-levels-2010-06-18,http://www.marketwatch.com/story/gold-rises-08-to-record-125830-an-ounce-2010-06-18,http://www.marketwatch.com/story/gold-futures-down-390-at-124480-an-ounce-2010-06-18,http://www.marketwatch.com/story/gold-futures-set-fresh-record-high-2010-06-18","canadian stocks lifted by gold,gold futures run towards fresh record levels,gold rises 0.8% to record $1,258.30 an ounce,gold futures down $3.90 at $1,244.80 an ounce,gold soars to fresh closing record"
19/6/2010,https://economictimes.indiatimes.com/markets/commodities/gold-may-scale-record-1300/articleshow/6065768.cms,"gold may scale record $1,300"
20/6/2010,,
21/6/2010,"https://economictimes.indiatimes.com/markets/commodities/gold-futures-fall-on-profit-selling/articleshow/6074370.cms,https://economictimes.indiatimes.com/articleshow/6074930.cms,http://www.marketwatch.com/story/gold-stumbles-14-off-fridays-record-high-2010-06-21","gold futures fall on profit-selling,gold extends gains for fourth day,gold stumbles 1.4% off friday's record high"
22/6/2010,https://economictimes.indiatimes.com/markets/commodities/gold-demand-in-india-halved-in-may/articleshow/6079116.cms,gold demand in india halved in may
23/6/2010,http://www.marketwatch.com/story/gold-heads-lower-changing-direction-2010-06-23,"gold heads lower, changing direction"
24/6/2010,http://www.marketwatch.com/story/canadian-markets-close-lower-rims-profits-grow-2010-06-24,canadian markets close down; gold stocks hold slight gain
25/6/2010,http://www.marketwatch.com/story/gold-tops-record-trades-at-125890-2010-06-25,"gold tops record, trades at $1,258.90"
26/6/2010,,
27/6/2010,,
28/6/2010,,
29/6/2010,"http://www.marketwatch.com/story/gold-settles-up-03-at-124240oz-2010-06-29,http://www.marketwatch.com/story/canadian-stocks-skid-to-close-all-sectors-down-2010-06-29,http://www.marketwatch.com/story/oil-gold-extend-losses-on-consumer-sentiment-2010-06-29,http://www.marketwatch.com/story/gold-turns-higher-on-flight-to-safety-buying-2010-06-29","gold settles up 0.3% at $1,242.40/oz,canadian markets close down; gold retreats,oil, gold extend losses on consumer sentiment,gold turns higher on flight-to-safety buying"
30/6/2010,http://www.marketwatch.com/story/gold-turns-modestly-lower-2010-06-30,gold turns modestly lower
1/7/2010,"http://www.marketwatch.com/story/a-stock-guy-likes-gold-as-a-second-half-play-2010-07-01,http://www.marketwatch.com/story/gold-contracts-set-record-open-interest-cme-2010-07-01,http://www.marketwatch.com/story/oil-gold-add-to-losses-after-ism-housing-data-2010-07-01","a stock guy likes gold as a second-half play,gold contracts set record open interest: cme,oil, gold add to losses after ism, housing data"
2/7/2010,"http://www.marketwatch.com/story/factory-orders-keeps-picture-gloomy-for-gold-oil-2010-07-02,http://www.marketwatch.com/story/gold-oil-keep-losses-after-factory-orders-data-2010-07-02","factory orders keeps picture gloomy for gold, oil,gold, oil keep losses after factory orders data"
3/7/2010,,
4/7/2010,,
5/7/2010,,
6/7/2010,https://economictimes.indiatimes.com/articleshow/6134762.cms,"gold falls by rs 50 to rs 18,750 per 10g on weakening trend"
7/7/2010,,
8/7/2010,"http://www.marketwatch.com/story/august-gold-falls-57-or-05-to-11932oz-2010-07-08,http://www.marketwatch.com/story/gold-settles-02-lower-at-119610oz-2010-07-08","august gold falls $5.7, or 0.5%, to $1,193.2/oz,gold settles 0.2% lower at $1,196.10/oz"
9/7/2010,,
10/7/2010,,
11/7/2010,,
12/7/2010,,
13/7/2010,"http://www.marketwatch.com/story/gold-steady-oil-off-highs-after-us-trade-data-2010-07-13,http://www.marketwatch.com/story/gold-futures-higher-on-portugals-ratings-cut-2010-07-13","gold steady, oil off highs after u.s. trade data,gold futures higher on portugal's ratings cut"
14/7/2010,,
15/7/2010,http://www.marketwatch.com/story/gold-pare-gains-oil-advances-after-us-data-2010-07-15,"gold pare gains, oil advances after u.s. data"
16/7/2010,http://www.marketwatch.com/story/canadian-stocks-drop-led-by-oil-gold-2010-07-16,"canadian stocks drop, led by oil, gold"
17/7/2010,,
18/7/2010,,
19/7/2010,http://www.marketwatch.com/story/gold-closes-lower-as-inflation-euro-fears-abate-2010-07-19,"gold closes lower as inflation, euro fears abate"
20/7/2010,"http://www.marketwatch.com/story/gold-ends-floor-trade-up-98-at-11917-an-ounce-2010-07-20,http://www.marketwatch.com/story/gold-etf-mired-in-losing-streak-2010-07-20,http://www.marketwatch.com/story/gold-futures-down-90c-at-118100-an-ounce-2010-07-20","gold ends floor trade up $9.8 at $1191.7 an ounce,gold etf mired in losing streak,gold futures down 90c at $1,181.00 an ounce"
21/7/2010,"http://www.marketwatch.com/story/gold-up-from-two-month-low-before-bernanke-2010-07-21,http://www.marketwatch.com/story/gold-closes-virtually-flat-at-119180oz-2010-07-21","gold up from two-month low before bernanke,gold closes virtually flat at $1,191.80/oz"
22/7/2010,,
23/7/2010,,
24/7/2010,,
25/7/2010,,
26/7/2010,"http://www.marketwatch.com/story/gold-futures-down-10-cents-at-118760oz-2010-07-26,http://www.marketwatch.com/story/gold-prices-mildly-lower-in-tracking-currency-move-2010-07-26","gold futures down 10 cents at $1187.60/oz,gold prices mildly lower in tracking currency move"
27/7/2010,http://www.marketwatch.com/story/gold-adds-to-loss-after-consumer-gauge-oil-lower-2010-07-27,"gold adds to loss after consumer gauge, oil lower"
28/7/2010,,
29/7/2010,,
30/7/2010,"https://economictimes.indiatimes.com/markets/commodities/gold-down-on-dollar-firmness-oil-range-bound-copper-steady/articleshow/6237019.cms,http://www.marketwatch.com/story/gold-prices-recover-after-us-economic-data-2010-07-30,http://www.marketwatch.com/story/gold-climbs-for-the-day-but-loses-5-on-month-2010-07-30","gold down on dollar firmness, oil range-bound, copper steady,gold prices recover after u.s. economic data,gold rises on day but notches worst month since december"
31/7/2010,http://www.marketwatch.com/story/stocks-cheer-a-benign-july-gold-dollar-suffer-2010-07-31,"stocks cheer a benign july; gold, dollar suffer"
1/8/2010,,
2/8/2010,,
3/8/2010,http://www.marketwatch.com/story/gold-futures-up-01-at-118660-an-ounce-2010-08-03,"gold futures up 0.1% at $1,186.60 an ounce"
4/8/2010,"http://www.marketwatch.com/story/gold-futures-up-1140-at-119870-an-ounce-2010-08-04,http://www.marketwatch.com/story/gold-futures-rise-as-china-liberalizes-market-2010-08-04","gold futures up $11.40 at $1,198.70 an ounce,gold futures rise as china liberalizes market"
5/8/2010,https://economictimes.indiatimes.com/markets/commodities/gold-steady-at-1195-silver-gaining/articleshow/6261125.cms,"gold steady at $1,195, silver gaining"
6/8/2010,,
7/8/2010,https://economictimes.indiatimes.com/articleshow/6270702.cms,gold rebounds by rs 155 on firming global trend
8/8/2010,,
9/8/2010,http://www.marketwatch.com/story/gold-ends-lower-copper-bucks-trend-to-go-higher-2010-08-09,gold prices end lower; copper bucks trend to post gains
10/8/2010,"http://www.marketwatch.com/story/gold-etf-swings-positive-in-wake-of-fomc-statement-2010-08-10,http://www.marketwatch.com/story/december-gold-down-07-at-119430-an-ounce-2010-08-10","gold etf swings positive in wake of fomc statement,december gold down 0.7% at $1,194.30 an ounce"
11/8/2010,http://www.marketwatch.com/story/gold-posts-gains-as-floor-trading-winds-down-2010-08-11,gold posts gains as floor trading winds down
12/8/2010,http://www.marketwatch.com/story/gold-futures-top-1200-mark-2010-08-12,"gold futures top $1,200 mark"
13/8/2010,"http://www.marketwatch.com/story/canadian-stocks-turn-lower-gold-materials-weigh-2010-08-13,http://www.marketwatch.com/story/crude-oil-higher-gold-down-after-us-data-2010-08-13,http://www.marketwatch.com/story/gold-closes-with-minor-loss-up-for-week-2010-08-13,http://www.marketwatch.com/story/oil-adds-to-gain-golds-lower-after-consumer-data-2010-08-13,http://www.marketwatch.com/story/this-is-one-gold-fund-that-doesnt-glitter-2010-08-13","canadian stocks turn lower; gold, materials weigh,crude oil higher, gold down after u.s. data,gold closes with minor loss, up for week,oil adds to gain, gold's lower after consumer data,leveraged gold fund is the stupid investment of the week"
14/8/2010,https://economictimes.indiatimes.com/markets/commodities/india-gold-moves-up-further-on-persistent-demand-silver-also-up/articleshow/6311111.cms,"india gold moves up further on persistent demand, silver also up"
15/8/2010,,
16/8/2010,http://www.marketwatch.com/story/gold-rises-as-manufacturing-japan-gdp-disappoint-2010-08-16,"gold ends at six-week high on disappointing data, dollar"
17/8/2010,,
18/8/2010,,
19/8/2010,"https://economictimes.indiatimes.com/articleshow/6337698.cms,http://www.marketwatch.com/story/gold-swerves-in-and-out-positive-territory-2010-08-19,http://www.marketwatch.com/story/gold-ends-03-higher-at-123540-an-ounce-2010-08-19","gold surges to 7-week high as festive demand pick up,gold swerves in and out of positive territory,gold ends 0.3% higher at $1,235.40 an ounce"
20/8/2010,http://www.marketwatch.com/story/gold-ends-lower-but-keeps-weekly-gain-2010-08-20,"gold slips, but previous sessions ensure 1% weekly gain"
21/8/2010,,
22/8/2010,,
23/8/2010,,
24/8/2010,"https://economictimes.indiatimes.com/markets/commodities/gold-to-hit-19500-mark-fuelled-by-festivals/articleshow/6426798.cms,http://www.marketwatch.com/story/gold-turns-positive-trades-at-123140-an-ounce-2010-08-24,https://economictimes.indiatimes.com/markets/commodities/gold-futures-decline-on-lower-global-trend/articleshow/6425814.cms","gold to hit 19,500 mark fuelled by festivals,gold turns positive, trades at $1,231.40 an ounce,gold futures decline on lower global trend"
25/8/2010,https://economictimes.indiatimes.com/articleshow/6424298.cms,"big us investors go for gold, bonds"
26/8/2010,,
27/8/2010,"http://www.marketwatch.com/story/oil-trades-below-73-gold-reverses-after-bernanke-2010-08-27,http://www.marketwatch.com/story/gold-turns-lower-on-bernanke-comments-2010-08-27,http://www.marketwatch.com/story/gold-silver-lose-some-steam-but-settle-higher-2010-08-27,http://www.marketwatch.com/story/gold-oil-steady-after-consumer-sentiment-data-2010-08-27","oil trades below $73, gold reverses after bernanke,gold turns lower on bernanke comments,gold, silver lose some steam but settle higher,gold, oil steady after consumer sentiment data"
28/8/2010,,
29/8/2010,https://economictimes.indiatimes.com/markets/commodities/gold-prices-set-to-touch-rs-20000-per-10-gram-by-diwali/articleshow/6455547.cms,"gold prices set to touch rs 20,000 per 10 gram by diwali"
30/8/2010,http://www.marketwatch.com/story/gold-futures-end-up-on-bargain-buys-econ-outlook-2010-08-30,"gold futures end up on bargain buys, econ outlook"
31/8/2010,http://www.marketwatch.com/story/crude-down-gold-up-after-us-home-prices-data-2010-08-31,"crude down, gold up after u.s. home prices data"
1/9/2010,http://www.marketwatch.com/story/gold-settles-02-lower-at-124810-an-ounce-2010-09-01,"gold settles 0.2% lower at $1,248.10 an ounce"
2/9/2010,"http://www.marketwatch.com/story/australia-shares-rise-on-oil-gold-price-strength-2010-09-02,http://www.marketwatch.com/story/crude-oil-down-gold-futures-up-after-jobless-data-2010-09-02","australia shares rise on oil, gold price strength,crude oil down, gold futures up after jobless data"
3/9/2010,http://www.marketwatch.com/story/gold-closes-down-02-at-125110-an-ounce-2010-09-03,"gold closes down 0.2% at $1,251.10 an ounce"
4/9/2010,,
5/9/2010,,
6/9/2010,,
7/9/2010,"http://www.marketwatch.com/story/most-active-gold-notches-new-settlement-high-2010-09-07,http://www.marketwatch.com/story/eldorado-gold-withdraws-bid-for-andean-resources-2010-09-07-1540160","most active gold notches new settlement high,eldorado gold withdraws bid for andean resources"
8/9/2010,"http://www.marketwatch.com/story/dec-gold-last-up-210-at-126130oz-on-globex-2010-09-08,http://www.marketwatch.com/story/gold-futures-ease-from-record-high-as-worries-fade-2010-09-08","dec. gold last up $2.10 at $1,261.30/oz on globex,gold futures edge lower as europe worries fade"
9/9/2010,,
10/9/2010,http://www.marketwatch.com/story/gold-falls-for-third-straight-day-to-125090-2010-09-10,"gold falls for third straight day, to $1,250.90"
11/9/2010,,
12/9/2010,,
13/9/2010,"http://www.marketwatch.com/story/gold-mildly-lower-as-safe-haven-flight-wanes-2010-09-13,http://www.marketwatch.com/story/dec-gold-climbs-3-to-125010oz-on-globex-2010-09-13,http://www.marketwatch.com/story/december-gold-adds-60-cents-to-124710-an-ounce-2010-09-13","gold mildly lower as safe-haven flight wanes,dec. gold climbs $3 to $1,250.10/oz on globex,december gold adds 60 cents to $1,247.10 an ounce"
14/9/2010,"http://www.marketwatch.com/story/us-stocks-pushing-modestly-higher-amid-treasury-gold-buying-2010-09-14,http://www.marketwatch.com/story/oil-turns-positive-after-inventories-gold-steady-2010-09-14,http://www.marketwatch.com/story/gold-etf-rallies-to-record-high-2010-09-14","us stocks pushing modestly higher amid treasury, gold buying,oil turns positive after inventories, gold steady,gold etf rallies to record high"
15/9/2010,"http://www.marketwatch.com/story/gold-closes-02-down-at-126870oz-2010-09-15,http://www.marketwatch.com/story/gold-backs-down-from-record-high-2010-09-15","gold closes 0.2% down at $1,268.70/oz,gold down modestly; silver at 30-month high"
16/9/2010,"http://www.marketwatch.com/story/gold-futures-up-04-at-127380-an-ounce-2010-09-16,http://www.marketwatch.com/story/gold-settles-at-record-silver-rallies-1-2010-09-16","gold futures up 0.4% at $1,273.80 an ounce,gold settles at record, silver rallies 1%"
17/9/2010,"http://www.marketwatch.com/story/gold-notches-fresh-record-silver-at-30-year-high-2010-09-17,http://www.marketwatch.com/story/gold-ends-at-record-high-silver-hits-30-year-best-2010-09-17","gold notches fresh record, silver at 30-year high,gold settles at new high; silver notches 30-year best"
18/9/2010,,
19/9/2010,,
20/9/2010,http://www.marketwatch.com/story/lydon-gold-remains-a-solid-etf-play-right-now-2010-09-20,lydon: gold remains a solid etf play right now
21/9/2010,http://www.marketwatch.com/story/gold-futures-slip-from-record-high-ahead-of-fed-2010-09-21,gold futures slip from record high ahead of fed
22/9/2010,,
23/9/2010,https://economictimes.indiatimes.com/markets/commodities/gold-silver-soar-to-new-record-high-on-global-surge/articleshow/6614541.cms,"gold, silver soar to new record high on global surge"
24/9/2010,"http://www.marketwatch.com/story/gold-settles-at-record-high-taps-1300-2010-09-24,http://www.marketwatch.com/story/december-gold-rises-to-intraday-high-of-1300oz-2010-09-24","gold ends at record high, taps $1,300,december gold rises to intraday high of $1,300/oz"
25/9/2010,,
26/9/2010,,
27/9/2010,"http://www.marketwatch.com/story/gold-turns-lower-trades-below-1298-an-anounce-2010-09-27,http://www.marketwatch.com/story/central-banks-sell-least-gold-since-1999-2010-09-27,http://www.marketwatch.com/story/gold-close-at-record-but-below-1300-an-ounce-2010-09-27","gold turns lower, trades below $1,298 an anounce,central banks sell the least gold since 1999,gold close at record, but below $1,300 an ounce"
28/9/2010,"https://economictimes.indiatimes.com/articleshow/6639369.cms,http://www.marketwatch.com/story/gold-gives-canadian-stocks-a-boost-2010-09-28,http://www.marketwatch.com/story/canadian-stocks-fall-as-gold-edges-lower-2010-09-28,http://www.marketwatch.com/story/gold-soars-above-and-beyond-1300-an-ounce-2010-09-28,http://www.marketwatch.com/story/gold-ends-at-130830-a-fresh-record-2010-09-28,http://www.marketwatch.com/story/gold-turns-higher-tops-1300-an-ounce-2010-09-28","gold milestones on the road to record high,gold gives canadian stocks a boost,canadian stocks fall as gold edges lower,gold soars above and beyond $1,300 an ounce,gold ends at $1,308.30, a fresh record,gold turns higher, tops $1,300 an ounce"
29/9/2010,"http://www.marketwatch.com/story/dec-gold-down-30-cents-at-1310oz-on-globex-2010-09-29,http://www.marketwatch.com/story/gold-futures-tally-modest-gains-after-new-record-2010-09-29,http://www.marketwatch.com/story/spot-gold-prices-set-record-131300oz-2010-09-29","dec. gold down 30 cents at $1,310/oz on globex,gold futures tally modest gains after new record,spot gold prices set record $1,313.00/oz"
30/9/2010,http://www.marketwatch.com/story/gold-caps-record-setting-month-with-slight-drop-2010-09-30,gold down for first time in seven sessions
1/10/2010,http://www.marketwatch.com/story/spot-gold-hits-record-131840oz-in-europe-trade-2010-10-01,"spot gold hits record $1,318.40/oz in europe trade"
2/10/2010,,
3/10/2010,,
4/10/2010,http://www.marketwatch.com/story/most-gold-bugs-confident-of-more-gains-2010-10-04,most gold bugs confident
5/10/2010,http://www.marketwatch.com/story/dec-gold-last-up-390-at-134420oz-2010-10-05,"dec. gold last up $3.90 at $1,344.20/oz"
6/10/2010,"http://www.marketwatch.com/story/vietnam-may-end-gold-import-ban-spot-prices-climb-2010-10-06,http://www.marketwatch.com/story/are-the-best-gold-timers-still-bullish-2010-10-06","vietnam may end gold-import ban; spot prices climb,another week, gold at another new high"
7/10/2010,"http://www.marketwatch.com/story/gold-slides-off-record-ending-lower-at-1335oz-2010-10-07,http://www.marketwatch.com/story/gold-futures-advance-past-1360-an-ounce-2010-10-07","gold slides off record, ending lower at $1,335/oz,gold futures advance past $1,360 an ounce"
8/10/2010,http://www.marketwatch.com/story/gold-futures-rise-after-us-jobs-report-2010-10-08,gold futures rise after u.s. jobs report
9/10/2010,,
10/10/2010,https://economictimes.indiatimes.com/markets/commodities/gold-prices-heading-for-the-longest-bull-market/articleshow/6723262.cms,gold prices heading for the longest bull market
11/10/2010,,
12/10/2010,http://www.marketwatch.com/story/goldman-ups-12-month-gold-price-forecast-to-1650-2010-10-12,"goldman ups 12-month gold price forecast to $1,650"
13/10/2010,"https://economictimes.indiatimes.com/opinion/interviews/we-see-gold-hitting-higher-vasu-menon-ocbc-bank/articleshow/6741368.cms,http://www.marketwatch.com/story/gold-rises-to-fresh-highs-near-1360-on-globex-2010-10-13,http://www.marketwatch.com/story/gold-futures-climb-near-1378oz-on-globex-2010-10-13","we see gold hitting higher: vasu menon, ocbc bank,gold rises to fresh highs near $1,360 on globex,gold futures climb near $1,378/oz on globex"
14/10/2010,https://economictimes.indiatimes.com/markets/commodities/high-gold-prices-fail-to-deter-buyers-ahead-of-festive-season/articleshow/6749194.cms,high gold prices fail to deter buyers ahead of festive season
15/10/2010,"http://www.marketwatch.com/story/crude-oil-higher-gold-futures-lower-after-data-2010-10-15,http://www.marketwatch.com/story/gold-oil-hold-on-to-losses-after-consumer-data-2010-10-15,http://www.marketwatch.com/story/gold-futures-up-520-at-138280oz-2010-10-15,https://economictimes.indiatimes.com/opinion/et-editorial/black-gold-coal-india-ipo-marks-a-watershed/articleshow/6751277.cms","crude oil higher, gold futures lower after data,gold, oil hold on to losses after consumer data,gold futures up $5.20 at $1,382.80/oz,black gold: coal india ipo marks a watershed"
16/10/2010,,
17/10/2010,,
18/10/2010,,
19/10/2010,"http://www.marketwatch.com/story/gold-lower-on-worst-one-day-drop-since-early-july-2010-10-19,http://www.marketwatch.com/story/gold-sells-off-on-geithner-talk-china-tightening-2010-10-19","gold lower on worst one-day drop since early july,gold settles 2.6% lower, worst drop in three months"
20/10/2010,,
21/10/2010,http://www.marketwatch.com/story/freeport-sitting-on-a-gold-mine-2010-10-21,sitting on a gold mine
22/10/2010,"http://www.marketwatch.com/story/gold-closes-a-tad-lower-at-132510oz-2010-10-22,http://www.marketwatch.com/story/gold-inches-down-ends-week-with-34-loss-2010-10-22,http://www.marketwatch.com/story/canadian-stocks-eke-out-gains-2010-10-22","gold closes a tad lower at $1,325.10/oz,gold inches down, ends week with 3.4% loss,canadian stocks eke out gains as gold miners rebound"
23/10/2010,,
24/10/2010,http://www.marketwatch.com/story/gold-miner-etf-fails-to-break-2008-peak-2010-10-24,gold-miner etf fails to break 2008 peak
25/10/2010,http://www.marketwatch.com/story/gold-loses-some-steam-but-settles-1-higher-2010-10-25,"gold loses some steam, but settles 1% higher"
26/10/2010,"http://www.marketwatch.com/story/gold-oil-prices-head-back-down-after-case-shiller-2010-10-26-914150,http://www.marketwatch.com/story/gold-closes-marginally-lower-at-133860oz-2010-10-26,https://economictimes.indiatimes.com/markets/commodities/gold-futures-rise-0-21-pc-on-global-cues/articleshow/6814347.cms","gold, oil prices head back down after case-shiller,gold closes marginally lower at $1,338.60/oz,gold futures rise 0.21 pc on global cues"
27/10/2010,"https://economictimes.indiatimes.com/markets/commodities/gold-futures-weaken-on-global-cues-low-spot-demand/articleshow/6820733.cms,http://www.marketwatch.com/story/dec-gold-climbs-410-to-132670oz-on-globex-2010-10-27","gold futures weaken on global cues, low spot demand,dec. gold climbs $4.10 to $1,326.70/oz on globex"
28/10/2010,,
29/10/2010,,
30/10/2010,https://economictimes.indiatimes.com/mf/mf-news/axis-mf-launches-new-exchange-traded-gold-fund/articleshow/6781628.cms,axis mf launches new exchange traded gold fund
31/10/2010,,
1/11/2010,"http://www.marketwatch.com/story/gold-closes-05-down-at-135060-an-ounce-2010-11-01,http://www.marketwatch.com/story/gold-futures-slide-copper-platinum-rally-2010-11-01,http://www.marketwatch.com/story/gold-turns-negative-retreats-to-135550-an-ounc-2010-11-01","gold closes 0.5% down at $1350.60 an ounce,gold ends lower as dollar strengthens,gold turns negative, retreats to $1,355.50 an ounc"
2/11/2010,http://www.marketwatch.com/story/gold-rises-on-weak-dollar-ahead-of-fed-elections-2010-11-02,"gold rises as investors watch fed, elections"
3/11/2010,"http://www.marketwatch.com/story/gold-silver-add-to-losses-after-macro-data-2010-11-03,http://www.marketwatch.com/story/gold-futures-climb-as-much-as-12-on-globex-2010-11-03","gold settles lower, at $1,337.60 an ounce,gold futures climb as much as $12 on globex"
4/11/2010,http://www.marketwatch.com/story/december-gold-rallies-41-or-31-to-137860-2010-11-04,"december gold rallies $41, or 3.1%, to $1,378.60"
5/11/2010,http://www.marketwatch.com/story/crude-oil-up-gold-down-after-us-jobs-report-2010-11-05,"crude oil up, gold down after u.s. jobs report"
6/11/2010,,
7/11/2010,,
8/11/2010,http://www.marketwatch.com/story/gold-reverts-to-record-high-breezes-past-1400-2010-11-08,"gold rises to record high, breezes past $1,400"
9/11/2010,"http://www.marketwatch.com/story/crude-oil-gold-futures-rise-as-dollar-dips-2010-11-09,https://economictimes.indiatimes.com/markets/commodities/gold-futures-rise-to-record-rs-21100-on-global-cues/articleshow/6893400.cms","crude oil, gold futures rise as dollar dips,gold futures rise to record rs 21,100 on global cues"
10/11/2010,,
11/11/2010,"http://www.marketwatch.com/story/gold-turns-lower-slips-under-1400oz-2010-11-11,http://www.marketwatch.com/story/dec-gold-falls-840-to-139490oz-on-globex-2010-11-11,http://www.marketwatch.com/story/gold-recaptures-1400-mark-silver-rises-2-2010-11-11","gold turns lower, slips under $1,400/oz,dec. gold falls $8.40 to $1,394.90/oz on globex,gold recaptures $1,400 mark, silver rises 2%"
12/11/2010,"http://www.marketwatch.com/story/gold-oil-fall-further-after-consumer-data-2010-11-12,http://www.marketwatch.com/story/mad-gold-pitch-is-a-sign-of-the-times-2010-11-12,http://www.marketwatch.com/story/gold-loses-more-than-30-trades-at-137290-2010-11-12","gold, oil fall further after consumer data,a mad gold pitch is a sign of the times,gold loses more than $30, trades at $1,372.90"
13/11/2010,,
14/11/2010,,
15/11/2010,"http://www.marketwatch.com/story/gold-futures-pare-loss-down-130-at-136420-2010-11-15,https://economictimes.indiatimes.com/markets/ipos/fpos/cil-staff-to-get-2nd-shot-at-ipo-gold/articleshow/6926589.cms","gold futures pare loss; down $1.30 at $1,364.20,cil staff to get 2nd shot at ipo gold"
16/11/2010,"http://www.marketwatch.com/story/crude-oil-gold-futures-lower-after-us-ppi-2010-11-16,http://www.marketwatch.com/story/cme-raises-gold-other-metals-trading-requirements-2010-11-16,http://www.marketwatch.com/story/gold-closes-22-lower-at-133840-an-ounce-2010-11-16","crude oil, gold futures lower after u.s. ppi,cme raises gold, other metals trading requirements,gold closes 2.2% lower at $1,338.40 an ounce"
17/11/2010,"http://www.marketwatch.com/story/dec-gold-up-80-cents-at-133770oz-on-globex-2010-11-17,http://www.marketwatch.com/story/gold-closes-marginally-lower-at-133690oz-2010-11-17","dec. gold up 80 cents at $1,337.70/oz on globex,gold closes marginally lower at $1,336.90/oz"
18/11/2010,"http://www.marketwatch.com/story/gold-miners-dehedge-by-2-mln-ounces-report-2010-11-18,http://www.marketwatch.com/story/oil-adds-to-gains-gold-steady-after-philly-fed-2010-11-18","gold miners dehedge by 2 mln ounces: report,oil adds to gains, gold steady after philly fed"
19/11/2010,"http://www.marketwatch.com/story/gold-ends-marginally-lower-palladium-surges-6-2010-11-19,http://www.marketwatch.com/story/gold-futures-waver-between-gains-and-losses-2010-11-19","gold ends marginally lower; palladium adds 1.2%,gold futures waver between gains and losses"
20/11/2010,,
21/11/2010,,
22/11/2010,"http://www.marketwatch.com/story/gold-bulls-and-bears-debate-outlook-2010-11-22,http://www.marketwatch.com/story/dec-gold-gains-760-to-136540oz-on-globex-2010-11-22","gold bulls and bears debate outlook,dec. gold gains $7.60 to $1,365.40/oz on globex"
23/11/2010,"http://www.marketwatch.com/story/gold-settles-15-higher-at-137760-an-ounce-2010-11-23,https://economictimes.indiatimes.com/markets/commodities/gold-regains-record-levels-of-rs-20600-on-wedding-demand/articleshow/6975660.cms","gold settles 1.5% higher at $1,377.60 an ounce,gold regains record levels of rs 20,600 on wedding demand"
24/11/2010,"http://www.marketwatch.com/story/gold-futures-down-05-at-1371-an-ounce-2010-11-24,http://www.marketwatch.com/story/crude-oil-up-gold-down-after-us-data-2010-11-24","gold futures down 0.5% at $1,371 an ounce,crude oil up, gold down after u.s. data"
25/11/2010,,
26/11/2010,https://economictimes.indiatimes.com/markets/commodities/silver-plunges-on-heavy-sell-off-gold-edges-up/articleshow/6996137.cms,"silver plunges on heavy sell-off, gold edges up"
27/11/2010,,
28/11/2010,,
29/11/2010,"http://www.marketwatch.com/story/gold-settles-higher-on-european-debt-woes-2010-11-29,http://www.marketwatch.com/story/gold-declines-on-irish-rescue-rising-dollar-2010-11-29","gold settles higher on european debt woes,gold higher as irish bailout doesn't quell worries"
30/11/2010,"http://www.marketwatch.com/story/gold-rallies-as-debt-woes-batter-euro-2010-11-30,http://www.marketwatch.com/story/gold-closes-14-higher-at-138610-an-ounce-2010-11-30,http://www.marketwatch.com/story/gold-futures-jump-1860-to-138460-an-ounce-2010-11-30,http://www.marketwatch.com/story/dec-gold-down-20-cents-at-138480oz-on-globex-2010-11-30","gold rallies as debt woes batter euro, china fund,gold closes 1.4% higher at $1,386.10 an ounce,gold futures jump $18.60 to $1,384.60 an ounce,dec. gold down 20 cents at $1,384.80/oz on globex"
1/12/2010,"http://www.marketwatch.com/story/dec-gold-up-720-at-139220oz-on-globex-2010-12-01,http://www.marketwatch.com/story/gold-rises-modestly-to-138830-an-ounce-2010-12-01,http://www.marketwatch.com/story/oil-gold-hold-on-to-gains-after-ism-2010-12-01","dec. gold up $7.20 at $1,392.20/oz on globex,gold rises modestly to $1,388.30 an ounce,oil, gold hold on to gains after ism"
2/12/2010,"http://www.marketwatch.com/story/china-gold-imports-headed-for-big-rise-2010-12-02,https://economictimes.indiatimes.com/markets/commodities/gold-silver-tumble-from-record-level-on-scrap-sale/articleshow/7028794.cms,http://www.marketwatch.com/story/gold-inches-higher-silver-comes-off-30-year-high-2010-12-02","china gold imports headed for big rise,gold, silver tumble from record level on scrap sale,gold inches higher, silver comes off 30-year high"
3/12/2010,https://economictimes.indiatimes.com/articleshow/7059826.cms,why silver could be the new gold
4/12/2010,,
5/12/2010,,
6/12/2010,http://www.marketwatch.com/story/gold-futures-up-780-at-at-142390-an-ounce-2010-12-06,"gold futures up $7.80 at $1,423.90 an ounce"
7/12/2010,http://www.marketwatch.com/story/gold-futures-up-1080-to-142690-an-ounce-2010-12-07,"gold futures up $10.80 to $1,426.90 an ounce"
8/12/2010,,
9/12/2010,"http://www.marketwatch.com/story/canada-stocks-rise-as-gold-strengthens-2010-12-09,https://economictimes.indiatimes.com/markets/commodities/gold-recovers-on-buying-at-low-levels-firm-asian-cues/articleshow/7071040.cms","canadian stocks gain as gold's luster returns,gold recovers on buying at low levels, firm asian cues"
10/12/2010,,
11/12/2010,,
12/12/2010,,
13/12/2010,http://www.marketwatch.com/story/gold-closes-higher-up-1310-at-1398-2010-12-13,"gold closes higher; up $13.10 at $1,398"
14/12/2010,https://economictimes.indiatimes.com/markets/commodities/gold-futures-up-on-firm-asian-cues/articleshow/7097840.cms,gold futures up on firm asian cues
15/12/2010,"http://www.marketwatch.com/story/gold-futures-drop-more-than-10-on-globex-2010-12-15,http://www.marketwatch.com/story/gold-closes-with-18-loss-pacing-metals-selloff-2010-12-15,http://www.marketwatch.com/story/gold-oil-extend-losses-after-cpi-empire-survey-2010-12-15","gold drops on fed stance, dollar strength,gold closes with $18 loss, pacing metals selloff,gold, oil extend losses after cpi, empire survey"
16/12/2010,,
17/12/2010,,
18/12/2010,,
19/12/2010,,
20/12/2010,https://economictimes.indiatimes.com/markets/commodities/gold-silver-rise-further-on-global-bullishness/articleshow/7134066.cms,"gold, silver rise further on global bullishness"
21/12/2010,,
22/12/2010,"https://economictimes.indiatimes.com/opinion/interviews/templetons-mobius-on-gold-stocks-industries-in-2011/articleshow/7138133.cms,http://www.marketwatch.com/story/oil-advances-above-90-after-data-gold-rises-2010-12-22,http://www.marketwatch.com/story/gold-copper-fall-before-us-data-2010-12-22,https://economictimes.indiatimes.com/markets/commodities/gold-silver-prices-decline/articleshow/7145776.cms","templeton's mobius on gold, stocks, industries in 2011,oil advances above $90 after data; gold rises,gold, copper fall before u.s. data,gold, silver prices decline"
23/12/2010,,
24/12/2010,,
25/12/2010,,
26/12/2010,,
27/12/2010,http://www.marketwatch.com/story/copper-hits-intraday-record-high-gold-up-2010-12-27,copper hits intraday record high; gold up
28/12/2010,http://www.marketwatch.com/story/dollar-treasurys-stay-down-gold-pares-gains-2010-12-28,"dollar, treasurys stay down; gold pares gains"
29/12/2010,,
30/12/2010,http://www.marketwatch.com/story/copper-logs-new-record-gold-silver-lose-ground-2010-12-30,"copper logs new record; gold, silver lose ground"
31/12/2010,"http://www.marketwatch.com/story/gold-ends-11-higher-at-142140-an-ounce-2010-12-31,https://economictimes.indiatimes.com/markets/commodities/silver-falls-by-rs-200-from-record-level-gold-also-declines/articleshow/7196069.cms","gold ends 1.1% higher at $1,421.40 an ounce,silver falls by rs 200 from record level, gold also declines"
1/1/2011,,
2/1/2011,,
3/1/2011,,
4/1/2011,https://www.moneycontrol.com/news/business/markets/-1326377.html,gold eases from 1-month high on positive us outlook
5/1/2011,,
6/1/2011,"https://www.moneycontrol.com/news/business/markets/-1316895.html,https://www.moneycontrol.com/news/business/markets/-1314491.html","gold falls on upbeat jobs data but ends off lows,see gold between &#36;1361-1386/oz in near-term: iti"
7/1/2011,http://www.marketwatch.com/story/gold-back-to-red-trades-at-1371-an-ounce-2011-01-07,"gold back to red, trades at $1,371 an ounce"
8/1/2011,,
9/1/2011,,
10/1/2011,"https://economictimes.indiatimes.com/markets/commodities/gold-moves-up-on-local-demand-silver-declines/articleshow/7254419.cms,http://www.marketwatch.com/story/gold-turns-lower-trades-under-1370-an-ounce-2011-01-10,http://www.marketwatch.com/story/gold-futures-close-04-up-at-137410-an-ounce-2011-01-10","gold moves up on local demand, silver declines,gold turns lower, trades under $1,370 an ounce,gold futures close 0.4% up at $1,374.10 an ounce"
11/1/2011,http://www.marketwatch.com/story/gold-trades-above-1380-an-ounce-2011-01-11,"gold trades above $1,380 an ounce"
12/1/2011,"http://www.marketwatch.com/story/gold-down-after-successful-portuguese-bond-selling-2011-01-12,https://www.moneycontrol.com/news/business/markets/-1293833.html","gold down after successful portuguese bond-selling,india gold buying retreats as prices hit 1-wk high"
13/1/2011,"http://www.marketwatch.com/story/gold-closes-modestly-up-at-1387-an-ounce-2011-01-13,http://www.marketwatch.com/story/gold-turns-lower-trades-at-138310-an-ounce-2011-01-13","gold closes modestly up at $1,387 an ounce,gold turns lower, trades at $1,383.10 an ounce"
14/1/2011,"http://www.marketwatch.com/story/gold-futures-slump-as-european-debt-worries-ease-2011-01-14,https://economictimes.indiatimes.com/markets/commodities/gold-could-hit-record-highs-above-1600-gfms/articleshow/7279143.cms,https://economictimes.indiatimes.com/markets/commodities/gold-declines-on-global-cues-silver-slumps-to-one-month-low/articleshow/7286093.cms","gold futures slump as european debt worries ease,gold could hit record highs above $1,600: gfms,gold declines on global cues, silver slumps to one month low"
15/1/2011,,
16/1/2011,,
17/1/2011,https://www.moneycontrol.com/news/business/markets/-1275539.html,india gold seen falling further
18/1/2011,http://www.marketwatch.com/story/dollar-stays-down-gold-up-after-empire-survey-2011-01-18-836530,"dollar stays down, gold up after empire survey"
19/1/2011,"http://www.marketwatch.com/story/gold-extends-gains-after-housing-data-2011-01-19,http://www.marketwatch.com/story/gold-ends-modestly-higher-on-weaker-dollar-2011-01-19","gold extends gains after housing data,gold ends modestly higher on weaker dollar"
20/1/2011,"http://www.marketwatch.com/story/dollar-recovers-gold-stays-down-after-claims-fall-2011-01-20,https://economictimes.indiatimes.com/markets/commodities/silver-plunges-on-heavy-sell-off-gold-declines/articleshow/7328159.cms","dollar recovers, gold stays down after claims fall,silver plunges on heavy sell-off, gold declines"
21/1/2011,http://www.marketwatch.com/story/gold-silver-extend-losses-2011-01-21,"gold, silver extend losses"
22/1/2011,,
23/1/2011,,
24/1/2011,,
25/1/2011,"https://economictimes.indiatimes.com/markets/commodities/bargain-hunting-may-support-gold/articleshow/7356921.cms,http://www.marketwatch.com/story/gold-futures-resume-downward-path-2011-01-25,http://www.marketwatch.com/story/gold-slips-further-after-consumer-confidence-data-2011-01-25","bargain-hunting may support gold,gold settles at lowest in nearly three months,gold slips further after consumer confidence data"
26/1/2011,,
27/1/2011,"http://www.marketwatch.com/story/gold-closes-11-lower-at-131840-an-ounce-2011-01-27,http://www.marketwatch.com/story/gold-reverses-lower-trades-near-multimonth-lows-2011-01-27,http://www.marketwatch.com/story/gold-futures-extend-advance-2011-01-26","gold closes 1.1% lower at $1,318.40 an ounce,gold reverses lower, trades near multimonth lows,gold settles at lowest in nearly four months"
28/1/2011,"http://www.marketwatch.com/story/gold-futures-turn-higher-2011-01-28,http://www.marketwatch.com/story/gold-pares-losses-after-losing-as-much-as-10-2011-01-28","gold soars as egypt protests prompt safety buying,gold pares losses after losing as much as $10"
29/1/2011,,
30/1/2011,,
31/1/2011,,
1/2/2011,https://economictimes.indiatimes.com/markets/commodities/silver-rallies-on-good-demand-gold-recovers/articleshow/7405819.cms,"silver rallies on good demand, gold recovers"
2/2/2011,,
3/2/2011,"http://www.marketwatch.com/story/gold-turns-higher-on-volatile-trading-2011-02-03,http://www.marketwatch.com/story/gold-gains-after-trichets-comments-2011-02-03,http://www.marketwatch.com/story/gold-turns-down-copper-hits-new-record-in-london-2011-02-03","gold turns higher in volatile trading,gold settles at two-week high on euro, egypt,gold turns down; copper hits new record in london"
4/2/2011,"http://www.marketwatch.com/story/gold-back-to-the-black-trades-at-1356-an-ounce-2011-02-04,http://www.marketwatch.com/story/gold-head-back-down-after-payrolls-2011-02-04","gold back to the black, trades at $1,356 an ounce,gold heads back down after payrolls"
5/2/2011,,
6/2/2011,,
7/2/2011,,
8/2/2011,,
9/2/2011,,
10/2/2011,http://www.marketwatch.com/story/gold-futures-gain-30-cents-after-mubarak-speaks-2011-02-10,gold futures gain 30 cents after mubarak speaks
11/2/2011,http://www.marketwatch.com/story/gold-closes-02-lower-at-136040-an-ounce-2011-02-11,"gold closes 0.2% lower at $1,360.40 an ounce"
12/2/2011,,
13/2/2011,,
14/2/2011,https://economictimes.indiatimes.com/markets/commodities/gold-fluctuates-on-economic-recovery-egyptian-changes/articleshow/7496001.cms,"gold fluctuates on economic recovery, egyptian changes"
15/2/2011,,
16/2/2011,"http://www.marketwatch.com/story/gold-rises-looking-poised-for-third-day-of-gains-2011-02-16,http://www.marketwatch.com/story/gold-oil-advance-afte-reports-on-irans-warships-2011-02-16","gold rises, looking poised for third day of gains,gold, oil advance after reports on iran's warships"
17/2/2011,"https://economictimes.indiatimes.com/markets/commodities/gold-demand-in-india-rose-by-66-to-963-tonnes-in-2010-wgc/articleshow/7516741.cms,http://www.marketwatch.com/story/gold-marks-highest-closing-level-in-5-weeks-2011-02-17,http://www.marketwatch.com/story/gold-futures-close-at-a-five-week-high-2011-02-17,https://www.moneycontrol.com/news/business/markets/-1159811.html","gold demand in india rose by 66% to 963 tonnes in 2010: wgc,gold marks highest closing level in 5 weeks,gold futures close at a five-week high,gold demand in india rises 66% to 963 tonnes in 2010: wgc"
18/2/2011,,
19/2/2011,,
20/2/2011,,
21/2/2011,,
22/2/2011,,
23/2/2011,,
24/2/2011,"http://www.marketwatch.com/story/when-will-gold-hit-a-new-high-2011-02-24,https://economictimes.indiatimes.com/markets/commodities/silver-vaults-to-rs-50k-tag-gold-conquers-fresh-highs/articleshow/7563750.cms","when will gold hit a new high?,silver vaults to rs 50k tag, gold conquers fresh highs"
25/2/2011,http://www.marketwatch.com/story/gold-oil-hold-to-losses-after-sentiment-data-2011-02-25,"gold, oil hold to losses after sentiment data"
26/2/2011,,
27/2/2011,,
28/2/2011,https://economictimes.indiatimes.com/markets/commodities/silver-hits-new-record-at-rs-50550-on-global-cues-gold-up-rs-10/articleshow/7595436.cms,"silver hits new record at rs 50,550 on global cues; gold up rs 10"
1/3/2011,http://www.marketwatch.com/story/gold-oil-hold-to-gains-after-ism-data-2011-03-01,"gold, oil hold to gains after ism data"
2/3/2011,"https://economictimes.indiatimes.com/markets/commodities/gold-touches-new-peak-at-rs-21270-on-strong-global-cues/articleshow/7610637.cms,http://www.marketwatch.com/story/april-gold-futures-up-240-at-143360-an-ounce-2011-03-02,http://www.marketwatch.com/story/gold-futures-set-sights-on-fresh-record-2011-03-02","gold touches new peak at rs 21,270 on strong global cues,april gold futures up $2.40 at $1,433.60 an ounce,gold prices settle at record high"
3/3/2011,"http://www.marketwatch.com/story/oil-gold-fall-on-report-gadhafi-mulls-peace-plan-2011-03-03,http://www.marketwatch.com/story/gold-closes-down-from-record-at-141640-an-ounce-2011-03-03,http://www.marketwatch.com/story/gold-trades-lower-after-two-record-high-sessions-2011-03-03","oil, gold fall on report gadhafi mulls peace plan,gold closes down from record at $1,416.40 an ounce,gold trades lower after two record-high sessions"
4/3/2011,http://www.marketwatch.com/story/gold-settles-09-higher-at-142860-an-ounce-2011-03-04,"gold settles 0.9% higher at $1,428.60 an ounce"
5/3/2011,,
6/3/2011,,
7/3/2011,"http://www.marketwatch.com/story/gold-settles-higher-but-off-session-highs-2011-03-07,http://www.marketwatch.com/story/gold-extends-gains-in-electronic-trading-2011-03-07","gold settles higher, but off session highs,gold futures gain, tap $1,445 mark"
8/3/2011,http://www.marketwatch.com/story/gold-declines-as-gadhafi-reportedly-exiting-2011-03-08,gold futures close with a more than $7 loss
9/3/2011,"http://www.marketwatch.com/story/april-gold-climbs-770-or-05-to-143470oz-2011-03-09,http://www.marketwatch.com/story/gold-investors-time-to-take-your-profits-2011-03-09","april gold climbs $7.70, or 0.5%, to $1,434.70/oz,gold investors: time to take your profits"
10/3/2011,"http://www.marketwatch.com/story/gold-other-metals-retreat-as-dollar-rallies-2011-03-10,http://www.marketwatch.com/story/gold-trades-lower-silver-off-31-year-high-2011-03-10","gold futures drop as dollar rallies, oil falls,gold trades lower; silver off 31-year high"
11/3/2011,http://www.marketwatch.com/story/gold-declines-after-japan-earthquake-2011-03-11,gold settles higher on safe-haven buying
12/3/2011,,
13/3/2011,,
14/3/2011,"http://www.marketwatch.com/story/gold-futures-rise-as-much-as-11-an-ounce-2011-03-14,https://economictimes.indiatimes.com/markets/commodities/silver-regains-peak-level-of-rs-54600-gold-up-by-rs-115/articleshow/7700669.cms,http://www.marketwatch.com/story/gold-settles-02-higher-at-142490-an-ounce-2011-03-14","gold futures rise as much as $11 an ounce,silver regains peak level of rs 54,600; gold up by rs 115,gold settles 0.2% higher at $1,424.90 an ounce"
15/3/2011,,
16/3/2011,https://economictimes.indiatimes.com/markets/commodities/gold-silver-decline-on-stockist-offering-global-cues/articleshow/7719199.cms,"gold, silver decline on stockist offering, global cues"
17/3/2011,,
18/3/2011,"http://www.marketwatch.com/story/gold-pares-gain-after-libyan-ceasefire-2011-03-18,http://www.marketwatch.com/story/buy-into-gold-after-recent-drop-goldman-says-2011-03-18,http://www.marketwatch.com/story/gold-pares-gain-to-1417-an-ounce-up-09-2011-03-18","gold pares gain after libyan ceasefire,buy into gold after recent drop, goldman says,gold pares gain to $1,417 an ounce, up 0.9%"
19/3/2011,,
20/3/2011,,
21/3/2011,,
22/3/2011,http://www.marketwatch.com/story/gold-futures-turn-higher-after-earlier-weakness-2011-03-22,gold futures turn higher after earlier weakness
23/3/2011,"http://www.marketwatch.com/story/gold-edges-higher-trades-at-143120-an-ounce-2011-03-23,http://www.marketwatch.com/story/gold-futures-trade-at-record-as-session-nears-end-2011-03-23","gold edges higher, trades at $1,431.20 an ounce,gold futures trade at record as session nears end"
24/3/2011,http://www.marketwatch.com/story/gold-turns-lower-fresh-record-slips-for-now-2011-03-24,"gold turns lower, fresh record slips for now"
25/3/2011,"http://www.marketwatch.com/story/gold-closes-06-lower-at-142620-an-ounce-2011-03-25,http://www.marketwatch.com/story/african-barrick-gold-up-38-after-drilling-update-2011-03-25","gold closes 0.6% lower at $1,426.20 an ounce,african barrick gold up 3.8% after drilling update"
26/3/2011,,
27/3/2011,,
28/3/2011,"https://www.thehindubusinessline.com/markets/commodities/A-Chennai-housewife-forecasts-gold-price-for-major-producer/article20114179.ece,http://www.marketwatch.com/story/gold-futures-up-30c-at-142020-an-ounce-2011-03-28","A Chennai housewife forecasts gold price for major producer,gold futures up 30c at $1,420.20 an ounce"
29/3/2011,,
30/3/2011,"https://economictimes.indiatimes.com/markets/commodities/gold-buying-in-india-set-to-rise-15/articleshow/7821374.cms,http://www.marketwatch.com/story/gold-futures-climb-after-finding-support-2011-03-30,http://www.marketwatch.com/story/gold-futures-close-up-740-at-142490-2011-03-30","gold buying in india set to rise 15%,gold ends losing streak as price dip lures buyers,gold futures close up $7.40 at $1,424.90"
31/3/2011,"http://www.marketwatch.com/story/gold-futures-trade-in-record-territory-2011-03-31,http://www.marketwatch.com/story/gold-futures-hold-06-gain-after-jobless-claims-2011-03-31","gold settles at record high, adds 1% for quarter,gold futures hold 0.6% gain after jobless claims"
1/4/2011,https://economictimes.indiatimes.com/markets/commodities/silver-slips-from-record-high-gold-moves-up/articleshow/7844866.cms,"silver slips from record high, gold moves up"
2/4/2011,,
3/4/2011,,
4/4/2011,,
5/4/2011,http://www.marketwatch.com/story/april-5-1933-a-day-that-will-live-in-infamy-2011-04-05,when fdr banned gold
6/4/2011,http://www.marketwatch.com/story/asian-shares-mostly-higher-gold-mining-plays-rally-2011-04-06,asian shares mostly higher; gold mining plays rally
7/4/2011,http://www.marketwatch.com/story/oil-lower-gold-higher-after-japans-quake-reports-2011-04-07,"oil lower, gold higher after japan's quake reports"
8/4/2011,https://www.moneycontrol.com/news/business/markets/-2145563.html,"silver hits new high on global cues,gold moves up"
9/4/2011,,
10/4/2011,,
11/4/2011,"http://www.marketwatch.com/story/gold-slips-off-record-closes-04-lower-2011-04-11,http://www.marketwatch.com/story/gold-off-record-on-stronger-dollar-silver-gains-2011-04-11","gold slips off record, closes 0.4% lower,gold falls on stronger dollar; silver gains"
12/4/2011,,
13/4/2011,"http://www.marketwatch.com/story/june-gold-closes-at-145560oz-up-2-or-01-2011-04-13,http://www.marketwatch.com/story/gold-futures-end-2-higher-after-two-session-drop-2011-04-13,http://www.marketwatch.com/story/gold-futures-head-higher-after-two-session-decline-2011-04-13","june gold closes at $1,455.60/oz, up $2, or 0.1%,gold futures end $2 higher after two-session drop,gold futures head higher after two-session decline"
14/4/2011,"http://www.marketwatch.com/story/heres-why-gold-is-about-to-crash-2011-04-14-15110100,http://www.marketwatch.com/story/canadian-gold-miners-lift-broader-market-2011-04-14","here's why gold is about to crash,canadian gold miners lift broader market"
15/4/2011,"http://www.marketwatch.com/story/gold-investing-what-to-do-and-how-to-do-it-2011-04-15,https://www.thehindubusinessline.com/markets/commodities/Gold-futures-at-record-high-on-global-cues/article20191870.ece,http://www.marketwatch.com/story/buy-the-rumor-sell-the-news-2011-04-15","gold investing: what to do and how to do it,Gold futures at record high on global cues,gold: buy the rumor, sell the news"
16/4/2011,https://www.thehindubusinessline.com/markets/commodities/rising-gold-putting-pressure-on-jewellery-exportersrsquo-margins/article20192163.ece1,Rising gold putting pressure on jewellery exporters' margins
17/4/2011,https://www.thehindubusinessline.com/markets/gold/Assets-under-Gold-ETFs-up-nearly-three-fold/article20192306.ece,Assets under Gold ETFs up nearly three fold
18/4/2011,http://www.marketwatch.com/story/gold-advances-oil-posts-losses-after-us-outlook-2011-04-18,"gold advances, oil posts losses after u.s. outlook"
19/4/2011,https://www.thehindubusinessline.com/markets/gold/Gold-slips-on-profit-taking-global-cues/article20192970.ece,"Gold slips on profit-taking, global cues"
20/4/2011,"https://www.thehindubusinessline.com/markets/commodities/Gold-futures-hits-record-high-at-Rs-2276910-gm/article20193415.ece,http://www.marketwatch.com/story/gold-settles-at-record-149890-an-ounce-2011-04-20","Gold futures hits record high at Rs 22,769/10 gm,gold settles at record $1,498.90 an ounce"
21/4/2011,"http://www.marketwatch.com/story/gold-gains-modestly-trades-at-150250-an-ounce-2011-04-21,http://www.marketwatch.com/story/gold-tops-1509-on-its-way-to-another-record-2011-04-21,https://www.thehindubusinessline.com/markets/commodities/gold-futures-at-record-high-of-rs-2284410-gm/article23048900.ece,https://www.moneycontrol.com/news/business/markets/-2122371.html,https://www.thehindubusinessline.com/markets/stock-markets/Gold-ETFs-smarter-option-than-buying-physical-gold-NSE/article20193447.ece","gold gains modestly, trades at $1,502.50 an ounce,gold settles at record above $1,500,Gold futures at record high of Rs 22,844/10 gm,gold roars to all-time high for fifth straight session,Gold ETFs smarter option than buying physical gold: NSE"
22/4/2011,,
23/4/2011,,
24/4/2011,https://economictimes.indiatimes.com/markets/commodities/gold-silver-prices-up-amidst-global-uncertainty/articleshow/8069702.cms,"gold, silver prices up amidst global uncertainty"
25/4/2011,"http://www.marketwatch.com/story/gold-settles-at-record-150910-an-ounce-2011-04-25,https://www.moneycontrol.com/news/business/markets/-2116857.html,https://www.moneycontrol.com/news/business/markets/-2115721.html","gold settles at record $1,509.10 an ounce,gold jumps to record high on weak dollar; silver surges,silver turns lower after rally, gold retreats"
26/4/2011,"http://www.marketwatch.com/story/canadian-stocks-fall-on-weakness-in-metals-prices-2011-04-26,http://www.marketwatch.com/story/gold-falls-below-1500-after-string-of-records-2011-04-26-1237160","gold, silver weigh on canadian stocks,gold falls below $1,500 after string of records"
27/4/2011,"http://www.marketwatch.com/story/june-gold-up-750-at-152460oz-on-globex-2011-04-27,http://www.marketwatch.com/story/gold-oil-futures-post-modest-gains-2011-04-27,http://www.marketwatch.com/story/gold-rallies-09-to-settle-at-record-151710oz-2011-04-27,http://www.marketwatch.com/story/dollar-rally-may-not-kill-gold-2011-04-26,http://www.marketwatch.com/story/gold-futures-settle-at-record-151710-an-ounce-2011-04-27,http://www.marketwatch.com/story/gold-gains-more-ground-as-fed-holds-rates-steady-2011-04-27-124030","june gold up $7.50 at $1,524.60/oz on globex,gold, oil futures post modest gains,gold rallies 0.9% to settle at record $1,517.10/oz,dollar rally may not kill gold,gold futures settle at record $1,517.10 an ounce,gold gains more ground as fed holds rates steady"
28/4/2011,http://www.marketwatch.com/story/sound-advice-worries-about-gold-2011-04-28,sound advice worries about gold
29/4/2011,"https://www.moneycontrol.com/news/business/markets/-2104243.html,https://economictimes.indiatimes.com/markets/commodities/gold-prices-soar-but-buyers-bet-on-akshaya-tritiya/articleshow/8113514.cms,http://www.marketwatch.com/story/june-gold-climbs-580-to-1537oz-in-ny-2011-04-29,http://www.marketwatch.com/story/fools-gold-mark-hulbert-questions-golds-rally-2011-04-29,https://economictimes.indiatimes.com/markets/commodities/gold-climbs-to-new-high-silver-slips/articleshow/8118928.cms","silver, gold near lifetime highs, dollar loses ground,gold prices soar but buyers bet on akshaya tritiya,june gold climbs $5.80 to $1,537/oz in ny,fool's gold? mark hulbert questions gold's rally,gold climbs to new high, silver slips"
30/4/2011,https://www.thehindubusinessline.com/markets/commodities/Gold-soars-on-global-cues-silver-tumbles/article20239040.ece,Gold soars on global cues; silver tumbles
1/5/2011,https://economictimes.indiatimes.com/articleshow/8133614.cms,"gold, silver still hold potential for investors"
2/5/2011,"https://www.moneycontrol.com/news/business/markets/-2098093.html,http://www.marketwatch.com/story/gold-edges-higher-silver-drops-25-at-closing-2011-05-02","india gold falls over 1%; attracts physical traders,gold edges higher, silver drops 5.2% at closing"
3/5/2011,,
4/5/2011,"http://www.marketwatch.com/story/bank-of-mexico-buys-100-tons-of-gold-in-two-months-2011-05-04,http://www.marketwatch.com/story/gold-ends-16-lower-at-151530-an-ounce-2011-05-04","bank of mexico buys 100 tons of gold in two months,gold ends 1.6% lower at $1,515.30 an ounce"
5/5/2011,"http://www.marketwatch.com/story/randgold-gold-output-up-24-on-year-2011-05-05,http://www.marketwatch.com/story/gold-settles-under-1500-silver-trades-8-lower-2011-05-05,https://economictimes.indiatimes.com/markets/commodities/hold-on-to-that-gold-it-could-glitter-for-some-more-time/articleshow/8164176.cms,http://www.marketwatch.com/story/gold-timers-in-denial-2011-05-05","randgold gold output up 24% on year,gold settles under $1,500, silver trades 8% lower,hold on to that gold, it could glitter for some more time,gold timers in denial"
6/5/2011,https://economictimes.indiatimes.com/markets/commodities/gold-prices-in-india-slip-despite-heavy-buying-on-akshaya-tritiya-oil-falls-by-5/articleshow/8177341.cms,gold prices in india slip despite heavy buying on akshaya tritiya; oil falls by $5
7/5/2011,,
8/5/2011,https://www.thehindubusinessline.com/markets/gold/gold-may-test-resistance-fall/article22985181.ece,"Gold may test resistance, fall"
9/5/2011,http://www.marketwatch.com/story/silver-leads-precious-metals-rebound-in-asia-2011-05-09,"silver climbs 5% as gold tops $1,500"
10/5/2011,"http://www.marketwatch.com/story/gold-and-silver-are-doomed-2011-05-10,http://www.marketwatch.com/story/gold-silver-extend-rebound-settle-higher-2011-05-10","gold and silver are doomed,gold, silver extend rebound, settle higher"
11/5/2011,"http://www.marketwatch.com/story/gold-settles-1-lower-at-150140-an-ounce-2011-05-11,http://www.marketwatch.com/story/gold-silver-end-sharply-lower-on-stronger-dollar-2011-05-11,http://www.marketwatch.com/story/gold-silver-slump-ahead-of-settlement-2011-05-11","gold settles 1% lower at $1,501.40 an ounce,gold, silver end sharply lower on stronger dollar,gold, silver slump ahead of settlement"
12/5/2011,"http://www.marketwatch.com/story/gold-ends-higher-silver-down-2-after-steep-loss-2011-05-12,http://www.marketwatch.com/story/gammon-gold-profit-soars-on-higher-production-2011-05-12-85650","gold ends higher; silver down 2% after steep loss,gammon gold profit soars on higher production"
13/5/2011,,
14/5/2011,https://www.thehindubusinessline.com/markets/gold/The-glitter-of-gold-loans/article20243545.ece,The glitter of gold loans
15/5/2011,https://www.thehindubusinessline.com/markets/gold/dazzling-returns-whet-investors-appetite-for-gold/article20244791.ece1,Dazzling returns whet investors' appetite for gold
16/5/2011,"http://www.marketwatch.com/story/june-gold-rises-440-to-1498oz-in-ny-2011-05-16,http://www.marketwatch.com/story/gold-gains-as-oil-futures-slip-in-early-dealings-2011-05-16","june gold rises $4.40 to $1,498/oz in ny,gold gains as oil futures slip in early dealings"
17/5/2011,http://www.marketwatch.com/story/gold-futures-close-07-lower-silver-off-19-2011-05-17,gold futures close 0.7% lower; silver off 1.9%
18/5/2011,"http://www.marketwatch.com/story/gold-silver-rally-on-renewed-fears-of-inflation-2011-05-18,https://economictimes.indiatimes.com/markets/commodities/gold-rises-to-rs-22350-silver-adds-rs-550-on-seasonal-demand/articleshow/8416043.cms","gold, silver rally on renewed fears of inflation,gold rises to rs 22350, silver adds rs 550 on seasonal demand"
19/5/2011,"https://www.moneycontrol.com/news/business/markets/-2044723.html,https://www.thehindubusinessline.com/markets/commodities/Gold-futures-dips-on-profit-booking-global-cues/article20244700.ece","silver gains by 3%, gold remains stable,Gold futures dips on profit-booking, global cues"
20/5/2011,http://www.marketwatch.com/story/gold-ends-above-1500-best-since-may-10-2011-05-20,"gold ends above $1,500, best since may 10"
21/5/2011,,
22/5/2011,,
23/5/2011,https://economictimes.indiatimes.com/markets/commodities/gold-prices-rise-on-global-rally-silver-drops/articleshow/8538990.cms,"gold prices rise on global rally, silver drops"
24/5/2011,,
25/5/2011,,
26/5/2011,"http://www.marketwatch.com/story/gold-settles-03-lower-to-152280-an-ounce-2011-05-26,http://www.marketwatch.com/story/gold-modestly-lower-silver-off-nearly-1-2011-05-26","gold settles 0.3% lower to $1,522.80 an ounce,gold inches lower; silver falls roughly 1%"
27/5/2011,https://economictimes.indiatimes.com/markets/commodities/gold-falls-to-rs-22745-on-global-cues-silver-sheds-rs-1300/articleshow/8604456.cms,"gold falls to rs 22,745 on global cues; silver sheds rs 1,300"
28/5/2011,,
29/5/2011,,
30/5/2011,,
31/5/2011,http://www.marketwatch.com/story/gold-futures-gain-as-dollar-weakens-2011-05-31,gold lower as safe-haven buying dries up
1/6/2011,"http://www.marketwatch.com/story/gold-is-the-only-place-for-new-money-in-june-2011-06-01,http://www.marketwatch.com/story/oil-loses-after-ism-manufacturing-index-2011-06-01,http://www.marketwatch.com/story/gold-futures-decline-in-electronic-trading-2011-06-01","gold is the only place for new money in june,oil, gold lose after ism manufacturing index,gold futures gain steam after ism data"
2/6/2011,"http://www.marketwatch.com/story/gold-turns-lower-as-dollar-index-off-session-lows-2011-06-02,https://www.moneycontrol.com/news/business/markets/-2117477.html","gold turns lower as dollar index off session lows,gold steady on greek crisis, us growth concerns"
3/6/2011,"http://www.marketwatch.com/story/oil-falls-below-99-a-barrel-gold-off-by-04-2011-06-03,https://economictimes.indiatimes.com/markets/commodities/gold-futures-extend-losses-on-asian-cues/articleshow/8709867.cms","oil falls below $99 a barrel, gold off by 0.4%,gold futures extend losses on asian cues"
4/6/2011,,
5/6/2011,https://www.thehindubusinessline.com/opinion/columns/gnanasekaar-t/Gold-futures-to-test-resistance/article20252286.ece,Gold futures to test resistance
6/6/2011,http://www.marketwatch.com/story/gold-futures-down-170-at-154550-an-ounce-2011-06-06,gold futures down $1.70 at $1.545.50 an ounce
7/6/2011,"http://www.marketwatch.com/story/gold-futures-edge-lower-in-electronic-trading-2011-06-07,https://www.moneycontrol.com/news/business/markets/-2106691.html,http://www.marketwatch.com/story/gold-futures-gain-a-tad-hold-above-1500ounce-2011-06-07","gold futures edge lower in electronic trading,gold hits one-month high on weak us outlook,gold futures gain a tad, hold above $1,500/ounce"
8/6/2011,http://www.marketwatch.com/story/go-for-the-gold-2011-06-08,go for the gold?
9/6/2011,http://www.marketwatch.com/story/gold-inches-up-after-ecb-vigilant-on-inflation-2011-06-09,gold inches up after ecb vigilant on inflation
10/6/2011,"http://www.marketwatch.com/story/gold-down-as-inflation-fear-subsides-silver-tanks-2011-06-10,http://www.marketwatch.com/story/gold-settles-09-lower-at-152920-an-ounce-2011-06-10","gold down as inflation fear subsides; silver tanks,gold settles 0.9% lower at $1,529.20 an ounce"
11/6/2011,,
12/6/2011,,
13/6/2011,"http://www.marketwatch.com/story/gold-silver-settle-at-multi-week-lows-2011-06-13,http://www.marketwatch.com/story/gold-inches-lower-other-metals-stumble-2011-06-13","gold, silver settle at multi-week lows,gold settles lower alongside other metals"
14/6/2011,,
15/6/2011,,
16/6/2011,,
17/6/2011,"http://www.marketwatch.com/story/gold-silver-settle-higher-on-greece-turmoil-2011-06-17,http://www.marketwatch.com/story/crude-oil-keeps-losses-after-data-gold-trades-up-2011-06-17,http://www.marketwatch.com/story/gold-turns-positive-trades-at-1537-an-ounce-2011-06-17,https://www.moneycontrol.com/news/business/markets/-2075503.html,https://economictimes.indiatimes.com/markets/stocks/recos/long-gold-short-silver-ur-bhat-dalton-capital-advisors/articleshow/8887035.cms","gold, silver settle higher on greece turmoil,crude oil keeps losses after data, gold trades up,gold turns positive, trades at $1,537 an ounce,india gold eases with world markets, demand poor,long gold, short silver: ur bhat, dalton capital advisors"
18/6/2011,,
19/6/2011,https://www.thehindubusinessline.com/economy/lsquoGold-prices-to-test-1600-on-haven-demand/article20256814.ece,"Gold prices to test $1,600 on haven demand'"
20/6/2011,,
21/6/2011,"http://www.marketwatch.com/story/gold-futures-score-sixth-straight-winning-session-2011-06-21,http://www.marketwatch.com/story/gold-inches-up-as-markets-await-greek-vote-2011-06-21","gold futures score sixth-straight winning session,gold inches up as markets await greek vote"
22/6/2011,"http://www.marketwatch.com/story/august-gold-settles-at-155340oz-up-7-2011-06-22,http://www.marketwatch.com/story/gold-tallies-a-seven-session-gain-of-nearly-38-2011-06-22,http://www.marketwatch.com/story/august-gold-up-960-at-1556oz-in-ny-2011-06-22","august gold settles at $1,553.40/oz, up $7,gold tallies a seven-session gain of nearly $38,august gold up $9.60 at $1,556/oz in ny"
23/6/2011,,
24/6/2011,"http://www.marketwatch.com/story/gold-edges-higher-as-other-metals-futures-fall-2011-06-24,https://www.moneycontrol.com/news/business/markets/-2054475.html,http://www.marketwatch.com/story/gold-falls-extending-thursdays-decline-2011-06-24,https://economictimes.indiatimes.com/markets/commodities/gold-will-keep-trading-in-the-range-of-22200-22800-biren-vakil/articleshow/8975660.cms","late-hour selloff sends gold to 5-week low,india gold extends losses; physical trading still dull,gold falls, extending thursday's decline,gold will keep trading in the range of 22200-22800: biren vakil"
25/6/2011,,
26/6/2011,,
27/6/2011,"https://www.moneycontrol.com/news/business/markets/-2050529.html,https://www.thehindubusinessline.com/markets/commodities/Gold-declines-on-poor-demand/article20259042.ece,https://economictimes.indiatimes.com/markets/commodities/gold-futures-fall-on-global-cues-poor-demand/articleshow/9011694.cms,http://www.marketwatch.com/story/gold-futures-fall-260-to-149830-an-ounce-2011-06-27,https://www.moneycontrol.com/news/business/markets/-2048769.html","india gold hits 3-week low; physical demand slack,Gold declines on poor demand,gold futures fall on global cues, poor demand,gold futures fall $2.60 to $1498.30 an ounce,gold near &#36;1,500/oz as eurozone crisis simmers"
28/6/2011,http://www.marketwatch.com/story/gold-settles-03-higher-at-150020-an-ounce-2011-06-28,"gold settles 0.3% higher at $1,500.20 an ounce"
29/6/2011,http://www.marketwatch.com/story/gold-trims-advance-on-greek-vote-2011-06-29,gold trims advance on greek vote
30/6/2011,http://www.marketwatch.com/story/gold-ends-lower-silver-copper-gain-2011-06-30,"gold ends lower; silver, copper gain"
1/7/2011,"http://www.marketwatch.com/story/googles-chrome-strikes-market-share-gold-2011-07-01,https://economictimes.indiatimes.com/markets/commodities/silver-falls-to-rs-51850-on-heavy-sell-off-gold-down-by-rs-270/articleshow/9063929.cms,http://www.marketwatch.com/story/gold-settles-13-lower-at-148260-an-ounce-2011-07-01","google's chrome strikes market share gold,silver falls to rs 51850 on heavy sell-off, gold down by rs 270,gold settles 1.3% lower at $1,482.60 an ounce"
2/7/2011,,
3/7/2011,,
4/7/2011,https://www.thehindubusinessline.com/money-and-banking/Dhanlaxmi-Bank-enters-gold-retailing/article20262338.ece,Dhanlaxmi Bank enters gold retailing
5/7/2011,https://www.moneycontrol.com/news/business/markets/-2143469.html,mcx gold futures trade tad higher; spot buying edges up
6/7/2011,"http://www.marketwatch.com/story/gold-futures-gain-11-to-close-at-a-two-week-high-2011-07-06,http://www.marketwatch.com/story/gold-futures-extend-gains-in-electronic-trading-2011-07-06","gold futures gain 1.1% to close at a two-week high,gold futures close at a two-week high"
7/7/2011,"http://www.marketwatch.com/story/strike-shuts-down-worlds-largest-gold-mine-2011-07-07,https://www.thehindubusinessline.com/markets/gold/Karnataka-to-follow-uniform-pricing-for-gold/article20303810.ece","strike shuts down world's largest gold mine,Karnataka to follow uniform pricing for gold"
8/7/2011,,
9/7/2011,https://economictimes.indiatimes.com/markets/commodities/gold-rises-to-rs-22570-silver-to-rs-54700-on-global-cues/articleshow/9162030.cms,"gold rises to rs 22,570, silver to rs 54,700 on global cues"
10/7/2011,,
11/7/2011,,
12/7/2011,http://www.marketwatch.com/story/gold-wobbles-between-small-gains-and-losses-2011-07-12,gold wobbles between small gains and losses
13/7/2011,"http://www.marketwatch.com/story/gold-options-fear-traders-turn-to-gold-miners-2011-07-13,https://www.moneycontrol.com/news/business/markets/-2116927.html,http://www.marketwatch.com/story/gold-futures-rise-headed-for-seventh-straight-win-2011-07-13","gold options 'fear' traders turn to gold miners,gold hovers near record high, euro zone eyed,gold futures rise, headed for seventh-straight win"
14/7/2011,"http://www.marketwatch.com/story/gold-settles-at-record-silver-gains-14-2011-07-14,http://www.marketwatch.com/story/gold-the-upside-is-wide-open-2011-07-14","gold settles at record; silver gains 1.4%,gold: 'the upside is wide open'"
15/7/2011,http://www.marketwatch.com/story/investing-carries-risks-even-for-gold-2011-07-15,investing carries risks - even for gold
16/7/2011,,
17/7/2011,https://www.thehindubusinessline.com/markets/gold/lack-of-trust-in-paper-currencies-should-benefit-gold-says-analyst/article22984439.ece,"Lack of trust in paper currencies should benefit gold, says analyst"
18/7/2011,"http://www.marketwatch.com/story/gold-futures-rise-above-1600-an-ounce-2011-07-18,http://www.marketwatch.com/story/gold-adds-07-to-trade-at-record-160150oz-2011-07-18,https://economictimes.indiatimes.com/markets/commodities/gold-rules-steady-at-rs-23270-silver-soars-to-rs-58000/articleshow/9270410.cms","gold futures rise above $1,600 an ounce,gold adds 0.7% to trade at record $1,601.50/oz,gold rules steady at rs 23,270, silver soars to rs 58,000"
19/7/2011,"http://www.marketwatch.com/story/gold-futures-down-1070-at-159040-an-ounce-2011-07-19,http://www.marketwatch.com/story/gold-falls-on-globex-on-us-debt-ceiling-progress-2011-07-19","gold futures down $10.70 at $1,590.40 an ounce,gold falls on globex on us debt ceiling progress"
20/7/2011,"https://www.moneycontrol.com/news/business/markets/-2097351.html,http://www.marketwatch.com/story/gold-pares-loss-inches-closer-to-1600-an-ounce-2011-07-20","experts tell you how gold and copper are poised for today,gold pares loss, inches closer to $1,600 an ounce"
21/7/2011,"http://www.marketwatch.com/story/gold-wavers-between-small-gains-and-losses-2011-07-21,http://www.marketwatch.com/story/gold-futures-steady-ahead-of-key-greek-debt-talks-2011-07-21","gold settles at lowest in a week,gold futures steady ahead of key greek debt talks"
22/7/2011,"http://www.marketwatch.com/story/gold-up-and-oil-down-friday-reversing-directions-2011-07-22,http://www.marketwatch.com/story/gold-settles-higher-but-90-cents-short-of-record-2011-07-22","gold up and oil down friday, reversing directions,gold settles higher but 90 cents short of record"
23/7/2011,,
24/7/2011,,
25/7/2011,"http://www.marketwatch.com/story/gold-up-oil-down-on-impasse-in-debt-ceiling-talks-2011-07-25,https://www.moneycontrol.com/news/business/markets/-2082961.html,https://www.thehindubusinessline.com/markets/commodities/Gold-touches-new-high-of-Rs-24175-on-global-cues/article20309500.ece","gold up, oil down on impasse in debt ceiling talks,gold hits record as us deficit talks stall,Gold touches new high of Rs 24,175 on global cues"
26/7/2011,"http://www.marketwatch.com/story/oil-drops-13-after-housing-data-gold-holds-2011-07-26,http://www.marketwatch.com/story/gold-notches-record-settles-at-161680-an-ounce-2011-07-26,http://www.marketwatch.com/story/oil-inches-up-gold-flip-flops-after-record-2011-07-26","oil drops 1.3% after housing data, gold holds,gold notches record, settles at $1,616.80 an ounce,oil inches up; gold flip-flops after record"
27/7/2011,http://www.marketwatch.com/story/gold-extends-advance-trades-at-record-2011-07-27,"gold extends advance, trades at record"
28/7/2011,"http://www.marketwatch.com/story/barrick-profit-up-35-on-higher-gold-copper-price-2011-07-28,https://economictimes.indiatimes.com/markets/commodities/gold-rise-towards-record-price-on-us-europe-debt-concerns/articleshow/9398476.cms,https://economictimes.indiatimes.com/markets/commodities/gold-declines-by-rs-25-silver-by-rs-600-on-global-cues/articleshow/9395906.cms","barrick profit up 35% on higher gold, copper price,gold rise towards record price on us, europe debt concerns,gold declines by rs 25, silver by rs 600 on global cues"
29/7/2011,"https://economictimes.indiatimes.com/markets/commodities/europe-us-debt-woes-may-spur-gold-demand/articleshow/9403028.cms,http://www.marketwatch.com/story/gold-adds-to-gains-on-fall-in-consumer-sentiment-2011-07-29,https://economictimes.indiatimes.com/opinion/et-editorial/gold-is-at-an-all-time-high-but-not-for-any-rational-reason/articleshow/9402958.cms","europe, us debt woes may spur gold demand,gold adds to gains on fall in consumer sentiment,gold is at an all-time high but not for any rational reason"
30/7/2011,,
31/7/2011,"http://www.marketwatch.com/story/outlook-for-gold-remains-positive-surbiton-2011-07-31,https://www.thehindubusinessline.com/markets/gold/gold-hits-all-time-high-amid-supportive-conditions/article23053521.ece","outlook for gold remains positive: surbiton,Gold hits all-time high amid supportive conditions"
1/8/2011,"http://www.marketwatch.com/story/gold-bounces-off-record-to-end-06-lower-2011-08-01,http://www.marketwatch.com/story/gold-back-to-negative-territory-at-162890oz-2011-08-01","gold bounces off record to end 0.6% lower,gold back to negative territory, at $1,628.90/oz"
2/8/2011,"https://www.thehindubusinessline.com/markets/gold/Gold-rises-to-record-as-slowing-growth-spurs-investor-demand/article20317955.ece,http://www.marketwatch.com/story/miners-end-south-africa-gold-strike-with-wage-deal-2011-08-02,http://www.marketwatch.com/story/gold-futures-top-1650-in-electronic-trading-2011-08-02","Gold rises to record as slowing growth spurs investor demand,miners end south africa gold strike with wage deal,gold futures top $1,650 in electronic trading"
3/8/2011,"http://www.marketwatch.com/story/gold-at-167050-near-days-intraday-record-2011-08-03,http://www.marketwatch.com/story/forward-gold-sales-suggest-fears-prices-may-fall-2011-08-03,https://www.moneycontrol.com/news/business/markets/-2039067.html","gold at $1,670.50, near day's intraday record,forward gold sales suggest fears prices may fall,stocks slide on borrowing cost fears, gold jumps"
4/8/2011,"https://economictimes.indiatimes.com/opinion/interviews/hold-long-positions-in-gold-pj-commodity-ventures/articleshow/9481038.cms,http://www.marketwatch.com/story/randgold-q2-gold-production-up-97-vs-year-ago-2011-08-04,http://www.marketwatch.com/story/gold-ends-lower-after-touching-intraday-record-2011-08-04","hold long positions in gold: pj commodity ventures,randgold q2 gold production up 97% vs. year-ago,gold ends lower after touching intraday record"
5/8/2011,"https://economictimes.indiatimes.com/markets/commodities/gold-hits-new-high-of-rs-24350-silver-sheds-rs-3100/articleshow/9493458.cms,https://www.moneycontrol.com/news/business/markets/-2139215.html,http://www.marketwatch.com/story/central-banks-hint-its-not-too-late-to-buy-gold-2011-08-05,http://www.marketwatch.com/story/gold-settles-lower-on-the-day-but-gains-on-week-2011-08-05,https://www.thehindubusinessline.com/markets/commodities/gold-futures-touches-new-high-of-rs-24289/article20317767.ece1,http://www.marketwatch.com/story/oil-down-92-gold-gains-13-on-week-2011-08-05,https://economictimes.indiatimes.com/markets/stocks/news/heard-on-the-street-gold-cummins-shares/articleshow/9488611.cms,http://www.marketwatch.com/story/gold-settles-04-lower-at-165180-2011-08-05","gold hits new high of rs 24,350; silver sheds rs 3,100,india gold hits record high on global markets, rupee,central banks hint: it's not too late to buy gold,gold settles lower on the day but gains on week,Gold futures touches new high of Rs 24,289,oil down 9.2%; gold gains 1.3% on week,heard on the street: gold, cummins shares,gold settles 0.4% lower at $1,651.80"
6/8/2011,https://www.thehindubusinessline.com/markets/commodities/Gold-at-a-new-high-of-Rs-2477010-grams/article20317958.ece,"Gold at a new high of Rs 24,770/10 grams"
7/8/2011,https://www.thehindubusinessline.com/opinion/columns/g-chandrashekhar/gold-benefits-other-commodities-and-equity-markets-collapse/article23056608.ece,Gold benefits; other commodities and equity markets collapse
8/8/2011,"http://www.marketwatch.com/story/3-trades-avoid-bonds-sell-gold-buy-blue-chips-2011-08-08,https://www.thehindubusinessline.com/companies/Golds-glitter-remains-despite-the-price-rise/article20318855.ece,https://www.moneycontrol.com/news/business/markets/-2133303.html,http://www.marketwatch.com/story/why-did-gold-climb-61-an-ounce-and-silver-jump-3-2011-08-08,https://www.moneycontrol.com/news/business/stocks/-2132151.html,https://www.moneycontrol.com/news/business/markets/-2130813.html,http://www.marketwatch.com/story/newmont-mining-shares-rise-on-jump-in-gold-prices-2011-08-08,http://www.marketwatch.com/story/year-to-date-performances-disappoint-except-for-gold-2011-08-08","3 trades: avoid bonds, sell gold, buy blue chips,Gold's glitter remains, despite the price rise,india gold extends gains to record high,why did gold climb $61 an ounce and silver jump 3%?,technical view on gold, zinc, natural gas, dollar, euro,gold soars as markets shrug off g7, ecb pledges,newmont mining shares rise on jump in gold prices,year to date performances disappoint, except for gold"
9/8/2011,"https://www.moneycontrol.com/news/business/markets/-2129229.html,http://www.marketwatch.com/story/gold-eyes-1800oz-after-astronomical-rally-2011-08-09,http://www.marketwatch.com/story/gold-settles-at-record-1743-an-ounce-2011-08-09,https://www.thehindubusinessline.com/markets/commodities/gold-futures-touches-all-time-high/article23057546.ece","is it too late for gold fever?,gold eyes $1,800/oz after 'astronomical' rally,gold settles at record $1,743 an ounce,Gold futures touches all-time high"
10/8/2011,https://www.moneycontrol.com/news/business/markets/-2122727.html,gold steady near record high; physical buying dull
11/8/2011,"http://www.marketwatch.com/story/gold-shares-responding-finally-2011-08-11,https://www.thehindubusinessline.com/markets/gold/Gold-futures-extend-gains-on-global-cues/article20322597.ece,http://www.marketwatch.com/story/trend-shifts-coming-for-stocks-and-gold-2011-08-11,https://www.moneycontrol.com/news/business/markets/-2118645.html","gold shares responding (finally)?,Gold futures extend gains on global cues,trend shifts coming for stocks and gold?,gold futures extend gains, up 0.34% on global cues"
12/8/2011,"http://www.marketwatch.com/story/canada-stocks-caught-between-strong-oil-weak-gold-2011-08-12,http://www.marketwatch.com/story/spot-gold-slightly-lower-but-well-supported-2011-08-12","canada stocks stuck: strong u.s. retail, weak gold,spot gold slightly lower, but well-supported"
13/8/2011,,
14/8/2011,,
15/8/2011,http://www.marketwatch.com/story/dec-gold-rallies-1360-to-175620oz-in-ny-2011-08-15,"dec. gold rallies $13.60 to $1,756.20/oz in ny"
16/8/2011,"http://www.marketwatch.com/story/gold-futures-close-at-a-record-level-2011-08-16,https://www.moneycontrol.com/news/business/markets/-2102975.html,http://www.marketwatch.com/story/dec-gold-up-2130-at-177940oz-in-ny-2011-08-16,http://www.marketwatch.com/story/dec-gold-up-2150-or-12-at177950oz-in-ny-2011-08-16","gold futures close at a record level,india gold rises over 1%; demand retreats,dec. gold up $21.30 at $1,779.40/oz in ny,dec. gold up $21.50, or 1.2%, at$1,779.50/oz in ny"
17/8/2011,"http://www.marketwatch.com/story/gold-futures-climb-9-edge-back-up-toward-1800-2011-08-17,https://www.moneycontrol.com/news/business/markets/-2098215.html,http://www.marketwatch.com/story/gold-futures-down-490-at-178870-an-ounce-2011-08-17","gold futures climb $9, edge back up toward $1,800,india gold extends gains to near peak; buying absent,gold futures down $4.90 at $1,788.70 an ounce"
18/8/2011,"http://www.marketwatch.com/story/gold-extends-record-run-on-growth-fears-2011-08-18,https://www.moneycontrol.com/news/trends/features-2/-2093237.html,https://economictimes.indiatimes.com/markets/commodities/gold-futures-hit-record-high-of-rs-26960-on-global-cues/articleshow/9645816.cms","gold ends at record $1,822 on growth fears,gold etfs mushroom in india,gold futures hit record high of rs 26,960 on global cues"
19/8/2011,"https://www.thehindubusinessline.com/markets/gold/gold-surges-past-rs-28k-level-in-futures-market/article23053253.ece,http://www.marketwatch.com/story/gold-rises-to-record-gains-63-in-week-2011-08-19","Gold surges past Rs 28K level in futures market,gold rises to record; gains 6.3% in week"
20/8/2011,"https://www.moneycontrol.com/news/business/markets/-2085267.html,https://www.thehindubusinessline.com/markets/commodities/Gold-at-new-high-of-Rs-28230-gains-Rs-80/article20325554.ece,https://www.moneycontrol.com/news/business/markets/-2087139.html","not gold, hide in high yielding currencies: fx global cap,Gold at new high of Rs 28,230; gains Rs 80,gold surges to record; dollar's loss is oil's gain"
21/8/2011,https://www.thehindubusinessline.com/markets/commodities/gold-import-may-cross-1000-tonne-mark-this-year-analysts/article20325642.ece1,"Gold import may cross 1,000-tonne mark this year: Analysts"
22/8/2011,"http://www.marketwatch.com/story/oil-gold-rise-as-markets-rebound-2011-08-22,http://www.marketwatch.com/story/gold-ends-at-record-a-stones-throw-from-1900-2011-08-22","oil, gold rise as markets rebound,gold ends at record, a stone's throw from $1,900"
23/8/2011,"http://www.marketwatch.com/story/oil-up-at-nearly-85-gold-declines-11-2011-08-23,http://www.marketwatch.com/story/low-confidence-cleaves-gold-from-us-stocks-2011-08-23,http://www.marketwatch.com/story/gold-off-record-down-nearly-2-copper-gains-2011-08-23","oil up at nearly $85; gold declines 1.1%,low confidence cleaves gold from u.s. stocks,gold off record, down nearly 2%; copper gains"
24/8/2011,"http://www.marketwatch.com/story/oil-down-more-than-100-as-settlement-approaches-2011-08-24,http://www.marketwatch.com/story/golds-10-worst-days-2011-08-24,http://www.marketwatch.com/story/gold-settles-56-lower-at-175730-an-ounce-2011-08-24,http://www.marketwatch.com/story/gold-drops-more-than-4-falls-below-1800-2011-08-24,http://www.marketwatch.com/story/dont-read-too-much-into-golds-drop-2011-08-24","gold down more than $100 as settlement approaches,gold's 10 worst days,gold settles 5.6% lower at $1,757.30 an ounce,gold drops more than 4%, falls below $1,800,don't read too much into gold's drop"
25/8/2011,"https://www.thehindubusinessline.com/markets/gold/gold-silver-plunges-on-global-meltdown/article23057665.ece,http://www.marketwatch.com/story/glencore-to-look-at-kazzinc-gold-assets-options-2011-08-25,https://www.moneycontrol.com/news/business/stocks/-2068353.html,https://www.moneycontrol.com/news/business/markets/-2066011.html,http://www.marketwatch.com/story/after-the-gold-rush-2011-08-25","Gold, silver plunges on global meltdown,glencore to look at kazzinc gold assets options,fundamental view on gold, silver, copper & crude: iifl,gold sees biggest single-day slump; falls by rs 1840/10 gm,after the gold rush"
26/8/2011,"http://www.marketwatch.com/story/dec-gold-up-3410-to-settle-at-179730oz-2011-08-26,https://www.moneycontrol.com/news/business/markets/-2061559.html,http://www.marketwatch.com/story/gold-gains-a-second-day-still-down-3-on-week-2011-08-26,https://www.moneycontrol.com/news/business/stocks/-2064583.html","dec. gold up $34.10 to settle at $1,797.30/oz,gold rises after bernanke talks about us jobs,gold gains a second day, still down 3% on week,technical view on gold, nickel, copper, silver: nirmal bang"
27/8/2011,,
28/8/2011,,
29/8/2011,"https://www.moneycontrol.com/news/business/stocks/-2057473.html,http://www.marketwatch.com/story/gold-swerves-between-gains-and-losses-at-1802-2011-08-29,https://www.moneycontrol.com/news/business/markets/-2057341.html,https://www.moneycontrol.com/news/business/markets/-2056211.html,http://www.marketwatch.com/story/gold-trades-under-1800-as-us-equities-rise-2011-08-29,http://www.marketwatch.com/story/perus-gold-production-rises-in-july-2011-08-29,https://www.thehindubusinessline.com/markets/commodities/gold-futures-succumbs-to-profit-taking/article20328763.ece1,https://economictimes.indiatimes.com/markets/commodities/gold-climbs-on-value-store-demand-as-bernanke-offers-no-boost/articleshow/9785773.cms","fundamental view on copper, crude oil, gold, silver: iifl,gold swerves between gains and losses; at $1,802,gold likely to top &#36;2000 by next month: swiss asia cap,at what levels does dani comm suggest a buy on gold, crude?,gold trades under $1,800 as u.s. equities rise,peru's gold production rises in july,Gold futures succumbs to profit-taking,gold climbs on value-store demand as bernanke offers no boost"
30/8/2011,"http://www.marketwatch.com/story/gold-rises-2-to-trade-at-182630-an-ounce-2011-08-30,http://www.marketwatch.com/story/gold-adds-42-or-24-to-trade-at-183330oz-2011-08-30,https://www.thehindubusinessline.com/markets/commodities/bullion-sales-vault-with-gold-prices-jewellery-loses-lustre/article20329772.ece1,http://www.marketwatch.com/story/gold-settles-21-higher-at-182980-an-ounce-2011-08-30,https://economictimes.indiatimes.com/markets/commodities/is-e-gold-better-than-gold-etf/articleshow/9755984.cms,https://www.thehindubusinessline.com/markets/commodities/gold-futures-up-at-rs-26793-on-global-cues/article20329285.ece1","gold rises 2% to trade at $1,826.30 an ounce,gold adds $42, or 2.4%, to trade at $1,833.30/oz,Bullion sales vault with gold prices; jewellery loses lustre,gold settles 2.1% higher at $1,829.80 an ounce,is e-gold better than gold etf?,Gold futures up at Rs 26,793 on global cues"
31/8/2011,"http://www.marketwatch.com/story/gold-has-best-monthly-performance-since-nov-2009-2011-08-31,http://www.marketwatch.com/story/gold-ends-01-higher-at-183170-an-ounce-2011-08-31,http://www.marketwatch.com/story/gold-edges-up-to-end-august-12-higher-2011-08-31","gold has best monthly performance since nov. 2009,gold ends 0.1% higher at $1,831.70 an ounce,gold edges up to end august 12% higher"
1/9/2011,,
2/9/2011,"https://www.moneycontrol.com/news/business/stocks/-2044881.html,https://www.thehindubusinessline.com/markets/commodities/gold-futures-rises-to-rs-27253-on-global-cues/article20331193.ece1,https://economictimes.indiatimes.com/markets/commodities/gold-silver-surges-further-on-global-cues/articleshow/9838342.cms,http://www.marketwatch.com/story/a-split-between-east-and-west-over-golds-future-2011-09-02,http://www.marketwatch.com/story/newmont-mining-bucks-sell-off-as-gold-prices-gain-2011-09-02,https://www.moneycontrol.com/news/business/markets/-2043235.html","intraday strategy for gold, nickel, lead: angel broking,Gold futures rises to Rs 27,253 on global cues,gold, silver surges further on global cues,a split between east and west over gold's future?,newmont mining bucks sell off as gold prices gain,gold not done yet, expert says sept to bring all-time high"
3/9/2011,https://economictimes.indiatimes.com/markets/commodities/gold-silver-extend-gains-on-rising-global-trend/articleshow/9847576.cms,"gold, silver extend gains on rising global trend"
4/9/2011,,
5/9/2011,https://www.moneycontrol.com/news/business/markets/-2037583.html,expert tips: how to play falling oil & rising gold today
6/9/2011,"https://www.moneycontrol.com/news/business/markets/-2030415.html,http://www.marketwatch.com/story/dec-gold-up-3220-or-17-at-190910oz-2011-09-06,https://www.moneycontrol.com/news/business/stocks/-2027841.html,http://www.marketwatch.com/story/spot-gold-hits-new-record-at-1920-2011-09-06","gold nears record above &#36;1,900, safety bid revives,dec. gold up $32.20, or 1.7%, at $1,909.10/oz,technical view on nickel, copper, gold: nirmal bang,spot gold hits new record at $1,920"
7/9/2011,"http://www.marketwatch.com/story/canada-shares-rise-but-gold-miners-cap-gains-2011-09-07-1221300,https://www.moneycontrol.com/news/business/markets/-2021799.html,https://www.moneycontrol.com/news/business/stocks/-2015691.html,https://www.moneycontrol.com/news/business/stocks/-2018071.html","canada shares rise, but gold miners lag gains,crude advances; gold falls from record levels,the gold march continues: angel broking,outlook on gold, silver, crude oil: angel broking"
8/9/2011,"http://www.marketwatch.com/story/gold-trims-gains-oil-adds-to-losses-on-bernanke-2011-09-08,http://www.marketwatch.com/story/gold-futures-rebound-to-top-1850-as-crude-slips-2011-09-08,http://www.marketwatch.com/story/gold-settles-22-higher-at-185750-an-ounce-2011-09-08,http://www.marketwatch.com/story/oil-inches-higher-gold-pushes-toward-1900-2011-09-08","gold trims gains; oil adds to losses on bernanke,gold futures rebound to top $1,850 as crude slips,gold settles 2.2% higher at $1,857.50 an ounce,oil inches higher, gold pushes toward $1,900"
9/9/2011,,
10/9/2011,,
11/9/2011,,
12/9/2011,"https://www.thehindubusinessline.com/markets/commodities/gold-futures-fall-on-weak-asian-trend/article23052958.ece,https://www.moneycontrol.com/news/business/stocks/-2128601.html,http://www.marketwatch.com/story/gold-losses-mount-off-2-at-182230oz-2011-09-12,https://www.moneycontrol.com/news/business/markets/-2127013.html","Gold futures fall on weak Asian trend,support level for crude, gold, copper: hem securities,gold losses mount: off 2% at $1,822.30/oz.,india gold seen snapping two-week gains"
13/9/2011,"https://www.moneycontrol.com/news/business/markets/-2125213.html,http://www.marketwatch.com/story/gold-futures-up-960-at-183970-2011-09-13","crude advances; gold slips more than 2%,gold futures up $9.60 at $1,839.70"
14/9/2011,http://www.marketwatch.com/story/crude-oil-futures-decline-as-gold-rises-modestly-2011-09-14,crude-oil futures decline as gold rises modestly
15/9/2011,"http://www.marketwatch.com/story/gold-falls-more-after-philly-fed-down-37-2011-09-15,http://www.marketwatch.com/story/gold-futures-add-to-losses-down-32-to-1795-2011-09-15,http://www.marketwatch.com/story/dec-gold-futures-tumble-2110-to-180540ounce-2011-09-15,http://www.marketwatch.com/story/losses-mount-for-gold-off-4540-to-178130oz-2011-09-15,http://www.marketwatch.com/story/gold-futures-for-dec-delivery-down-2270-ounce-2011-09-15","gold falls more after philly fed, down $37,gold futures add to losses, down $32 to $1,795,dec gold futures tumble $21.10 to $1,805.40/ounce,losses mount for gold, off $45.40 to $1,781.30/oz,gold futures for dec. delivery down $22.70-ounce"
16/9/2011,https://www.moneycontrol.com/news/business/markets/-2108747.html,"gold falls 2% on central banks' action, euro hopes"
17/9/2011,,
18/9/2011,,
19/9/2011,"http://www.marketwatch.com/story/gold-slips-after-an-earlier-a-high-of-183290-2011-09-19,https://www.moneycontrol.com/news/business/markets/-2096307.html,http://www.marketwatch.com/story/low-satisfaction-confidence-support-gold-hsbc-2011-09-19,http://www.marketwatch.com/story/dec-gold-closes-at-177890-down-3580-2011-09-19,http://www.marketwatch.com/story/dec-gold-falls-3370-or-19-1781oz-2011-09-19,http://www.marketwatch.com/story/dec-gold-touches-intraday-low-of-1771oz-2011-09-19,http://www.marketwatch.com/story/gold-inclusion-as-tier-1-asset-would-be-huge-lbma-2011-09-19,https://www.moneycontrol.com/news/business/markets/-2099911.html,http://www.marketwatch.com/story/gold-closes-at-lowest-level-in-over-three-weeks-2011-09-19","gold slips after an earlier a high of $1,832.90,gold gains as european debt concerns boost demand,low satisfaction, confidence support gold: hsbc,dec. gold closes at $1,778.90, down $35.80,dec. gold falls $33.70, or 1.9%, $1,781/oz,dec. gold touches intraday low of $1,771/oz,gold inclusion as tier 1 asset would be huge: lbma,gold prices bounce back in futures trade on global cues,gold closes at lowest level in over three weeks"
20/9/2011,,
21/9/2011,https://www.moneycontrol.com/news/business/markets/-2087319.html,india gold edges up; awaits leads from us fed
22/9/2011,"https://www.moneycontrol.com/news/business/markets/-2078601.html,https://economictimes.indiatimes.com/markets/forex/rupee-hits-25-mth-low-as-shares-slide-dollar-up-gold-down-nearly-1/articleshow/10077107.cms,https://economictimes.indiatimes.com/markets/commodities/as-gold-vaults-secure-storage-space-runs-out/articleshow/10073277.cms,http://www.marketwatch.com/story/gold-investment-shift-leaves-market-vulnerable-2011-09-22,http://www.marketwatch.com/story/december-gold-futures-off-4570-to-176240-oz-2011-09-22","gold falls to 4-week low as &#36; gains post fed purchase plan,rupee hits 25-mth low as shares slide, dollar up; gold down nearly 1%,as gold vaults, secure storage space runs out,gold investment shift leaves market vulnerable,december gold futures off $45.70 to $1,762.40 oz"
23/9/2011,"http://www.marketwatch.com/story/gold-off-over-30-as-commodities-pressure-builds-2011-09-23,http://www.marketwatch.com/story/gold-trades-under-1700-loses-4-2011-09-23,https://economictimes.indiatimes.com/markets/commodities/gold-dips-below-rs-28k-mark-on-weak-global-cues/articleshow/10095239.cms,http://www.marketwatch.com/story/gold-down-63-as-selling-intensifies-pre-settle-2011-09-23,https://economictimes.indiatimes.com/markets/commodities/silver-tumbles-by-rs-5500-gold-down-by-rs-300-on-global-cues/articleshow/10091436.cms","gold off over $30 as commodities pressure builds,gold trades under $1,700, loses 4%,gold dips below rs 28k mark on weak global cues,gold down 6.3% as selling intensifies pre-settle,silver tumbles by rs 5,500, gold down by rs 300 on global cues"
24/9/2011,,
25/9/2011,,
26/9/2011,"https://www.thehindubusinessline.com/markets/commodities/Gold-silver-crash-on-shift-to-cash/article20340975.ece,https://economictimes.indiatimes.com/markets/commodities/gold-futures-tumble-3-82-today-on-weak-global-cues/articleshow/10125366.cms,http://www.marketwatch.com/story/oil-gold-add-to-losses-after-housing-data-2011-09-26,http://www.marketwatch.com/story/gold-beats-sp-500-to-bear-market-level-2011-09-26,https://www.moneycontrol.com/news/business/stocks/-2068517.html,http://www.marketwatch.com/story/gold-settles-27-lower-at-159480-an-ounce-2011-09-26","Gold, silver crash on shift to $, cash,gold futures tumble 3.82% today on weak global cues,oil, gold add to losses after housing data,gold beats s&p 500 to bear market level,intraday strategies on gold, crude oil: angel broking,gold settles 2.7% lower at $1,594.80 an ounce"
27/9/2011,"https://www.moneycontrol.com/news/business/markets/-2061923.html,https://economictimes.indiatimes.com/markets/commodities/gold-futures-bounce-back-on-global-cues-short-covering/articleshow/10138651.cms,http://www.marketwatch.com/story/canadian-stocks-gain-on-metals-and-mining-rally-2011-09-27,http://www.marketwatch.com/story/gold-oil-keep-advance-after-consumer-confidence-2011-09-27,https://www.moneycontrol.com/news/business/markets/-2058539.html,https://economictimes.indiatimes.com/markets/commodities/gold-loses-pricey-tag-futures-exchange-comex-raises-margins-on-gold-and-silver-/articleshow/10134432.cms","gold stages comeback with aid of weak dollar,gold futures bounce back on global cues; short-covering,canadian stocks pare early gains; gold shares fall,gold, oil keep advance after consumer confidence,gold gain after biggest 3-day drop spur investor concern,gold loses pricey tag, futures exchange comex raises margins on gold and silver."
28/9/2011,"https://www.thehindubusinessline.com/markets/gold/Gold-futures-decline-0.97-on-global-cues/article20341693.ece,https://economictimes.indiatimes.com/markets/stocks/recos/buy-gold-on-dips-ashwani-gujral/articleshow/10153845.cms,https://economictimes.indiatimes.com/markets/commodities/gold-silver-decline-on-profit-selling/articleshow/10159792.cms","Gold futures decline 0.97% on global cues,buy gold on dips: ashwani gujral,gold, silver decline on profit-selling"
29/9/2011,https://www.moneycontrol.com/news/business/stocks/-2050203.html,"technical view on gold, silver, nickel: nirmal bang"
30/9/2011,"https://www.thehindubusinessline.com/money-and-banking/higher-gold-loan-rates-to-affect-customers-more-than-nbfcs-says-muthoot-finance-chief/article20343265.ece1,http://www.marketwatch.com/story/gold-futures-up-570-to-1623-an-ounce-2011-09-30","Higher gold loan rates to affect customers more than NBFCs: says Muthoot Finance chief,gold futures up $5.70 to $1,623 an ounce"
1/10/2011,,
2/10/2011,,
3/10/2011,"http://www.marketwatch.com/story/ubs-cuts-3-month-gold-silver-price-forecasts-2011-10-03,https://www.moneycontrol.com/news/business/markets/-2037295.html,https://www.thehindubusinessline.com/markets/gold/gold-gains-on-higher-asian-cues/article23055385.ece,http://www.marketwatch.com/story/natixis-lifts-gold-estimates-cuts-pgm-outlook-2011-10-03,https://www.moneycontrol.com/news/business/markets/-2034579.html","ubs cuts 3-month gold, silver price forecasts,global stocks, euro fall; gold gains on europe worries,Gold gains on higher Asian cues,natixis lifts gold estimates, cuts pgm outlook,mcx gold oct contract gains nearly 2%"
4/10/2011,"https://economictimes.indiatimes.com/markets/commodities/gold-adds-rs-285-silver-sheds-rs-200-on-global-cues/articleshow/10231367.cms,https://www.moneycontrol.com/news/business/companies/-2017729.html,https://www.moneycontrol.com/news/business/markets/-2026149.html","gold adds rs 285, silver sheds rs 200 on global cues,titan to raise watch prices as gold, strong dollar bite,mcx goldpetal oct contract trading firm"
5/10/2011,"http://www.marketwatch.com/story/gold-edges-higher-after-previous-sessions-selloff-2011-10-05,https://www.moneycontrol.com/news/business/markets/-2137507.html,https://www.moneycontrol.com/news/business/stocks/-2011801.html,http://www.marketwatch.com/story/gold-crude-futures-hold-gains-after-payrolls-data-2011-10-05,https://economictimes.indiatimes.com/markets/commodities/silver-coins-log-biggest-single-day-fall-gold-dips-rs-835/articleshow/10244961.cms","gold on firmer footing, gains more than 1%,bofa keeps 12-month gold price target,trading strategies on gold: geojit comtrade,gold, crude futures hold gains after payrolls data,silver coins log biggest single day fall; gold dips rs 835"
6/10/2011,https://www.thehindubusinessline.com/companies/dip-in-gold-prices-pushes-up-sales/article20345216.ece1,Dip in gold prices pushes up sales
7/10/2011,"https://www.moneycontrol.com/news/business/markets/-2128571.html,https://www.moneycontrol.com/news/business/markets/-2128787.html,https://economictimes.indiatimes.com/mf/mf-news/hdfc-mutual-fund-launches-gold-fund/articleshow/10270084.cms,https://www.moneycontrol.com/news/business/markets/-2130465.html,https://www.thehindubusinessline.com/markets/commodities/Gold-futures-jumps-to-Rs-26607-on-firm-Asian-cues/article20345382.ece,https://www.thehindubusinessline.com/markets/stock-markets/HDFC-MF-launches-gold-fund/article20345731.ece","mcx goldguinea nov contract firms up,buy gold at rs 26600/10 gm, copper at rs 354/kg: experts,hdfc mutual fund launches gold fund,mcx goldm dec contract up marginally,Gold futures jumps to Rs 26,607 on firm Asian cues,HDFC MF launches gold fund"
8/10/2011,https://economictimes.indiatimes.com/markets/commodities/gold-silver-turn-weak-on-global-cues-sluggish-demand/articleshow/10278433.cms,"gold, silver turn weak on global cues, sluggish demand"
9/10/2011,"https://www.thehindubusinessline.com/opinion/columns/g-chandrashekhar/Gold-silver-prices-improve-on-physical-demand/article20346163.ece,https://economictimes.indiatimes.com/markets/commodities/gold-may-scale-up-to-rs-30000-per-10-grams-by-diwali-industry/articleshow/10286906.cms","Gold, silver prices improve on physical demand,gold may scale up to rs 30000 per 10 grams by diwali: industry"
10/10/2011,"https://economictimes.indiatimes.com/markets/commodities/gold-up-by-rs-260-silver-by-rs-500-on-global-cues/articleshow/10300969.cms,https://www.moneycontrol.com/news/business/markets/-2114101.html,https://economictimes.indiatimes.com/opinion/interviews/can-make-money-on-gold-at-these-levels-also-kishore-narne-anand-rathi-commodities/articleshow/10302156.cms,https://economictimes.indiatimes.com/markets/commodities/gold-buyers-return-to-shop-ahead-of-diwali-as-prices-drop/articleshow/10294500.cms,http://www.marketwatch.com/story/gold-climbs-to-log-highest-close-in-over-two-weeks-2011-10-10,http://www.marketwatch.com/story/gold-futures-close-at-highest-level-since-sept-22-2011-10-10,https://www.moneycontrol.com/news/business/markets/-2120183.html,https://www.moneycontrol.com/news/business/stocks/-2119111.html,http://www.marketwatch.com/story/dec-gold-settles-at-167080oz-up-35-or-21-2011-10-10","gold up by rs 260, silver by rs 500 on global cues,Gold, silver futures extend gains on broad dollar weakness,can make money on gold at these levels also: kishore narne, anand rathi commodities,gold buyers return to shop ahead of diwali as prices drop,gold climbs to log highest close in over two weeks,gold futures close at highest level since sept. 22,gold up 1% as hopes rise on europe debt,outlook on gold, silver, usdinr: way2wealth,dec. gold settles at $1,670.80/oz, up $35, or 2.1%"
11/10/2011,"https://www.moneycontrol.com/news/business/markets/-2110837.html,https://www.moneycontrol.com/news/business/markets/-2111225.html,https://economictimes.indiatimes.com/markets/commodities/do-not-buy-gold-silver-at-current-level-kunal-shah/articleshow/10313657.cms,http://www.marketwatch.com/story/gold-extends-gains-in-asia-trading-2011-10-11,https://economictimes.indiatimes.com/markets/commodities/gold-advances-on-investment-demand-silver-declines/articleshow/10316670.cms,https://www.moneycontrol.com/news/business/markets/-2104857.html,https://www.moneycontrol.com/news/trends/advertising-trends/-2111295.html,https://economictimes.indiatimes.com/markets/commodities/gold-rises-by-rs-195-silver-up-by-rs-400-on-festive-demand/articleshow/10313195.cms,https://www.moneycontrol.com/news/business/markets/-2108065.html,https://www.moneycontrol.com/news/business/markets/-2107931.html","MCX GOLDPETAL Nov contract up marginally,Gold extends gains on EU debt hopes,do not buy gold, silver at current level: kunal shah,gold futures end with a loss of almost $10,gold advances on investment demand, silver declines,Gold declines as commodities fall before Slovakia Vote,Crude gains more than 3%; gold rises 2%,gold rises by rs 195, silver up by rs 400 on festive demand,MCX GOLDGUINEA Oct contract firms up,Gold prices in India"
12/10/2011,"https://www.moneycontrol.com/news/business/markets/-2099803.html,https://www.moneycontrol.com/news/business/markets/-2099645.html,https://www.moneycontrol.com/news/business/markets/-2099447.html,https://www.moneycontrol.com/news/business/markets/-2096665.html,https://www.moneycontrol.com/news/business/markets/-2098549.html,https://www.moneycontrol.com/news/business/markets/-2100999.html,http://www.marketwatch.com/story/gold-futures-up-17-to-168850-an-ounce-2011-10-12,https://economictimes.indiatimes.com/markets/commodities/gold-price-seen-averaging-1770-in-q4-gfms/articleshow/10324567.cms,https://www.moneycontrol.com/news/business/markets/-2098107.html,https://economictimes.indiatimes.com/markets/commodities/gold-rises-to-rs-27190silver-adds-rs-700-on-firm-global-cues/articleshow/10326968.cms,http://www.marketwatch.com/story/dec-gold-rises-2910-to-169010ounce-2011-10-12,https://economictimes.indiatimes.com/markets/commodities/no-gold-dhamaka-in-diwali-run-up-as-gold-prices-are-expected-to-trade-in-the-rs-26000-28500-range/articleshow/10323028.cms","MCX GOLDM Nov contract makes smart gains,Gold Rates: Prices in major cities in India,gold price seen averaging &#36;1770 in q4: gfms,Gold climbs as dollar weakens; Slovak vote supports,MCX GOLDGUINEA Oct contract up nearly 1%,MCX GOLDPETAL Oct contract gains,gold futures up 1.7% to $1,688.50 an ounce,gold price seen averaging $1,770 in q4: gfms,India gold rises 1%; festivals prop up demand,gold rises to rs 27,190,silver adds rs 700 on firm global cues,dec gold rises $29.10 to $1,690.10/ounce,no gold dhamaka in diwali run-up as gold prices are expected to trade in the rs 26,000-28,500 range"
13/10/2011,"https://www.moneycontrol.com/news/business/markets/-2083005.html,https://economictimes.indiatimes.com/markets/commodities/gold-falls-to-rs-27010-silver-down-by-rs-500-on-asian-cues/articleshow/10339855.cms,https://www.moneycontrol.com/news/business/markets/-2090323.html,https://www.moneycontrol.com/news/business/markets/-2091777.html,https://www.moneycontrol.com/news/business/markets/-2089111.html,https://economictimes.indiatimes.com/markets/commodities/gold-silver-decline-on-profit-selling/articleshow/10341864.cms","MCX GOLDGUINEA Oct contract down marginally,gold falls to rs 27010, silver down by rs 500 on asian cues,Gold Rates: Prices decline today,MCX GOLDPETAL Oct contract declines,India gold reverses early gains; physical demand up,gold, silver decline on profit selling"
14/10/2011,"https://www.moneycontrol.com/news/business/markets/-2081851.html,https://www.moneycontrol.com/news/business/stocks/-2081779.html,https://economictimes.indiatimes.com/articleshow/10353147.cms,http://www.marketwatch.com/story/opportunity-knocks-in-gold-silver-mining-stocks-2011-10-14,https://economictimes.indiatimes.com/markets/commodities/gold-futures-gain-0-24-pc-on-global-cues/articleshow/10353892.cms,https://economictimes.indiatimes.com/markets/commodities/gold-recovers-by-rs-110-on-festive-demandsilver-down-by-rs-300/articleshow/10353822.cms,https://www.moneycontrol.com/news/business/markets/-2082259.html,https://www.moneycontrol.com/news/business/markets/-2081723.html,https://www.moneycontrol.com/news/business/markets/-2081973.html,https://www.moneycontrol.com/news/business/markets/-2083019.html","MCX GOLDM Nov contract up slightly,Gold, Silver may trade negative today: Angel Commodities,sentiment for gold looks positive; prices may take support around 1620-1630: ajay kedia,opportunity knocks in gold, silver mining stocks,gold futures gain 0.24 pc on global cues,gold recovers by rs 110 on festive demand;silver down by rs 300,India gold edges higher but strong rupee limits upside,Gold rises in Delhi, Mumbai market,Smart gains in gold prices,MCX GOLDGUINEA Dec contract up marginally"
15/10/2011,"https://www.thehindubusinessline.com/markets/gold/Gold-silver-surge-on-fresh-demand/article20348744.ece,https://economictimes.indiatimes.com/markets/commodities/gold-glittersup-rs-45-on-seasonal-demandsilver-down-by-rs-250/articleshow/10366206.cms","Gold, silver surge on fresh demand,gold glitters,up rs 45 on seasonal demand;silver down by rs 250"
16/10/2011,https://economictimes.indiatimes.com/markets/commodities/national-stock-exchange-clocks-four-fold-surge-in-gold-etf-trade/articleshow/10374571.cms,national stock exchange clocks four-fold surge in gold etf trade
17/10/2011,"https://www.moneycontrol.com/news/business/markets/-2069331.html,https://economictimes.indiatimes.com/markets/commodities/diwali-2011-gold-coins-jewellery-bookings-up-on-price-worries/articleshow/10386925.cms,https://www.moneycontrol.com/news/business/markets/-2068555.html,https://economictimes.indiatimes.com/markets/commodities/gold-silver-down-on-mild-profit-taking/articleshow/10390122.cms,https://www.moneycontrol.com/news/business/markets/-2066167.html,https://www.moneycontrol.com/news/business/markets/-2071039.html","Gain seen in gold prices in Mumbai, Delhi market,diwali 2011: gold coins, jewellery bookings up on price worries,Spot Gold trades lower in Jaipur, Chennai market,gold, silver down on mild profit-taking,Gold gains as Europe debt concern spurs demand,MCX GOLDPETAL Oct contract down marginally"
18/10/2011,"https://www.moneycontrol.com/news/business/markets/-2061383.html,https://economictimes.indiatimes.com/markets/commodities/diwali-2011-with-prices-rising-does-buying-gold-make-sense-this-dhanteras/articleshow/10398975.cms,https://www.moneycontrol.com/news/business/markets/-2062299.html,https://economictimes.indiatimes.com/markets/commodities/platinum-a-hit-with-youngsters-as-price-difference-with-gold-drops/articleshow/10396516.cms,https://economictimes.indiatimes.com/markets/commodities/gold-loses-rs-200-silver-sheds-rs-1000-on-sluggish-demand/articleshow/10401630.cms,https://www.moneycontrol.com/news/business/markets/-2061269.html,http://www.marketwatch.com/story/gold-futures-drop-by-more-than-40-an-ounce-2011-10-18","Gold prices down in Mumbai, Delhi, Ahmedabad market,diwali 2011: with prices rising, does buying gold make sense this dhanteras?,Selling seen in spot gold prices,platinum a hit with youngsters as price difference with gold drops,gold loses rs 200, silver sheds rs 1,000 on sluggish demand,MCX GOLDPETAL October trades lower,gold futures log a loss of nearly $24 an ounce"
19/10/2011,"https://www.moneycontrol.com/news/business/markets/-2053919.html,https://www.moneycontrol.com/news/business/markets/-2054433.html,https://economictimes.indiatimes.com/markets/commodities/gold-falls-further-by-rs-170-silver-adds-rs-500/articleshow/10415370.cms,https://www.moneycontrol.com/news/business/stocks/-2054781.html,https://www.moneycontrol.com/news/business/markets/-2053615.html,https://www.moneycontrol.com/news/business/stocks/-2052527.html","MCX GOLDM Nov contract slips marginally,Spot Gold trades lower,gold falls further by rs 170, silver adds rs 500,Support for MCX Gold Dec at Rs 26250: Kotak Commodity,Spot Gold prices slip further,Gold prices may trade higher today: Angel Commodities"
20/10/2011,"https://www.moneycontrol.com/news/business/markets/-2048613.html,https://www.thehindubusinessline.com/markets/gold/gold-loses-rs-255-silver-rs-1100-on-weak-asian-cues/article23057495.ece,https://economictimes.indiatimes.com/markets/commodities/gold-continues-to-dip-silver-also-falls-on-global-cues/articleshow/10429523.cms,https://economictimes.indiatimes.com/markets/commodities/gold-loses-rs-225-silver-sheds-rs-1100-on-weak-asian-cues/articleshow/10428051.cms,https://www.moneycontrol.com/news/business/markets/-2046223.html,https://economictimes.indiatimes.com/markets/commodities/gold-prices-to-further-correct-in-the-near-term-geojit-comtrade/articleshow/10427320.cms,https://www.moneycontrol.com/news/business/markets/-2044775.html,https://www.moneycontrol.com/news/business/markets/-2049943.html,https://www.moneycontrol.com/news/business/stocks/-2046469.html,https://www.moneycontrol.com/news/business/markets/-2044649.html,http://www.marketwatch.com/story/oil-turns-lower-gold-trims-loss-on-eu-report-2011-10-20","MCX GOLD Dec contract trading lower,Gold loses Rs 255, silver Rs 1,100 on weak Asian cues,gold continues to dip, silver also falls on global cues,gold loses rs 225, silver sheds rs 1,100 on weak asian cues,Spot Gold rates down in major metros,gold prices to further correct in the near term: geojit comtrade,MCX GOLDPETAL Nov contract trades lower,gold falls with equities as euro zone talks stuck,Gold prices may test Rs 26150-26000: Nirmal Bang,Gold prices trading lower in major metros,oil turns lower, gold trims loss on eu report"
21/10/2011,"https://economictimes.indiatimes.com/markets/commodities/seasonal-demand-pushes-up-gold-by-rs-375-silver-by-rs-400/articleshow/10440725.cms,https://www.moneycontrol.com/news/business/markets/-2034449.html,https://economictimes.indiatimes.com/markets/commodities/gold-futures-rise-on-global-cues/articleshow/10439334.cms,https://www.moneycontrol.com/news/business/markets/-2031851.html,https://www.moneycontrol.com/news/business/stocks/-2033863.html,https://www.moneycontrol.com/news/business/markets/-2034117.html,https://www.moneycontrol.com/news/business/markets/-2033705.html,https://www.moneycontrol.com/news/business/markets/-2032159.html,https://www.moneycontrol.com/news/business/markets/-2037451.html","seasonal demand pushes up gold by rs 375; silver by rs 400,MCX GOLD April contract gains 1%,gold futures rise on global cues,Smart surge in gold rates,MCX Gold, Silver may note some gains: Kotak Commodity,Spot Gold trades higher,India gold up over 1%, recovering from 2-week low,MCX GOLDGUINEA Oct contract up marginally,MCX GOLDPETAL Dec contract up nearly 1%"
22/10/2011,"https://economictimes.indiatimes.com/markets/commodities/festive-demand-lifts-up-gold-silver-prices/articleshow/10452730.cms,https://www.thehindubusinessline.com/markets/gold/Gold-silver-spurt-on-festive-offtake-global-cues/article20351877.ece,https://economictimes.indiatimes.com/markets/commodities/2-week-low-price-revives-investor-appetite-for-gold/articleshow/10448638.cms,https://www.thehindubusinessline.com/markets/commodities/festive-demand-lifts-gold-silver-prices/article20351818.ece1","festive demand lifts up gold & silver prices,Gold, silver spurt on festive offtake, global cues,2-week low price revives investor appetite for gold,Festive demand lifts gold, silver prices"
23/10/2011,,
24/10/2011,"https://www.moneycontrol.com/news/business/markets/-2018061.html,https://www.thehindubusinessline.com/companies/dhanteras-this-season-it-is-lightweight-gold-silver/article20352567.ece1,https://www.moneycontrol.com/news/business/markets/-2013241.html,https://economictimes.indiatimes.com/markets/commodities/gold-silver-prices-could-move-little-higher-chirag-sheth-latin-manharlal-commodities/articleshow/10474383.cms,https://economictimes.indiatimes.com/markets/commodities/dhanteras-festive-demand-global-cues-push-up-gold-futures/articleshow/10473650.cms,https://www.moneycontrol.com/news/business/mutual-funds/-1933913.html,https://www.moneycontrol.com/news/business/stocks/-2014035.html,https://economictimes.indiatimes.com/markets/commodities/show-off-as-bling-get-coloured-highlights-indians-are-obsessed-with-gold/articleshow/10460981.cms,https://economictimes.indiatimes.com/markets/commodities/dhanteras-demand-pushes-up-gold-by-rs-100-silver-by-rs-300/articleshow/10474981.cms,https://www.moneycontrol.com/news/business/stocks/-2015333.html,https://www.moneycontrol.com/news/business/markets/-2022353.html,https://www.moneycontrol.com/news/business/stocks/-2013821.html,https://www.moneycontrol.com/news/business/stocks/-2019027.html,https://www.thehindubusinessline.com/markets/commodities/Gold-may-rebound-in-the-medium-term/article20352589.ece","Spot Gold rates move up today,Dhanteras: This season, it is lightweight gold, silver,investing in gold this dhanteras? expert picks best tools,gold, silver prices could move little higher: chirag sheth, latin manharlal commodities,dhanteras: festive demand, global cues push up gold futures,Golden opportunity: Demand for gold ETFs and funds soars,Gold, Silver may trade with positive bias:Angel Commodities,show off as bling, get coloured highlights: indians are obsessed with gold,dhanteras demand pushes up gold by rs 100, silver by rs 300,Hedging policy: Shield gold retailers from price volatility,MCX GOLD April contract firms up,Gold to trade on positive note today: Angel Commodities,Support for MCX Gold Oct at Rs 26500: Kotak Commodity,Gold may rebound in the medium term"
25/10/2011,"https://economictimes.indiatimes.com/markets/commodities/gold-futures-up-0-33-per-cent-on-global-cues-spot-demand/articleshow/10485157.cms,https://economictimes.indiatimes.com/markets/commodities/dhanteras-has-a-silver-lining-high-cost-of-gold-makes-silver-peoples-favourite-this-year/articleshow/10483386.cms,https://www.moneycontrol.com/news/business/stocks/-2003057.html","gold futures up 0.33 per cent on global cues, spot demand,dhanteras has a silver lining: high cost of gold makes silver people's favourite this year,Gold, Silver may trade with positive bias today: Angel"
26/10/2011,"http://www.marketwatch.com/story/crude-eases-back-before-european-outcome-gold-up-2011-10-26,http://www.marketwatch.com/story/dec-gold-up-2050-or-12-at-172090oz-2011-10-26,https://economictimes.indiatimes.com/markets/commodities/gold-price-surge-by-rs-730-in-special-diwali-mahurat-trade-on-rising-demand/articleshow/10499768.cms","crude eases back before european outcome, gold up,dec. gold up $20.50, or 1.2%, at $1.720.90/oz,gold price surge by rs 730 in special diwali mahurat trade on rising demand"
27/10/2011,"https://www.thehindubusinessline.com/markets/gold/gold-futures-down-at-rs-27477-on-profit-taking/article23063013.ece,https://economictimes.indiatimes.com/markets/commodities/gold-climbs-as-europe-woes-spur-demand/articleshow/10504611.cms,https://economictimes.indiatimes.com/markets/commodities/gold-futures-down-on-profit-taking-global-cues/articleshow/10508167.cms","Gold futures down at Rs 27,477 on profit-taking,gold climbs as europe woes spur demand,gold futures down on profit-taking, global cues"
28/10/2011,"https://www.moneycontrol.com/news/business/markets/-1981949.html,http://www.marketwatch.com/story/gold-futures-give-up-europe-deal-gains-2011-10-28,https://www.moneycontrol.com/news/business/markets/-1986667.html,https://www.moneycontrol.com/news/business/markets/-1970763.html,http://www.marketwatch.com/story/gold-edges-lower-after-five-session-win-2011-10-28,https://www.moneycontrol.com/news/business/markets/-1977737.html,https://economictimes.indiatimes.com/markets/commodities/gold-regains-rs-28000-mark-silver-up-by-rs-2300/articleshow/10518529.cms,https://www.moneycontrol.com/news/business/stocks/-1979883.html,https://www.moneycontrol.com/news/business/stocks/-1985133.html,https://www.moneycontrol.com/news/business/markets/-1986883.html","MCX GOLDGUINEA Nov contract down marginally,gold futures give up europe-deal gains,MCX GOLD Dec contract trades lower,fat prophets commodity bets: gold, zinc, copper,gold edges lower after five-session win,Gold regains Rs 28,000-mark, silver up by Rs 2,300,gold regains rs 28000-mark, silver up by rs 2,300,Buy MCX Gold on dips at Rs 27,400: Dani Commodities,Gold, Silver may trade positive today: Angel Commodities,commodities today: here are calls on copper, gold, crude"
29/10/2011,"https://economictimes.indiatimes.com/markets/commodities/gold-down-by-rs-120-silver-by-rs-900-on-profit-booking/articleshow/10529950.cms,https://economictimes.indiatimes.com/markets/commodities/gold-at-five-week-high-leads-to-profit-booking/articleshow/10524590.cms","gold down by rs 120, silver by rs 900 on profit-booking,gold at five-week high leads to profit-booking"
30/10/2011,,
31/10/2011,"http://www.marketwatch.com/story/gold-loses-13-but-logs-monthly-gain-of-63-2011-10-31,https://www.moneycontrol.com/news/business/markets/-1955751.html,https://www.moneycontrol.com/news/business/markets/-1957419.html,https://www.moneycontrol.com/news/business/stocks/-1960753.html,https://www.moneycontrol.com/news/business/markets/-1955793.html,http://www.marketwatch.com/story/gold-drops-22-but-scores-over-6-monthly-gain-2011-10-31,https://www.moneycontrol.com/news/business/markets/-1960653.html","gold loses 1.3%, but logs monthly gain of 6.3%,MCX GOLDGUINEA Oct contract trading lower,Gold prices in major cities in India,MCX Gold, Silver may decline today: Kotak Commodity,India gold falls by 1.5%on global leads,gold drops $22, but scores over 6% monthly gain,MCX GOLDPETAL Dec contract trades lower"
1/11/2011,"https://www.moneycontrol.com/news/business/stocks/-1946461.html,https://economictimes.indiatimes.com/markets/commodities/silver-dips-further-on-global-fall-gold-eases/articleshow/10570426.cms,https://www.moneycontrol.com/news/business/markets/-1946493.html,http://www.marketwatch.com/story/gold-and-silver-show-signs-of-a-bottom-2011-11-01,https://www.moneycontrol.com/news/business/markets/-1942931.html,https://economictimes.indiatimes.com/markets/commodities/wedding-season-demand-pushes-up-gold-by-rs-230silver-by-rs450/articleshow/10567351.cms,http://www.marketwatch.com/story/crude-gold-retreat-as-greek-debt-worries-return-2011-11-01,https://economictimes.indiatimes.com/markets/commodities/gold-falls-for-third-day-as-dollar-may-curb-demand/articleshow/10570370.cms","Gold, Silver may trade lower today: Angel Commodities,silver dips further on global fall, gold eases,MCX GOLD Dec contract firms up,gold and silver show signs of a bottom,MCX GOLDM Nov contract trades lower,wedding season demand pushes up gold by rs 230,silver by rs450,crude, gold retreat as greek debt worries return,gold falls for third day as dollar may curb demand"
2/11/2011,"https://www.moneycontrol.com/news/business/markets/-1914689.html,https://www.moneycontrol.com/news/business/markets/-1926187.html,https://www.moneycontrol.com/news/business/markets/-1923521.html,https://www.moneycontrol.com/news/business/markets/-1929429.html,http://www.marketwatch.com/story/gold-futures-head-higher-after-three-session-drop-2011-11-02","Gold gains as debt concern spurs demand,MCX GOLDGUINEA Nov contract gains,MCX GOLDPETAL Dec contract up marginally,MCX GOLD Dec contract up slightly,gold futures head higher after three-session drop"
3/11/2011,"https://economictimes.indiatimes.com/markets/commodities/gold-extends-rally-up-by-rs-50-silver-recovers-by-rs-200/articleshow/10593144.cms,https://www.moneycontrol.com/news/business/stocks/-1904035.html,https://www.moneycontrol.com/news/business/stocks/-1907921.html,https://economictimes.indiatimes.com/markets/commodities/gold-to-rebound-from-biggest-monthly-fall-since-08-ahead-of-europe-fears/articleshow/10586716.cms","gold extends rally; up by rs 50, silver recovers by rs 200,nirmal bang`s view on gold, silver, copper, lead, crude,Buy MCX Gold Dec at Rs 27,600; Target Rs 27,770: IIFL,gold to rebound from biggest monthly fall since '08 ahead of europe fears"
4/11/2011,"https://economictimes.indiatimes.com/markets/commodities/gold-up-by-rs-420-silver-by-rs-1100-on-wedding-season-demand/articleshow/10606149.cms,https://www.moneycontrol.com/news/business/markets/-1887529.html,https://www.moneycontrol.com/news/business/markets/-1889885.html,https://www.moneycontrol.com/news/business/stocks/-1885123.html,https://www.moneycontrol.com/news/business/markets/-1883447.html","gold up by rs 420, silver by rs 1,100 on wedding season demand,Spot Gold rates trading higher,Gold moves up further,Gold may trade lower today: Angel Commodities,Gold declines as rally to six-week high spurs selling"
5/11/2011,"https://www.thehindubusinessline.com/markets/commodities/gold-falls-to-rs-28315-on-low-demand/article23070581.ece,https://economictimes.indiatimes.com/markets/commodities/gold-falls-on-low-demand-global-cues/articleshow/10619135.cms,https://economictimes.indiatimes.com/markets/commodities/gold-silver-slip-on-profit-booking-global-cues/articleshow/10620533.cms","Gold falls to Rs 28,315 on low demand,gold falls on low demand, global cues,gold, silver slip on profit-booking, global cues"
6/11/2011,"https://www.thehindubusinessline.com/markets/gold/turn-assets-in-gold-realty-into-financial-savings/article23066523.ece,https://www.thehindubusinessline.com/opinion/columns/g-chandrashekhar/gold-at-crossroads-awaiting-direction/article23067427.ece","Turn assets in gold, realty into financial savings',Gold at crossroads, awaiting direction"
7/11/2011,"https://economictimes.indiatimes.com/markets/commodities/gold-silver-start-week-on-firm-note-rise-on-global-cues/articleshow/10641646.cms,http://www.marketwatch.com/story/gold-futures-climb-to-top-1780-an-ounce-2011-11-07,https://economictimes.indiatimes.com/markets/commodities/gold-climbs-to-six-week-high-as-european-concerns-spur-demand/articleshow/10642854.cms","gold, silver start week on firm note, rise on global cues,gold tops $1,790 to end at over six-week high,gold climbs to six-week high as european concerns spur demand"
8/11/2011,"https://economictimes.indiatimes.com/markets/commodities/returns-from-gold-fund-of-funds-generates-lower-to-flat-returns-for-investors/articleshow/10647361.cms,https://www.moneycontrol.com/news/business/markets/-1857261.html,https://www.moneycontrol.com/news/business/stocks/-1854909.html,https://www.moneycontrol.com/news/business/stocks/-1852517.html,http://www.marketwatch.com/story/gold-futures-end-higher-but-below-1800-2011-11-08,https://www.moneycontrol.com/news/business/markets/-1844235.html","returns from gold fund of funds generates lower-to-flat returns for investors,MCX GOLD December contract up marginally,Gold, Silver may trade higher today: Angel Commodities,Support for MCX Gold December at Rs 28000: Kotak Commodity,gold futures end higher, but below $1,800,India gold extends rise to over 2-mth high"
9/11/2011,"https://www.moneycontrol.com/news/business/markets/-1837729.html,http://www.marketwatch.com/story/gold-falls-12-in-electronic-trade-vs-comex-close-2011-11-09,https://economictimes.indiatimes.com/markets/commodities/gold-zooms-to-all-time-high-on-marriage-season-demand/articleshow/10667461.cms,http://www.marketwatch.com/story/tsx-drops-on-italy-concerns-gold-miners-rally-2011-11-09,https://economictimes.indiatimes.com/markets/commodities/gold-futures-hit-fresh-peak-of-rs-29186-on-global-cues/articleshow/10664972.cms,https://www.moneycontrol.com/news/business/markets/-1834763.html","Gold prices trading higher in Chennai, Ahmedabad market,gold falls 1.2% in electronic trade vs comex close,gold zooms to all-time high on marriage season demand,tsx drops on italy concerns; gold miners rally,gold futures hit fresh peak of rs 29,186 on global cues,India gold slips from 2-month high"
10/11/2011,http://www.marketwatch.com/story/gold-futures-drop-by-more-than-40-an-ounce-2011-11-10,gold futures drop by more than $40 an ounce
11/11/2011,"https://www.moneycontrol.com/news/business/markets/-1410777.html,http://www.marketwatch.com/story/spot-gold-higher-short-term-direction-unclear-2011-11-11,http://www.marketwatch.com/story/gold-futures-climb-after-two-session-drop-2011-11-11,http://www.marketwatch.com/story/on-the-hunt-for-cost-savvy-gold-miners-2011-11-11,https://www.moneycontrol.com/news/business/stocks/-1411203.html","Spot Gold rates trading lower,spot gold higher; short-term direction unclear,gold ends 1.6% higher after two-session drop,on the hunt for cost-savvy gold miners,Gold, Silver may trade with sideways bias:Angel Commodities"
12/11/2011,https://economictimes.indiatimes.com/markets/commodities/gold-rebounds-to-climb-new-highs-silver-also-shines/articleshow/10704852.cms,"gold rebounds to climb new highs, silver also shines"
13/11/2011,https://economictimes.indiatimes.com/markets/commodities/gold-hits-record-high-of-rs-29265-on-seasonal-demand/articleshow/10704893.cms,"gold hits record high of rs 29,265 on seasonal demand"
14/11/2011,"http://www.marketwatch.com/story/gold-dec-futures-drop-890-to-177920ounce-2011-11-14,https://economictimes.indiatimes.com/markets/commodities/gold-hits-new-high-at-rs-29295-on-marriage-season-demand/articleshow/10726718.cms,https://economictimes.indiatimes.com/markets/commodities/rising-gold-prices-diwali-jewellery-sales-fall-by-25-30/articleshow/10720388.cms,http://www.marketwatch.com/story/peltzs-trian-buys-pepsi-sells-gold-2011-11-14,https://economictimes.indiatimes.com/markets/stocks/recos/buy-gold-for-long-term-ashish-shah/articleshow/10727775.cms,https://economictimes.indiatimes.com/markets/stocks/recos/buy-gold-on-every-dip-kaushal-jaini/articleshow/10726646.cms,https://economictimes.indiatimes.com/markets/commodities/gold-declines-on-reduced-european-debt-concern/articleshow/10730205.cms,https://economictimes.indiatimes.com/markets/commodities/gold-futures-rise-up-to-rs-28966-on-global-cues/articleshow/10726563.cms","gold dec futures drop $8.90 to $1,779.20/ounce,gold hits new high at rs 29,295 on marriage season demand,rising gold prices: diwali jewellery sales fall by 25-30%,peltz's trian buys pepsi, sells gold,buy gold for long term: ashish shah,buy gold on every dip: kaushal jaini,gold declines on reduced european debt concern,gold futures rise up to rs 28,966 on global cues"
15/11/2011,"https://www.moneycontrol.com/news/business/markets/-1393139.html,https://www.moneycontrol.com/news/business/markets/-1393761.html,http://www.marketwatch.com/story/gold-ends-higher-as-traders-mull-investment-appeal-2011-11-15,https://www.moneycontrol.com/news/business/markets/-1393175.html,http://www.marketwatch.com/story/gold-up-as-italy-spain-worsen-euro-zone-fears-2011-11-15,https://economictimes.indiatimes.com/markets/commodities/gold-eases-on-reduced-jewellery-offtake-silver-declines/articleshow/10742164.cms,http://www.marketwatch.com/story/dec-gold-up-40-cents-at-177880oz-2011-11-15","Spot Gold rates trading higher in Chennai, Jaipur market,Gold prices marginally lower in Mumbai, Delhi market,gold ends higher as traders mull investment appeal,MCX GOLDM Dec contract down slightly,gold closes up as traders mull safe-haven appeal,gold eases on reduced jewellery offtake, silver declines,dec. gold up 40 cents at $1,778.80/oz"
16/11/2011,"https://economictimes.indiatimes.com/markets/commodities/gold-touches-new-high-of-rs-29440-on-seasonal-demand/articleshow/10755091.cms,http://www.marketwatch.com/story/gold-closes-04-lower-at-177430-an-ounce-2011-11-16,https://www.moneycontrol.com/news/business/markets/-1387237.html,http://www.marketwatch.com/story/gold-stumbles-more-than-1-2011-11-16","gold touches new high of rs 29,440 on seasonal demand,gold closes 0.4% lower at $1,774.30 an ounce,MCX GOLD Dec contract down marginally,gold comes off lows but ends in the red"
17/11/2011,"https://www.moneycontrol.com/news/business/markets/-1378427.html,https://www.moneycontrol.com/news/business/markets/-1378619.html,https://economictimes.indiatimes.com/markets/commodities/gold-futures-extend-loses-on-weak-asian-cues/articleshow/10765954.cms,https://www.moneycontrol.com/news/business/markets/-1379193.html,http://www.marketwatch.com/story/gold-futures-down-2490-at-174980oz-2011-11-17,https://www.moneycontrol.com/news/business/markets/-1377233.html,https://www.moneycontrol.com/news/business/markets/-1377319.html,https://economictimes.indiatimes.com/markets/commodities/gold-slips-from-all-time-high-silver-slumps/articleshow/10771999.cms,http://www.marketwatch.com/story/gold-futures-extend-declines-in-asian-trading-2011-11-17","Gold prices trading lower,gold demand rises in q3, european purchases surge,gold futures extend loses on weak asian cues,MCX GOLDPETAL Nov contract declines,gold futures down $24.90 at $1,749.80/oz,Gold prices slip in major metros in India,MCX GOLDGUINEA Nov contract slips,gold slips from all time high, silver slumps,gold futures extend declines in asian trading"
18/11/2011,"https://economictimes.indiatimes.com/markets/commodities/gold-drops-over-2-per-cent-on-technicals-silver-dives/articleshow/10774602.cms,http://www.marketwatch.com/story/shanghai-hikes-silver-margins-to-fresh-high-2011-11-18,http://www.marketwatch.com/story/gold-ends-modestly-higher-silver-recoups-losses-2011-11-18,https://economictimes.indiatimes.com/markets/commodities/gold-gain-as-europe-debt-woes-spur-investor-demand/articleshow/10783330.cms,https://economictimes.indiatimes.com/markets/commodities/gold-down-by-rs-265-silver-by-rs-2425-on-weak-global-cues/articleshow/10780608.cms,https://www.moneycontrol.com/news/business/markets/-1354321.html,https://www.moneycontrol.com/news/business/markets/-1351501.html","gold drops over 2 per cent on technicals; silver dives,gold ends modestly up after two-session losses,gold ends modestly higher, silver recoups losses,gold gain as europe debt woes spur investor demand,gold down by rs 265, silver by rs 2,425 on weak global cues,Gold steady; dollar, euro zone weigh,Gold prices trading lower in major metros in India"
19/11/2011,https://economictimes.indiatimes.com/markets/commodities/gold-silver-rebound-on-low-level-buying-firm-global-cues/articleshow/10792594.cms,"gold, silver rebound on low-level buying; firm global cues"
20/11/2011,,
21/11/2011,"https://www.moneycontrol.com/news/business/markets/-1336989.html,https://www.moneycontrol.com/news/business/stocks/-1338121.html,https://www.moneycontrol.com/news/business/stocks/-1338397.html,https://www.moneycontrol.com/news/business/markets/-1337863.html,https://economictimes.indiatimes.com/markets/commodities/gold-gains-on-global-cues-silver-falls-on-sluggish-demand/articleshow/10816445.cms,https://www.moneycontrol.com/news/business/markets/-1335719.html","MCX GOLD December contract down marginally,Gold may trade with negative bias: Angel Commodities,Support for MCX Gold Dec at Rs 28500: Kotak Commodity,Gold prices trading higher in Delhi, Chennai, Ahmd market,gold gains on global cues, silver falls on sluggish demand,Gold will shine at &#36;3000 in 2-3 yrs: Superfund Financial"
22/11/2011,"https://www.moneycontrol.com/news/business/markets/-1329767.html,https://www.moneycontrol.com/news/business/markets/-1326157.html,https://economictimes.indiatimes.com/markets/commodities/gold-rises-further-up-by-rs-10-on-global-cues/articleshow/10829220.cms,https://www.moneycontrol.com/news/business/markets/-1326611.html,https://economictimes.indiatimes.com/markets/commodities/gold-rebounds-from-four-week-low-as-debt-concerns-spur-demand/articleshow/10831102.cms,https://www.moneycontrol.com/news/business/markets/-1325723.html,https://www.thehindubusinessline.com/markets/gold/gold-futures-rises-to-rs-28595-on-global-cues-short-covering/article23070030.ece,https://www.moneycontrol.com/news/business/markets/-1330085.html","MCX GOLD February contract moves up,Spot Gold rates slip in Jaipur, Ahmd, Chennai market,gold rises further; up by rs 10 on global cues,MCX GOLDGUINEA Jan contract moves up smartly,gold rebounds from four-week low as debt concerns spur demand,How to play rupee, gold, crude now? Nirmal Bang guides,Gold futures rises to Rs 28,595 on global cues, short-covering,Gold drops 2.5% on equity sell-off, debt fears"
23/11/2011,"https://economictimes.indiatimes.com/markets/commodities/gold-falls-to-rs-29240-silver-adds-rs-800/articleshow/10842606.cms,https://economictimes.indiatimes.com/markets/commodities/gold-silver-decline-on-lower-off-take/articleshow/10847178.cms,https://www.moneycontrol.com/news/business/markets/-1314677.html,https://www.moneycontrol.com/news/business/markets/-1314449.html,https://www.moneycontrol.com/news/business/stocks/-1315399.html,https://www.moneycontrol.com/news/business/markets/-1314533.html,https://www.moneycontrol.com/news/business/markets/-1316465.html","gold falls to rs 29,240; silver adds rs 800,gold, silver decline on lower off-take,MCX GOLDPETAL Jan contract down marginally,India gold down 1% on recovering rupee; silver down 3%,Support for MCX Gold Dec at Rs 28350: Kotak Commodity,Gold prices trading mixed in major metros in India,MCX GOLDGUINEA Nov contract trading lower"
24/11/2011,"https://www.moneycontrol.com/news/business/markets/-1304463.html,https://economictimes.indiatimes.com/markets/commodities/gold-eases-silver-recovers/articleshow/10858448.cms,https://www.moneycontrol.com/news/business/markets/-1305601.html,https://www.moneycontrol.com/news/business/markets/-1306565.html,https://economictimes.indiatimes.com/markets/commodities/gold-down-by-rs-150-silver-by-rs-1170-on-reduced-offtake/articleshow/10855564.cms,https://economictimes.indiatimes.com/markets/commodities/gold-prices-to-reach-2000-by-march-2012-scotia/articleshow/10858005.cms","MCX GOLD April contract trading lower,gold eases, silver recovers,Spot Gold rates slip in Mumbai, Delhi, Chennai market,MCX GOLDGUINEA Nov contract declines,gold down by rs 150, silver by rs 1,170 on reduced offtake,gold prices to reach $2,000 by march 2012: scotia"
25/11/2011,"https://www.moneycontrol.com/news/business/stocks/-1296269.html,https://www.moneycontrol.com/news/business/markets/-1293933.html,https://www.moneycontrol.com/news/business/stocks/-1296141.html,https://www.moneycontrol.com/news/business/stocks/-1292825.html,http://www.marketwatch.com/story/gold-nudges-lower-in-cautious-trade-2011-11-24,https://www.moneycontrol.com/news/business/markets/-1297387.html,https://economictimes.indiatimes.com/markets/commodities/gold-futures-fall-0-50-on-weak-global-cues/articleshow/10868156.cms,https://www.moneycontrol.com/news/business/markets/-1295593.html,https://economictimes.indiatimes.com/markets/commodities/gold-continues-to-fall-on-profit-taking-silver-also-slips/articleshow/10870285.cms","Support for MCX Gold Dec at Rs 28250: Kotak Commodity,MCX GOLDPETAL Jan contract trading lower,Gold prices may trade rangebound today: IIFL,Short MCX Gold Dec at Rs 28,500; target Rs 28,200: IIFL,gold ends lower as stocks fizzle,MCX GOLD December contract slips,gold futures fall 0.50% on weak global cues,MCX GOLDGUINEA Jan contract trading lower,gold continues to fall on profit-taking, silver also slips"
26/11/2011,https://economictimes.indiatimes.com/markets/commodities/gold-recovers-on-low-level-buying-but-silver-declines/articleshow/10881104.cms,"gold recovers on low level buying, but silver declines"
27/11/2011,,
28/11/2011,"https://www.moneycontrol.com/news/business/markets/-1283083.html,https://www.moneycontrol.com/news/business/stocks/-1276865.html,https://www.moneycontrol.com/news/business/markets/-1281691.html,https://economictimes.indiatimes.com/markets/commodities/gold-jumps-on-global-cues-silver-also-soars/articleshow/10907181.cms,https://www.moneycontrol.com/news/business/stocks/-1281731.html,https://www.moneycontrol.com/news/business/stocks/-1281541.html,https://www.moneycontrol.com/news/business/markets/-1280425.html,https://economictimes.indiatimes.com/markets/commodities/gold-futures-up-0-87-on-global-cues/articleshow/10902501.cms,https://www.moneycontrol.com/news/business/markets/-1272139.html","MCX GOLD Dec contract trading higher,Buy MCX Gold at Rs 28,600; Target Rs 28,900: IIFL,Spot Gold rates trading higher in major metros,gold jumps on global cues, silver also soars,Gold may trade higher during week: Angel Commodities,way2wealth`s view on gold, natural gas, zinc,MCX GOLDPETAL Jan contract trading higher,gold futures up 0.87% on global cues,Gold rises 2% on euro hopes, biggest gain in 3 weeks"
29/11/2011,"https://www.moneycontrol.com/news/business/stocks/-1271161.html,https://www.moneycontrol.com/news/business/markets/-1268733.html,https://economictimes.indiatimes.com/markets/commodities/gold-rallies-for-third-day-up-by-rs-40-on-seasonal-demand/articleshow/10917733.cms,https://www.moneycontrol.com/news/business/markets/-1267579.html,https://www.moneycontrol.com/news/business/stocks/-1268005.html,https://www.moneycontrol.com/news/business/markets/-1268857.html,http://www.marketwatch.com/story/gold-futures-slip-190-to-1709-an-ounce-2011-11-29,http://www.marketwatch.com/story/gold-holds-to-small-gain-after-consumer-confidence-2011-11-29","Gold, Silver may trade with negative bias:Angel Commodities,MCX GOLDGUINEA Jan contract down slightly,gold rallies for third day; up by rs 40 on seasonal demand,Gold prices slip in Mumbai, Ahmedabad market,Support for MCX Gold December at Rs 28300: Kotak Commodity,MCX GOLD Dec contract slips marginally,gold futures slip $1.90 to $1,709 an ounce,gold holds to small gain after consumer confidence"
30/11/2011,"http://www.marketwatch.com/story/gold-futures-add-1980-to-173320-2011-11-30,https://economictimes.indiatimes.com/markets/commodities/gold-futures-up-by-0-78-on-asian-cues-short-covering/articleshow/10928882.cms,https://www.moneycontrol.com/news/business/markets/-1259141.html,https://www.moneycontrol.com/news/business/markets/-1259267.html,https://www.moneycontrol.com/news/business/markets/-1260271.html,https://www.moneycontrol.com/news/business/markets/-1260383.html,https://www.moneycontrol.com/news/business/stocks/-1259235.html","gold futures add $19.80 to $1,733.20,gold futures up by 0.78% on asian cues, short-covering,Gold prices in major metros in India,MCX GOLDPETAL Nov contract gains,MCX GOLDGUINEA Jan contract trades higher,Gold Rates: Prices move up today,Support for MCX Gold Dec at Rs 28300: Kotak Commodity"
1/12/2011,"https://www.moneycontrol.com/news/business/stocks/-1249899.html,https://www.moneycontrol.com/news/business/markets/-1251857.html,http://www.marketwatch.com/story/south-korea-boosts-gold-reserve-2011-12-01,https://economictimes.indiatimes.com/markets/commodities/gold-rise-on-banks-efforts-to-ease-euro-zone-debt-crisis/articleshow/10946177.cms,https://www.moneycontrol.com/news/business/stocks/-1253097.html,https://www.moneycontrol.com/news/business/stocks/-1249595.html,https://economictimes.indiatimes.com/opinion/et-editorial/inflation-indexed-bonds-can-bolster-the-rupee-by-lowering-imports-of-gold/articleshow/10938512.cms,https://www.thehindubusinessline.com/markets/commodities/Gold-futures-rise-on-firm-Asian-cues/article20366423.ece","Support for MCX Gold Feb at Rs 28800: Kotak Commodity,Gold prices trading higher in Mumbai, Chennai market,south korea boosts gold reserve,gold rise on banks efforts to ease euro zone debt crisis,Gold may test Rs 29500 on higher end: Nirmal Bang,Weak US Dollar may support Gold, Silver: Angel Commodities,inflation-indexed bonds can bolster the rupee by lowering imports of gold,Gold futures rise on firm Asian cues"
2/12/2011,"http://www.marketwatch.com/story/oil-gold-hold-gains-after-jobless-rate-drops-2011-12-02,https://www.moneycontrol.com/news/business/markets/-1245741.html,https://economictimes.indiatimes.com/markets/commodities/falling-rupee-hits-gold-silver-imports/articleshow/10951440.cms,https://economictimes.indiatimes.com/markets/commodities/gold-see-biggest-weekly-gain-in-five-after-korean-purchase/articleshow/10959623.cms,http://www.marketwatch.com/story/oil-gold-advance-before-us-jobs-data-2011-12-02,https://economictimes.indiatimes.com/markets/commodities/gold-hits-new-high-at-rs-29490-on-seasonal-demand/articleshow/10956606.cms,https://www.moneycontrol.com/news/business/markets/-1243877.html,https://www.moneycontrol.com/news/business/markets/-1243641.html","oil, gold hold gains after jobless rate drops,sell gold; buy silver and copper suggest experts,falling rupee hits gold, silver imports,gold see biggest weekly gain in five after korean purchase,oil, gold advance before u.s. jobs data,gold hits new high at rs 29,490 on seasonal demand,MCX GOLDPETAL Feb contract up marginally,buy gold, copper from short-term perspective: aditya birla"
3/12/2011,"https://economictimes.indiatimes.com/markets/commodities/gold-slips-by-rs-50-from-record-high-on-sluggish-demand-at-higher-levels/articleshow/10969093.cms,https://economictimes.indiatimes.com/markets/commodities/silver-drops-on-profit-taking-gold-ends-almost-flat/articleshow/10970058.cms","gold slips by rs 50 from record high on sluggish demand at higher levels,silver drops on profit taking, gold ends almost flat"
4/12/2011,,
5/12/2011,"http://www.marketwatch.com/story/feb-gold-falls-810-or-05-to-174320oz-2011-12-05,https://www.moneycontrol.com/news/business/stocks/-1233025.html","feb gold falls $8.10, or 0.5%, to $1,743.20/oz,Expect gold prices to rise today: Angel Commodities"
